id,text,text_el,topic,topic-context,subtopic,subtopic-context,topic-open,sentiment,polarization,polarization-definition,toxicity,toxicity-definition,populism,populism-definition,hate speech,ner,ner-limited
22," So there are no surplus funds in Greece for the maintenance and guarding of the lines, the equipment and railway material, for the effective control of the operation of the railways, while there are generous funds for the Sea2Sea project, the railway interconnection of the ports of Northern Greece, Bulgaria and Romania.  	The most prominent example is the appalling delay in the operation of the telecommand system, which is one of the factors in preventing and limiting the consequences of any human error in handling.   This is the now infamous contract 717/2014 that has not yet been completed, 8.5 years after its award, under the responsibility of the SYRIZA and ND governments.  Governments, which proved to be very capable of implementing many profitable investment projects of the conglomerates with fast-track procedures, but here they moved at a turtle's pace, with delays and freezing of procedures due to foreseeable problems in most of the corresponding public projects.  Unfortunately, this is not the only shortage, the only delay. "," Έτσι δεν περισσεύουν κονδύλια στην Ελλάδα για την συντήρηση και τη φύλαξη των γραμμών, τον εξοπλισμό και του σιδηροδρομικού υλικού, για τον ουσιαστικό έλεγχο της λειτουργίας των σιδηροδρόμων, ενώ δίνονται πλουσιοπάροχα κονδύλια για το σχέδιο Sea2Sea, τη σιδηροδρομική διασύνδεση των λιμανιών της Βόρειας Ελλάδας, της Βουλγαρίας και της Ρουμανίας  	Το πιο χαρακτηριστικό παράδειγμα, είναι η τρομακτική καθυστέρηση στη λειτουργία του συστήματος τηλεδιοίκησης, που αποτελεί έναν από τους παράγοντες για την αποτροπή και τον περιορισμό των συνεπειών του όποιου ανθρώπινου λάθους χειρισμού   Πρόκειται για την περιβόητη πλέον σύμβαση 717/2014 που δεν έχει ακόμα ολοκληρωθεί, 8,5 χρόνια μετά την ανάθεσή της, με ευθύνη των κυβερνήσεων ΣΥΡΙΖΑ και ΝΔ  Κυβερνήσεων, που αποδείχθηκαν πολύ ικανές να υλοποιήσουν με διαδικασίες fast-track πολλά κερδοφόρα επενδυτικά σχέδια των ομίλων, αλλά εδώ κινήθηκαν με ρυθμούς χελώνας, με καθυστερήσεις και πάγωμα των διαδικασιών για προβλέψιμα προβλήματα στα περισσότερα αντίστοιχα δημόσια έργα  Δυστυχώς δεν πρόκειται για τη μοναδική έλλειψη, τη μοναδική καθυστέρηση",infrastructure,,railway,,railway maintenance and funding in greece,-0.8,0.6,0.2,0.2,0.2,0.2,0.0,0.0,"[['greece', 'location', '1.0'], ['sea2sea', 'project', '1.0'], ['northern greece', 'location', '1.0'], ['bulgaria', 'location', '1.0'], ['romania', 'location', '1.0'], ['telecommand system', 'entity', '1.0'], ['syriza', 'organization', '1.0'], ['nd', 'organization', '1.0']]","[['greece', 'location', '1.0'], ['sea2sea', 'organization', '0.8'], ['northern greece', 'location', '1.0'], ['bulgaria', 'location', '1.0'], ['romania', 'location', '1.0'], ['syriza', 'political party', '1.0'], ['nd', 'political party', '1.0']]"
23," Negative trend in all critical parameters concerning transport safety.  The understaffing and underperformance of the competent state authorities for the railways is another example.  	Of course, every bourgeois party tries to cover up its complicity in the timeless crime. "," Αρνητικό είναι το πρόσημο σε όλες τις κρίσιμες παραμέτρους που αφορούν την ασφάλεια των μεταφορών  Η υποστελέχωση και η υποβαθμισμένη λειτουργία των αρμόδιων κρατικών αρχών για τους σιδηροδρόμους, είναι ένα ακόμα χαρακτηριστικό παράδειγμα  	Φυσικά κάθε αστικό κόμμα προσπαθεί να συγκαλύψει τη συνενοχή του στο διαχρονικό έγκλημα",accountability,,railway,,transport safety,-0.9,1.0,1.0,0.8,0.7,0.7,0.1,0.3,"[['transport safety', 'misc', '1.0'], ['railways', 'org', '1.0'], ['bourgeois party', 'org', '1.0']]","[['state authorities', 'organization', '0.8'], ['railways', 'organization', '0.5'], ['bourgeois party', 'political party', '0.9.']]"
24," SYRIZA continues to talk about the safety nets that existed until 2019 and were abolished by the Mitsotakis government and promotes as a salutary solution ""the use of the Recovery Fund to rebuild a public transport network and renegotiate contracts"".  The president of PASOK speaks openly about a return to the public sector, consolidation, and then privatisation with new conditions.  Varoufakis explained in his earlier interviews that he was in favour of private entry into OSE, because the Greek state did not have the capacity for investment... And in more recent ones, that he disagreed with the choice of the Italian company because it could not invest either... He needed, in other words, a different kind of successful privatisation.  None of them question the basic framework of EU commercialisation and liberalisation.  The tragedy of 2023 is therefore the essential result of the EU - Greek bourgeoisie policy on rail transport - freight, which all bourgeois governments have been implementing, with miraculous precision, throughout the previous period.  That is why the views on the supposed Greek specificity, or on the neoliberal dissonance of Greek railways against the ""European reality"" that is friendly to trains, simply lack seriousness. "," Ο ΣΥΡΙΖΑ εξακολουθεί να μιλά για τις δικλείδες ασφαλείας που υπήρχαν μέχρι το 2019 και κατάργησε η κυβέρνηση Μητσοτάκη και προβάλλει ως σωτήρια λύση «την αξιοποίηση του Ταμείου Ανάκαμψης για την ανάταξη ενός δημόσιου δικτύου μεταφορών και για επαναδιαπραγμάτευση των συμβάσεων»  Ο πρόεδρος του ΠΑΣΟΚ μιλά απροκάλυπτα για επιστροφή στο δημόσιο, εξυγίανση, και στη συνέχεια ιδιωτικοποίηση με νέους όρους  Ο Βαρουφάκης στις παλαιότερες συνεντεύξεις του, εξηγούσε ότι τάχθηκε υπέρ της εισόδου ιδιωτών στον ΟΣΕ, γιατί το ελληνικό κράτος δεν είχε τις δυνατότητες για επενδύσεις… Και στις πιο πρόσφατες, ότι διαφωνούσε με την επιλογή της ιταλικής εταιρείας γιατί επίσης δεν μπορούσε να κάνει επενδύσεις… Χρειαζόταν, με άλλα λόγια, μια διαφορετική πετυχημένη ιδιωτικοποίηση  Κανείς τους δεν αμφισβητεί το βασικό πλαίσιο της εμπορευματοποίησης και της απελευθέρωσης της ΕΕ  Η τραγωδία του 2023 είναι επομένως το ουσιαστικό αποτέλεσμα της πολιτικής ΕΕ – ελληνικής αστικής τάξης για σιδηροδρομικές μεταφορές – εμπόρευμα, που υλοποιούν, με θαυμαστή ακρίβεια, όλες οι αστικές κυβερνήσεις όλη την προηγούμενη περίοδο  Γι’ αυτό και οι απόψεις για τάχα ελληνική ιδιαιτερότητα, ή για την νεοφιλελεύθερη παραφωνία των Ελληνικών σιδηροδρόμων κόντρα στην “ευρωπαϊκή πραγματικότητα” που είναι φιλική με τα τρένα, απλά, στερούνται σοβαρότητας",privatization,,privatization of public goods,,greek railways,0.0,0.2,0.3,0.3,0.4,0.3,0.0,0.0,"[['syriza', 'organization', '1.0'], ['mitsotakis', 'person', '1.0'], ['recovery fund', 'organization', '1.0'], ['pasok', 'organization', '1.0'], ['varoufakis', 'person', '1.0'], ['greek', 'nationality', '1.0'], ['ose', 'organization', '1.0'], ['italian', 'nationality', '1.0'], ['eu', 'organization', '1.0']]","[['syriza', 'organization', '1.0'], ['mitsotakis', 'person', '1.0'], ['pasok', 'political party', '1.0'], ['varoufakis', 'person', '1.0'], ['ose', 'organization', '1.0'], ['greek', 'country', '1.0'], ['italian', 'country', '1.0'], ['eu', 'organization', '1.0'], ['2023', 'date', '1.0']]"
25,"  What all of the above proves.  They prove that as long as we move on the rails of capitalist profit and the state hostile to the people, there is no lesser evil.  We're going from bad to worse.  This is the unpopular direction defined by the EU's policy of ""liberalisation"" and the strategy of capital, which is currently agreed upon by the New Democracy, SYRIZA, PASOK, MERA25, all the parties of the system.  That is why there is no room for any more illusions. ","  Τι αποδεικνύουν όλα όσα προαναφέραμε  Αποδεικνύουν ότι όσο κινούμαστε στις ράγες του καπιταλιστικού κέρδους και του εχθρικού για το λαό κράτους, δεν υπάρχει μικρότερο κακό  Θα πηγαίνουμε απ’  το κακό στο χειρότερο  Σε αυτή την αντιλαϊκή κατεύθυνση που καθορίζει η πολιτική “απελευθέρωσης” της ΕΕ και η στρατηγική του κεφαλαίου, συμφωνούν σήμερα ΝΔ, ΣΥΡΙΖΑ, ΠΑΣΟΚ, ΜΕΡΑ25, όλα τα κόμματα του συστήματος  Για αυτό δεν υπάρχουν περιθώρια για άλλες αυταπάτες",economy,,other,,capitalism,-0.9,1.0,0.2,0.7,0.4,0.2,0.25,0.0,"[['capitalist', 'organization', '0.8'], ['state', 'organization', '0.6'], ['eu', 'organization', '0.8'], ['new democracy', 'organization', '0.6'], ['syriza', 'organization', '0.6'], ['pasok', 'organization', '0.6'], ['mera25', 'organization', '0.6']]","[['new democracy', 'organization', '0.9'], ['syriza', 'political party', '0.9'], ['pasok', 'political party', '0.9'], ['mera25', 'political party', '0.9'], ['eu', 'organization', '0.8']]"
26," No one should be trapped again by the offer of phony salvation solutions, by a supposedly ""more progressive government"" the next day.  We will not be saved by a better privatisation, a supposedly stricter public control, nor by a ""re-nationalisation without compensation"".  As long as transport is a commodity and the railway companies operate within the capitalist economy, the situation cannot change radically, essentially.  	Even if the transport enterprises are owned by the capitalist state, they will operate for profit and in the strategic interests of the ruling class.  They will squeeze their workers, they will waste passengers, they will take security measures only on the basis of cost-benefit ratio for the company and the state.  Their very monopolistic nature says that if they don't do this, they will become loss-making, they will be damaging to working taxpayers and they will not be able to implement necessary projects. Even if we were to return to the era of the state monopoly, it would borrow, purchase equipment and contract out projects to groups, according to the laws of the capitalist market. "," Κανείς δεν πρέπει να παγιδευτεί ξανά από την προσφορά κάλπικων λύσεων σωτηρίας, από μία δήθεν “πιο προοδευτική κυβέρνηση” την επόμενη μέρα  Δεν θα μας σώσει μία καλύτερη ιδιωτικοποίηση, ένας δήθεν πιο αυστηρός δημόσιος έλεγχος, ούτε μία “επανακρατικοποίηση χωρίς αποζημίωση”  Όσο οι μεταφορές αποτελούν εμπόρευμα και οι σιδηροδρομικές επιχειρήσεις λειτουργούν μέσα στην καπιταλιστική  οικονομία, η κατάσταση δεν μπορεί να αλλάξει ριζικά, ουσιαστικά  	Ακόμα και αν ανήκουν οι επιχειρήσεις μεταφορών στο κράτος του κεφαλαίου, θα λειτουργούν με γνώμονα το κέρδος τους και τα στρατηγικά συμφέροντα της άρχουσας τάξης  Θα ξεζουμίζουν τους εργαζομένους τους, θα χαρατσώνουν τους επιβάτες, θα λαμβάνουν μέτρα ασφαλείας μόνο με κριτήριο τη σχέση κόστους-οφέλους για την επιχείρηση και το κράτος  Η ίδια η μονοπωλιακή τους φύση, λέει, ότι αν δεν το πράξουν αυτό, θα γίνουν ζημιογόνες, θα φορτώσουν ζημιές στους εργαζόμενους φορολογούμενους και δεν θα μπορούν να υλοποιήσουν αναγκαία έργα Ακόμα και αν επιστρέφαμε στην εποχή του κρατικού μονοπωλίου, αυτό θα δανειζόταν, θα προμηθευόταν εξοπλισμό και θα ανέθετε έργα σε ομίλους, σύμφωνα με τους νόμους της καπιταλιστικής αγοράς",privatization,,hospital privatization,,transport and railway companies,-0.5,0.9,0.2,0.25,0.5,0.7,0.0,0.0,"[['no', 'o', ''], ['phony salvation solutions', 'person', '0.4'], ['more progressive government', 'organization', '0.4'], ['privatisation', 'o', ''], ['public control', 'o', ''], ['re-nationalisation without compensation', 'o', ''], ['transport', 'o', ''], ['railway companies', 'organization', '0.5'], ['capitalist economy', 'o', ''], ['capitalist state', 'organization', '0.5'], ['ruling class', 'o', ''], ['workers', 'o', ''], ['passengers', 'o', ''], ['security measures', 'o', ''], ['company', 'o', ''], ['monopolistic nature', 'o', ''], ['loss-making', 'o', ''], ['working taxpayers', 'o', ''], ['era', 'o', ''], ['state monopoly', 'organization', '0.5'], ['equipment', 'o', ''], ['contract', 'o', ''], ['capitalist market', 'o.']]",[]
27," The new projects and the development of the railways would again be carried out according to the priorities and objectives of the ruling social class.  This proposal, which promises supposedly pro-people's management of transport under capitalism, not only fails to illuminate, but obscures the need to open the road to reversal.  Not only does it not help, but it undermines the concentration of forces against the real opponent, capital and its state. "," Τα νέα έργα και η ανάπτυξη των σιδηροδρόμων, θα γινόταν και πάλι, σύμφωνα με τις  προτεραιότητες και τους στόχους της άρχουσας κοινωνικής τάξης  Αυτή η πρόταση που υπόσχεται δήθεν φιλολαϊκή διαχείριση των μεταφορών στον καπιταλισμό, όχι μόνο δεν φωτίζει, αλλά συσκοτίζει την ανάγκη να ανοίξει ο δρόμος της ανατροπής  Όχι μόνο δεν βοηθά, αλλά υπονομεύει τη συγκέντρωση δυνάμεων απέναντι στον πραγματικό αντίπαλο, το κεφάλαιο και το κράτος του",privatization,,working class,,transportation railways,-0.8,0.9,0.7,0.7,0.3,0.9,0.0,0.1,"[['none', 'as there are no specific named entities mentioned in the text.']]","[['ruling social class', 'group of people', '0.90'], ['capitalism', 'organization', '0.60'], ['capital', 'organization', '0.60'], ['state', 'organization', '0.60']]"
28," The social character of rail transport is not possible if the construction of the works, the production of lines and rolling stock, the energy industry, and the construction of the works are not social in nature.  The social character of rail transport is not possible if its ""competitors"", air, sea and road transport, do not have a social character. 	That is why the KKE is not fighting the battle against the policy of liberalisation and commercialisation, under the banner of yesterday, of the return to the state monopoly of the dictatorship of capital, but under the banner of their socialisation, with the working class, the people at the helm of power. Universal, safe, safe, quality and cheap transport and public transport for the people can only be guaranteed by the new social system, socialism.  On the ground of social property, transport ceases to be a commodity and is enshrined as a social right. "," Δεν είναι δυνατός ο κοινωνικός χαρακτήρας των σιδηροδρομικών μεταφορών, όταν δεν έχει κοινωνικό χαρακτήρα η κατασκευή των έργων, η παραγωγή γραμμών και τροχαίου υλικού, η βιομηχανία ενέργειας  Δεν είναι δυνατός ο κοινωνικός χαρακτήρας των σιδηροδρομικών μεταφορών, αν δεν έχουν κοινωνικό χαρακτήρα οι «ανταγωνιστές» του, οι αεροπορικές μεταφορές, οι θαλάσσιες και οι οδικές μεταφορές 	Γι’ αυτό και το ΚΚΕ, δεν δίνει τη μάχη, ενάντια στην πολιτική της απελευθέρωσης και της εμπορευματοποίησης, με τη σημαία του χτες, της επιστροφής στο κρατικό μονοπώλιο της δικτατορίας του κεφαλαίου αλλά με τη σημαία της κοινωνικοποίησής τους, με την εργατική τάξη, το λαό στο τιμόνι της εξουσίας Καθολικές, ασφαλείς, ποιοτικές και φθηνές μεταφορές και συγκοινωνίες για το λαό μπορεί να διασφαλίσει μόνο το νέο κοινωνικό σύστημα, ο σοσιαλισμός  Πάνω στο έδαφος της κοινωνικής ιδιοκτησίας, οι μεταφορές παύουν να αποτελούν εμπόρευμα και κατοχυρώνονται ως κοινωνικό δικαίωμα",other,,railway,,rail transport's social character,0.0,0.95,0.5,0.2,0.0,0.9,0.0,0.0,"[['kke', 'organization', '1.0'], ['air', 'transport', '1.0'], ['sea', 'transport', '1.0'], ['road', 'transport', '1.0'], ['socialisation', 'concept', '1.0'], ['working class', 'group', '1.0'], ['people', 'group', '1.0'], ['power', 'concept', '1.0'], ['universal', 'transport service', '1.0'], ['safe', 'transport feature', '1.0'], ['quality', 'transport feature', '1.0'], ['cheap', 'transport feature', '1.0'], ['social system', 'concept', '1.0'], ['socialism', 'concept', '1.0'], ['social property', 'concept', '1.0'], ['commodity', 'concept', '1.0'], ['social right', 'concept', '1.0']]","[['rail transport', 'organization', '0.7'], ['kke', 'political party', '0.9'], ['dictatorship of capital', 'group of people', '0.6'], ['working class', 'group of people', '0.6'], ['people', 'group of people', '0.6'], ['socialism', 'organization', '0.5']]"
29," For in this higher organisation of society, the purpose of production and the role of the workers are changed.  The aim is no longer profit, but the combined satisfaction of all the needs of the people, which are expanding.  And employees play an active role in making and controlling decisions every day. "," Γιατί σ’ αυτή την ανώτερη οργάνωση της κοινωνίας, αλλάζει και ο σκοπός της παραγωγής και ο ρόλος των εργαζόμενων  Σκοπός δεν είναι πια το κέρδος, αλλά η συνδυασμένη ικανοποίηση του συνόλου των λαϊκών αναγκών που διευρύνονται  Και οι εργαζόμενοι παίζουν καθημερινά ενεργό ρόλο στη λήψη και στον έλεγχο των αποφάσεων",other,,economic equity,,socialism,0.9,0.2,0.0,0.0,0.0,0.0,0.0,0.0,"[['society', 'organisation', 'type', '0.898'], ['production', 'type', '0.680'], ['workers', 'type', '0.978'], ['people', 'type', '0.882'], ['employees', 'type', '0.936']]","[['society', 'organization', '0.75'], ['workers', 'group of people', '0.6'], ['people', 'group of people', '0.6'], ['employees', 'group of people', '0.6']]"
