id,text,text_el,topic,topic-context,subtopic,subtopic-context,topic-open,sentiment,polarization,polarization-definition,toxicity,toxicity-definition,populism,populism-definition,hate speech,ner,ner-limited
13," It introduces the liberalisation of international passenger transport from 2010.  The culmination of all this, most recently came the 2012 directive on the ""creation of a single European railway area"", which essentially unifies the previous directives. 	In our country, the long-standing policy for the liberalisation of railways in Greece follows the corresponding policy of the EU, the main aim of which is to create a single market for railway activities, in which the monopolistic groups of the EU can invest without any hindrance.   	However, the creation of a single rail market required the separation of transport operations from the rail infrastructure.  This is the key element of the European liberalisation policy: the separation of rail infrastructure from transport work.  This is the only way to ensure that the infrastructure can be used by other companies, the only way to pave the way for the penetration of groups into rail transport.  The consequences of this policy are, as is constantly being demonstrated, tragic for the working people. Liberalisation has two main, complementary axes, separation and full commercialisation.  Segregation means that many different firms compete and operate on the same network.  The ""mess"" of understanding between OSE, and Hellenic Train did not succeed.  It worked. "," Εκεί εισάγεται η απελευθέρωση των διεθνών επιβατικών μεταφορών από το 2010  Αποκορύφωμα όλων, τελευταία ήρθε η οδηγία του 2012 που αφορά τη «δημιουργία ενιαίου ευρωπαϊκού σιδηροδρομικού χώρου» και που ουσιαστικά ενοποιεί τις προηγούμενες οδηγίες 	Στη χώρα μας, η διαχρονική πολιτική για την απελευθέρωση των σιδηρόδρομων στην Ελλάδα, ακολουθεί την αντίστοιχη πολιτική της ΕΕ, η βασική στόχευση της οποίας συνίσταται στη δημιουργία μιας ενιαίας αγοράς σιδηροδρομικών δραστηριοτήτων, στην οποία να μπορούν να επενδύσουν απρόσκοπτα οι μονοπωλιακοί όμιλοι της ΕΕ   	Όμως, η δημιουργία μιας ενιαίας σιδηροδρομικής αγοράς, απαιτούσε την απόσπαση της εκμετάλλευσης του μεταφορικού έργου από την σιδηροδρομική υποδομή  Αυτό είναι και το βασικότερο στοιχείο της ευρωπαϊκής πολιτικής της απελευθέρωσης: ο διαχωρισμός της σιδηροδρομικής υποδομής από το μεταφορικό έργο  Μόνο έτσι διασφαλίζεται η δυνατότητα χρήσης της υποδομής από άλλες επιχειρήσεις, μόνο έτσι ανοίγει ο δρόμος για τη διείσδυση των ομίλων στις σιδηροδρομικές μεταφορές  Οι συνέπειες της πολιτικής αυτής είναι, όπως αποδεικνύεται συνεχώς, τραγικές για τα εργατικά λαϊκά στρώματα Η απελευθέρωση έχει δύο βασικούς, συμπληρωματικούς μεταξύ τους άξονες, τον διαχωρισμό και την πλήρη εμπορευματοποίηση  Διαχωρισμός σημαίνει ότι πολλές διαφορετικές επιχειρήσεις ανταγωνίζονται και  δραστηριοποιούνται πάνω στο ίδιο δίκτυο  Το “μπάχαλο” συνεννόησης μεταξύ ΟΣΕ, και Hellenic Train δεν έτυχε  Πέτυχε",privatization,,railway,,liberalisation of railways,0.0,0.3,0.2,0.1,0.0,0.1,0.0,0.0,"[['liberalisation', 'policy', '1.0'], ['international passenger transport', 'entity', '1.0'], ['2010', 'entity', '1.0'], ['2012 directive', 'entity', '1.0'], ['single european railway area', 'entity', '1.0'], ['directives', 'entity', '1.0'], ['greece', 'entity', '1.0'], ['eu', 'entity', '1.0'], ['single market', 'entity', '1.0'], ['railway activities', 'entity', '1.0'], ['monopolistic groups', 'entity', '1.0'], ['rail market', 'entity', '1.0'], ['transport operations', 'entity', '1.0'], ['rail infrastructure', 'entity', '1.0'], ['european liberalisation policy', 'entity', '1.0'], ['working people', 'entity', '1.0'], ['axes', 'entity', '1.0'], ['separation', 'entity', '1.0'], ['full commercialisation', 'entity', '1.0'], ['many different firms', 'entity', '1.0'], ['same network', 'entity', '1.0'], ['ose', 'entity', '1.0'], ['hellenic train', 'entity', '1.0']]","[['2010', 'date', '1.0'], ['2012 directive', 'organization', '1.0'], ['european union or eu', 'organization', '1.0'], ['greece', 'country', '1.0'], ['ose or hellenic train', 'organization', '0.5']]"
14," It is the inevitable result of the very policy of rail liberalisation. 		Most importantly, the guilt of the policy of liberation lies elsewhere.  Its aim, as we have mentioned before, is none other than the exploitation of rail transport as a profitable field for capital investment.  And here lies the core of the problem. "," Είναι το νομοτελειακό αποτέλεσμα της ίδιας της πολιτικής της απελευθέρωσης των σιδηροδρομικών μεταφορών 		Κυρίως όμως, η ενοχή της πολιτικής της απελευθέρωσης βρίσκεται αλλού  Στόχος της, όπως αναφέραμε και προηγουμένως, δεν είναι άλλος απ’ την αξιοποίηση των σιδηροδρομικών μεταφορών, ως πεδίου κερδοφόρας τοποθέτησης κεφαλαίων  Κι εδώ βρίσκεται ο πυρήνας του προβλήματος",privatization,,hospital privatization,,rail liberalisation,-0.5,0.7,0.1,0.2,0.2,0.0,0.0,0.0,"[['rail liberalisation', 'policy', '0.80'], ['liberation', 'policy', '0.80'], ['rail transport', 'field', '0.60'], ['capital investment', 'profitable field', '0.60']]","[['rail liberalisation', 'organization', '0.6'], ['rail transport', 'organization', '0.6']]"
15," Profit-driven business operation means increasing prices and constantly squeezing so-called ""costs"".  It means reducing maintenance ""to the absolute minimum"", reducing staff, reducing their training.  It means limiting investment in security, because it reduces the so-called ""costs"".  And no matter how much the various apologists of capitalism try to attribute this situation to a Greek peculiarity, they cannot hide the fact that the jungle of the capitalist market is the ultimate culprit.  The iron laws of the capitalist market have this content, regardless of whether the owner of such an enterprise is a private individual or the state.  	The State-owned enterprise evaluates its productivity in comparison with the rest of the industry, using private-economic criteria. "," Επιχειρηματική λειτουργία με γνώμονα το κέρδος, σημαίνει αύξηση των τιμών και συνεχή συμπίεση του λεγόμενου “κόστους”  Σημαίνει μείωση της συντήρησης “στο απολύτως ελάχιστο”, μείωση του προσωπικού, μείωση της εκπαίδευσής του  Σημαίνει περιορισμό των επενδύσεων για την ασφάλεια, γιατί έτσι περιορίζεται το ονομαζόμενο “κόστος”  Και όσο και αν προσπαθούν οι διάφοροι απολογητές του καπιταλισμού να αποδώσουν αυτή την κατάσταση σε ελληνική ιδιαιτερότητα, δεν μπορούν να κρύψουν πως η ζούγκλα της καπιταλιστικής αγοράς είναι ο τελικός υπεύθυνος  Οι σιδερένιοι νόμοι της καπιταλιστικής αγοράς έχουν αυτό το περιεχόμενο, ανεξάρτητα με το αν ο ιδιοκτήτης μιας τέτοιας επιχείρησης είναι ιδιώτης ή το κράτος  	Η κρατική επιχείρηση αποτιμά την παραγωγικότητά της σε σύγκριση με τις υπόλοιπες του κλάδου, με ιδιωτικο-οικονομικά κριτήρια",other,,other,,profit-driven business operation,-0.8,0.8,0.9,0.76,0.5,0.7,0.2,0.0,"[['none', 'there are no proper nouns or named entities in this text.']]","[['1. capitalist market', 'group of people', '0.8'], ['2. greek', 'location', '0.9'], ['3. state', 'organization', '0.7'], ['4. industry', 'organization', '0.8']]"
16," It is exposed to capitalist competition, chasing ""positive"" economic results, using, as a matter of law, the same methods as private individuals.  	The result, throughout Europe, was and is negative for the people, increases in ticket prices, limitation of routes, increase in the frequency of accidents, ""destructive"" exploitation of the network infrastructure, ""battle"" of construction groups for contractors, great acceleration of the concentration of the ""railway pie"" in a handful of monopolies, at a pan-European level.   It is worth mentioning that in Great Britain, where the liberalisation of rail transport has already taken place since 1970, the real cost (deflated) of rail travel, from 1997 to 2009, increased by more than 20%.  	Similarly, in Germany, in the same period, the increase in real costs exceeds 15%, and in the Netherlands more than 10%, to name just a few typical examples. "," Εκτίθεται στον καπιταλιστικό ανταγωνισμό, κυνηγάει τα “θετικά” οικονομικά αποτελέσματα, αξιοποιώντας,  νομοτελειακά, τις ίδιες μεθόδους με τους ιδιώτες  	Το αποτέλεσμα, σε ολόκληρη την Ευρώπη ήταν και είναι αρνητικό για το λαό, αυξήσεις στις τιμές των εισιτηρίων, περιορισμός των δρομολογίων, αύξηση της συχνότητας των ατυχημάτων, “καταστροφική” αξιοποίηση των υποδομών του δικτύου, “μάχη” κατασκευαστικών ομίλων για τις εργολαβίες, μεγάλη επιτάχυνση της συγκέντρωσης της “σιδηροδρομικής πίτας” σε μια χούφτα μονοπώλια, σε πανευρωπαϊκό επίπεδο   Αξίζει να αναφέρουμε πως στη Μεγάλη Βρετανία, όπου η απελευθέρωση των σιδηροδρομικών μεταφορών έχει συντελεστεί ήδη από το 1970, το πραγματικό κόστος (αποπληθωρισμένο) της σιδηροδρομικής μετακίνησης, από το 1997 έως το 2009, αυξήθηκε πάνω από 20%  	Αντίστοιχα στη Γερμανία, στο ίδιο χρονικό διάστημα, η αύξηση του πραγματικού κόστος υπερβαίνει το 15%, ενώ και στην Ολλανδία υπερβαίνει το 10%, για να αναφέρουμε ορισμένα μόνο χαρακτηριστικά παραδείγματα",privatization,,railway,,railway liberalization,-0.8,0.9,0.0,0.9,0.5,0.2,0.0,0.0,"[['europe', 'location', '1.0'], ['great britain', 'location', '1.0'], ['1970', 'date', '1.0'], ['1997', 'date', '1.0'], ['2009', 'date', '1.0'], ['germany', 'location', '1.0'], ['netherlands', 'location', '1.0']]","[['europe', 'location', '0.6'], ['great britain', 'country', '0.9'], ['germany', 'country', '0.9'], ['netherlands', 'country', '0.9'], ['1970', 'date', '0.8'], ['1997', 'date', '0.8'], ['2009', 'date', '0.8']]"
17," It is worth noting that in the major EU economies all forms of ownership, state, private and mixed, have been tried, coexisting, without any substantial improvement for the people.  The real culprit behind the accident in Tempe, behind the devaluation of a network and the conversion of the railways into an Athens - Thessaloniki line, which they defined as barren, is the EU's own rail policy.  All governments to date have implemented this policy to the hilt. "," Αξίζει να σημειώσουμε ότι στις μεγάλες οικονομίες της ΕΕ δοκιμάστηκαν, συνυπάρχουν, όλες οι μορφές ιδιοκτησίας, κρατική, ιδιωτική και μικτή, χωρίς καμιά ουσιαστική βελτίωση για το λαό  Ο πραγματικός ένοχος πίσω απ’ το δυστύχημα στα Τέμπη, πίσω απ’ την απαξίωση ενός δικτύου και την μετατροπή των σιδηρόδρομων σε μία γραμμή Αθήνα – Θεσσαλονίκη, την οποία προσδιόριζαν ως άγονη, είναι η ίδια η πολιτική της ΕΕ για τους σιδηρόδρομους  Όλες οι μέχρι σήμερα κυβερνήσεις έχουν υλοποιήσει την συγκεκριμένη πολιτική μέχρι κεραίας",privatization,,railway,,eu rail policy,-0.4,0.75,0.2,0.4,0.2,0.75,0.1,0.0,"[['eu', 'organization', '0.9'], ['tempe', 'location', '0.9'], ['athens', 'location', '0.8'], ['thessaloniki', 'location', '0.8']]","[['eu', 'organization', '1.0'], ['tempe', 'location', '0.6'], ['athens', 'location', '0.8'], ['thessaloniki', 'location', '0.8']]"
18," 	The promotion of EU policy has been gradual.   The first act of the drama was carried out in 1997 by the PASOK government, which proceeded to adapt national legislation to the Community legislation, introducing into national law European Directives 91/440, 95/18 and 95/19.  A year later, Law 2671/1998 on OSE, implemented the national legislation and proceeded to the internal restructuring of OSE, implementing the accounting separation of infrastructure and operation, paving the way for the continuation of the.  This was followed in 2005, by the government of the New Democracy (ND), by which the harmonisation of Greek legislation with the first EU railway package was implemented. "," 	Η προώθηση της ευρωενωσιακής πολιτικής έγινε βαθμιαία   Η πρώτη πράξη του δράματος έγινε το 1997 από την κυβέρνηση του ΠΑΣΟΚ, που προχώρησε στην προσαρμογή της εθνικής νομοθεσίας με την κοινοτική, εισάγοντας στο εθνικό δίκαιο τις ευρωπαϊκές οδηγίες 91/440, 95/18 και 95/19  Ένα χρόνο αργότερα ο νόμος 2671/1998 για τον ΟΣΕ, υλοποίησε την εθνική πλέον νομοθεσία και προχώρησε στην εσωτερική αναδιάρθρωση του ΟΣΕ, εφαρμόζοντας το λογιστικό διαχωρισμό υποδομής και εκμετάλλευσης, ανοίγοντας το δρόμο για τη συνέχεια  Ακολουθεί το 2005, από την κυβέρνηση της ΝΔ, το ΠΔ 41/2005, με το οποίο υλοποιήθηκε η εναρμόνιση της ελληνικής νομοθεσίας με το πρώτο σιδηροδρομικό πακέτο της ΕΕ",europe,,other,,eu policy promotion,0.0,0.0,0.0,0.0,0.0,0.0,0.0,0.0,"[['eu', 'organization', '1.0'], ['pasok', 'political party', '1.0'], ['community', 'organization', '1.0'], ['european directives 91/440', 'law', '1.0'], ['european directives 95/18', 'law', '1.0'], ['european directives 95/19', 'law', '1.0'], ['law 2671/1998', 'law', '1.0'], ['ose', 'organization', '1.0'], ['new democracy', 'political party', '1.0'], ['eu railway package', 'law', '1.0'], ['greek', 'nationality', '1.0']]","[['pasok government', 'organization', '0.75'], ['european directives 91/440', '95/18 and 95/19', 'organization', '0.75'], ['law 2671/1998 on ose', 'organization', '0.75'], ['ose', 'organization', '0.75'], ['new democracy', 'political party', '0.75'], ['greek', 'country', '0.75'], ['eu', 'organization', '0.75'], ['1997', 'date', '0.75'], ['2005', 'date', '0.75']]"
19," In the same year, the first major restructuring of OSE's corporate structure is implemented.  The company TRAINOSE is created, as a merger of PROSTIACOS A. Ε. "," Τον ίδιο χρόνο, υλοποιείται η πρώτη μεγάλη αναδιάρθρωση του εταιρικού σχήματος του ΟΣΕ  Δημιουργείται η εταιρία ΤΡΑΙΝΟΣΕ, ως συνένωση της ΠΡΟΑΣΤΙΑΚΟΣ Α Ε",other,,railway,,corporate restructuring,0.0,0.0,0.0,0.0,0.0,0.0,0.0,0.0,"[['ose', 'organization', '1.0'], ['trainose', 'organization', '1.0'], ['prostiacos a. ε.', 'organization', '1.0']]","[['ose', 'organization', '0.8'], ['trainose', 'organization', '1.0'], ['prostiacos a. ε.', 'organization', '0.7']]"
20," (an existing subsidiary of OSE) and the remaining activities of OSE in the provision of railway services.  Initially, TRAINOSE remains a subsidiary of the OSE Group.  Finally, in 2008, TRAINOSE becomes independent from OSE.  Finally, the independence of TRAINOSE is completed with the latest legislation of the PASOK government, which annuls the last remaining link between the two companies, giving the rolling stock of OSE to the ownership of TRAINOSE and replacing the hitherto existing system of renting the rolling stock from TRAINOSE. 	The next act of the drama was the 2010 PASOK law on railways, which was the last link in a long chain of reforms that as a whole constitute the liberalisation of rail transport.  This law implements the completion of the separation of OSE and TRAINOSE, the separation of infrastructure and operation, and provides for an extensive operational restructuring of the railway undertakings.  The government of SYRIZA, then, was the one that proceeded with the sale of TRAINOSE to Italian Railways, while then, during the government of the Southwest, the process of absorption of the rolling stock maintenance company from TRAINOSE was completed. "," (μιας ήδη υπάρχουσας θυγατρικής του ΟΣΕ) και των υπόλοιπων δραστηριοτήτων παροχής σιδηροδρομικών υπηρεσιών του ΟΣΕ  Αρχικά η ΤΡΑΙΝΟΣΕ παραμένει θυγατρική του ομίλου ΟΣΕ  Τέλος, το 2008 η ΤΡΑΙΝΟΣΕ ανεξαρτητοποιείται από τον ΟΣΕ  Τελικά η ανεξαρτητοποίηση της ΤΡΑΙΝΟΣΕ ολοκληρώνεται με το τελευταίο νομοθέτημα της κυβέρνησης του ΠΑΣΟΚ που αναιρεί και τον τελευταίο εναπομείναντα συνδετικό κρίκο των δύο εταιριών, παραχωρώντας το τροχαίο υλικό του ΟΣΕ στην κυριότητα της ΤΡΑΙΝΟΣΕ και αντικαθιστώντας το μέχρι τώρα ισχύον καθεστώς ενοικίασης του υλικού από την ΤΡΑΙΝΟΣΕ 	Η επόμενη πράξη του δράματος, έγινε με το νόμο του ΠΑΣΟΚ του 2010 για τους σιδηροδρόμους, που ήταν ο τελευταίος κρίκος μιας μακράς αλυσίδας μεταρρυθμίσεων που ως σύνολο συνιστούν την απελευθέρωση των σιδηροδρομικών μεταφορών  Αυτός ο νόμος, υλοποιεί την ολοκλήρωση του διαχωρισμού ΟΣΕ και ΤΡΑΙΝΟΣΕ, το διαχωρισμό υποδομής και εκμετάλλευσης, ενώ προβλέπει μια εκτενή λειτουργική αναδιαμόρφωση των σιδηροδρομικών επιχειρήσεων  Η κυβέρνηση του ΣΥΡΙΖΑ, στη συνέχεια, ήταν αυτή που προχώρησε στην πώληση της ΤΡΑΙΝΟΣΕ στους Ιταλικούς σιδηρόδρομους ενώ στη συνέχεια, κατά την διάρκεια της κυβέρνησης της ΝΔ, ολοκληρώθηκε η διαδικασία απορρόφησης της εταιρίας συντήρησης τροχαίου υλικού απ’ την ΤΡΑΙΝΟΣΕ",privatization,,railway,,railway services,0.0,0.1,0.0,0.0,0.0,0.0,0.0,0.0,"[['ose', 'organization', '1.0'], ['trainose', 'organization', '1.0'], ['ose group', 'organization', '1.0'], ['pasok', 'government', '1.0'], ['syriza', 'government', '1.0'], ['italian railways', 'organization', '1.0'], ['southwest', 'government', '1.0']]","[['ose', 'organization', '1.0'], ['trainose', 'organization', '1.0'], ['ose group', 'organization', '1.0'], ['pasok', 'political party', '1.0'], ['syriza', 'political party', '1.0'], ['italian railways', 'organization', '1.0'], ['southwest', 'location', '1.0'], ['2010', 'date', '1.0'], ['2008', 'date', '1.0']]"
21,"Friends The liberalisation of rail transport is literally a recipe for increased risk, for railway workers and passengers alike.  In a system of great complexity, high sensitivity and many risks, many different firms are active, each of which, aiming for the greatest possible profit, aims to pass on the costs to the others.  It aims to increase its profit margins as much as possible.  Here we have to take into account the competition from groups that have invested in major roads and an upgrade of rail transport can have a negative impact on their profitability.  All the parameters concerning the prevention and mitigation of the consequences of major accidents are put on the cost-benefit scale for each group and for the capital state.  Decisions are made on the basis of capitalist profitability: On the number of recruitments, the pace and hours of work, the level of wages and the effective training of workers.  Based on the commitments and guidelines of the EU, and the strategy of capital, the bourgeois state chooses which investments to prioritise and how much money to allocate. ","Φίλες και φίλοι	Η απελευθέρωση των σιδηροδρομικών μεταφορών είναι κυριολεκτικά συνταγή αύξησης της επικινδυνότητας, για τους σιδηροδρομικούς και τους επιβάτες  Σε ένα σύστημα μεγάλης πολυπλοκότητας, μεγάλης ευαισθησίας και πολλών κινδύνων, δραστηριοποιούνται πολλές διαφορετικές επιχειρήσεις, η κάθε μία απ’ τις οποίες, στοχεύει στο μεγαλύτερο δυνατό κέρδος, στοχεύει στο να μετακυλίσει το κόστος στις υπόλοιπες  Στοχεύει στο να αυξήσει όσο γίνεται τα περιθώρια κέρδους της  Εδώ πρέπει να συνυπολογίσουμε και τον ανταγωνισμό από τους ομίλους που έχουν επενδύσει σε μεγάλους οδικούς άξονες και μια αναβάθμιση των σιδηροδρομικών μεταφορών μπορεί να επιδράσει αρνητικά στην κερδοφορία τους  Όλες οι παράμετροι που αφορούν την πρόληψη και τον περιορισμό των συνεπειών μεγάλων ατυχημάτων μπαίνουν στη ζυγαριά κόστους – οφέλους για τον κάθε όμιλο και για το κράτος του κεφαλαίου  Με γνώμονα τη καπιταλιστική κερδοφορία λαμβάνονται οι αποφάσεις: Για τον αριθμό των προσλήψεων, τον ρυθμό και τις ώρες εργασίας, το ύψος των μισθών και την ουσιαστική εκπαίδευση των εργαζόμενων  Με βάση τις δεσμεύσεις και τις κατευθύνσεις της ΕΕ, και την στρατηγική του κεφαλαίου, επιλέγει το αστικό κράτος, ποιες επενδύσεις θα ιεραρχήσει και ποιο ύψος κονδυλίων θα διαθέσει",privatization,,other,,rail transport liberalisation,-0.8,0.9,0.7,0.9,0.5,0.7,0.0,0.2,"[['eu', 'organization', '1.0']]","[['friends', 'group of people', '0.8'], ['railway workers', 'group of people', '0.8'], ['passengers', 'group of people', '0.8'], ['firms', 'organization', '0.8'], ['groups', 'organization', '0.8'], ['capital state', 'location', '0.8'], ['eu', 'organization', '0.8'], ['bourgeois state', 'political party', '0.8']]"
