id,text,text_el,topic,topic-context,subtopic,subtopic-context,topic-open,sentiment,polarization,polarization-definition,toxicity,toxicity-definition,populism,populism-definition,hate speech,ner,ner-limited
10," The investments presented here.  They are essentially projects that do not come to meet its own needs, but to enhance the profitability of various large business groups.  Such an investment is the concession by the State Property Fund to a business group, for example, of the thermal springs in the burnt bogs, making the right to access the thermal springs an expensive commodity.  Just a month ago, the KKE presented at a special event in the burnt bourla, a comprehensive proposal that is in the completely opposite direction and ensures the exploitation of the thermal springs for the benefit of our people, while opening the way for the exploitation of the important geothermal field that exists there in the energy sector. "," Οι επενδύσεις που παρουσιάστηκαν εδώ  Είναι επί της ουσίας έργα που δεν έρχονται να ικανοποιήσουν τις δικές του ανάγκες, αλλά να ενισχύσουν την κερδοφορία διάφορων επιχειρηματικών μεγάλων ομίλων  Τέτοια επένδυση είναι η παραχώρηση από το ΤΑΙΠΕΔ σε επιχειρηματικό όμιλο, για παράδειγμα των ιαματικών πηγών στα καμένα βούρλα, κάνοντας το δικαίωμα στην πρόσβαση στις ιαματικές πηγές, πανάκριβο εμπόρευμα  Το ΚΚΕ μόλις πριν έναν μήνα παρουσίασε σε ειδική εκδήλωση στα καμένα βούρλα, ολοκληρωμένη πρόταση που βρίσκεται στην εντελώς αντίθετη κατεύθυνση και εξασφαλίζει την αξιοποίηση των ιαματικών πηγών προς όφελος του λαού μας, ενώ ανοίγει το δρόμο και για την αξιοποίηση του σημαντικού γεωθερμικού πεδίου που υπάρχει εκεί στον τομέα της ενέργειας",privatization,,investments,,investments,-0.5,0.75,0.0,0.2,0.1,0.8,0.0,0.0,"[['state property fund', 'organization', '1.0'], ['thermal springs', 'location', '1.0'], ['burnt bogs', 'location', '1.0'], ['business group', 'organization', '1.0'], ['kke', 'organization', '1.0'], ['burnt bourla', 'location', '1.0'], ['geothermal field', 'location', '1.0']]","[['state property fund', 'organization', '0.6'], ['kke', 'political party', '0.6'], ['burnt bogs', 'location', '0.6'], ['burnt bourla', 'location', '0.6']]"
11,"Another such investment is the announcement of the construction of student halls of residence at the university through PPPs.  So the people have to pay for the construction of the dormitories, but also pay rent for their children's dormitories, while there is a need for truly free education for all students.  Such an investment is the redevelopment of the Panhellenic Exhibition of Lamia of the area that hosts us today, in which we are located, which could certainly be exploited for the benefit of the people of the Greek people with modern facilities, recreational areas, but in the end it is only given to business groups.  Such an investment is the millions that will be given for the various roads.  The modern roads, so advertised.  But these are roads in reality that the Greek people pay gold for them to be built without being accompanied even by the necessary anti-flooding works, since these are, as they say, unnecessary costs for the state.  For the builders, for the contractors and then he pays them in gold again to use them with the tolls, while the surrounding villages here in the plain of Spercheios drown with the first rain.  We know what he's pulling. ","Τέτοια άλλη επένδυση είναι η εξαγγελία για την ανέγερση φοιτητικών εστιών στο πανεπιστήμιο με ΣΔΙΤ  Άρα ο λαός να πληρώσει και τη δημιουργία των εστιών, αλλά και να καταβάλει μετά ενοίκιο στις εστίες των παιδιών του, ενώ υπάρχει ανάγκη για πραγματικά δωρεάν σπουδές για όλους τους φοιτητές  Τέτοια επένδυση είναι και η ανάπλαση της πανελλήνιας έκθεσης Λαμίας του χώρου που μας φιλοξενεί σήμερα, στον οποίο βρισκόμαστε που θα μπορούσε βεβαίως να αξιοποιηθεί προς όφελος του φθιωτικού λαού του ελληνικού λαού με σύγχρονες εγκαταστάσεις, χώρους αναψυχής, αλλά τελικά δίνεται μόνο φιλέτο σε επιχειρηματικούς ομίλους  Τέτοια επένδυση είναι και τα εκατομμύρια που θα δοθούν για τους διάφορους οδικούς άξονες  Ο σύγχρονους οδικούς άξονες, έτσι διαφημίζονται  Πρόκειται όμως για οδικούς άξονες στην πραγματικότητα που τους χρυσοπληρώνει ο ελληνικός λαός για να φτιαχτούν χωρίς να συνοδεύονται ούτε από τα απαραίτητα αντιπλημμυρικά έργα, αφού αυτά αποτελούν, όπως λένε, αχρείαστο κόστος για το κράτος  Για τους κατασκευαστές, για τους εργολάβους και μετά τους χρυσοπληρώνει πάλι για να τους χρησιμοποιήσει με τα διόδια, ενώ τα γύρω χωριά εδώ στον κάμπο του Σπερχειού πνίγονται με την πρώτη βροχή  Ξέρουμε τι τραβάει",privatization,,other,,investments,-0.7,0.8,0.0,0.6,0.2,0.8,0.5,0.0,"[['ppps', 'org', '0.5'], ['the university', 'org', '0.5'], ['panhellenic exhibition of lamia', 'org', '1.0'], ['greek', 'misc', '0.5']]","[['ppps', 'organization', '0.8'], ['university', 'organization', '0.8'], ['greek people', 'group of people', '0.75'], ['panhellenic exhibition of lamia', 'location', '0.7'], ['greek people', 'country', '0.7'], ['business groups', 'organization', '0.6'], ['spercheios', 'location', '0.5']]"
12," For example, the village, but other villages here in the plain of Lamia, but also further up, some time ago we were there and we saw the malpractices of the investors who have devastated the area.  Creating a lake in the villages, so that the water from the streams comes back in case of flooding in every downpour with huge damage to crops, livestock, houses, property, even endangering the lives of the inhabitants.  It is the criminal policy.  We believe in the cost-benefit that led us to the predictable crime of Tempe, which filled the Greek people and youth with sincere sadness and unimaginable anger.  And here in our region, leading to some of the biggest mobilizations ever in Lamia and elsewhere.  Throughout the country. "," Για παράδειγμα το χωριό, αλλά άλλα χωριά εδώ στον κάμπο της Λαμίας, αλλά και πιο πάνω πριν λίγο καιρό ήμασταν εκεί και είδαμε τις κακοτεχνίες των επενδυτών που έχουν ρημάξει την περιοχή  Δημιουργώντας λίμνη τα χωριά, με αποτέλεσμα το νερό από τα ρέματα να γυρνάει πίσω σε περίπτωση πλημμύρας σε κάθε νεροποντή με τεράστιες καταστροφές σε καλλιέργειες, σε ζωντανά, σε σπίτια, σε περιουσίες, βάζοντας ακόμα και σε κίνδυνο τη ζωή των κατοίκων  Πρόκειται για την εγκληματική πολιτική  Πιστεύουμε του κόστους οφέλους που μας οδήγησε άλλωστε και στο προδιαγεγραμμένο έγκλημα των τεμπών, το οποίο γέμισε με ειλικρινή θλίψη αλλά και με αφάνταστη οργή τον ελληνικό λαό και τη νεολαία  Και εδώ στην περιοχή μας, οδηγώντας και σε κάποιες από τις μεγαλύτερες κινητοποιήσεις που έχει γίνει ποτέ στη Λαμία αλλά και αλλού  Σε όλη τη χώρα",environment,,natural disasters,,investor malpractices,-0.8,0.9,0.0,0.1,0.0,0.1,0.0,0.0,"[['village', 'location', '0.75'], ['lamia', 'location', '1.0'], ['investors', 'organization', '0.5'], ['lake', 'object', '0.6'], ['streams', 'object', '0.5'], ['crime', 'object', '0.7'], ['tempe', 'location', '0.6'], ['greek', 'nationality', '0.5'], ['youth', 'group', '0.5'], ['lamia', 'location', '1.0'], ['country', 'location', '0.5']]","[['lamia', 'location', '1'], ['greek', 'country', '1'], ['tempe', 'political party', '0.7'], ['lamia mobilizations', 'group of people', '0.8']]"
13," At the same time that all these investments are being advertised, not a word has been said about what will happen to LARCO, an emblematic production unit for the region, for the whole country, where the waste of millions by all governments or conscious abandonment to demolish it and give it away for a plate of lentils, resulting in.  To have its furnaces shut down now and the workers do not know if and when it will be reopened.  The KKE consistently highlights the possibilities for the continued operation and development of the. "," Την ίδια ώρα βέβαια που διαφημίζονται όλες αυτές οι επενδύσεις, δεν ακούστηκε μια κουβέντα για το τι θα γίνει με τη ΛΑΡΚΟ μία εμβληματική παραγωγική μονάδα για την περιοχή, για ολόκληρη τη χώρα όπου βγάζει μάτι η κατασπατάληση εκατομμυρίων από όλες τις κυβερνήσεις ή συνειδητή εγκατάλειψη για να την γκρεμίσουν και να τη δώσουν έναντι πινακίου φακής, με αποτέλεσμα  Να έχουν σβήσει τα καμίνια της τώρα να μην γνωρίζουν οι εργαζόμενοι, αν και πότε θα επαναλειτουργήσει  Το ΚΚΕ σταθερά αναδεικνύει τις δυνατότητες για τη συνέχιση της λειτουργίας και της ανάπτυξης της",employment,,other,,larco,-0.5,0.67,0.0,0.1,0.3,0.4,0.1,0.0,"[['larco', 'organization', '1.0'], ['kke', 'organization', '1.0']]","[['larco', 'organization', '0.9'], ['kke', 'political party', '0.9']]"
14," Struggling steadfastly for the future of the more than 1300 employees and the associated professionals in the respective areas where the company operates.  We submitted 3 legislative proposals for the reopening of LARCO and for the safeguarding of all jobs, none of which were rejected by the government, none of which were rejected by the other parties.  We also did not hear a word about the demands that the farmers of the region put forward in the face of the acute problems they face with the exorbitant production costs, the lack of guaranteed prices for which they sell their products.  To be exploited with humiliating prices by industrialists, big traders and then the products reach the shelves at high prices for the people's family. "," Παλεύει αταλάντευτα για το μέλλον των 1300 και πλέον εργαζομένων, αλλά και των συνεργαζόμενων επαγγελματιών στις αντίστοιχες στις αντίστοιχες περιοχές που δραστηριοποιείται η επιχείρηση  3 προτάσεις νόμων καταθέσαμε για την επαναλειτουργία της ΛΑΡΚΟ και για τη διασφάλιση όλων των θέσεων εργασίας, της οποίας απέρριψε η κυβέρνηση σε καμιά μας σε καμιά δεν τοποθετήθηκαν όμως και τα άλλα κόμματα  Κουβέντα, δεν ακούσαμε επίσης για τα αιτήματα που βάζουν οι αγρότες της περιοχής μπροστά στα οξυμένα προβλήματα που αντιμετωπίζουν με το υπέρογκο κόστος παραγωγής, την έλλειψη εγγυημένων τιμών για την οποία πουλάνε τα προϊόντα τους αποτέλεσμα  Να τους εκμεταλλεύονται με εξευτελιστικές τιμές, βιομήχανοι, μεγαλέμποροι και στη συνέχεια τα προϊόντα να φτάνουν πανάκριβα στα ράφια για τη λαϊκή οικογένεια",employment,,other,,job security,0.0,0.1,0.0,0.05,0.0,0.1,0.0,0.0,"[['larco', 'organization', '1.0'], ['1300', 'quantity', '1.0']]","[['larco', 'organization', '1.0'], ['government', 'organization', '1.0'], ['political parties', 'group of people', '1.0'], ['farmers', 'group of people', '1.0'], ['region', 'location', '1.0'], ['industrialists', 'group of people', '0.9'], ['big traders', 'group of people', '0.8']]"
15,"  The serious decrease in population in several areas of Central Greece and especially here in Fthiotida, is the result of the abandonment by the state, especially of these rural areas, an area which instead of producing quality cheap agricultural products, in order to solve the food problem of the population, is wiping out farmers and livestock farmers.  In order for a young person to stay here, to be active professionally, to start a family, to live in his place, it is necessary to have the necessary state assistance to cope with all these adversities.  We need public hospitals fully staffed, equipped and not in the current state of the hospitals of Lamia and Livadia.  The rest needs health centres, rural clinics, schools for its children, development of cultural and sports infrastructure, projects to protect its life and property from natural and other hazards.  The KKE was and is with the people of North Evia in the catastrophic fire of 2021 ignited by the state government policy.  We are fighting for 100% compensation against the false promises in the so-called reconstruction plan that is tailor-made for big interests. ","  Η σοβαρή μείωση του πληθυσμού σε αρκετές περιοχές της Κεντρικής Ελλάδας και ειδικά εδώ στη Φθιώτιδα, είναι αποτέλεσμα της εγκατάλειψης από μέρους του κράτους, ιδιαίτερα αυτών των αγροτικών περιοχών, μια περιοχή η οποία αντί να παράγει ποιοτικά φθηνά αγροτικά προϊόντα, ώστε να λύσει και το διατροφικό πρόβλημα του πληθυσμού, ξεκληρίζει αγρότες και κτηνοτρόφους  Για να μείνει ένας νέος άνθρωπος εδώ να δραστηριοποιηθεί επαγγελματικά, να φτιάξει οικογένεια, να ζήσει στον τόπο του απαραίτητη προϋπόθεση είναι να έχει την απαιτούμενη κρατική βοήθεια για να ανταπεξέλθει σε όλες αυτές τις αντιξοότητες  Χρειάζονται δημόσια νοσοκομεία πλήρως στελεχωμένα, εξοπλισμένα και όχι στην κατάσταση που βρίσκονται σήμερα τα νοσοκομεία της λαμίας της Λιβαδειάς  Τα υπόλοιπα χρειάζονται κέντρα υγείας, αγροτικά ιατρεία, σχολεία για τα παιδιά του, ανάπτυξη πολιτιστικών και αθλητικών υποδομών, έργα για την προστασία της ζωής και της περιουσίας του από φυσικούς και άλλους κινδύνους  Το ΚΚΕ ήταν και είναι μαζί με το λαό της Βόρειας Εύβοιας στην καταστροφική πυρκαγιά του 2021 που άναψε η κρατική κυβερνητική πολιτική  Παλεύουμε για αποζημιώσεις 100% κόντρα στις ψεύτικες υποσχέσεις στο λεγόμενο σχέδιο ανασυγκρότησης που είναι κομμένο και ραμμένο στα μέτρα των μεγάλων συμφερόντων",agricultural policy,,other,,population decrease,-0.7,0.1,0.2,0.1,0.0,0.2,0.0,0.0,"[['central greece', 'geographic', '1.0'], ['fthiotida', 'geographic', '1.0'], ['kke', 'organization', '1.0'], ['north evia', 'geographic', '1.0']]","[['fthiotida', 'location', '1.0'], ['central greece', 'location', '1.0'], ['lamia', 'location', '1.0'], ['livadia', 'location', '1.0'], ['kke', 'political party', '1.0'], ['north evia', 'location', '1.0'], ['2021', 'date', '1.0']]"
16," But at the expense of the needs of the people.  At the same time.  Being very concerned about the seismic activity in the whole region, we took an important initiative and recently organized an event in Chalkida for seismic armouring with well-known scientists and mass organizations of the prefecture. "," Σε βάρος όμως των λαϊκών αναγκών  Ταυτόχρονα  Ανησυχώντας πολύ για τη σεισμική δραστηριότητα σε όλη την περιοχή, πήραμε μια σημαντική πρωτοβουλία και οργανώσαμε πρόσφατα εκδήλωση στη Χαλκίδα για την αντισεισμική θωράκιση με γνωστούς επιστήμονες και μαζικούς φορείς του νομού",environment,,other,,seismic activity,0.0,0.1,0.0,0.0,0.0,0.0,0.0,0.0,"[['chalkida', 'location', '1.0']]","[['chalkida', 'location', '0.8'], ['scientists', 'group of people', '0.8'], ['mass organizations', 'organization', '0.8'], ['prefecture', 'location', '0.8']]"
17," Friends and friends.  Overall, we believe that the people of the region and of the whole country now have valuable accumulated experience, which they can and should use.  In the next elections.  Everyone and everything has now been tested in successive unpopular governmental schemes created by all the parties before, the New Democracy, SYRIZA before that, PASOK and other parties.  Which turned out to be disposable. "," Φίλες και φίλοι  Συνολικά θεωρούμε ότι ο λαός της περιοχής και όλης της χώρας έχει πλέον πολύτιμη συσσωρευμένη πείρα, την οποία μπορεί και πρέπει να αξιοποιήσει  Στις ερχόμενες εκλογές  Έχουν δοκιμαστεί πλέον οι πάντες και τα πάντα σε διαδοχικά αντιλαϊκά κυβερνητικά σχήματα που έφτιαξαν όλα μαζί τα κόμματα πριν, η νέα Δημοκρατία, ο ΣΥΡΙΖΑ πιο πριν το ΠΑΣΟΚ μαζί με άλλα κόμματα  Που τελικά αποδείχτηκαν μιας χρήσης",other,,election spending,,elections,0.0,0.1,0.0,0.1,0.0,0.2,0.0,0.0,"[['region', 'location', '0.5'], ['country', 'location', '0.5'], ['new democracy', 'organization', '0.5'], ['syriza', 'organization', '0.5'], ['pasok', 'organization', '0.5']]","[['region', 'location', '0.7'], ['country', 'country', '0.8'], ['new democracy', 'political party', '0.7'], ['syriza', 'political party', '0.7'], ['pasok', 'political party', '0.7'], ['elections', 'date', '0.6']]"
18," Unfortunately, the other parties agree to the goals of large groups for new and large profits at the expense of workers, agree to the fixing of the minimum wage at 2011 levels, essentially with individual differences in the maintenance of the memorandum and post-memorandum laws of commitments that loosen the hands of large employers in the European Union's policy of energy liberalization.  And the so-called green growth that on the one hand explodes energy poverty for the people and on the other hand boosts the profits of the green energy conglomerates.  All together, unfortunately, they voted for the objectives of the European Union's Development Development Fund and now they are fooling the people with divided roles. "," Δυστυχώς τα άλλα κόμματα συμφωνούν στους στόχους μεγάλων ομίλων για νέα και μεγάλα κέρδη σε βάρος των εργαζομένων συμφωνούν στην καθήλωση του κατώτατου μισθού στα επίπεδα του 2011, ουσιαστικά με επιμέρους διαφοροποιήσεις στη διατήρηση των μνημονιακών και μεταμνημονιακών νόμων των δεσμεύσεων που λύνουν τα χέρια των μεγάλων εργοδοτών στην πολιτική της Ευρωπαϊκής Ένωσης για την απελευθέρωση της ενέργειας  Και την δήθεν έτσι θα την πούμε πράσινη ανάπτυξη που εκτοξεύει από τη μία την ενεργειακή φτώχεια για το λαό και από την άλλη απογειώνει τα κέρδη των πράσινων ομίλων της ενέργειας  Όλοι μαζί, δυστυχώς ψήφισαν τους στόχους του Ταμείου Ανάπτυξης Ανάπτυξης της Ευρωπαϊκής Ένωσης και τώρα κοροϊδεύουν το λαό με μοιρασμένους ρόλους",energy,,other,,minimum wage,-0.7,0.85,0.3,0.8,0.2,0.5,0.0,0.2,"[['european union', 'organization', '1.0']]","[['european union', 'organization', '1.0'], ['green energy conglomerates', 'group of people', '0.8'], [""european union's development development fund"", 'organization', '1.0'], ['people', 'group of people', '0.8']]"
19," That this SUPER memorandum, because that's what it is, can have positive effects for the people.  Finally, they are arguing with each other about which groups will absorb this money that has been accumulated again by the working people themselves.  They put on, as you can see, daily shows for tapas and baskets, but together these parties reject the proposals of the KKE for relief.  In fact, energy poverty, because these proposals, you see, affect the privileges of a few. "," Ότι τάχα μπορεί αυτό το ΥΠΕΡ μνημονιο, γιατί τέτοιο είναι να έχει και θετικά για το λαό  Τελικά τσακώνονται μεταξύ τους για το ποιοι όμιλοι θα απορροφήσουν αυτά τα χρήματα που συσσωρεύτηκαν πάλι από τον ίδιο τον εργαζόμενο λαό  Στήνουν, όπως βλέπετε, καθημερινά σόου για τάπας και τα καλάθια, αλλά από κοινού αυτά τα κόμματα απορρίπτουν τις προτάσεις του ΚΚΕ για την ανακούφιση  Από την ακρίβεια, από την ενεργειακή φτώχεια, γιατί αυτές οι προτάσεις βλέπετε θιγούν τα προνόμια κάποιων λίγων",economy,,other,,proposals,0.4,0.4,0.1,0.1,0.2,0.5,0.2,0.0,"[['super', 'organization', '0.8'], ['kke', 'organization', '0.8']]","[['kke', 'organization', '0.7']]"
