id,text,text_el,topic,topic-context,subtopic,subtopic-context,topic-open,sentiment,polarization,polarization-definition,toxicity,toxicity-definition,populism,populism-definition,hate speech,ner,ner-limited
10,"Friends, that is why I call on every Greek to choose between a state of opacity, patronage for the blue children, for the cronies of Mr.Tsipras, a state of meritocracy, transparency and respect for institutions, or a state of social injustice that implements policies that make the rich richer, or a state with justice and strong health and public education. Between a state that hands over the toil, the sacrifices of the Greek people through their red loans to the speculators of the funds, and a state that ensures the fair regulation of the private debt of households and businesses. Friends, Mr Mitsotakis. He touts himself as a champion of stability. He talks of paralysis when his track record includes the interception or capture of the rule of law, the blue children, the widening of social inequalities and he states clearly that he will hold elections as many times as necessary until he himself is elected Prime Minister. But he is probably not so sure of his strategy, because he said a moment ago that he will eventually use the first mandate. So let the Greek people see who has a firm position to govern the country? I have been talking for a year now about stability and progress since the first mandate, or Mr Mitsotakis, who has been talking about second and third elections, but in the face of deadlock, his staff say that he will use the first mandate. We will hear a lot because they understand quite simply that things are not that simple. For his part, Mr Tsipras voted for the simple proportional representation. What does simple proportional representation mean throughout Europe? It means that the parties that have 151 seats work together. But he is talking about a special simple proportional representation that in order to cooperate in the electoral system that he voted for he has to be the first party, do you know what that proves? That the real concern of the leader of Syriza is not to get rid of New Democracy and Mitsotakis, but to save his own political future.","Φίλες και φίλοι, γι αυτό καλώ κάθε Ελληνίδα και κάθε Έλληνα να επιλέξει ανάμεσα σε ένα κράτος αδιαφάνειας, πελατειασμό για τα γαλάζια παιδιά, για τους κολλητούς του κυρίου Τσίπρα σε ένα κράτος αξιοκρατίας, διαφάνειας και σεβασμού των θεσμών μεταξύ ενός κράτους κοινωνικής αδικίας που υλοποιεί πολιτικές που κάνουν τους πλούσιους πλουσιότερους σε ένα κράτος με δικαιοσύνη και ισχυρή υγεία και δημόσια παιδεία. Μεταξύ ενός κράτους που παραδίδει τις κόπους, τις θυσίες του ελληνικού λαού μέσω των κόκκινων δανείων του στους κερδοσκόπους των funds, σε ένα κράτος που διασφαλίζει τη δίκαιη ρύθμιση του ιδιωτικού χρέους των νοικοκυριών και των επιχειρήσεων. Φίλες και φίλοι, κύριος Μητσοτάκης. Αυτοδιαφημίζεται ως υπέρμαχος της σταθερότητας. Μιλάει για παραλυσία, όταν στα πεπραγμένα του συγκαταλέγονται οι υποκλοπές ή άλωση του κράτους δικαίου, τα γαλάζια παιδιά, η διεύρυνση των κοινωνικών ανισοτήτων και δηλώνει ευθαρσώς ότι θα κάνει όσες φορές χρειαστεί εκλογές μέχρι ο ίδιος να εκλεγεί πρωθυπουργός. Μάλλον όμως δεν είναι τόσο σίγουρος για τη στρατηγική του, γιατί πριν από λίγο είπε ότι τελικά θα αξιοποιήσει την πρώτη εντολή. Ας δει λοιπόν ο ελληνικός λαός, ποιος έχει σταθερή θέση για τη διακυβέρνηση της χώρας; Εγώ τώρα και ένα χρόνο που μιλώ από την πρώτη εντολή σταθερότητα και πρόοδο, ή ο κύριος Μητσοτάκης που έλεγε και δεύτερες και τρίτες εκλογές, αλλά μπροστά στο αδιέξοδο το προσωπικό του λέει ότι θα αξιοποιήσει την πρώτη εντολή. Θα ακούσουμε πολλά γιατί πολύ απλά καταλαβαίνουν ότι δεν είναι τόσο απλά τα πράγματα. Από την πλευρά του ο κύριος Τσίπρας ψήφισε την απλή αναλογική. Τι σημαίνει απλή αναλογική σε όλη την Ευρώπη; Ότι συνεργάζονται τα κόμματα που έχουν 151 έδρες. Όμως αυτός μιλάει για μια ειδική απλή αναλογία ότι για να συνεργαστεί στο εκλογικό σύστημα που ψήφισε ο ίδιος πρέπει να είναι πρώτο κόμμα, ξέρετε τι αποδεικνύει αυτό; Ότι η πραγματική αγωνία του αρχηγού του ΣΥΡΙΖΑ δεν είναι να φύγει η Νέα Δημοκρατία και ο Μητσοτάκης, αλλά να σώσει ο ίδιος το πολιτικό του μέλλον. ",,opponent criticism,,election spending,,-0.5,,0.5,,,,0.2,,[],[]
11,"So we have other priorities. On 21 May, give us the strength, because for us the priority is both progress and stability from the first Sunday solutions, positions, a programme and a new political ethos, which they so desperately need. Particularly young people, so that they can believe in politics again.","Έχουμε λοιπόν άλλες προτεραιότητες. Στις 21 Μαϊου δώστε μας τη δύναμη, γιατί για εμάς προτεραιότητα είναι και η πρόοδος και η σταθερότητα από την πρώτη Κυριακή λύσεις, θέσεις, πρόγραμμα και ένα νέο πολιτικό ήθος που το έχουν τόσο πολύ ανάγκη. Ιδιαίτερα οι νέοι άνθρωποι για να ξαναπιστέψουν στην πολιτική. ",,elections,,youth,,0.6,,0.0,,,,0.0,,[],"[['21 may', 'date', '1.0'], ['young people', 'group of people', '1.0']]"
12,"With a strong PASOK, I pledge to every Greek to create a social housing pool of 150,000 houses throughout Greece, newly built or with Recovery Fund funds or rebuilt with apologies, with tax incentives and relief for their owners. I am talking about closed houses with a view to making them available at cheap rent so that young couples and the poorest Greeks can have decent access. This is how we achieve competition to drive down rents. Because today one of the biggest cost of living systems every day is the cost of rent.","Με ένα ισχυρό ΠΑΣΟΚ δεσμεύομαι σε κάθε Έλληνα για τη δημιουργία κοινωνικής δεξαμενής κατοικιών 150.000 σπιτιών σε όλη την Ελλάδα, νεόδμητων ή με κονδύλια του Ταμείου Ανάκαμψης ή ανακατασκευασμένων με παροχή συγγνώμη με παροχή φορολογικών κινήτρων και ελαφρύνσεων στους ιδιοκτήτες τους. Μιλώ για κλειστά σπίτια με σκοπό τη διάθεσή τους με φθηνό ενοίκιο για να έχουν αξιοπρεπή πρόσβαση τα νέα ζευγάρια και οι φτωχότεροι Έλληνες. Έτσι πετυχαίνουμε ανταγωνισμό για να μειωθούν τα ενοίκια προς τα κάτω. Διότι σήμερα ένα από τα μεγαλύτερα συστήματα του κόστους ζωής καθημερινά είναι το κόστος του ενοικίου. ",,housing,,affordable housing,,0.5,,0.2,,,,0.2,,[],"[['pasok', 'political party', '0.9'], ['greek', 'country', '0.9'], ['greece', 'location', '0.8'], ['recovery fund', 'organization', '0.7'], ['greeks', 'group of people', '0.6']]"
13,"The second issue is the management of private debt. For us, the second chance of dignity for all Greeks who fought and struggled objectively but could not endure the conditions of multiple crises is a priority. We do not say with the dry and the green, as Mr Tsipras did when he said in 2012, 2013, 2014 seismic and do not pay. We come for own arrangements and handed over your toil and sacrifices to the blackmailers of foreign funds.
We therefore propose against Mr Mitsotakis who completely abolished the protection of the first home in the restoration of the protection of the main house for over-indebted households, by updating the PASOK law of 2010.","Δεύτερο ζήτημα είναι η διαχείριση του ιδιωτικού χρέους. Για μας είναι προτεραιότητα η δεύτερη ευκαιρία αξιοπρέπειας για όλους τους Έλληνες που πάλεψαν αντικειμενικά αγωνίστηκαν αλλά δεν άντεξαν στις συνθήκες των πολλαπλών κρίσεων. Εμείς δεν λέμε μαζί με τα ξερά και τα χλωρά, όπως έκανε ο κύριος Τσίπρας που έλεγε το 2012, 2013, 2014 σεισάχθεια και μην πληρώνετε. Ερχόμαστε για δικές ρυθμίσεις και παρέδωσε τους κόπους και τους θυσίες σας στους εκβιαστές των ξένων funds. 
Εμείς λοιπόν, προτείνουμε απέναντι και στον κύριο Μητσοτάκη που κατήργησε ολοκληρωτικά την προστασία της πρώτης κατοικίας στην επαναφορά της προστασίας της κύριας κατοικίας για τα υπερχρεωμένα νοικοκυριά, με επικαιροποίηση του νόμου του ΠΑΣΟΚ του 2010. ",,debt,,debt regulations,,0.0,,0.0,,,,0.0,,[],"[['greeks', 'group of people', '1.0'], ['mr tsipras', 'person', '1.0'], ['mitsotakis', 'person', '1.0'], ['pasok', 'political party', '1.0'], ['greece', 'country', '1.0'], ['2012', 'date', '1.0'], ['2013', 'date', '1.0'], ['2014', 'date', '1.0']]"
14,"Corresponding property, corresponding protection for agricultural property, protection for borrowers in Swiss francs, by limiting the interest rate increase to 1/3 for the borrower and 2/3 for the banking institution. Substantial negotiation with banks and taking measures to eliminate and prevent increases in interest rates on loans for weak households and reducing the banks' profit margin for consistent borrowers, so that consistent borrowers also have incentives to continue to comply with their arrangements.","Αντίστοιχη περιουσία, αντίστοιχη προστασία για την αγροτική περιουσία, προστασία των δανειοληπτών σε ελβετικό φράγκο, με τον περιορισμό της αύξησης του επιτοκίου στο 1/3 για το δανειολήπτη και 2/3 για το τραπεζικό ίδρυμα. Ουσιαστική διαπραγμάτευση με τις τράπεζες και λήψη μέτρων για την απάλειψη και αποτροπή των αυξήσεων στα επιτόκια των δανείων των αδύναμων νοικοκυριών και μείωση του περιθωρίου κέρδους των τραπεζών για τους συνεπείς δανειολήπτες, ώστε και οι συνεπείς να έχουν κίνητρα να συνεχίσουν να τηρούν τις ρυθμίσεις τους. ",,agricultural policy,,loans,,0.4,,0.1,,,,0.1,,[],"[['swiss francs', 'currency', '0.8'], ['banks', 'organization', '0.7'], ['interest rates', 'date', '0.6'], ['borrowers', 'group of people', '0.6'], ['consistent borrowers', 'group of people', '0.6'], ['weak households', 'group of people', '0.6']]"
15,"With PASOK strong and I say this. Because for us the national health system is a top issue today, as today its initiator, one of his great comrades, George Gennimatas, who, together with Andreas Papandreou and Paraskevas Avgerinos, left this very great social legacy to the Greek people, has passed away. So we are talking about the rebirth of the national health system. Which needs support, so we are proposing an adjustment so that the Recovery Fund can finance the NHS with 8 to 10%, which are percentages similar to countries that have the same problems as Greece and not the 2-4% that New Democracy has given. Also, strong primary health care that reaches every home in every case. It requires staffing the hospitals of the national health system with permanent medical staff and, as we must not only give applause and clapping, but also an increase in the salaries of the health workers of the national health system, so that we can bring us into line with the average of doctors and health workers with the other countries of the European Union. Introduce social, economic and scientific incentives to stop the understaffing of hospitals in the region. You are well aware of the problem here in Epirus too. Finally, on the heavy and unhealthy pay of NHS health workers and no more selective increases in allowances.","Με το ΠΑΣΟΚ ισχυρό και το λέω αυτό. Διότι για μας είναι κορυφαίο ζήτημα το εθνικό σύστημα υγείας σήμερα σαν και σήμερα έφυγε από τη ζωή ο εμπνευστής του, ένας από τους μεγάλους συμπαίκτες του, ο Γιώργος Γεννηματάς, που μαζί με τον Ανδρέα Παπανδρέου και τον Παρασκευά Αυγερινό άφησαν αυτή την πολύ μεγάλη κοινωνική παρακαταθήκη στον ελληνικό λαό. Εμείς λοιπόν μιλάμε για την αναγέννηση του εθνικού συστήματος υγείας. Που χρειάζεται στήριξη για αυτό προτείνουμε την αναπροσαρμογή ώστε από το Ταμείο Ανάκαμψης να χρηματοδοτήσει με 8 ως 10% το ΕΣΥ είναι ποσοστά ανάλογα κρατών που έχουν τα ίδια προβλήματα με την Ελλάδα και όχι το 2-4% που έχει δώσει η Νέα Δημοκρατία. Επίσης, ισχυρή πρωτοβάθμια φροντίδα υγείας που θα φτάνει σε κάθε περίπτωση σε όλα τα σπίτια. Απαιτείται στελέχωση των νοσοκομείων του εθνικού συστήματος υγείας με μόνιμο ιατρικό προσωπικό και καθώς πρέπει να μην δώσουμε μόνο χειροκροτήματα και παλαμάκια, αλλά και αύξηση των αποδοχών των υγειονομικών του εθνικού συστήματος υγείας, ώστε να εναρμονιστούμε στο μέσο όρο των γιατρών και των υγειονομικών με τις υπόλοιπες χώρες της Ευρωπαϊκής Ένωσης. Θέσπιση κοινωνικών, οικονομικών και επιστημονικών κινήτρων για να σταματήσει η υποστελέχωση των νοσοκομείων στην περιφέρεια. Το γνωρίζετε πάρα πολύ καλά το πρόβλημα και εδώ στην Ήπειρο ένταξη. Τέλος, στα βαρέα και ανθυγιεινά των υγειονομικών του ΕΣΥ και όχι άλλες επιλεκτικές αυξήσεις επιδομάτων.",,health,,other,,0.6,,0.0,,,,0.0,,[],"[['andreas papandreou', 'person', '0.9'], ['george gennimatas', 'person', '0.9'], ['paraskevas avgerinos', 'person', '0.9'], ['pasok', 'political party', '0.8'], ['greek people', 'group of people', '0.7'], ['recovery fund', 'organization', '0.7'], ['nhs', 'organization', '0.9'], ['greece', 'country', '0.8'], ['european union', 'organization', '0.8'], ['epirus', 'location', '0.7']]"
16,"Friends, education. For us, education is the greatest lever of social justice and social mobility. Do you know all too well the older people? That public education made the child of the farmer in the Epirus of the cattle farmer study in the good years of the PASOK. Doctor, lawyer engineer, to produce wealth and build his family with dignity. We have a duty to strengthen all levels of public education again, so that all Greek children have free access to reduce inequalities and not Greek children taking computer tests by looking into the pocket of their grandfather's, grandmother's father and mother. But looking at their future and their ambitions for it, so for us the vision for public education is a priority. Schools today must be a key instrument for young people to respond to the digital world and sustainable development, offering equal opportunities to all young people, breaking down inequalities, setting them up to take on the challenges of the future both as citizens and as workers. For this there must be a strong public school and a strong public university. We know that the ideological policies of SYRIZA and, of course, the policies of New Democracy, which want to privatise education at all levels, have degraded and undermined education in our country. That is why it is time to take bold decisions. Always in cooperation with teachers, with an increase in public spending on education, so that we can gradually reach the average spending of the European Union countries, our proposals focus on strengthening quality by modernising content and implementing the 16 quality indicators of the European Union, with remedial teaching programmes to cover learning gaps and address inequalities by using modern digital capabilities, which unfortunately do not exist.","Φίλες και φίλοι, η παιδεία. Η παιδεία για μας είναι ο μεγαλύτερος μοχλός κοινωνικής δικαιοσύνης και κοινωνικής κινητικότητας. Γνωρίζετε πάρα πολύ καλά οι μεγαλύτερης ηλικίας; Ότι η δημόσια παιδεία έκανε το παιδί του αγρότη στην Ήπειρο του κτηνοτρόφου να σπουδάσει τα καλά χρόνια του ΠΑΣΟΚ. Γιατρός, δικηγόρος μηχανικός, να παράξει πλούτο και να οικοδομήσει την οικογένειά του με αξιοπρέπεια. Έχουμε χρέος να ενισχύσουμε ξανά όλες τις βαθμίδες της δημόσιας παιδείας, ώστε να υπάρχει δωρεάν πρόσβαση σε όλα τα ελληνόπουλα για να μειώσουμε τις ανισότητες και όχι τα ελληνόπουλα να κάνουν µηχανογραφικά κοιτώντας στην τσέπη του παππού της, γιαγιάς του πατέρα και της μάνας. Αλλά κοιτώντας το μέλλον και τις φιλοδοξίες τους για αυτό λοιπόν, για μας το όραμα για τη δημόσια παιδεία είναι προτεραιότητα. Το σχολειό σήμερα πρέπει να αποτελεί καθοριστικό μέσο για την ανταπόκριση των νέων στον ψηφιακό κόσμο και στη βιώσιμη ανάπτυξη, να προσφέρει ίσες ευκαιρίες σε όλους τους νέους, σπάζοντας τις ανισότητες, βάζοντάς τους να ακολουθήσουν τις προκλήσεις του μέλλοντος και ως πολίτες, αλλά και ως εργαζόμενοι. Για αυτό πρέπει να υπάρχει ένα ισχυρό δημόσιο σχολείο και ένα ισχυρό δημόσιο πανεπιστήμιο. Γνωρίζουμε ότι οι ιδεοληπτικές πολιτικές του ΣΥΡΙΖΑ και βέβαια οι πολιτικές της Νέας Δημοκρατίας που θέλουν την ιδιωτικοποίηση της παιδείας όλων των βαθμίδων, υποβάθμισαν και υπονόμευσαν την παιδεία στη χώρα μας. Γι αυτό λοιπόν είναι ώρα να πάρουμε τολμηρές αποφάσεις. Σε συνεργασία πάντα με τους εκπαιδευτικούς, με αύξηση στις δημόσιες δαπάνες για την παιδεία, ώστε να φτάσουμε σταδιακά στη μέση δαπάνη των χωρών της Ευρωπαϊκής Ένωσης, με τις προτάσεις μας επικεντρώνουμε στην ενίσχυση της ποιότητας με εκσυγχρονισμό του περιεχομένου και εφαρμογή των 16 δεικτών ποιότητας της Ευρωπαϊκής Ένωσης με προγράμματα ενισχυτικής διδασκαλίας για την κάλυψη των μαθησιακών κενών και την αντιμετώπιση των ανισοτήτων με αξιοποίηση ψηφιακών σύγχρονων δυνατοτήτων, που δυστυχώς δεν υπάρχουν. ",,education,,higher education,,0.8,,0.2,,,,0.0,,[],"[['pasok', 'political party', '0.75'], ['greek', 'country', '0.75'], ['syriza', 'political party', '0.75'], ['new democracy', 'political party', '0.75'], ['european union', 'organization', '0.75']]"
