id,text,text_el,topic,subtopic,topic-open,sentiment,polarization,polarization-definition,toxicity,toxicity-definition,populism,populism-definition,hate speech,ner
24, The judiciary and independent authorities spoke.  That this effort is at the expense of democracy and transparency.  The Polakis and all the executives came out and attacked the independent authorities.  What the new democracy is doing today.  Once Rammos and Menudako had done their job. , Μιλούσε η δικαιοσύνη και ανεξάρτητες αρχές  Ότι αυτή η προσπάθεια που κάνει είναι εις βάρος της δημοκρατίας και της διαφάνειας  Βγαίνανε οι Πολάκηδες και όλα τα στελέχη και χτυπούσαν τις ανεξάρτητες αρχές  Τι κάνει σήμερα η νέα δημοκρατία  Μόλις ο Ράμμος με το Μενουδάκο έκαναν τη δουλειά τους,justice,democracy-institutions,,-0.6,0.8,0.5,0.3,0.5,,,0.2,"[['judiciary', 'organization', '0.9626'], ['independent authorities', 'organization', '0.8687'], ['democracy', 'other', '0.8932'], ['transparency', 'other', '0.8932'], ['polakis', 'person', '0.4779'], ['executives', 'other', '0.8932'], ['new democracy', 'organization', '0.7414'], ['rammos', 'person', '0.3187'], ['menudako', 'person', '0.3187']]"
25, And they announced to the most official bodies of the European Parliament that there are 300 messages.  Predator with 100 targets have found companies.  They were directly targeted by those who until the day before yesterday were defending them. , Και ανακοίνωσαν στο πιο επίσημα όργανα του Ευρωπαϊκού Κοινοβουλίου ότι υπάρχουν 300 μηνύματα  Predator με 100 στόχους έχουν βρει εταιρείες  Απευθείας στοχοποιήθηκαν από αυτούς που μέχρι προχθές τους υπερασπιζόταν,security,interception,,-0.6,0.6,0.0,0.4,0.6,,,0.2,"[['european parliament', 'organization', '1.0'], ['predator', 'product', '1.0']]"
26, So what is our value difference.  Not only consistency and responsibility.  It's something more. ," Άρα ποια είναι η αξιακή μας διαφορά  Δεν είναι μόνο η συνέπεια και η ευθύνη  Είναι κάτι, περισσότερο",reference to other parties,other,,0.0,0.0,0.0,0.0,0.0,,,0.0,[]
27," It's respect for institutions, for democratic democracy, even if.  Sometimes these institutions point to our own officials for responsibility and what do we do then?  We're doing a cover-up.  We put them on the ballot papers like Tsipras put Mr Pappas on the ballot papers.  Or we cover them up, like Mitsotakis, his nephew.  And the commander of the NSA and Mrs. Vlachou and the owners of these software.  No.  We within a few seconds, when the Qatar gate emerged. "," Είναι ο σεβασμός στους θεσμούς, στις δημοκρατικές δημοκρατία, ακόμη και αν  Κάποιες φορές αυτοί οι θεσμοί δείχνουν και δικά μας στελέχη για ευθύνες και εμείς τι κάνουμε τότε  Κάνουμε συγκάλυψη  Τους βάζουμε στα ψηφοδέλτια όπως ο Τσίπρας τον κύριο Παππά  Ή τους καλύπτουμε το συγκαλύπτουμε, όπως ο Μητσοτάκης, τον ανιψιό του  Και το διοικητή της ΕΥΠ και την κυρία Βλάχου και τους ιδιοκτήτες των λογισμικών αυτών  Όχι  Εμείς μέσα σε μερικά δευτερόλεπτα, όταν προέκυψε το Qatar gate",government programme,democracy-institutions,,-0.4,0.2,0.0,0.2,0.3,,,0.1,"[['tsipras', 'person', '0.6'], ['mr pappas', 'person', '0.6'], ['mitsotakis', 'person', '0.6'], ['nsa', 'organization', '0.6'], ['mrs. vlachou', 'person', '0.6'], ['qatar', 'location', '0.6']]"
28," We deleted Mrs Kaili.  We just came up with an irregularity, an irregularity which is not directly related to the accident with the accident, but an irregularity in a hospital we removed from our ballot.  The doctor who committed the irregularity. "," Διαγράψαμε την κυρία Καϊλή  Εμείς μόλις προέκυψε μια παρατυπία, μια παρατυπία η οποία δεν έχει άμεση σχέση με το δυστύχημα με το δυστύχημα, αλλά μια παρατυπία σε ένα νοσοκομείο βγάλαμε από το ψηφοδέλτιό μας  Τον γιατρό που έκανε την παρατυπία",health,understaffing of hospitals,,-0.2,0.0,0.0,0.2,0.5,,,0.0,"[['mrs kaili', 'person', '0.99'], ['hospital', 'organization', '0.98'], ['doctor', 'person', '0.94']]"
29, What the New Democracy is doing with SYRIZA.  New Democracy with SYRIZA.  And let's start with SYRIZA. , Τι κάνει η νέα Δημοκρατία με τον ΣΥΡΙΖΑ  Η Νέα Δημοκρατία με τον ΣΥΡΙΖΑ  Κι ας ξεκινήσουμε από το ΣΥΡΙΖΑ,reference to other parties,other,,0.0,0.0,0.1,0.2,0.2,,,0.0,"[['new democracy', 'org', '0.875'], ['syriza', 'org', '0.875'], ['syriza', 'org', '1.0']]"
30," It has the slogan justice everywhere.  Justice for all of us.  But for them, when justice speaks.  It's bad justice, justice for us, but for them.  Cover-up for their best friends.  And they even had the nerve to say, ""I'm taken,"" he says, ""I'm from New Democracy.  That's why, he says, I'm not raising the issue of wiretapping. "," Έχει το σύνθημα δικαιοσύνη παντού  Δικαιοσύνη για όλους εμάς  Αλλά για αυτούς όταν μιλάει η δικαιοσύνη  Είναι κακή δικαιοσύνη, δικαιοσύνη για μας, αλλά για αυτούς  Συγκάλυψη για τους κολλητούς τους  Και μάλιστα είχαν το θράσος να πουν λέει, είμαι πιασμένος, λέει από τη Νέα Δημοκρατία  Για αυτό λέει, δεν σηκώνω το θέμα των υποκλοπών",slogan,,,-0.6,0.78,0.75,0.8,0.8,,,0.6,"[['new democracy', 'organization', '0.5'], ['wiretapping', 'event', '0.5']]"
31, What else to do at the European Court of Human Rights.  I went to.  I went to the Greek justice system.  We had a committee of inquiry in the European Parliament and the same in the Greek Parliament.  What they did. , Τι άλλο να κάνω στο Ευρωπαϊκό Δικαστήριο Ανθρωπίνων Δικαιωμάτων  Πήγα  Στην ελληνική δικαιοσύνη πήγα  Στο Ευρωπαϊκό Κοινοβούλιο κάναμε εξεταστική επιτροπή το ίδιο και στο ελληνικό κοινοβούλιο  Αυτοί τι έκαναν,justice,justice,,0.0,0.0,0.0,0.0,0.0,,,0.0,"[['european court of human rights', 'organization', '1.0'], ['greek justice system', 'organization', '1.0'], ['european parliament', 'organization', '1.0'], ['greek parliament', 'organization', '1.0']]"
32," Is it the same as the New Democracy.  Mr Mitsotakis.  Who is a liberal, that's how he wants to be presented to the Greek public opinion.  What kind of liberalism it represents.  Liberalism that is capable of doing anything even to expose Greece irreparably. "," Μήπως τα ίδια που κάνει η Νέα Δημοκρατία  Ο κύριος Μητσοτάκης  Που είναι φιλελεύθερος, έτσι θέλει να πλασάρεται στην ελληνική κοινή γνώμη  Τι είδους φιλελευθερισμό εκπροσωπεί  Τον φιλελευθερισμό που είναι ικανός να κάνει τα πάντα ακόμη και να εκθέσει ανεπανόρθωτα την Ελλάδα",economy,other,,-0.7,0.9286,0.1,0.8,0.7,,,0.6,"[['new democracy', 'org', '0.80'], ['mitsotakis', 'per', '1.0'], ['greek', 'misc', '0.60'], ['greece', 'loc', '0.80']]"
33," When the European institutions ask the Rights Committee to come to the country to talk to the ministers, to the secretariats general, to civil society.  And we have the ambassador in Brussels send a letter, don't come.  Because we have a three-day mourning period.  And he replies, the Commission says, the three-day mourning period is over, since it's next week. "," Όταν ζητάνε οι ευρωπαϊκοί θεσμοί, η Επιτροπή Δικαιωμάτων να ρθει στη χώρα να μιλήσει με τους υπουργούς με τους γενικούς γραμματείες, με την κοινωνία των πολιτών  Και βάζουμε τον πρέσβη στις Βρυξέλλες, να στείλει γράμμα, μην έρθετε  Διότι έχουμε τριήμερο πένθος  Και τους απαντά, η Επιτροπή μα λέει, λήγει το τριήμερο πένθος, αφού είναι την άλλη βδομάδα",reference to other parties,democracy-institutions,,0.0,0.0,0.0,0.0,0.1,,,0.0,"[['european', 'org', '0.953'], ['rights committee', 'org', '0.943'], ['commission', 'org', '0.901']]"
34," And after a while Mr. Gerapetritis sends them a new letter and says whenever you come you will not see any of us.  What other country does this.  France, Germany, Spain, Portugal, France, Germany and Spain.  Only Kaczynski's Poland has the tools and the behaviour of the Mitsotakis government, but Greece is a country that fought for democracy and this party is the guarantor of the institutions of transparency and we will stand in the way of any attempt to expose our country internationally by this government.  And they have the nerve to tell us who you're going with. "," Και μετά από λίγο τους στέλνει νέο γράμμα ο κύριος Γεραπετρίτης και λέει όποτε και να ρθειτε δεν θα δείτε κανένα από μας  Ποια άλλη χώρα τα κάνει αυτά  Η Γαλλία, η Γερμανία, η Ισπανία, η Πορτογαλία  Μόνο η Πολωνία του Καζίνσκι έχει τα εργαλεία και τη συμπεριφορά της κυβέρνησης Μητσοτάκη, αλλά η Ελλάδα είναι μια χώρα που έδωσε αγώνες για τη δημοκρατία και αυτή η παράταξη είναι εγγυητής των θεσμών της διαφάνειας και θα μπούμε εμπόδιο σε οποιαδήποτε προσπάθεια η χώρα μας να εκτίθεται διεθνώς απ αυτή την κυβέρνηση  Και έχουν το θράσος να μας πούνε με ποιον θα πάτε",foreign policy,democracy-institutions,,-0.8,0.95,0.0,0.6,0.6,,,0.2,"[['mr. gerapetritis', 'person', '1.0'], ['france', 'location', '0.5'], ['germany', 'location', '0.5'], ['spain', 'location', '0.5'], ['portugal', 'location', '0.5'], [""kaczynski's poland"", 'location', '0.7'], ['mitsotakis government', 'organization', '0.6'], ['greece', 'location', '1.0'], ['democracy', 'concept', '1.0'], ['party', 'organization', '1.0']]"
35," What it is, who we will go with, with our principles, with our values, with our history and with our programme.  His program wants to make Greece a normal European country, a country of perspective for the new generations, a country that will stop the brain-drain of thousands of Greek children from all over Greece going abroad, seeing no hope in the country.  This is the agony of the democratic party and not the agony of power.  Who instrumentalizes everything is ready to sell everything for a chair of power. "," Τι είναι, με ποιον θα πάμε με τις αρχές, με τις αξίες, με την ιστορία μας και με το πρόγραμμά μας  Το πρόγραμμα του συγκεκριμένου θέλει να κάνει την Ελλάδα μια κανονική ευρωπαϊκή χώρα, μια χώρα προοπτικής για τις νέες γενιές, μια χώρα που θα σταματήσει το brain-drain να φύγουν χιλιάδες ελληνόπουλα από όλη την Ελλάδα στο εξωτερικό, μη βλέποντας ελπίδα στη χώρα  Αυτή είναι η αγωνία της δημοκρατικής παράταξης και όχι η αγωνία της εξουσίας  Που εργαλειοποιεί τα πάντα είναι έτοιμοι να πουλήσουν τα πάντα για μια καρέκλα εξουσίας",young people,brain drain,,0.5,0.45,0.1,0.2,0.2,,,0.1,"[['greece', 'location', '1.0'], ['european', 'organization', '1.0'], ['greek', 'nationality', '1.0'], ['democratic party', 'organization', '1.0']]"
36," So that's why here from Kilkis.  We are setting, building a strong programme that will turn Greece around.  This is our fight in the next national elections and the dilemma is clear.  Dear friends.  It is not Tsipras or Mitsotakis. "," Γι αυτό λοιπόν και εδώ από το Κιλκίς  Βάζουμε, οικοδομούμε ένα ισχυρό πρόγραμμα που θα κάνει την Ελλάδα να γυρίσει σελίδα  Αυτός είναι ο αγώνας μας στις επόμενες εθνικές εκλογές και το δίλημμα είναι καθαρό  Αγαπητές φίλες και φίλοι  Δεν είναι Τσίπρας ή Μητσοτάκης",government programme,elections,,0.0,0.0,0.0,0.0,0.0,,,0.0,"[['kilkis', 'location', '1.0'], ['greece', 'location', '1.0'], ['tsipras', 'person', '1.0'], ['mitsotakis', 'person', '1.0']]"
37," The dilemma is.  Or a state prey to the hands of the rulers of the day.  Or a state.  Guarantor of the public interest with a strong mandate from the Greek people.  I guarantee that we will build a state.  A guarantor of the public interest, which will be transparent, meritocratic, respectful of the taxes of the Greek people, utilizing European programs, the Recovery Fund will create modern infrastructure.  The public sector will have evaluation, meritocracy and the private sector and powerful interests will operate by rules. "," Το δίλημμα είναι  Ή ένα κράτος λάφυρο στα χέρια των εκάστοτε κυβερνώντων  Ή ένα κράτος  Εγγυητής του δημοσίου συμφέροντος με ισχυρή εντολή από τον ελληνικό λαό  Εγγυώμαι ότι θα οικοδομήσουμε ένα κράτος  Εγγυητή του δημοσίου συμφέροντος, το οποίο θα είναι διαφάνειας αξιοκρατίας, θα σέβεται τους φόρους του ελληνικού λαού, θα αξιοποιεί τα ευρωπαϊκά προγράμματα, το Ταμείο Ανάκαμψης θα δημιουργεί σύγχρονες υποδομές  Το δημόσιο θα έχει αξιολόγηση, αξιοκρατία και ο ιδιωτικός τομέας και τα ισχυρά συμφέροντα θα λειτουργούν με κανόνες",transparency,recovery fund,,0.55,0.1,0.2,0.1,0.2,,,0.0,"[['greek', 'nationality', '1.0'], ['european', 'nationality', '1.0'], ['recovery fund', 'organization', '1.0']]"
38," There will be justice and not when you are strong always find your right even when you are wrong.  But when you're powerless.  Trying to find your right, but most of the time being lost.  This country does not deserve the Greek people.  This state is not the state we aspire to, the state of the twenty-first century.  And that's the problem.  An expensive state with expensive services but of very poor quality and this was proven in the crime of Tempe.  Why we need to be honest. "," Θα υπάρχει δικαιοσύνη και όχι όταν είσαι ισχυρός να βρίσκεις πάντα το δίκιο σου ακόμη και όταν έχεις άδικο  Αλλά όταν είσαι ανίσχυρος  Να προσπαθείς να βρεις το δίκιο σου, αλλά τις περισσότερες φορές να είσαι χαμένος  Αυτή η χώρα δεν αξίζει στον ελληνικό λαό  Αυτό το κράτος δεν είναι το κράτος που φιλοδοξούμε το κράτος του εικοστού πρώτου αιώνα  Και αυτό είναι το πρόβλημα  Ένα ακριβό κράτος με ακριβές υπηρεσίες αλλά πολύ κακής ποιότητας και αυτό απεδείχθη και στο έγκλημα των Τεμπών  Γιατί πρέπει να είμαστε ειλικρινείς",justice,tempe,,-0.6,0.2,0.5,0.2,0.2,,,0.0,"[['greek people', 'person', '0.6'], ['twenty-first century', 'date', '0.5'], ['tempe', 'location', '0.5']]"
39, How it was found.  Alone.  A stationmaster. , Πώς βρέθηκε  Μόνος  Ένα σταθμάρχης,reference to other parties,other,,0.0,0.0,0.0,0.1,0.5,,,0.0,"[['stationmaster', 'person', '1.0']]"
40, When there should have been others with him.  How a 58 year old man was transferred.  When the age limit is 48. , Ενώ έπρεπε να είναι και άλλοι μαζί του  Πώς έγινε μια μετάταξη ενός ανθρώπου 58 ετών  Όταν το ηλικιακό όριο είναι 48,reference to other parties,other,,-0.6,0.0,0.0,0.2,0.2,,,0.0,[]
41," And then after the holiday they tried to bring in another amendment to try to fix it.  How is it possible to have a privatisation.  In which Mr Tsipras said before he became prime minister that the 300 million was a sell-out.  But to be elected Prime Minister and to be paid only 45 million, but to be a great success and even to endow the Italians with 250 million euros for the barren lines.  And what did the Italians do.  What the Italians did.  They didn't know what tracks their trains were running on. "," Και μετά κατόπιν εορτής προσπαθούν προσπάθησαν να φέρουν άλλη τροπολογία για να το διευθετήσουν  Πώς είναι δυνατόν να γίνεται μια ιδιωτικοποίηση  Στην οποία ο κύριος Τσίπρας έλεγε πριν γίνει πρωθυπουργός ότι τα 300 εκατομμύρια ήταν ξεπούλημα  Αλλά να εκλέγεται πρωθυπουργός και να παίρνει αντίτιμο μόνο 45 εκατομμύρια, αλλά να είναι μεγάλη επιτυχία και μάλιστα να προικοδοτεί τους Ιταλούς με 250 εκατομμύρια ευρώ για τις άγονες γραμμές  Και οι Ιταλοί τι έκαναν  Τι έκαναν οι Ιταλοί  Δεν ήξεραν τα τρένα τους σε τι ράγες κινούνται",reference to other parties,privatisations,,-0.5,0.2,0.0,0.2,0.2,,,0.0,"[['mr tsipras', 'person', '0.9'], ['prime minister', 'position', '0.8'], ['italians', 'location', '0.7'], ['300 million', 'money', '0.6'], ['45 million', 'money', '0.6'], ['250 million euros', 'money', '0.6']]"
42, It is a successful privatisation.  What rules mean.  When you make a mistake.  A privatisation mistake.  That didn't go well.  You don't put your hands up. , Είναι μια επιτυχημένη ιδιωτικοποίηση  Τι σημαίνει κανόνες  Όταν κάνεις ένα λάθος  Μια λάθος ιδιωτικοποίηση  Που δεν πήγε καλά  Δεν σηκώνεις τα χέρια ψηλά,reference to other parties,privatisations,,0.0,0.143,0.0,0.1,0.2,,,0.0,[]
43," You don't say I'll negotiate with the same people again.  With whom with whom Mr Tsipras will renegotiate when he himself signed this purchase and sale, this privatisation.  We say something else clean. ", Ούτε λες ξανά θα διαπραγματευτώ με τους ίδιους  Με ποιους μ’αυτούς που ο κύριος Τσίπρας θα επαναδιαπραγματευτεί όταν ο ίδιος υπέγραψε αυτή την αγοραπωλησία αυτή την ιδιωτικοποίηση  Εμείς λέμε κάτι άλλο καθαρό,economy,privatisations,,-0.5,0.1,0.0,0.1,0.3,,,0.0,"[['mr tsipras', 'person', '0.9']]"
44," When a privatisation goes wrong.  There is a transitional privatization looking for a new strategic investor to get a proper railway network in Greece, because it cannot in the twenty-first century.  To say I'm leaving lignite to go to clean energy, because I have to go green.  Low emission pollutants in energy production and transport, but the most environmentally friendly means of transport, the train, to be devalued by your choices.  So we have to find another strategic investor, this particular company, which didn't have the best name, failed miserably.  Rail regulator did its job.  The gentlemen of SYRIZA appointed their party children.  People who didn't know what a train was.  We are talking about a rail regulator to European standards that will be staffed by an international competition and I want to make a. "," Όταν μια ιδιωτικοποίηση δεν πάει καλά  Γίνεται μεταβατική αποκρατικοποίηση ψάχνοντας νέο στρατηγικό επενδυτή για να αποκτήσουμε ένα κανονικό σιδηροδρομικό δίκτυο στην Ελλάδα, διότι δεν μπορεί στον εικοστό πρώτο αιώνα  Να λες αφήνω το λιγνίτη για να πάω στην καθαρή ενέργεια, γιατί πρέπει να κάνω πράσινη μετάβαση  Χαμηλή εκπομπό εκπομπή ρύπων στην παραγωγή ενέργειας και τις μεταφορές, αλλά το πιο φιλικό μέσο για το περιβάλλον, το τρένο να το απαξιώνεις με τις επιλογές σου  Άρα πρέπει να βρούμε έναν άλλο στρατηγικό επενδυτή, η συγκεκριμένη εταιρεία που δεν είχε το καλύτερο όνομα, απέτυχε παταγωδώς δεύτερο θέμα  Ρυθμιστική αρχή σιδηροδρόμων έκανε τη δουλειά της  Τα κομματικά τους παιδιά διόρισαν οι κύριοι του ΣΥΡΙΖΑ  Ανθρώπους που δεν γνώριζαν τι σημαίνει τρένο  Εμείς μιλάμε για μια ρυθμιστική αρχή σιδηροδρόμων στα ευρωπαϊκά πρότυπα που θα στελεχωθεί με διεθνή διαγωνισμό και θέλω εγώ να κάνω μια",economy,privatisations,,-0.2,0.2,0.0,0.1,0.2,,,0.0,"[['greece', 'location', '1.0'], ['lignite', 'product', '1.0'], ['energy', 'product', '0.8'], ['low emission pollutants', 'product', '0.6'], ['transport', 'product', '0.6'], ['train', 'transport', '1.0'], ['strategic investor', 'organization', '1.0'], ['rail regulator', 'organization', '1.0'], ['syriza', 'organization', '1.0'], ['european', 'location', '1.0']]"
45," Footnote.  We are not tired of elections.  And after the elections, the whole state is torn apart.  And to have people come without any parchment, only their party identity.  Getting fat salaries.  And all they do is favors.  Where else is this happening. "," Υποσημείωση  Δεν κουραστήκαμε να κάνουμε εκλογές  Και μετά τις εκλογές να ξηλώνεται όλο το κράτος  Και να έρχονται άνθρωποι χωρίς καμιά περγαμηνή, παρά μόνο την κομματική τους ταυτότητα  Να παίρνουν παχυλούς μισθούς  Και το μόνο που κάνουν είναι εξυπηρετήσεις  Πού αλλού συμβαίνει αυτό",government programme,democracy-institutions,,-0.8,0.75,0.0,0.8,0.7,,,0.2,"[['none', 'as there are no proper nouns or previously known entities mentioned in the text.']]"
