id,text,text_el,topic,subtopic,topic-open,sentiment,polarization,polarization-definition,toxicity,toxicity-definition,populism,populism-definition,hate speech,ner
1,Friends and friends.  Your presence today confirms. ,Φίλες και φίλοι  Η σημερινή σας παρουσία επιβεβαιώνει,reference to other parties,,,1.0,0.0,0.0,0.0,0.0,,,0.0,[]
2," That we are rebuilding, rebuilding a relationship of trust with the Greek people.  From one end of the country to the other.  PASOK returned again strong and united to play a leading role in the political life of the country against the elitism of the new democracy and the populism of SYRIZA.  Democratic Party.  The party that in the years of post-independence gave struggles for democracy, institutional constitution of strong European infrastructures.  The party of social justice and national dignity, the party of Andreas Papandreou and here from Kilkis sends a clear message of victory throughout Greece.  is the party that made steps towards the strong and hard core of the European Union.  It is the party that made the great reforms. "," Ότι χτίζουμε ξανά, οικοδομούμε ξανά μια σχέση εμπιστοσύνης με τον ελληνικό λαό  Απ άκρη σε άκρη της χώρας  Το ΠΑΣΟΚ επέστρεψε ξανά ισχυρό δυναμικό ενωμένο για να πρωταγωνιστήσει στην πολιτική ζωή του τόπου απέναντι στον ελιτισμό της νέας δημοκρατίας και το λαϊκισμό του ΣΥΡΙΖΑ  Δημοκρατική παράταξη  Η παράταξη που τα χρόνια της μεταπολίτευσης έδωσε αγώνες δημοκρατίας θεσμικής συγκρότησης ισχυρών ευρωπαϊκών υποδομών  Η παράταξη της κοινωνικής δικαιοσύνης και της εθνικής αξιοπρέπειας, η παράταξη του Ανδρέα Παπανδρέου και εδώ από το Κιλκίς στέλνει καθαρό μήνυμα νίκης σε όλη την Ελλάδα  είναι η παράταξη που έκανε βήματα προς τον ισχυρό και σκληρό πυρήνα της Ευρωπαϊκής Ένωσης  Είναι η παράταξη που έκανε τις μεγάλες μεταρρυθμίσεις",foreign policy,reforms,,0.5,0.5,0.0,0.1,0.0,,,0.0,"[['greek', 'type', 'probability', ''], ['pasok', 'organization', 'probability', ''], ['syriza', 'organization', 'probability', ''], ['democratic party', 'organization', 'probability', ''], ['european union', 'organization', 'probability', ''], ['andreas papandreou', 'person', 'probability', ''], ['kilkis', 'location', 'probability']]"
3," Unfortunately lately.  The Greek people have experienced an unspeakable tragedy.  A tragedy that shocked all Greek women and all Greeks.  Could our own children, your own grandchildren be on this fatal train in this tragedy in Tempe?  A tragedy that proves the inability of the state to protect the basic necessities of security, the prospect.  Make modern European infrastructure, make good use of European programmes. "," Δυστυχώς το τελευταίο διάστημα  Ο ελληνικός λαός έζησε μια ανείπωτη τραγωδία  Μια τραγωδία που συγκλόνισε όλες τις Ελληνίδες και όλους τους Έλληνες  Θα μπορούσαν τα δικά μας παιδιά τα δικά σας εγγόνια να είναι σε αυτό το μοιραίο τρένο σε αυτή την τραγωδία των Τεμπών  Μια τραγωδία που αποδεικνύει την αδυναμία του κράτους να περιφρουρήσει τα στοιχειώδη την ασφάλεια, την προοπτική  Να κάνει σύγχρονες ευρωπαϊκές υποδομές, να αξιοποιεί σωστά τα ευρωπαϊκά προγράμματα",infrastructure,infrastructure,,-0.6,0.3,0.0,0.0,0.0,,,0.0,"[['greek', 'norp', '0.8'], ['tempe', 'person', '0.4'], ['european', 'norp', '0.6']]"
4," But what are the responsibilities.  They have learned in recent years The gentlemen of the new democracy, when something good happens it is always by order.  Mitsotakis.  When something bad, tragic happens.  Mitsotakis does not know anything, declares ignorance.  What is unnecessary price. "," Ποιες όμως είναι οι ευθύνες  Μάθανε τα τελευταία χρόνια Οι κύριοι της νέας δημοκρατίας, όταν συμβαίνει κάτι καλό να είναι πάντα με την εντολή  Μητσοτάκη  Όταν συμβαίνει κάτι άσχημο, τραγικό  ο Μητσοτάκης δεν ξέρει τίποτα δηλώνει άγνοια  Αυτό τι είναι περιττή τιμή",reference to other parties,,,-0.6,0.6,0.1,0.6,0.7,,,0.1,"[['mitsotakis', 'person', '0.666']]"
5, Treats honour to the Prime Minister.  But I want to tell you what happened before.  Since a few hours in the Greek Parliament today you are discussing.  This very serious.  tragic accident.  They said they did not know the extent of the problem.  But let's put things in order. , Περιποιεί τιμή στον πρωθυπουργό  Θέλω όμως να σου πω τι συνέβη πριν  Από λίγες ώρες στην Βουλή των Ελλήνων σήμερα που συζητάτε  Αυτό το πολύ σοβαρό  τραγικό δυστύχημα  Είπαν ότι δεν γνώριζαν το μέγεθος του προβλήματος  Ας τα βάλουμε όμως στη σειρά τα πράγματα,,other,,0.0,0.1,0.0,0.1,0.0,,,0.0,"[['prime minister', 'person', '0.9'], ['greek parliament', 'organization', '0.8']]"
6, The European Railway Agency.  Conducts rail safety surveys every 2 years across Europe.  In 2020 and 2022 Greece will officially.  It has the highest mortality rate. , Ο Ευρωπαϊκός Οργανισμός Σιδηροδρόμων  Κάνει κάθε 2 χρόνια έρευνες για την ασφάλεια των σιδηροδρόμων σε όλη την Ευρώπη  Το 2020 και το 2022 επισήμως η Ελλάδα  Έχει το μεγαλύτερο δείκτη θνησιμότητας,reference to other parties,railways,,-1.0,1.0,0.0,0.3,0.2,,,0.0,"[['european railway agency', 'organization', '1.0'], ['europe', 'location', '1.0'], ['greece', 'location', '1.0']]"
7," On a kilometre basis across the European Union.  In 2019, in March, before the elections, Mr Mitsotakis himself, at a New Democracy event on the New Democracy programme, was saying and showing the real situation of the network.  Of course, that didn't stop him from talking about hydrogen trains a few years later that he was going to include them in the Recovery Fund.  And of course as Mr Tsipras before Mr Mitsotakis was talking about the silver train that they were going to bring to these networks, which could not even guarantee the safety, the basic safety of the citizens.  The European Commission is coming soon.  A few weeks before this shocking accident.  And sends us to the European Court of Justice.  We had not managed to get the cooperation legislation in place between the rail regulator. "," Βάσει χιλιομέτρων σε όλη την Ευρωπαϊκή Ένωση  Το 2019, τον Μάρτιο, πριν τις εκλογές ο ίδιος ο κύριος Μητσοτάκης σε εκδήλωση της Νέας Δημοκρατίας για το πρόγραμμα της Νέας Δημοκρατίας έλεγε και εμφάνιζε την πραγματική κατάσταση που είχε το δίκτυο  Βεβαίως αυτό δεν τον εμπόδιζε να μιλά για τρένα υδρογόνου λίγα χρόνια μετά ότι θα τα ενέτασσε στο Ταμείο Ανάκαμψης  Και βέβαια όπως ο κύριος Τσίπρας πριν από τον κύριο Μητσοτάκη μιλούσε για το ασημένιο τρένο που θα φέρνανε σε αυτά τα δίκτυα, τα οποία δεν μπορούσαν να εγγυηθούν ούτε την ασφάλεια, τη στοιχειώδη ασφάλεια των πολιτών  Μετά από λίγο έρχεται η Ευρωπαϊκή Επιτροπή  Λίγες εβδομάδες πριν το συγκλονιστικό αυτό δυστύχημα  Και μας στέλνει στο Ευρωπαϊκό Δικαστήριο  Δεν είχαμε καταφέρει να φτιάξουμε τη νομοθεσία συνεργασίας μεταξύ της ρυθμιστικής αρχής σιδηροδρόμων",infrastructure,railways,,0.0,0.2,0.0,0.2,0.2,,,0.0,"[['european union', 'organization', '1.0'], ['2019', 'date', '1.0'], ['march', 'date', '1.0'], ['mr mitsotakis', 'person', '1.0'], ['new democracy', 'organization', '1.0'], ['hydrogen trains', 'product', '1.0'], ['recovery fund', 'organization', '1.0'], ['mr tsipras', 'person', '1.0'], ['silver train', 'product', '1.0'], ['european commission', 'organization', '1.0'], ['european court of justice', 'organization', '1.0'], ['rail regulator', 'organization', '1.0']]"
8, And ERGOSE.  And today.  You have another bomb. , Και της ΕΡΓΟΣΕ  Και σήμερα  Έχετε μια ακόμη βόμβα,reference to other parties,other,,-1.0,0.5,0.0,0.4,0.8,,,0.0,"[['ergose', 'organization', '0.90'], ['today', 'date', '0.80'], ['bomb', 'object', '0.60']]"
9, In a document.  The National Transparency Authority.  Which he sent.  At the Ministry of Transport.  On 04/10/2021.  He speaks of criminal inaction in the handling of the 717 contract.  04/10/2021. , Με έγγραφο  Της η εθνική Αρχή Διαφάνειας  Το οποίο έστειλε  Στο Υπουργείο Μεταφορών  Στις 04/10/2021  Μιλά για εγκληματική αδράνεια στους χειρισμούς που αφορούν τη σύμβαση 717  04/10/2021,transparency,corruption,,-0.6,0.0,0.0,0.1,0.0,,,0.0,"[['national transparency authority', 'organization', '0.95'], ['ministry of transport', 'organization', '0.85'], ['717 contract', 'product', '0.70']]"
10, He went to the Ministry of Mr. Karamanlis.  The conclusion of the authority.  The special independent transparency authority.  And today our MPs are asking him in Parliament and he says he knew nothing. , Πήγε στο Υπουργείο του κυρίου Καραμανλή  Το πόρισμα της αρχής  Της ειδικής ανεξάρτητης αρχής διαφάνειας  Και σήμερα τον ρωτάνε οι βουλευτές μας στη Βουλή και λέει ότι δεν γνώριζε τίποτα,transparency,transparency,,-0.5,0.0,0.0,0.2,0.2,,,0.0,"[['mr. karamanlis', 'person', '0.7'], ['ministry', 'organization', '0.6'], ['authority', 'organization', '0.9'], ['special independent transparency authority', 'organization', '1.0'], ['mps', 'organization', '0.5'], ['parliament', 'organization', '0.6.']]"
11," So this, dear friends, is not a staff state that guarantees the basics, it is a staff state of audacity and cover-up alone.  The priority is for the current government not to face up to its responsibilities, but this is not the first time.  This is the first time this has happened.  Didn't the same thing happen on the issue of wiretapping.  Where after decades we suddenly find ourselves in front of phenomena that we believed that Andreas Papandreou's PASOK, the democratic party, would have been closed in the dustbin of history and here we are again facing interceptions and attempts by modern means to imprison me and other people.  People in very critical positions in the state.  As are the armed forces. "," Αυτό λοιπόν αγαπητές φίλες και φίλοι δεν είναι επιτελικό κράτος που εγγυάται τα στοιχειώδη είναι ένα επιτελικό κράτους του θράσους και της συγκάλυψης μόνη του  Προτεραιότητα είναι να μην αντιμετωπίσει τις ευθύνες της η σημερινή κυβέρνηση, αλλά δεν είναι η πρώτη φορά  Είναι η πρώτη φορά που συμβαίνει αυτό  Μήπως το ίδιο δεν έγινε και στο ζήτημα των υποκλοπών  Όπου μετά από δεκαετίες ξαφνικά βρισκόμαστε μπροστά σε φαινόμενα που πιστεύαμε ότι το ΠΑΣΟΚ του Ανδρέα Παπανδρέου, η δημοκρατική παράταξη θα είχε κλείσει στο χρονοντούλαπο της ιστορίας και να τα μπροστά μας ξανά υποκλοπές και προσπάθεια με σύγχρονα μέσα να εγκλωβίσουν εμένα και άλλους ανθρώπους  Ανθρώπους σε πολύ κρίσιμες θέσεις του κράτους  Όπως είναι οι ένοπλες δυνάμεις",national defence,interception,,-0.6,0.8,0.2,0.2,0.4,,,0.0,"[['andreas papandreou', 'person', '0.6'], ['pasok', 'organization', '0.7']]"
12, What was the Prime Minister's response.  An alleged apology.  All in the light.  Did any of this happen.  Which is all in light. , Ποια ήταν η απάντηση του πρωθυπουργού  Ένα δήθεν συγγνώμη  Όλα στο φως  Έγινε κάτι από αυτά  Ποιο είναι όλα στο φως,reference to other parties,other,,0.0,0.0,0.0,0.1,0.2,,,0.0,"[['prime minister', 'person', '0.94']]"
13," Since last summer when I went to the Supreme Court prosecutor's office.  It's been many months.  Whatever you learned, you learned and I learned. "," Από πέρσι το καλοκαίρι που πήγα στην Εισαγγελία του Αρείου Πάγου  Έχουν περάσει πολλοί μήνες  Ό,τι μάθατε, εσείς έμαθα κι εγώ",reference to other parties,other,,0.0,0.0,0.0,0.1,0.0,,,0.0,"[['supreme court', 'organization', '0.7'], [""prosecutor's office"", 'organization', '0.6']]"
14, While the investigations by the independent authorities of Mr Menoudakos and Mr Rammou have already advanced too much evidence to shed light on this case.  Why is justice moving so slowly.  Is he waiting for the election to be over.  For the Greek people to learn about the criminal activity of the state before the elections and to evaluate Mr Mitsotakis and his nephew as they should.  But.  He said recently that he is ready. , Ενώ οι έρευνες των ανεξάρτητων αρχών του κυρίου Μενουδάκου και του κύριου Ράμμου έχουν προχωρήσει ήδη πάρα πολλά στοιχεία για να ρίξουν φως σε αυτή την υπόθεση  Γιατί κινείται τόσο αργά η δικαιοσύνη  Μήπως περιμένει να τελειώσουν οι εκλογές  Για να μάθει ο ελληνικός λαός την εγκληματική δραστηριότητα του παρακράτους πριν τις εκλογές και αξιολογήσει όπως πρέπει τον κύριο Μητσοτάκη και τον ανιψιό του  Αλλά  Είπε πρόσφατα ότι είναι έτοιμος,justice,elections,,0.0,0.1,0.0,0.1,0.2,,,0.0,"[['mr menoudakos', 'person', '0.85'], ['mr rammou', 'person', '0.85'], ['greek', 'norp', '0.8'], ['mr mitsotakis', 'person', '0.8'], ['elections', 'date', '0.6']]"
15, To take on the deep state.  Calling himself a reformer.  Who is the deep state.  Deep State It is those who are exploiting the Recovery Fund on clientelistic terms.  Deep state are those who organize the parastate of eavesdropping from the Maximos building.  A deep state is one that has a contract.  9 years without implementation. , Να τα βάλει με το βαθύ κράτος  Βαφτίζοντας τον εαυτό του μεταρρυθμιστή  Ποιος είναι το βαθύ κράτος  Βαθύ κράτος Είναι αυτοί που αξιοποιούν με πελατειακούς όρους Το Ταμείο Ανάκαμψης  Βαθύ κράτος είναι αυτοί που οργανώνουν από το Μέγαρο Μαξίμου το παρακράτος των υποκλοπών  Βαθύ κράτος είναι αυτό το οποίο έχει μια σύμβαση  9 χρόνια χωρίς να υλοποιείται,,,,-0.5,0.5,0.2,0.5,0.5,,,0.1,"[['deep state', 'organization', '1.0'], ['recovery fund', 'organization', '1.0'], ['maximos building', 'location', '1.0']]"
16," They are aware of the criminal responsibilities of certain agents of the agencies and the ministry and do nothing having the tragic results, as an independent authority says.  Deep state is appointing your party kids to critical positions in organizations, let's look at the resumes of everyone involved.  Most of them are executives who supported Mr Mitsotakis, party children of the new democracy.  You don't see meritocratic choices. "," Γνωρίζουν τιςεγκληματικές ευθύνες συγκεκριμένων παραγόντων των οργανισμών και του υπουργείου και δεν κάνουν τίποτα έχοντας τα τραγικά αποτελέσματα, όπως λέει και ανεξάρτητη αρχή  Βαθύ κράτος είναι να διορίζεις τα κομματικά σου παιδιά σε κρίσιμες θέσεις των οργανισμών, ας δούμε τα βιογραφικά όλων των εμπλεκομένων  Οι περισσότεροι είναι στελέχη που στήριζαν τον κύριο Μητσοτάκη κομματικά παιδιά της νέας Δημοκρατίας  Δεν βλέπεις αξιοκρατικές επιλογές",transparency,corruption,,-0.8,0.8,0.5,0.8,0.7,,,0.1,"[['mitsotakis', 'person', '0.9'], ['new democracy', 'organization', '0.9']]"
17," Not to talk historically about who represents the deep bureaucratic and client state in Greece, Mr Mitsotakis, because we all know each other very well in this country.  Who are the ones who can tackle this deep state.  It is the faction.  Who, as much as they try to charge her.  Looking for a small amount of PASOK. "," Για να μη μιλήσουμε ιστορικά για το ποιος εκπροσωπεί το βαθύ ρουσφετολογικό και πελατειακό κράτος στην Ελλάδα, κύριε Μητσοτάκη, γιατί όλοι γνωριζόμαστε πάρα πολύ καλά σ αυτό τον τόπο  Ποιοι είναι αυτοί που μπορούν να αντιμετωπίσουν αυτό το βαθύ κράτος  Είναι η παράταξη  Που όσο και αν προσπαθούν να της χρεώσουν  Ψάχνοντας μικροποσότητα ΠΑΣΟΚ",reference to other parties,corruption,,0.0,0.5,0.5,0.5,0.8,,,0.2,"[['greece', 'location', '1.0'], ['mitsotakis', 'person', '1.0'], ['pasok', 'organization', '1.0']]"
18, To cast and diffuse blame.  It is this faction that has brought anything to do with meritocracy in the country.  For all its faults.  Because we are ready to take responsibility for all the mistakes made in the past. , Για να ρίξουν και να διαχύσουν τις ευθύνες τους  Αυτή η παράταξη είναι που έφερε οτιδήποτε αφορά την αξιοκρατία στον τόπο  Παρόλα τα λάθη της  Γιατί εμείς είμαστε έτοιμοι να σηκώσουμε και τις ευθύνες μας για όσα λάθη έγιναν στο παρελθόν,reference to other parties,self-criticism,,0.0,0.2,0.0,0.1,0.2,,,0.0,[]
19," But who created the independent authorities in Greece.  New Democracy, SYRIZA or PASOK.  Who made. "," Αλλά ποιος έφτιαξε τις ανεξάρτητες αρχές στην Ελλάδα  Η Νέα Δημοκρατία, το ΣΥΡΙΖΑ ή το ΠΑΣΟΚ  Ποιος έφτιαξε",reference to other parties,other,,0.0,0.0,0.0,0.2,0.2,,,0.0,"[['greece', 'location', '1.0'], ['new democracy', 'organization', '0.8'], ['syriza', 'organization', '0.6'], ['pasok', 'organization', '0.5']]"
20," The meritocracy of the ASEP in Greece.  The new democracy, SYRIZA or PASOK.  Who built open gov and transparency on the site so we can find out where your resources go and how they use that money. "," Την αξιοκρατία του ΑΣΕΠ στην Ελλάδα  Η νέα δημοκρατία, ο ΣΥΡΙΖΑ ή το ΠΑΣΟΚ  Ποιος έφτιαξε το open gov και τη διαύγεια στον τόπο για να μαθαίνουμε πού πάνε οι πόροι σας και πώς αξιοποιούν αυτά τα χρήματα",transparency,transparency,,0.0,0.0,0.0,0.0,0.2,,,0.0,"[['asep', 'organization', '0.80'], ['greece', 'location', '0.80'], ['syriza', 'organization', '0.80'], ['pasok', 'organization', '0.80']]"
21," The new democracy, SYRIZA or PASOK, not only did not bring them, but they fought them fiercely in the Greek Parliament, discrediting every effort of meritocracy and transparency.  So the only party that can guarantee a state.  Which will operate on terms that have above all the citizen and society at the forefront, is this party and its history proves it.  Its reforms, its quality, its culture of respect for institutions and democracy.  Because we are the ones who not only created the independent authorities, we respected the independent authorities. "," Η νέα δημοκρατία, ο ΣΥΡΙΖΑ ή το ΠΑΣΟΚ και όχι μόνο δεν τα έφεραν, αλλά τα πολέμησαν λυσσαλέα στην ελληνική Βουλή, Απαξιώνοντας κάθε προσπάθεια αξιοκρατίας και διαφάνειας  Άρα η μόνη παράταξη που μπορεί να εγγυηθεί ένα κράτος  Το οποίο θα λειτουργεί με όρους που έχουν πάνω απ όλα τον πολίτη και την κοινωνία στο προσκήνιο, είναι αυτή η παράταξη και το αποδεικνύει η ιστορία της  Οι μεταρρυθμίσεις της, η ποιότητά της, η κουλτούρα σεβασμού των θεσμών και της δημοκρατίας  Γιατί εμείς είμαστε αυτοί που όχι φτιάξαμε μόνο τις ανεξάρτητες αρχές, τις σεβαστήκαμε τις ανεξάρτητες αρχές",transparency,democracy-institutions,,0.3,0.75,0.2,0.1,0.2,,,0.0,"[['new democracy', 'organization', '0.90'], ['syriza', 'organization', '0.70'], ['pasok', 'organization', '0.70'], ['greek parliament', 'organization', '0.70']]"
22," I want to remind you.  What happened in the TV licence case.  When Mr Mitsotakis was saying, what we are saying today.  I was saying the same things we say today.  Mr Mitsotakis was talking about SYRIZA.  And he was saying that this competition is a stock-sharing game of the new democracy.  What we also believed in strong interests, which he proved with his decision. "," Θέλω να σας θυμίσω  Τι έγινε στην υπόθεση των τηλεοπτικών αδειών  Όταν ο κύριος Μητσοτάκης έλεγε, αυτά που λέμε σήμερα  Έλεγα τα ίδια που λέμε σήμερα  Τα έλεγε Ο κύριος Μητσοτάκης για το ΣΥΡΙΖΑ  Και έλεγε ότι αυτός ο διαγωνισμός είναι ένα παιχνίδι μοιράσματος μετοχών της νέας δημοκρατίας  Αυτό που πιστεύαμε κι εμείς σε ισχυρά συμφέροντα, το οποίο το απέδειξε με την απόφασή του",reference to other parties,media,,0.0,0.1,0.0,0.1,0.0,,,0.0,"[['mr mitsotakis', 'person', '0.89'], ['tv licence', 'organization', '0.8'], ['syriza', 'organization', '0.76'], ['new democracy', 'organization', '0.65']]"
23," The Special Court, sentencing Mr. Pappas to 13 zeroes.  Mr Mitsotakis as governor is saying the same things he said then.  Or does it do the same as SYRIZA did back then.  What did Syriza do then. "," Το Ειδικό Δικαστήριο, καταδικάζοντας 13 μηδέν τον κύριο Παππά  Ο κύριος Μητσοτάκης ως κυβερνήτης λέει τα ίδια που έλεγε τότε  Ή μήπως κάνει τα ίδια που έκανε ο ΣΥΡΙΖΑ τότε  Τι έκανε ο σύριζα τότε",reference to other parties,other,,0.0,0.0,1.0,0.1,0.2,,,0.0,"[['the special court', 'organization', '0.70'], ['mr. pappas', 'person', '0.80'], ['mr. mitsotakis', 'person', '0.80'], ['syriza', 'organization', '1.00']]"
