id,text,text_el,topic,topic-context,subtopic,subtopic-context,topic-open,sentiment,polarization,polarization-definition,toxicity,toxicity-definition,populism,populism-definition,hate speech,ner,ner-limited
17,"That is why I am committed that every student and every teacher will have their own computer and every classroom will have their own interactive whiteboard and more. Specific examples that confirm the rule of shortcomings. By opening the school to culture, environmental education, art and health education, by supporting all-day kindergarten and primary school with a reformed curriculum with foreign language and computer certification, up to high school level. As a result, we are enabling the cost that each parent has to pay for tutoring in these areas to drop. Friends. Our priority is vocational education and lifelong learning with a link to the modern needs of production, with the safeguarding of professions and professional rights, a safe school environment and psychological and social support services to deal with the phenomena of violence, which unfortunately, as we see, are multiplying, especially in large urban centres. Establishment of a single school-leaving certificate in accordance with European standards, so that the Greek family can slowly be freed from the burden of the school system. From the burden of tutorials and at this level of education, extroverted universities with a link to production, local development, funding of research and innovation by implementing a national study that will propose as a basis for a discourse on how many schools and how many departments our country really needs in each specialised field of knowledge. For example, agricultural schools cannot be without an extensive network of agricultural schools when we want to invest in the primary sector and agri-food. We cannot not have a university of tourism when we have millions of tourists and we want high-level workers with very good salaries. Friends. Dignity in academic development. Unfortunately, Mr Mitsotakis, with Mrs Kerameos' law, has reintroduced family rule in universities and, finally, financial support for our teachers at all levels of education and the evaluation of educational work with factors that will shape the quality of education.","Για αυτό δεσμεύομαι ότι κάθε μαθητής και κάθε εκπαιδευτικός θα έχει το δικό του υπολογιστή και κάθε αίθουσα θα έχει το δικό της διαδραστικό πίνακα και όχι μόνο. Ειδικά παραδείγματα που επιβεβαιώνουν τον κανόνα των ελλείψεων. Με άνοιγμα του σχολείου στον πολιτισμό, στην περιβαντολλογική εκπαίδευση, στην τέχνη και στην αγωγή υγείας, με στήριξη του ολοήμερου νηπιαγωγείου και δημοτικού με αναμορφωμένο εκπαιδευτικό πρόγραμμα με πιστοποίηση της ξένης γλώσσας και των ηλεκτρονικών υπολογιστών, ως την γυμνασίου. Με αποτέλεσμα να δίνουμε δυνατότητα να πέσει το κόστος που έχει κάθε γονέας για να πληρώνει φροντιστήρια στους τομείς αυτούς. Φίλες και φίλοι. Προτεραιότητά μας είναι η επαγγελματική εκπαίδευση και η διά βίου μάθηση με σύνδεση με τις σύγχρονες ανάγκες της παραγωγής, με κατοχύρωση των επαγγελμάτων αλλά και των επαγγελματικών δικαιωμάτων, ασφαλές σχολικό περιβάλλον και υπηρεσίες ψυχολογικής και κοινωνικής στήριξης για την αντιμετώπιση των φαινομένων βίας, που δυστυχώς, όπως βλέπουμε, γίνονται πολλαπλασιάζονται ιδιαίτερα στα μεγάλα αστικά κέντρα. Καθιέρωση του ενιαίου απολυτηρίου κατά τα ευρωπαϊκά πρότυπα, ώστε σιγά σιγά να απαλλαχθεί η ελληνική οικογένεια. Από την επιβάρυνση των φροντιστηρίων και σε αυτή τη βαθμίδα της εκπαίδευσης, εξωστρεφή πανεπιστήμια με σύνδεση με την παραγωγή, τοπική ανάπτυξη, χρηματοδότηση της έρευνας και της καινοτομίας με την εφαρμογή της εθνικής μελέτης που θα προτείνει ως βάση για λόγου το πόσες σχολές και πόσα τμήματα πραγματικά χρειάζεται η χώρα μας σε κάθε ειδικό γνωστικό πεδίο. Παραδείγματος χάρη, οι αγροτικές σχολές δεν μπορεί να μην έχουμε εκτεταμένο δίκτυο αγροτικών σχολών όταν θέλουμε να επενδύσουμε στον πρωτογενή τομέα και στην αγροδιατροφή. Δεν μπορούμε να μην έχουμε πανεπιστήμιο τουρισμού όταν έχουμε εκατομμύρια τουρίστες και θέλουμε υψηλού επιπέδου εργαζόμενους με πολύ καλούς μισθούς. Φίλες και φίλοι. Αξιοκρατία στην ακαδημαϊκή εξέλιξη. Δυστυχώς, ο κύριος Μητσοτάκης με τον νόμο της κυρίας Κεραμέως επανέφερε την οικογενειοκρατία στα πανεπιστήμια και τέλος, η οικονομική στήριξη των εκπαιδευτικών μας σε όλες τις βαθμίδες εκπαίδευσης, αλλά και η αξιολόγηση του εκπαιδευτικού έργου με συντελεστές που θα διαμορφώνουν ποιότητα εκπαίδευσης. ",,other,,other,,0.0,,0.0,,,,0.0,,[],"[['every student', 'person', '0.6'], ['every teacher', 'person', '0.6'], ['every classroom', 'group of people', '0.6'], ['culture', 'organization', '0.4'], ['environmental education', 'organization', '0.4'], ['art', 'organization', '0.4'], ['health education', 'organization', '0.4'], ['kindergarten', 'organization', '0.4'], ['primary school', 'organization', '0.4'], ['high school', 'organization', '0.4'], ['vocational education', 'organization', '0.4'], ['lifelong learning', 'organization', '0.4'], ['production', 'organization', '0.4'], ['professions', 'organization', '0.4'], ['professional rights', 'organization', '0.4'], ['school environment', 'organization', '0.4'], ['psychological support services', 'organization', '0.4'], ['social support services', 'organization', '0.4'], ['violence', 'organization', '0.4'], ['urban centres', 'location', '0.4'], ['school-leaving certificate', 'organization', '0.4'], ['european standards', 'organization', '0.4'], ['greek family', 'group of people', '0.6'], ['tutorial', 'organization', '0.4'], ['universities', 'organization', '0.4'], ['production', 'organization', '0.4'], ['local development', 'organization', '0.4'], ['research', 'organization', '0.4'], ['innovation', 'organization', '0.4'], ['national study', 'organization', '0.4'], ['specialised field of knowledge', 'organization', '0.4'], ['agricultural schools', 'organization', '0.4'], ['primary sector', 'organization', '0.4'], ['agri-food', 'organization', '0.4'], ['university of tourism', 'organization', '0.4'], ['tourists', 'group of people', '0.6'], ['workers', 'group of people', '0.6'], ['good salaries', 'date', '0.6'], ['mr mitsotakis', 'person', '0.6'], ['mrs kerameos', 'person', '0.6'], ['financial support', 'organization', '0.4'], ['teachers', 'group of people', '0.6'], ['education', 'organization', '0.4'], ['evaluation', 'organization', '0.4'], ['quality of education', 'organization', '0.4']]"
18,"Friends, I cannot but report here from Epirus. Which is the heart of productive Greece along with Thessaly in the issue of agri-food. From Trikala the day before yesterday I spoke about a new price contract. With the Greek farmer and the Greek farmer. We used to say that blood is not water. That is why every farmer and every farmer's wife must remember. Which is the party that gave them dignity in the 80s and 90s. Only PASOK has proved that it can provide redemptive solutions to the sharp rise in production costs and the precariousness faced by the farming and livestock farming world. Here in Epirus, you are well aware that the livestock sector has been in dramatic decline over the last three years, both in terms of the number of producers and, of course, in terms of the quantities of milk in the region. It is typical that in 2020 the production and sheep's milk units in Epirus. They have declined significantly in just one year, 500 producers have left the profession, while milk volumes have fallen by tens of tens of 10,000 tonnes.","Φίλες και φίλοι, δεν μπορώ να μην αναφερθώ εδώ από την Ήπειρο. Που είναι καρδιά της παραγωγικής Ελλάδας μαζί με τη Θεσσαλία στο ζήτημα της αγροδιατροφής. Από τα Τρίκαλα προχθές μίλησα για ένα νέο συμβόλαιο τιμής. Με τον Έλληνα αγρότη και την Ελληνίδα αγρότισσα. Κάποτε λέγαμε ότι το αίμα νερό δεν γίνεται. Για αυτό πρέπει να θυμηθεί κάθε αγρότης και κάθε αγρότισσα. Ποια είναι η παράταξη που τους έδωσε αξιοπρέπεια τη δεκαετία του 80 και του 90. Μόνο το ΠΑΣΟΚ έχει αποδείξει ότι μπορεί να δώσει λυτρωτικές λύσεις στην κατακόρυφη αύξηση του κόστους παραγωγής και στις επισφάλειες που αντιμετωπίζει ο αγροτικός και κτηνοτροφικός κόσμος. Εδώ από την Ήπειρο γνωρίζετε καλά ότι ο κτηνοτροφικός τομέας καταγράφει δραματική συρρίκνωση τα 3 τελευταία χρόνια, τόσο ως προς τον αριθμό των παραγωγών, όσο βέβαια και προς τις ποσότητες του γάλακτος στην περιοχή. Είναι χαρακτηριστικό ότι το 2020 η παραγωγή και οι μονάδες πρόβειου γάλακτος στην Ήπειρο. Μειώθηκαν αισθητά μέσα μόλις σε ένα χρόνο, 500 παραγωγοί εγκατέλειψαν το επάγγελμα, ενώ οι ποσότητες γάλακτος μειώθηκαν κατά δεκάδες κατά 10.000 τόνους. ",,agricultural policy,,other,,-0.3,,0.0,,,,0.2,,[],"[['trikala', 'location', '1.0'], ['greek', 'organization', '0.8'], ['pasok', 'political party', '1.0'], ['epirus', 'location', '1.0'], ['greece', 'country', '1.0']]"
19,"Therefore, immediate measures are needed to protect and support productive Greece, to reduce production costs, especially for agricultural supplies, animal feed and fuel, with zero excise duty on agricultural oil, as long as the energy crisis lasts.","Απαιτούνται λοιπόν άμεσα μέτρα εφαρμογής προστασίας και στήριξης της παραγωγικής Ελλάδας, μείωση του κόστους παραγωγής ειδικά για τα αγροτικά εφόδια τις ζωοτροφές και τα καύσιμα με μηδενισμό του ειδικού φόρου κατανάλωσης στο αγροτικό πετρέλαιο, όσο διαρκεί η ενεργειακή κρίση. ",,agricultural policy,,energy crisis,,0.5,,0.0,,,,0.0,,[],"[['greece', 'location', '1.0']]"
20,"Support for farmers, farmers, farmers, farmers' cooperatives with priority to renewable energy parks, so that each one of you knows that through renewable energy sources you will have fixed energy costs for the next 15 years, as is the case in all European countries, and not the green transition to be a business of 5 oligarchs in Greece. We want the green transition with energy justice without energy poverty, with priority for producers. And to the poorest Greeks we want a highly interconnected network, that is what we are saying.","Στήριξη. των αγροτών των κτηνοτρόφων των συνεταιρισμών με προτεραιοποίηση στα πάρκα ανανεώσιμων πηγών ενέργειας, ώστε να ξέρει ο καθένας από σας ότι μέσω των ανανεώσιμων πηγών ενέργειας θα έχει σταθερό κόστος ενεργειακό κόστος για τα επόμενα 15 χρόνια, όπως συμβαίνει σε όλα τα ευρωπαϊκά κράτη και όχι η πράσινη μετάβαση να είναι μια μπίζνα 5 ολιγαρχών στην Ελλάδα. Εμείς θέλουμε την πράσινη μετάβαση με ενεργειακή δικαιοσύνη χωρίς ενεργειακή φτώχεια, με προτεραιότητα στους παραγωγούς. Και στους φτωχότερους Έλληνες θέλουμε ένα δίκτυο υψηλής διασυνδεσιμότητας, γι αυτό λέμε. ",,agricultural policy,,other,,0.75,,0.1,,,,0.2,,[],"[['farmers', 'group of people', '1.0'], [""farmers' cooperatives"", 'organization', '1.0'], ['renewable energy parks', 'organization', '1.0'], ['european countries', 'location', '1.0'], ['greece', 'country', '1.0'], ['energy justice', 'organization', '1.0'], ['poorest greeks', 'group of people', '1.0']]"
21,"The Recovery Fund to finance the energy grid across Greece, so that municipalities can make communities energy efficient. Farmers, ranchers, energy price stability. I am very much afraid that costs will rise and what happened last year will happen. The tariff will be reduced from our taxes and from our taxes they will make billions in subsidies. Those who are being coddled by the media, by Mr Mitsotakis, we have a duty to stand in the way of this injustice that is being done at the expense of the production of Greece, of the country.","Το Ταμείο Ανάκαμψης να χρηματοδοτήσει το δίκτυο ενέργειας σε όλη την Ελλάδα, ώστε δήμοι να κάνουν κοινότητες ενεργειακές. Αγρότες, κτηνοτρόφοι, σταθερότητα στην τιμή της ενέργειας. Φοβάμαι πάρα πολύ ότι το κόστος θα αυξηθεί και θα γίνεται ό,τι έγινε την προηγούμενη χρονιά. Θα μειώνεται το τιμολόγιο από τους δικούς μας φόρους και από τους δικούς μας φόρους θα βγάζουν δισεκατομμύρια επιδοτήσεων. Αυτοί που χαϊδεύουν από τα μίντια, τον κύριο Μητσοτάκη, έχουμε χρέος να μπούμε εμπόδιο σε αυτή την αδικία που γίνεται εις βάρος της παραγωγής της Ελλάδας, της χώρας. ",,energy,,energy crisis,,-0.6,,0.2,,,,0.2,,[],"[['recovery fund', 'organization', '0.75'], ['greece', 'country', '1.0'], ['municipalities', 'group of people', '0.5'], ['farmers', 'group of people', '0.75'], ['ranchers', 'group of people', '0.5'], ['mr mitsotakis', 'person', '0.5'], ['greece', 'country', '1.0.']]"
22,"Friends. Universal protection of agricultural land from confiscation, we have a duty to stand in the way of the de-fellatinization of the Greek economy. Establishment of an end to the confiscation and tax-free status of subsidies, compensation and aid to farmers and, of course, updating the ELGA insurance regulation by extending the coverage of disasters to livestock due to climate change - the Ministry probably does not know what climate change means. And what huge problems it will create in the future and does not modernise the mechanism and the ELGA insurance regulation. Finally, the whole process for the new CAP programmes must be completed exactly within one year without bureaucracy. No more hassle for thousands of farmers and stockbreeders, specific dates for the submission of applications, evaluation and payment.","Φίλες και φίλοι. Καθολική προστασία της αγροτικής γης από τις κατασχέσεις έχουμε χρέος να μπούμε εμπόδιο στον αφελληνισμό της ελληνικής οικονομίας. Καθιέρωση τέλος του ακατάσχετου και αφορολόγητου, των επιδοτήσεων, των αποζημιώσεων και των ενισχύσεων των αγροτών και βέβαια επικαιροποίηση του κανονισμού ασφάλισης ΕΛΓΑ με επέκταση της κάλυψης καταστροφών στο ζωικό φυτικό κεφάλαιο που οφείλονται στην κλιματική αλλαγή το Υπουργείο μάλλον δεν ξέρει τι σημαίνει κλιματική αλλαγή. Και τι τεράστια προβλήματα θα δημιουργήσει στο μέλλον και δεν εκσυγχρονίζει τον μηχανισμό και τον κανονισμό ασφάλισης ΕΛΓΑ. Τέλος, όλη η διαδικασία για τα προγράμματα της νέας ΚΑΠ πρέπει να ολοκληρώνεται ακριβώς μέσα σε ένα χρόνο χωρίς γραφειοκρατίες. Τέρμα με την ταλαιπωρία χιλιάδων αγροτών και κτηνοτρόφων, συγκεκριμένες ημερομηνίες υποβολής αιτήσεων, αξιολόγησης και πληρωμής. ",,agricultural policy,,other,,0.2,,0.0,,,,0.0,,[],"[['greek', 'country', '0.85'], ['elga', 'organization', '0.9'], ['cap', 'organization', '0.75']]"
23,"Friends. In closing I cannot fail to mention. The challenges we had today from Turkey. Many people say that we are waiting in our country for the Turkish elections to be completed and for the environment for discussions with Turkey to change. Indeed, Mr Tsipras, the visionary, says. To make the Aegean Prespes. Mr Mitsotakis is hiding from the real problems. They meet both European leaders, but never once did they talk about an arms embargo on Turkey, which even today Erdogan had spot putting within the Turkish Charter the Northeast Aegean and Western Thrace. It is therefore incumbent on both the Europeans and the Americans, if Kilitzaroglu and Erdogan continue their provocations, the violation of our sovereign rights and the undermining of good neighbourly relations, to stop selling even one bullet to Turkey, because otherwise they are Pontius Pilates. and accomplices of provocations against Cyprus and Greece.","Φίλες και φίλοι. Κλείνοντας δεν μπορεί να μην αναφερθώ. Στις προκλήσεις που είχαμε σήμερα από την Τουρκία. Πολλοί λένε ότι περιμένουμε στη χώρα μας να ολοκληρωθούν οι τουρκικές εκλογές και να αλλάξει το περιβάλλον συζητήσεων με την Τουρκία. Μάλιστα ο κύριος Τσίπρας, ο οραματιστής λέει. Να κάνει τις Πρέσπες που Αιγαίου. Ο κύριος Μητσοτάκης κρύβεται από τα πραγματικά προβλήματα. Συναντούν και οι 2 ευρωπαίους ηγέτες, αλλά ουδέποτε δεν μίλησαν για εμπάργκο όπλων στην Τουρκία, που ακόμη και σήμερα ο Ερντογάν είχε spot βάζοντας εντός του Τουρκικού Χάρτη το Βορειοανατολικό Αιγαίο και τη Δυτική Θράκη. Έχουν χρέος λοιπόν και οι Ευρωπαίοι και οι Αμερικανοί εάν συνεχίσει ο Κιλιτζάρογλου και ο Ερντογάν τις προκλήσεις, την καταπάτηση κυριαρχικών μας δικαιωμάτων και την υπονόμευση των συνθηκών καλής γειτονίας να σταματήσουν να πωλούν έστω και μια σφαίρα στην Τουρκία, διότι σε άλλη περίπτωση είναι Πόντιοι Πιλάτοι. και συνένοχοι των προκλήσεων εις βάρος της Κύπρου και της Ελλάδας. ",,other,,other,,-0.6,,0.0,,,,0.0,,[],"[['turkey', 'location', '1.0'], ['mr tsipras', 'person', '1.0'], ['aegean prespes', 'location', '1.0'], ['mr mitsotakis', 'person', '1.0'], ['europeans', 'group of people', '1.0'], ['americans', 'group of people', '1.0'], ['kilitzaroglu', 'person', '1.0'], ['erdogan', 'person', '1.0'], ['cyprus', 'country', '1.0'], ['greece', 'country', '1.0']]"
24,"this party? This democratic movement, PASOK. It has always handled national issues with realism and patriotism, without grand talk. That is why I call on the Greeks to trust us on national issues as well. This is the party that put Cyprus in the European Union with the Cyprus problem unresolved. This is the party that created the Helsinki Strategy, which Karamanlis discredited.","αυτή η παράταξη; Αυτό το δημοκρατικό κίνημα, το ΠΑΣΟΚ. Πάντα χειριζόταν τα εθνικά θέματα με ρεαλισμό και πατριωτισμό, χωρίς μεγάλα λόγια. Για αυτό καλώ τους Έλληνες να μας εμπιστευτούν και στα εθνικά θέματα. Αυτό είναι το κόμμα που έβαλε την Κύπρο στην Ευρωπαϊκή Ένωση με άλυτο το Κυπριακό. Αυτό είναι το κόμμα που δημιούργησε τη Στρατηγική του Ελσίνκι. που απαξίωσε ο Καραμανλής. ",,external affairs,,other,,0.5,,0.1,,,,0.0,,[],"[['pasok', 'organization', '1.0'], ['greeks', 'group of people', '1.0'], ['cyprus', 'location', '1.0'], ['european union', 'organization', '1.0'], ['helsinki strategy', 'organization', '1.0'], ['karamanlis', 'person', '1.0']]"
25,"This is the party of social justice and national dignity. That is why I invite every Greek here in Ioannina. To trust this party, the democratic party of respect for human rights, the rule of law and the party of hope and perspective for the underprivileged, the party of the middle class.","Αυτό είναι το κόμμα της κοινωνικής δικαιοσύνης και της εθνικής αξιοπρέπειας. Γι αυτό καλώ και εδώ από τα Γιάννενα κάθε Ελληνίδα και κάθε Έλληνα. Να εμπιστευθεί αυτή την παράταξη τη δημοκρατική παράταξη του σεβασμού των ανθρωπίνων δικαιωμάτων του κράτους δικαίου και η παράταξη της ελπίδας και της προοπτικής στην παράταξη των μη προνομιούχων, την παράταξη της μεσαίας τάξης. ",,democracy,,other,,0.71,,0.1,,,,0.2,,[],"[['ioannina', 'location', '1.0'], ['greek', 'group of people', '1.0'], ['democratic party', 'political party', '1.0'], ['middle class', 'group of people', '1.0']]"
26,"So that's why, friends. I call on every Greek woman on May 21 together to make a decision to change the page for all Greeks and especially for the younger generation, so that your children and grandchildren can stay here with dignified jobs, so that we can deal with our demographics and give our country a perspective.","Γι αυτό λοιπόν φίλες και φίλοι. Καλώ κάθε Ελληνίδα 21 Μαϊου μαζί να πάρουμε απόφαση αλλαγής αλλαγής σελίδας για όλους τους Έλληνες και ιδιαίτερα για τη νέα γενιά να μείνουν εδώ τα παιδιά και τα εγγόνια σας με δουλειές αξιοπρέπειας, να αντιμετωπίσουμε το δημογραφικό μας για να έχει προοπτική η πατρίδα μας. ",,employment,,youth,,0.75,,0.0,,,,0.0,,[],"[['greek', 'nationality', '0.9'], ['may 21', 'date', '0.9']]"
