id,text,text_el,topic,topic-context,subtopic,subtopic-context,topic-open,sentiment,polarization,polarization-definition,toxicity,toxicity-definition,populism,populism-definition,hate speech,ner,ner-limited
27,"And a little further away, the regeneration of our shipyards, in neighbouring Elefsina. The workers have returned to work. And notice, they're back on what wages? From 1,500 to 3,000 euros. With investments of more than 100 million. We'll have a total of 2,000 workers, most of them working here, in West Athens.","Και λίγο πιο μακριά η αναγέννηση των ναυπηγείων μας, στη γειτονική Ελευσίνα. Οι εργαζόμενοι γύρισαν στις δουλειές τους. Και προσέξτε, γύρισαν με τι μισθούς; Από 1.500 έως 3.000 ευρώ. Με επενδύσεις που ξεπερνούν τα 100 εκατομμύρια. Θα έχουμε συνολικά 2.000 εργαζόμενους, οι πιο πολλοί δουλεύουν εδώ, στη Δυτική Αθήνα.",,employment,,investments,,0.8,,0.0,,,,0.0,,[],"[['elefsina', 'location', '1.0'], ['west athens', 'location', '1.0'], ['greece', 'country', '1.0']]"
28,"While we sanctified and resolved the ""Gordian knot"" of the Skaramanga shipyards, where 700 more recruitments are expected. Proof that the whole of society can share in the country's development.","Ενώ εξυγιάναμε και λύσαμε και τον «γόρδιο δεσμό» των ναυπηγείων Σκαραμαγκά, όπου αναμένονται ακόμα 700 προσλήψεις. Απόδειξη ότι μέρισμα στην ανάπτυξη της χώρας μπορεί να έχει όλη η κοινωνία.",,employment,,employment,,,,0.2,,,,0.0,,[],"[['skaramanga shipyards', 'location', '0.85'], ['700', 'number', '0.7']]"
29,"A second proof: the plan to finance the Aghia Varvara Hospital, a personal bet of mine, so that it can operate independently from Attikon and the General Hospital of Nice. With new services, with day surgeries, a rehabilitation centre, a palliative care department, but also with primary health care units that emphasise prevention.","Μία δεύτερη απόδειξη: το σχέδιο της χρηματοδότησης του Νοσοκομείου της Αγίας Βαρβάρας, ένα προσωπικό μου στοίχημα, ώστε αυτό να λειτουργεί αυτόνομα από το «Αττικόν» και το Γενικό της Νίκαιας. Με νέες υπηρεσίες, με χειρουργεία ημέρας, με κέντρο αποκατάστασης, με τμήμα ανακουφιστικής φροντίδας, αλλά και με μονάδες πρωτοβάθμιας υγείας που θα δίνουν έμφαση στην πρόληψη.",,health,,public health system,,0.8,,0.0,,,,0.0,,[],"[['aghia varvara hospital', 'organization', '1.0'], ['attikon', 'organization', '1.0'], ['general hospital of nice', 'organization', '1.0']]"
30,"So you see, a lot has happened in these four years on the west side of the capital. And from the Philodemos and Tritsis programmes alone, we have 120 million euros in total for the seven municipalities of Western Attica.","Βλέπετε, λοιπόν, έγιναν πολλά αυτά τα τέσσερα χρόνια στη δυτική πλευρά της πρωτεύουσας. Και μόνο από τα προγράμματα «Φιλόδημος» και «Τρίτσης», έχουμε 120 εκατομμύρια ευρώ συνολικά για τους επτά Δήμους της Δυτικής Αττικής.",,infrastructure,,other,,,,0.0,,,,0.0,,[],"[['philodemos', 'organization', '0.6'], ['tritsis', 'organization', '0.6'], ['western attica', 'location', '0.8']]"
31,"However, I am well aware that much more remains to be done. I am the first to know, after all, that wages in our country remain low. That public health is still ailing. That our young people, this amazing youth, require more attention from the state. That's why specific cuts are becoming our priorities.","Ωστόσο, το ξέρω καλά, μένουν να γίνουν πολλά περισσότερα. Πρώτος εγώ, άλλωστε, ξέρω ότι οι μισθοί στη χώρα μας παραμένουν χαμηλοί. Ότι η δημόσια υγεία ακόμα νοσεί. Ότι οι νέοι μας, αυτή η καταπληκτική νεολαία απαιτεί περισσότερη προσοχή από την πολιτεία. Γι’ αυτό και συγκεκριμένες τομές γίνονται προτεραιότητές μας.",,employment,,wages,,-0.2,,0.0,,,,0.0,,[],[]
32,"Friends of West Athens, in July 2019 - and a big thank you to our GCP, which will give its own fight in the student elections to be the first party in the student elections again - in July 2019 I did not promise miracles. I promised a plan and a lot of work for specific goals. And today that is a reality.","Φίλες και φίλοι της Δυτικής Αθήνας, τον Ιούλιο του 2019 -και ένα μεγάλο ευχαριστώ και στη ΔΑΠ μας, που θα δώσει το δικό της αγώνα στις φοιτητικές εκλογές για να ξαναβγεί πρώτη παράταξη στις φοιτητικές εκλογές- τον Ιούλιο του 2019 δεν υποσχέθηκα θαύματα. Υποσχέθηκα σχέδιο και πολλή δουλειά για συγκεκριμένους στόχους. Κι αυτό σήμερα είναι πραγματικότητα.",,political promises,,other,,0.5,,0.0,,,,0.0,,[],"[['west athens', 'location', '1.00'], ['gcp', 'political party', '1.00'], ['july 2019', 'date', '1.00']]"
33,"But all this is not enough. Although we have received a deserted plot of land, the Greece we are building already has a solid foundation, it has its first floors. But there are still more to be built, which will make it higher, which will make it a better country.","Όμως όλα αυτά δεν αρκούν. Αν και παραλάβαμε ένα ερημωμένο οικόπεδο, η Ελλάδα που χτίζουμε έχει ήδη γερά θεμέλια, έχει τους πρώτους της ορόφους. Μένουν, ωστόσο, να ανεγερθούν κι άλλοι, που θα την κάνουν ψηλότερη, που θα την κάνουν καλύτερη χώρα.",,other,,other,,0.5,,0.0,,,,0.0,,[],"[['greece', 'location', '0.98'], ['country', 'type', '0.96']]"
34,"See, for example, health. Maybe in the pandemic, the National Health System held up, had more ICUs, many more health workers, but our health has been the big patient for decades. That is why I am not satisfied with the steps we have taken forward. We need to make leaps, especially in our hospitals, especially in our emergency departments and in the prevention of serious diseases.","Δείτε, για παράδειγμα, την υγεία. Μπορεί στην πανδημία το Εθνικό Σύστημα Υγείας να άντεξε, να έχει περισσότερες ΜΕΘ, πολύ περισσότερους υγειονομικούς, αλλά η υγεία μας παραμένει εδώ και δεκαετίες ο μεγάλος ασθενής. Γι’ αυτό και δεν αρκούμαι στα βήματα που κάναμε εμπρός. Πρέπει να κάνουμε άλματα, ειδικά στα νοσοκομεία μας, ειδικά στα τμήματα επειγόντων περιστατικών και στην πρόληψη των σοβαρών ασθενειών.",,health,,public health system,,0.2,,0.0,,,,0.0,,[],"[['national health system', 'organization', '0.8'], ['icus', 'group of people', '0.3'], ['health workers', 'group of people', '0.3'], ['hospitals', 'organization', '0.5'], ['emergency departments', 'organization', '0.5'], ['serious diseases', 'group of people', '0.2']]"
35,"The same applies to education. For the first time - listen to this and tell everyone - 25 000 permanent teacher appointments have been made. We went from 62 experimental schools to 138. Kindergarten now teaches a foreign language - look out - from four. And soon-I was here in a school in Agiou Anargyros to see the new interactive whiteboards-36,000 interactive whiteboards in all schools.",Το ίδιο ισχύει για την παιδεία. Έγιναν για πρώτη φορά -ακούστε το και πείτε το σε όλες και σε όλους- 25.000 μόνιμοι διορισμοί εκπαιδευτικών. Από τα 62 Πειραματικά φτάσαμε στα 138. Το νηπιαγωγείο διδάσκει πλέον ξένη γλώσσα -προσέξτε- από τα τέσσερα. Και σύντομα -είχα βρεθεί εδώ σε ένα σχολείο στους Αγίους Αναργύρους για να δω τους καινούριους διαδραστικούς πίνακες- 36.000 διαδραστικοί πίνακες σε όλα τα σχολεία.,,education,,higher education,,0.75,,0.0,,,,0.0,,[],"[['25 000', 'date', '1.0'], ['kindergarten', 'organization', '1.0'], ['agiou anargyros', 'location', '1.0'], ['36', '000', 'date', '1.0']]"
36,"But we know that this is not enough. Other breakthroughs are needed, especially in vocational education, especially in our universities.","Αλλά ξέρουμε ότι αυτά δεν αρκούν. Χρειάζονται και άλλες τομές, κυρίως στην επαγγελματική εκπαίδευση, κυρίως στα πανεπιστήμιά μας.",,education,,higher education,,0.3,,0.0,,,,0.0,,[],"[['none of the given text contains a named entity. therefore', 'there are no entities to list.']]"
37,"And look at the state. We transformed a dismantled Secretariat into a modern Civil Protection. But in the administration there are still pockets of anachronism lurking, as the accident in Tempe showed.","Και δείτε και το κράτος. Μεταμορφώσαμε μία διαλυμένη Γραμματεία σε σύγχρονη Πολιτική Προστασία. Αλλά στη διοίκηση καραδοκούν ακόμα εστίες αναχρονισμού, όπως έδειξε και το δυστύχημα στα Τέμπη.",,civil protection,,other,,0.0,,0.0,,,,0.0,,[],"[['tempe', 'location', '1.0']]"
38,We made ERT a model of quality broadcasting. gov.gr has more than 1 billion transactions. We eliminated queues.,Την ΕΡΤ την κάναμε υπόδειγμα ποιοτικής ραδιοτηλεόρασης. Το gov.gr έχει παραπάνω από 1 δισεκατομμύριο συναλλαγές. Καταργήσαμε ουρές. ,,public sector,,digital governance,,0.6,,0.0,,,,0.0,,[],"[['ert', 'organization', '0.85'], ['gov.gr', 'organization', '0.75']]"
39,"But, as you well know, in what we call the state there is still a double reality. The good aspects of the state must prevail over the bad. The state is also the ""112"". The state is the EMAK, the border guards, the members of the armed forces who flew to rescue the Greeks from Sudan.","Όμως, το ξέρετε καλά, σε αυτό που λέμε κράτος υπάρχει ακόμα μία διπλή πραγματικότητα. Οι καλές όψεις του κράτους πρέπει να επικρατήσουν των κακών. Κράτος είναι και το «112». Κράτος είναι η ΕΜΑΚ, οι συνοριοφύλακες, τα στελέχη των Ενόπλων Δυνάμεων που πέταξαν για να διασώσουν τους Έλληνες από το Σουδάν.",,national security,,other,,0.4,,0.0,,,,0.0,,[],"[['emak', 'organization', '1.0'], ['armed forces', 'group of people', '0.9'], ['greeks', 'group of people', '0.8'], ['sudan', 'location', '1.0']]"
40,"The state is the police, the ambulance is by our side in every danger. The state we want is the new EFKA, which pays out pensions on time. And of course it is the same state that we want, the one that called 120,000 Greek women to have free screening mammograms.","Κράτος είναι η αστυνομία, είναι το ΕΚΑΒ, δίπλα μας σε κάθε κίνδυνο. Κράτος το οποίο θέλουμε είναι και ο καινούριος ΕΦΚΑ, που βγάζει στην ώρα του τις συντάξεις. Και βέβαια είναι το ίδιο κράτος, αυτό που θέλουμε, αυτό που κάλεσε 120.000 Ελληνίδες να κάνουν δωρεάν προληπτικές εξετάσεις  μαστογραφίας.",,health,,other,,,,0.0,,,,0.0,,[],"[['efka', 'organization', '0.9'], ['greek women', 'group of people', '0.9'], ['120', '000', 'date', '0.9'], ['state', 'organization', '0.7'], ['ambulance', 'organization', '0.6']]"
41,"This is the state we want and this is the state we will have with the victory of New Democracy in the elections. That is precisely why, from our first term of office, keep one thing in mind: consistency of words and deeds. It is the guarantee that just as we have delivered what we promised, we will deliver what we want for tomorrow. We will have the opportunity to present our government's work in detail in two days' time.",Αυτό είναι το κράτος που θέλουμε και αυτό το κράτος θα έχουμε με τη νίκη της Νέας Δημοκρατίας στις εκλογές. Ακριβώς γι’ αυτό από την πρώτη μας θητεία κρατήστε ένα πράγμα: τη συνέπεια λόγων και πράξεων. Είναι η εγγύηση ότι όπως υλοποιήσαμε όσα υποσχεθήκαμε έτσι θα πραγματοποιήσουμε και όσα θέλουμε για το αύριο. Το κυβερνητικό μας έργο θα έχουμε την ευκαιρία να το παρουσιάσουμε αναλυτικά σε δύο μέρες.,,elections,,other,,0.6,,0.0,,,,0.0,,[],"[['new democracy', 'political party', '1.0'], ['tomorrow', 'date', '1.0']]"
42,"This New Democracy that we are fighting for is the New Democracy that will fight for a productive and social Greece, for a digital and green Greece, for a fair and strong Greece.","Αυτή η Νέα Δημοκρατία για την οποία αγωνιζόμαστε είναι η Νέα Δημοκρατία που θα αγωνιστεί για μία παραγωγική και κοινωνική Ελλάδα, για μία ψηφιακή και πράσινη Ελλάδα, για μία δίκαιη και ισχυρή Ελλάδα.",,economy,,green energy,,0.8,,0.0,,,,0.0,,[],"[['new democracy', 'organization', '1.0'], ['greece', 'country', '1.0']]"
43,"We have a comprehensive and costed plan. It is tried and tested in the experiences of our first term, but it is also geared to the challenges of the next decade.","Έχουμε ένα ολοκληρωμένο και κοστολογημένο σχέδιο. Είναι δοκιμασμένο στις εμπειρίες της πρώτης μας θητείας, αλλά είναι και στρατευμένο στις προκλήσεις της επόμενης δεκαετίας.",,economy,,other,,0.6,,0.0,,,,0.0,,[],[]
44,"Is it ambitious? Yes. But it's also realistic. It extends across public life. It gives special weight - I will only say two words about our programme, we will talk about it in detail two days from now - to three specific objectives and two horizontal necessities.","Είναι φιλόδοξο; Ναι. Αλλά είναι και ρεαλιστικό. Απλώνεται σε όλη τη δημόσια ζωή. Δίνει ξεχωριστό βάρος -δύο κουβέντες θα σας πω μόνο για το πρόγραμμά μας, θα τα πούμε αναλυτικά σε δύο μέρες από τώρα- σε τρεις ειδικές στοχεύσεις και σε δύο οριζόντιες αναγκαιότητες.",,elections,,other,,0.5,,0.0,,,,0.0,,[],"[['two days from now', 'date', '1.0'], ['public life', 'location', '0.8'], ['programme', 'organization', '0.7'], ['three', 'group of people', '0.6']]"
45,I will briefly mention them. In 2019 I came and spoke here in West Athens and I promised you one thing: I will reduce taxes and contributions for all Greeks. I put it into practice.,"Τις αναφέρω επιγραμματικά. Το 2019 ήρθα και μίλησα εδώ, στη Δυτική Αθήνα, και σας έταξα ένα πράγμα: θα μειώσω φόρους και εισφορές για όλες τις Ελληνίδες και όλους τους Έλληνες. Το έκανα πράξη.",,economy,,tax cuts,,1.0,,0.0,,,,0.0,,[],"[['west athens', 'location', '0.6'], ['greeks', 'group of people', '0.7'], ['2019', 'date', '0.8']]"
46,"Today I come here again, in Egaleo, and I tell you that the next four years will be the four years of better wages for every Greek woman and every Greek man. We can raise our wages 25% in one four-year period.","Σήμερα έρχομαι πάλι εδώ, στο Αιγάλεω, και σας λέω ότι η επόμενη τετραετία θα είναι η τετραετία των καλύτερων μισθών για κάθε Ελληνίδα και για κάθε Έλληνα. Μπορούμε να αυξήσουμε τους μισθούς μας 25% σε μία τετραετία.",,employment,,wages,,0.8,,0.0,,,,0.0,,[],"[['egaleo', 'location', '1.0'], ['greek', 'nationality', '0.5'], ['greek', 'nationality', '0.5']]"
47,"From 2024, the new single pay scale for civil servants will finally come into force. And for freelancers, the business tax at the end of four years will be a thing of the past, as tax compliance will improve.","Από το 2024 θα ισχύσει, επιτέλους, το νέο ενιαίο μισθολόγιο για τους δημοσίους υπαλλήλους. Και για τους ελεύθερους επαγγελματίες το τέλος επιτηδεύματος στο τέλος της τετραετίας θα αποτελεί παρελθόν, καθώς θα βελτιώνεται η φορολογική συμμόρφωση.",,employment,,other,,0.6,,0.0,,,,0.0,,[],"[['2024', 'date', '1.0'], ['civil servants', 'group of people', '1.0'], ['freelancers', 'group of people', '1.0']]"
48,"Second priority: Health. I have told you what we are going to do at St Barbara's Hospital, but I am putting a lot of emphasis on primary care. We have already said, free screening for all major diseases, a hugely important intervention. Universal power of the Personal Doctor. Modernization of all emergency departments of hospitals and 156 health centers. And recruitment of 10,000 nurses over four years.","Δεύτερη προτεραιότητα: Υγεία. Σας είπα τι θα κάνουμε στο Νοσοκομείο της Αγίας Βαρβάρας, όμως δίνω μεγάλη έμφαση στην πρωτοβάθμια φροντίδα. Είπαμε ήδη, δωρεάν προληπτικές εξετάσεις για όλα τα βασικά νοσήματα, τεράστιας σημασίας παρέμβαση. Καθολική ισχύ του Προσωπικού Γιατρού. Εκσυγχρονισμός όλων των τμημάτων επειγόντων περιστατικών των νοσοκομείων και των 156 κέντρων υγείας. Και πρόσληψη 10.000 νοσηλευτών σε βάθος τετραετίας.",,health,,public health system,,0.4,,0.0,,,,0.0,,[],"[[""st barbara's hospital"", 'organization', '0.8'], ['personal doctor', 'organization', '0.6'], ['emergency departments', 'organization', '0.5'], ['health centers', 'organization', '0.5'], ['nurses', 'group of people', '0.5']]"
49,"The third horizontal intervention, effective public administration. Horizontal competitions of the ASEP, officials to be made permanent after a probationary period, evaluation for all. Civil servants' performance will be rewarded and weaknesses will be cured.","Τρίτη οριζόντια παρέμβαση, το αποτελεσματικό δημόσιο. Οριζόντιοι διαγωνισμοί ΑΣΕΠ, στελέχη που θα μονιμοποιούνται μετά από δοκιμαστική θητεία, αξιολόγηση για όλους. Οι επιδόσεις των δημοσίων υπαλλήλων θα επιβραβεύονται και οι αδυναμίες θα θεραπεύονται.",,public sector,,other,,0.4,,0.0,,,,0.0,,[],"[['asep', 'organization', '0.8'], ['civil servants', 'group of people', '0.6']]"
50,"By 2027, four years from now, all processes in public administration will be digital, with electronic transactions and professional behaviours.","Μέχρι το 2027, σε τέσσερα χρόνια από τώρα, όλες οι διαδικασίες στη δημόσια διοίκηση θα είναι ψηφιακές, με ηλεκτρονικές συναλλαγές, αλλά και με επαγγελματικές συμπεριφορές.",,other,,digital governance,,1.0,,0.0,,,,0.0,,[],"[['2027', 'date', '1.0'], ['public administration', 'organization', '1.0']]"
51,"These three objectives will be accompanied by two others, which will permeate all our decisions. The first is to support the younger generation with affordable housing. And of course, national security policy. I think there is no Greek who is not aware of the struggles we have fought to safeguard our national interests over these four years.","Τους τρεις αυτούς στόχους θα συνοδεύουν δύο ακόμα, που θα διαπερνούν όλες μας τις αποφάσεις. Ο πρώτος, η στήριξη της νέας γενιάς με προσιτή στέγη. Και βέβαια, η πολιτική εθνικής ασφάλειας. Νομίζω ότι δεν υπάρχει Ελληνίδα και Έλληνας που να μην γνωρίζει τους αγώνες που δώσαμε για τη διασφάλιση των εθνικών μας συμφερόντων αυτά τα τέσσερα χρόνια.",,housing,,other,,0.0,,0.0,,,,0.0,,[],"[['greek', 'country', '100%'], ['national security policy', 'organization', '100%'], ['greek', 'person', '100%'], ['four years', 'date', '100%']]"
52,"A word just for our young people. I want to make a special mention of the ""My Home"" programme. For the first time in our country there is such a program, 10,000 houses for young people with cheap loans that they will repay in instalments of less than one rent.","Μια κουβέντα μόνο για τους νεολαίους μας. Θέλω να κάνω μια ειδική αναφορά στο πρόγραμμα «Σπίτι μου». Για πρώτη φορά γίνεται ένα τέτοιο πρόγραμμα στην πατρίδα μας, 10.000 σπίτια για νέους με φθηνά δάνεια που θα αποπληρώνουν με δόσεις μικρότερες ενός ενοικίου.",,housing,,affordable housing,,1.0,,0.0,,,,0.0,,[],"[['my home', 'organization', '0.9'], ['country', 'location', '0.5'], ['10', '000', 'group of people', '0.2'], ['young people', 'group of people', '0.9'], ['cheap loans', 'organization', '0.1'], ['less than one rent', 'date', '0.3']]"
53,"Social consideration. What does this mean? There are school plots everywhere in Greece. We will be able to build modern apartments with private resources, most of them exclusively available to our young citizens at low rent.","Κοινωνική αντιπαροχή. Τι σημαίνει αυτό; Υπάρχουν σχολάζοντα οικόπεδα παντού στην Ελλάδα. Θα μπορούμε να χτίζουμε με ιδιωτικούς πόρους σύγχρονα διαμερίσματα, τα περισσότερα από αυτά θα διατίθενται αποκλειστικά σε νέους συμπολίτες μας με χαμηλό ενοίκιο.",,housing,,affordable housing,,0.4,,0.0,,,,0.0,,[],"[['greece', 'location', '1.0'], ['young citizens', 'group of people', '0.8.']]"
