id,text,text_el,topic,topic-context,subtopic,subtopic-context,topic-open,sentiment,polarization,polarization-definition,toxicity,toxicity-definition,populism,populism-definition,hate speech,ner,ner-limited
54,"Now, about our armaments, I will not tell you much. Sixty-eight, keep the number, not 10, not 20, not 30, 68 arms programs launched by this government. And certainly the presence of New Democracy in the governance of the country guarantees that our voice will be heard everywhere, in the American Congress, in Brussels, in all the major capitals.","Τώρα, για τα εξοπλιστικά μας δεν θα σας πω πολλά πράγματα. Εξήντα-οκτώ, κρατήστε τον αριθμό, ούτε 10, ούτε 20, ούτε 30, 68 εξοπλιστικά προγράμματα δρομολόγησε αυτή η κυβέρνηση. Και σίγουρα η παρουσία της Νέας Δημοκρατίας στη διακυβέρνηση του τόπου εγγυάται ότι η φωνή μας θα ακούγεται παντού, στο Αμερικανικό Κογκρέσο, στις Βρυξέλλες, σε όλες τις μεγάλες πρωτεύουσες.",,national security,,other,,0.5,,0.2,,,,0.0,,[],"[['new democracy', 'organization', '0.9'], ['american congress', 'organization', '0.9'], ['brussels', 'location', '0.8']]"
55,"Young democrats of Egaleo, all of Greece is blue and West Athens is blue and Egaleo is blue.","Νεοδημοκράτισσες και νεοδημοκράτες του Αιγάλεω, όλη η Ελλάδα είναι μπλε και η Δυτική Αθήνα είναι μπλε και το Αιγάλεω είναι μπλε. ",,other,,other,,1.0,,0.1,,,,0.0,,[],"[['egaleo', 'location', '1.0'], ['greece', 'country', '1.0'], ['west athens', 'location', '1.0'], ['young democrats of egaleo', 'group of people', '1.0']]"
56,"I could, friends, talk for hours about our report. I will not do so, I will not bore you, I will not talk about the major roads that cross the region, about our irrigation projects. I have not said a word about the Thessaloniki Metro, which is ready, it is not painted on canvas. About the new airports. About double benefits.","Θα μπορούσα, φίλες και φίλοι, να μιλώ ώρες για τον απολογισμό μας. Δεν θα το κάνω, δεν θα σας κουράσω, δεν θα μιλήσω για τους μεγάλους οδικούς άξονες που διασχίζουν την περιφέρεια, για τα αρδευτικά μας έργα. Δεν είπα κουβέντα για το Μετρό της Θεσσαλονίκης που είναι έτοιμο, δεν είναι ζωγραφισμένο σε μουσαμάδες. Για τα νέα αεροδρόμια. Για τα διπλά επιδόματα.",,other,,other,,0.5,,0.0,,,,0.0,,[],"[['thessaloniki metro', 'organization', '0.8'], ['airports', 'organization', '0.7'], ['thessaloniki', 'location', '0.6']]"
57,"Because this party is the great party of popular social sensitivity. We have given a double benefit to our vulnerable fellow citizens, we have actively supported our fellow citizens with disabilities.","Επειδή αυτή η παράταξη είναι η μεγάλη παράταξη της λαϊκής κοινωνικής ευαισθησίας. Εμείς δώσαμε διπλό επίδομα στους ευάλωτους συμπολίτες μας, εμείς στηρίξαμε έμπρακτα τους συμπολίτες μας με αναπηρία.",,social state,,vulnerable citizens,,0.8,,0.0,,,,0.2,,[],[]
58,"Nor will I talk much about our major defence agreements, with France, America, the agreements we have signed with Egypt, Israel and Italy.","Ούτε θα μιλήσω πολύ για τις μεγάλες αμυντικές μας συμφωνίες, με την Γαλλία, την Αμερική, τις συμφωνίες που έχουμε υπογράψει με την Αίγυπτο, το Ισραήλ και την Ιταλία.",,external affairs,,other,,0.0,,0.0,,,,0.0,,[],"[['france', 'location', '0.85'], ['america', 'country', '0.85'], ['egypt', 'country', '0.85'], ['israel', 'country', '0.85'], ['italy', 'country', '0.85']]"
59,"Why did I say that little? As I said, we can talk for hours about our work. Because I want this to contrast with the misery and catastrophism of our opponents.","Γιατί τα είπα αυτά τα λίγα; Όπως σας είπα, θα μπορούμε να μιλάμε πολλές ώρες για το έργο μας. Γιατί θέλω αυτά να αντιπαρατεθούν στη μιζέρια και την καταστροφολογία των αντιπάλων μας.",,opponent criticism,,populism,,0.5,,0.2,,,,0.0,,[],[]
60,"What do we have in front of us? A SYRIZA that, after failing as a government, has failed as an opposition, just as it is now failing as a political presence.","Τι έχουμε άλλωστε απέναντί μας; Έναν ΣΥΡΙΖΑ που αφού απέτυχε ως κυβέρνηση απέτυχε και ως αντιπολίτευση, όπως αποτυγχάνει τώρα και ως πολιτική παρουσία.",,opponent criticism,,other,,-0.8,,0.2,,,,0.0,,[],"[['syriza', 'political party', '1.0']]"
61,"Between 2015-2019, SYRIZA showed us what it wants and what it can do. It loaded the country with a third unnecessary memorandum, bringing it one step away from the precipice. It has burdened you, the middle class, with 29 new taxes. It has turned Greece into a centre for passing immigrants. It mortgaged public property for 99 years.","Το διάστημα 2015-2019 ο ΣΥΡΙΖΑ μάς έδειξε τι θέλει και τι μπορεί να κάνει. Φόρτωσε στη χώρα ένα τρίτο αχρείαστο μνημόνιο, φέρνοντάς την ένα βήμα από τον γκρεμό. Φόρτωσε εσάς, τη μεσαία τάξη, με 29 νέους φόρους. Μετέτρεψε την Ελλάδα σε κέντρο διερχομένων μεταναστών. Υποθήκευσε τη δημόσια περιουσία για 99 χρόνια.",,other,,austerity,,-0.8,,0.5,,,,0.2,,[],"[['syriza', 'organization', '1.0'], ['greece', 'country', '1.0'], ['middle class', 'group of people', '1.0']]"
62,"Here, for our students, let me remind them that he introduced sledgehammers in universities. We are with the libraries, not the sledgehammers.","Εδώ, για τους φοιτητές μας, να τους θυμίσω ότι καθιέρωσε τις βαριοπούλες στα πανεπιστήμια. Εμείς είμαστε με τις βιβλιοθήκες, όχι με τις βαριοπούλες.",,education,,higher education,,-0.6,,0.1,,,,0.0,,[],"[['universities', 'organization', '0.5'], ['libraries', 'organization', '0.5']]"
63,"Worse, it pushed the country to the margins of Europe. I believe that this is what has ultimately hurt us all the most, to feel that we are a country without dignity, a beggar in Europe, which we are constantly asking and begging for.","Και το χειρότερο, έσπρωξε τον τόπο στο περιθώριο της Ευρώπης. Αυτό πιστεύω ότι είναι που μας πλήγωσε τελικά όλους περισσότερο, να αισθανόμαστε ότι είμαστε μία χώρα χωρίς αξιοπρέπεια, επαίτης στην Ευρώπη, που μονίμως ζητάμε και παρακαλούμε.",,other,,injustice,,-0.75,,0.0,,,,0.0,,[],"[['europe', 'location', '1.0'], ['country', 'country', '1.0'], ['europe', 'location', '1.0']]"
64,"However, SYRIZA also seemed incapable of opposition. It said - and hold this back for your own political sake - ""no"" to everything and ""yes"" to nothing. No to tax cuts, no to an increase in the minimum wage, no to armaments, no to defence agreements, no to the Evros fence. Watch out, not even on the rights of our fellow citizens with disabilities, and no to the protection of the Parliament from the ""straw men"" of the Golden Dawn.","Φάνηκε, όμως, ο ΣΥΡΙΖΑ ανίκανος και για αντιπολίτευση. Είπε -και συγκρατήστε το αυτό και για τον δικό σας πολιτικό λόγο- «όχι» σε όλα και «ναι» σε τίποτα. Όχι στις φοροελαφρύνσεις, όχι στην αύξηση του βασικού μισθού, όχι στους εξοπλισμούς, όχι στις αμυντικές συμφωνίες, όχι στον φράχτη του Έβρου. Προσέξτε, όχι ακόμα και στα δικαιώματα των συμπολιτών μας με αναπηρία, όπως και όχι στην προστασία της Βουλής από τους «αχυρανθρώπους» της Χρυσής Αυγής.",,other,,other,,-0.8,,0.2,,,,0.2,,[],"[['syriza', 'organization', '0.95'], ['golden dawn', 'group of people', '0.75'], ['parliament', 'organization', '0.5'], ['evros', 'location', '0.4']]"
65,"And then what did he remember? The easy money center, the ""yes"" to benefits. How much is the SYRIZA program he announced costing us? What Thessaloniki? This is Thessaloniki on the cube, 45 billion euros Tsipras is spending today. But the people do not believe him, because they have tried him and have been hurt by these policies of deception, arrogance and incompetence.","Και μετά τι ξαναθυμήθηκε; Το εύκολο λεφτόδεντρο, το «ναι» σε παροχές. Πόσο κοστολογείται το πρόγραμμα του ΣΥΡΙΖΑ το οποίο μας εξήγγειλε; Ποια Θεσσαλονίκη; Αυτό είναι Θεσσαλονίκη στον κύβο, 45 δισεκατομμύρια ευρώ τάζει ο Τσίπρας σήμερα. Αλλά οι πολίτες δεν τον πιστεύουν, γιατί τον δοκίμασαν και πόνεσαν από τις πολιτικές αυτές της εξαπάτησης, της αλαζονείας, της ανικανότητας.",,economy,,austerity,,-0.8,,0.0,,,,0.2,,[],"[['thessaloniki', 'location', '0.8'], ['syriza', 'political party', '0.8'], ['tsipras', 'person', '0.8'], ['45 billion euros', 'date', '0.6']]"
66,"And what is the central slogan? ""Justice everywhere"". Justice everywhere, huh? Everywhere, but not next to him, because that's where he's holding the convicted Special Court Pappas.","Και ποιο είναι το κεντρικό σύνθημα; «Δικαιοσύνη παντού». Δικαιοσύνη παντού, ε; Παντού, αλλά όχι δίπλα του, γιατί εκεί κρατά τον καταδικασμένο στο Ειδικό Δικαστήριο Παππά. ",,justice,,corruption,,-0.5,,0.0,,,,0.0,,[],"[['special court pappas', 'organization', '0.7'], ['justice', 'group of people', '0.5'], ['everywhere', 'location', '0.5']]"
67,"While he was travelling to Berlin 3-4 days ago to explain his positions to the Germans, he was the one who shouted ""Go back Madame Merkel"".","Ενώ ο ίδιος πριν από 3-4 μέρες ταξίδεψε στο Βερολίνο για να εξηγήσει τις θέσεις του στους Γερμανούς, αυτός που φώναζε «Go back Madame Merkel».",,external affairs,,other,,-0.6,,0.5,,,,0.1,,[],"[['berlin', 'location', '1.0'], ['germans', 'group of people', '0.9'], ['madame merkel', 'person', '0.8']]"
68,"And I don't really know whether Mr Tsipras is laughing or crying. But I do know that he is divisive, faithful to his ""populism"", threatening again that ""the second time will be different"". A hypocrite of morality, as the case of MEP Georgoulis has shown.","Και δεν ξέρω πραγματικά αν ο κ. Τσίπρας είναι για γέλια ή για κλάματα. Ξέρω όμως ότι είναι διχαστικός, πιστός στον «πολακισμό» του, απειλώντας και πάλι ότι «η δεύτερη φορά θα είναι αλλιώς». Υποκριτής της ηθικής, όπως έδειξε και η υπόθεση του ευρωβουλευτή Γεωργούλη.",,other,,other,,-0.8,,0.2,,,,0.2,,[],"[['mr tsipras', 'person', '0.9'], ['mep georgoulis', 'person', '0.7']]"
69,"But also dangerous. Dangerous, since he made sure to leave behind the ""mine"" of the simple proportional representation, betting on what? On ungovernability. This action was taken in order to harm New Democracy, but in the end it harms democracy itself and there is only one way to cancel it: our vote on May 21, the one that will answer the central question.","Αλλά και επικίνδυνος. Επικίνδυνος, αφού φρόντισε να αφήσει πίσω του τη «νάρκη» της απλής αναλογικής, ποντάροντας που; Στην ακυβερνησία. Αυτή η ενέργεια έγινε με σκοπό να βλάψει τη Νέα Δημοκρατία, όμως τελικά βλάπτει την ίδια τη δημοκρατία και υπάρχει ένας τρόπος μόνο να ακυρωθεί: η ψήφος μας την 21η Μαΐου, αυτή που θα απαντήσει και στο κεντρικό ερώτημα.",,democracy,,abstention,,-0.4,,0.1,,,,0.0,,[],"[['new democracy', 'organization', '0.5'], ['may 21', 'date', '1.0']]"
70,"Because what is the final dilemma to which citizens, friends, will be called upon to respond? It is very simple. Do we move forward or do we go back? Do we ask for results or do we ask for lies? Do we ask again for taxes and cuts or for increases and better pay?","Γιατί ποιο είναι τελικά το δίλημμα στο οποίο θα κληθούν να απαντήσουν οι πολίτες, φίλες και φίλοι; Είναι πολύ απλό. Βαδίζουμε μπροστά ή γυρίζουμε πίσω; Ζητάμε αποτελέσματα ή ζητάμε ψέματα; Ζητάμε ξανά φόρους και περικοπές ή αυξήσεις και καλύτερες αμοιβές;",,other,,austerity,,0.0,,0.2,,,,0.0,,[],"[['citizens', 'group of people', '0.85'], ['friends', 'group of people', '0.7']]"
71,And let me remind you: our election year coincides with Turkey's. As with Bulgaria's. What happened in the neighbouring country? Simple proportional representation is leading Bulgaria to its sixth election in two years.,Και θυμίζω: ο εκλογικός μας χρόνος συμπίπτει με αυτόν της Τουρκίας. Όπως και με τα δεδομένα της Βουλγαρίας. Τι έγινε στη γειτονική χώρα; Η απλή αναλογική οδηγεί τη Βουλγαρία σε έκτη εκλογική αναμέτρηση μέσα σε δύο χρόνια.,,external affairs,,other,,0.0,,0.2,,,,0.0,,[],"[['turkey', 'country', '0.9'], ['bulgaria', 'country', '0.9'], ['bulgaria', 'group of people', '0.6'], ['proportional representation', 'organization', '0.6'], ['sixth', 'date', '0.6'], ['two years', 'date', '0.6']]"
72,We do not need such uncertainties and such instability in our country. And the only guarantee that these things will not happen is a strong government of New Democracy the next day.,Δεν χρειαζόμαστε τέτοιες αβεβαιότητες και τέτοια αστάθεια στη χώρα μας. Και η μόνη εγγύηση για να μην συμβούν αυτά είναι η ισχυρή κυβέρνηση της Νέας Δημοκρατίας την επόμενη μέρα.,,political parties,,other,,0.2144,,0.1,,,,0.0,,[],"[['new democracy', 'organization', '1.0'], ['country', 'location', '1.0']]"
73,"And you see that the international environment remains uncertain. What do we need today? A clear horizon but also a clear solution in the leadership of the country. Certainty, continuity and consistency. And there are many facets to the dilemma that citizens face.","Και βλέπετε ότι το διεθνές περιβάλλον παραμένει αβέβαιο. Τι χρειαζόμαστε σήμερα; Καθαρό ορίζοντα αλλά και καθαρή λύση στην ηγεσία της χώρας. Σιγουριά, συνέχεια και συνέπεια. Και είναι πολλές οι όψεις του διλήμματος που έχουν μπροστά τους οι πολίτες.",,external affairs,,other,,0.0,,0.0,,,,0.0,,[],"[['1. international environment', 'location', '0.7'], ['2. country', 'location', '0.5'], ['3. citizens', 'group of people', '0.6']]"
74,Do we choose a government that knows how to win in the rough and tumble or some amateurs who drown in the first difficulties? A Prime Minister who will be respected abroad as a leader or a speechless and awkward visitor?,Επιλέγουμε μια κυβέρνηση που ξέρει να νικά στις τρικυμίες ή κάποιους ερασιτέχνες που πνίγονται στις πρώτες δυσκολίες; Έναν Πρωθυπουργό που θα τον σέβονται στο εξωτερικό ως ηγέτη ή έναν άφωνο και αμήχανο επισκέπτη;,,other,,other,,0.3,,0.1,,,,0.2,,[],"[['prime minister', 'person', '0.8'], ['abroad', 'location', '0.6']]"
75,"So, all versions of this dilemma are united in one: the New Democracy with Prime Minister Kyriakos Mitsotakis or SYRIZA with Prime Minister Alexis Tsipras?","Όλες, λοιπόν, οι εκδοχές αυτού του διλήμματος ενώνονται σε μία: Νέα Δημοκρατία με Πρωθυπουργό Κυριάκο Μητσοτάκη ή ΣΥΡΙΖΑ με Πρωθυπουργό Αλέξη Τσίπρα;",,other,,election spending,,0.0,,0.4,,,,0.0,,[],"[['kyriakos mitsotakis', 'person', '0.85'], ['new democracy', 'political party', '0.80'], ['syriza', 'political party', '0.80'], ['alexis tsipras', 'person', '0.85']]"
76,That is why the stakes of these elections are as simple as they are real. But it is also so critical in our daily lives.,Γι’ αυτό και το στοίχημα αυτών των εκλογών είναι τόσο απλό όσο και αληθινό. Αλλά είναι και τόσο κρίσιμο στην καθημερινή μας ζωή.,,elections,,other,,0.5,,0.0,,,,0.0,,[],[]
77,"I feel on this slogan, to be the Prime Minister again we all have to fight together so that no vote is wasted.","Αισθάνομαι στο σύνθημα αυτό, για να είμαι ο Πρωθυπουργός και πάλι πρέπει όλοι μαζί να δώσουμε τον αγώνα να μην πάει καμία ψήφος χαμένη.",,abstention,,abstention,,0.55,,0.0,,,,0.0,,[],"[['1. prime minister', 'person', '0.5'], ['2. we', 'group of people', '0.5']]"
78,"Why? Because in this ballot box there is no room for frivolous behaviour, and no room for uncounted votes. We do not need ""blank"" messages of so-called protest. No wrong choice at the ballot box will be corrected afterwards.","Γιατί; Γιατί σε αυτή την κάλπη δεν χωρούν επιπόλαιες συμπεριφορές, ούτε και αψήφιστες ψήφοι. Δεν χρειαζόμαστε «άσφαιρα» μηνύματα δήθεν διαμαρτυρίας. Καμία λάθος επιλογή στην κάλπη δεν θα διορθώνεται μετά.",,abstention,,abstention,,-0.5,,0.0,,,,0.0,,[],[]
79,"Much more - and note this because it is of particular importance - our opponents are ruthless. I personally do not believe anything they say. They said one thing and did another, after all, in the 'bloody referendum'. They proclaimed then that they would not hold new elections, and they did. They pledged that they would stand firm on their positions and then allied themselves with Kammenos' far-right.","Πολύ περισσότερο -και προσέξτε το αυτό γιατί έχει ξεχωριστή σημασία- οι αντίπαλοί μας είναι αδίστακτοι. Προσωπικά δεν πιστεύω τίποτα από όσα λένε. Άλλα είπαν και άλλα έκαναν, εξάλλου, στο «δημοψήφισμα της κωλοτούμπας». Διαλαλούσαν τότε ότι δεν θα κάνουν νέες εκλογές και τις έκαναν. Δεσμεύονταν ότι θα μείνουν σταθεροί στις θέσεις τους και μετά συμμάχησαν με την ακροδεξιά του Καμμένου.",,other,,other,,-0.75,,0.6,,,,0.0,,[],"[['opponents', 'group of people', '0.6'], ['kammenos', 'person', '0.9'], ['far-right', 'group of people', '0.8']]"
80,Just as I don't trust anyone who refuses to accept as Prime Minister the leader of the party that the people have voted for.,"Όπως, επίσης, δεν εμπιστεύομαι και όποιον αρνείται για Πρωθυπουργό τον αρχηγό του κόμματος που έχουν ψηφίσει οι πολίτες.",,democracy,,other,,0.2,,0.2,,,,0.2,,[],"[['prime minister', 'position', '1.0'], ['leader', 'person', '1.0'], ['party', 'political party', '1.0'], ['people', 'group of people', '1.0'], ['voted', 'date', '1.0.']]"
81,"So, again, they have no principles. And watch out, they are capable of uniting even if they are defeated. If the numbers favour them, then have no doubt, they will attempt a SYRIZA-PASOK-Varoufakis government. Imagine it a little please, with Prime Minister Tsipras, in exchange for the consolidation of the simple proportional representation so that they can float at the expense of the sinking country. Well, we will not indulge them.","Το ξαναλέω, λοιπόν, δεν έχουν αρχές. Και προσέξτε, είναι ικανοί να συνασπιστούν ακόμα και αν ηττηθούν. Εάν οι αριθμοί τούς ευνοήσουν, τότε μην έχετε καμία αμφιβολία, θα επιχειρήσουν μία κυβέρνηση ΣΥΡΙΖΑ - ΠΑΣΟΚ - Βαρουφάκη. Φανταστείτε την λίγο παρακαλώ, με Πρωθυπουργό Τσίπρα, με αντάλλαγμα την παγίωση της απλής αναλογικής ώστε να επιπλεύσουν εκείνοι εις βάρος της πατρίδας που θα βουλιάζει. Ε, λοιπόν, δεν θα τους κάνουμε το χατίρι.",,opponent criticism,,coalition,,-0.4,,0.4,,,,0.2,,[],"[['syriza', 'organization', '0.6'], ['pasok', 'organization', '0.5'], ['varoufakis', 'person', '0.7'], ['tsipras', 'person', '0.5'], ['greece', 'country', '0.8']]"
82,"This scenario seems difficult, but it is not unlikely. So people should think very carefully about what they are going to vote for. They may, for example, vote for PASOK and tomorrow they will see Prime Minister Tsipras and Finance Minister Yanis Varoufakis, with an ""n"".","Το σενάριο αυτό μοιάζει δύσκολο, δεν είναι απίθανο. Γι’ αυτό και οι πολίτες ας σκεφτούν πολύ τι θα ψηφίσουν. Μπορεί, για παράδειγμα, να ψηφίσουν ΠΑΣΟΚ και αύριο να δουν Πρωθυπουργό Τσίπρα και Υπουργό Οικονομικών τον Γιάνη Βαρουφάκη, με ένα «ν».",,elections,,other,,-0.2,,0.0,,,,0.0,,[],"[['pasok', 'organization', '0.8'], ['prime minister tsipras', 'person', '0.7'], ['finance minister yanis varoufakis', 'person', '0.7']]"
83,"Be careful because this is no laughing matter. The latter makes no secret of the fact that he wants to blow up the banks again. Just the day before yesterday he chose a currency once he has taken us out of the euro. What did he call it? ""Demeter"". So, in Crete, where I was, I heard the first mantra: ""how many ""Demitres"" does the souvlaki make, ask Yanis Varoufakis for your change"".","Προσέξτε γιατί εδώ δεν είναι για γέλια. Ο τελευταίος δεν κρύβει ότι θέλει και πάλι να ανατινάξει τις τράπεζες. Μόλις προχθές διάλεξε και νόμισμα μόλις μας βγάλει από το ευρώ. Πώς το βάφτισε; «Δήμητρα». Έτσι, λοιπόν, στην Κρήτη που ήμουν άκουσα και την πρώτη μαντινάδα: «πόσες “Δήμητρες” κάνει το σουβλάκι, ζήτησε τα ρέστα σου από το Γιάνη Βαρουφάκη».",,economy,,bank regulations,,-0.5,,0.1,,,,0.0,,[],"[['yanis varoufakis', 'person', '0.9'], ['crete', 'location', '0.8'], ['euro', 'organization', '0.7'], ['demeter', 'organization', '0.6']]"
