id,text,text_el,topic,topic-context,subtopic,subtopic-context,topic-open,sentiment,polarization,polarization-definition,toxicity,toxicity-definition,populism,populism-definition,hate speech,ner,ner-limited
1,"Young Democrats of Egaleo and West Athens, thank you for this impressive reception. I return the joy, emotion and enthusiasm that your presence here today indicates.","Νεοδημοκράτισσες και Νεοδημοκράτες του Αιγάλεω και της Δυτικής Αθήνας, σας ευχαριστώ γι’ αυτή την εντυπωσιακή υποδοχή. Σας ανταποδίδω τη χαρά, τη συγκίνηση και τον ενθουσιασμό που δηλώνει σήμερα, εδώ, η παρουσία σας.",,political parties,,other,,0.8,,0.0,,,,0.0,,[],"[['young democrats of egaleo', 'organization', '0.9'], ['west athens', 'location', '0.8']]"
2,"A big thank you to our youth, a warm round of applause for the young people of New Democracy and for the many ""timeless"" Onnedites who are among us. Our first major pre-election rally in Attica could not have taken place anywhere else but here, in Egaleo, in my constituency.","Ένα μεγάλο ευχαριστώ στη νεολαία μας, ένα θερμό χειροκρότημα για τις νέες και τους νέους της Νέας Δημοκρατίας και για τους πολλούς «διαχρονικούς» Οννεδίτες που είναι ανάμεσά μας. Η πρώτη μας μεγάλη προεκλογική συγκέντρωση της Αττικής δε θα μπορούσε να γίνει αλλού παρά μόνο εδώ, στο Αιγάλεω, στην εκλογική μου περιφέρεια.",,other,,youth,,0.7,,0.0,,,,0.0,,[],"[['egaleo', 'location', '1.0'], ['attica', 'location', '1.0'], ['new democracy', 'political party', '1.0']]"
3,"I met some old friends on the way in. They may remember that I made my first political appearance here in Egaleo exactly 20 years ago, in April 2003. Since then you have surrounded me with your trust. I thank you from the bottom of my heart.","Συνάντησα κάποιους παλιούς φίλους μπαίνοντας. Ίσως θυμούνται ότι εδώ στο Αιγάλεω είχα κάνει την πρώτη μου πολιτική εμφάνιση ακριβώς πριν από 20 χρόνια, τον Απρίλιο του 2003. Από τότε με περιβάλλετε με την εμπιστοσύνη σας. Σας ευχαριστώ από καρδιάς.",,political promises,,other,,0.8,,0.0,,,,0.0,,[],"[['egaleo', 'location', '1.0'], ['april 2003', 'date', '1.0']]"
4,"From the Western Sector, then, and from its seven municipalities, I start our struggle - municipalities which I know very well, I have walked them for 20 years, Agia Varvara, Agioi Anargyros, Kamatero, Egaleo, Ilion, Peristeri, Petroupoli, Haidari - so that this area becomes the starting point of our victorious journey.","Από τον Δυτικό Τομέα, λοιπόν, και από τους επτά Δήμους του, ξεκινώ τον αγώνα μας - δήμους τους οποίους γνωρίζω πολύ καλά, τους έχω περπατήσει εδώ και 20 χρόνια, την Αγία Βαρβάρα, τους Αγίους Αναργύρους, το Καματερό, το Αιγάλεω, το Ίλιον, το Περιστέρι, την Πετρούπολη, το Χαϊδάρι - ώστε εδώ η περιοχή να γίνει αφετηρία της νικηφόρας μας διαδρομής.",,other,,other,,0.25,,0.0,,,,0.0,,[],"[['agia varvara', 'location', '1.0'], ['agioi anargyros', 'location', '1.0'], ['kamatero', 'location', '1.0'], ['egaleo', 'location', '1.0'], ['ilion', 'location', '1.0'], ['peristeri', 'location', '1.0'], ['petroupoli', 'location', '1.0'], ['haidari', 'location', '1.0']]"
5,"The one that on May 21 will bring what the whole country is expecting, a self-reliant Greece and a self-reliant New Democracy. To finally close the door to yesterday and open it wide to the future. All Greece will be blue on May 21.","Αυτής που την 21η Μαΐου θα φέρει αυτό που προσδοκά όλη η χώρα, την αυτοδύναμη Ελλάδα και την αυτοδύναμη Νέα Δημοκρατία. Για να κλείσουμε οριστικά την πόρτα στο χθες και να την ανοίξουμε διάπλατα στο μέλλον. Όλη η Ελλάδα θα γίνει μπλε την 21η Μαΐου.",,other,,other,,0.75,,0.2,,,,0.0,,[],"[['greece', 'country', '1.0'], ['new democracy', 'political party', '1.0'], ['may 21', 'date', '1.0']]"
6,"I see, friends, that perhaps we should have chosen another venue, the indoor stadium in the city does not fit us all. However, it sends a strong message that West Athens will also become blue, just as our whole country will be dressed in blue from end to end.","Βλέπω, φίλες και φίλοι, ότι ίσως έπρεπε να είχαμε επιλέξει άλλο χώρο, το κλειστό γήπεδο της πόλης δεν μας χωρά όλους. Στέλνει, ωστόσο, το ηχηρό μήνυμα, η Δυτική Αθήνα θα γίνει και αυτή γαλάζια, όπως στα γαλάζια θα ντυθεί από άκρη σε άκρη και όλη μας η πατρίδα.",,political parties,,other,,0.4,,0.0,,,,0.0,,[],"[['west athens', 'location', '0.7'], ['country', 'country', '0.7'], ['blue', 'organization', '0.5']]"
7,"I see it, friends, in your faces, I hear it in your voices, in all that is happening, and my own strength, we are here to unite all Greeks and I will insist on it to the end.","Το βλέπω, φίλες και φίλοι, στα πρόσωπά σας, το ακούω στη φωνή σας, σε όλα αυτά που γίνονται, και η δική μου δύναμη, είμαστε εδώ για να ενώσουμε όλους τους Έλληνες και σε αυτό θα επιμείνω μέχρι τέλους.",,elections,,other,,0.8,,0.0,,,,0.2,,[],"[['greeks', 'group of people', '1.0'], ['i', 'person', '1.0']]"
8,"These were the exact words I used four years ago, heading into the 2019 elections. Along with a commitment that we would cut taxes, support income and grow jobs in a country that would be shielded and modernized.","Αυτά τα λόγια ακριβώς είχα χρησιμοποιήσει πριν από τέσσερα χρόνια, βαδίζοντας τότε προς τις εκλογές του 2019. Μαζί με τη δέσμευση ότι θα μειώσουμε τους φόρους, στηρίζοντας το εισόδημα και αυξάνοντας τις δουλειές σε μια χώρα που θα θωρακίζεται και θα εκσυγχρονίζεται.",,economy,,tax cuts,,0.75,,0.0,,,,0.0,,[],"[['2019 elections', 'date', '1.0']]"
9,"Well, I wouldn't change a word of those words. On the contrary, I am here to assure you that our motto is now a tangible reality: we said it and we did it.","Ε λοιπόν, δεν θα άλλαζα ούτε μια λέξη από εκείνα μου τα λόγια. Αντίθετα, είμαι εδώ για να σας βεβαιώσω ότι το σύνθημά μας αποτελεί πια χειροπιαστή πραγματικότητα: το είπαμε και το κάναμε.",,political promises,,other,,1.0,,0.0,,,,0.0,,[],[]
10,"Let us recall, friends, what we said. In 2019, we said we would cut taxes for everyone. Today, Greeks are exempt from fifty taxes and contributions. All of you are paying 35% lower ENFIA, more than the 30% I promised you.","Για να θυμηθούμε λίγο, φίλες και φίλοι, τι είχαμε πει. Το 2019 είχαμε πει ότι θα μειώσουμε τους φόρους για όλους. Σήμερα οι Έλληνες και οι Ελληνίδες έχουν απαλλαγεί από πενήντα φόρους και εισφορές. Όλοι σας πληρώνετε 35% χαμηλότερο ΕΝΦΙΑ, πάνω από το 30% που σας είχα υποσχεθεί.",,economy,,tax cuts,,0.8,,0.0,,,,0.0,,[],"[['greeks', 'group of people', '0.6'], ['enfia', 'organization', '0.5'], ['2019', 'date', '0.4']]"
11,"The tax rate on individuals fell from 22% to 9%. The corporate rate for all businesses, small and medium-sized businesses, here in the region, dropped from 29% to 22%. The solidarity levy and the parental benefit tax were finally abolished.","Ο συντελεστής της φορολογίας στα φυσικά πρόσωπα έπεσε από το 22% στο 9%. Ο εταιρικός συντελεστής για όλες τις επιχειρήσεις, τις μικρομεσαίες επιχειρήσεις, εδώ της περιοχής, έπεσε από το 29% στο 22%. Καταργήθηκε οριστικά η εισφορά αλληλεγγύης και ο φόρος των γονικών παροχών.",,economy,,tax cuts,,0.8,,0.0,,,,0.0,,[],"[['1. individuals', 'group of people', '1.0'], ['2. region', 'location', '1.0'], ['3. small and medium-sized businesses', 'group of people', '1.0']]"
12,"At the same time, the new investments have created more than 300,000 new jobs. We reduced unemployment by six points.",Οι νέες επενδύσεις έφεραν ταυτόχρονα παραπάνω από 300.000 νέες θέσεις εργασίας. Μειώσαμε την ανεργία κατά έξι μονάδες.,,employment,,employment,,0.8,,0.0,,,,0.0,,[],[]
13,"Seventeen SYRIZA cuts replaced increases - I see among us many friends I have known for many years, many of you are pensioners - 1.6 million of our fellow citizens saw the first pension increases in 12 years, almost 8%. And those who were wronged by the Katrougalos personal differential were boosted by EUR 200-300 and I pledge that they will continue to be supported until the Katrougalos personal differential is finally erased.","Δεκαεπτά περικοπές του ΣΥΡΙΖΑ αντικατέστησαν αυξήσεις -βλέπω ανάμεσά μας πολλούς φίλους που γνωρίζω πολλά χρόνια, πολλοί από εσάς είστε συνταξιούχοι- 1,6 εκατομμύρια συμπολίτες μας είδαν τις πρώτες αυξήσεις στις συντάξεις εδώ και 12 χρόνια, σχεδόν 8%. Και όσοι αδικούνται από την προσωπική διαφορά Κατρούγκαλου ενισχύθηκαν από 200-300 ευρώ και δεσμεύομαι ότι θα εξακολουθούν να στηρίζονται μέχρι η προσωπική διαφορά Κατρούγκαλου να σβήσει οριστικά.",,pensioners,,pensions,,0.8,,0.0,,,,0.0,,[],"[['syriza', 'organization', '1.0'], ['katrougalos', 'person', '1.0'], ['eur', 'organization', '0.7'], ['12 years', 'date', '1.0']]"
14,"And not only. The basic salary, where did we receive it? At 650 euros. Where is it today? At 780 euros, 20% increase.","Και όχι μόνο. Ο βασικός μισθός, πού τον παραλάβαμε; Στα 650 ευρώ. Πού είναι σήμερα; Στα 780 ευρώ, 20% αύξηση.",,employment,,wages,,0.5,,0.0,,,,0.0,,[],[]
15,"Our exports are setting a continuous record. The country is currently growing at three times the rate of Europe. The economy has been freed from the surveillance imposed on it in 2018, upgraded 12 times. It is half a step away from investment grade.","Οι εξαγωγές μας καταγράφουν συνεχή ρεκόρ. Η χώρα σήμερα αναπτύσσεται με ρυθμό τριπλάσιο της Ευρώπης. Η οικονομία απαλλάχθηκε από την επιτήρηση που της είχε επιβληθεί το 2018, αναβαθμίστηκε 12 φορές. Βρίσκεται μισό σκαλί από την επενδυτική βαθμίδα.",,economy,,economic crisis,,1.0,,0.0,,,,0.0,,[],"[['europe', 'location', '0.9'], ['2018', 'date', '0.8'], ['investment grade', 'organization', '0.5']]"
16,"In other words, the country autonomously determines its economic policy. And soon borrowing will become more favourable for everyone, for the state, for businesses and for households.","Με άλλα λόγια, η χώρα καθορίζει αυτόνομα την οικονομική της πολιτική. Και σύντομα ο δανεισμός θα γίνει ευνοϊκότερος για όλους, για το κράτος, για τις επιχειρήσεις αλλά και για τα νοικοκυριά.",,debt,,interest rates,,0.6,,0.0,,,,0.0,,[],[]
17,"This implies the investment grade. And keep my commitment from here, from Egaleo: if a strong government of the New Democracy emerges - which it will - the investment grade will be a reality before the end of the year. But, beware, with one condition that is in our hands: the stability and the prospects of the country, something that will only be guaranteed by a strong and experienced government on May 21.","Αυτό συνεπάγεται η επενδυτική βαθμίδα. Και κρατήστε και από εδώ, από το Αιγάλεω, τη δέσμευσή μου: εφόσον προκύψει -που θα προκύψει- ισχυρή κυβέρνηση της Νέας Δημοκρατίας η επενδυτική βαθμίδα θα είναι πραγματικότητα πριν το τέλος του χρόνου. Αλλά, προσέξτε, με μία προϋπόθεση που είναι στο χέρι μας: τη σταθερότητα και την προοπτική του τόπου, κάτι το οποίο θα εγγυάται μόνο μια ισχυρή και έμπειρη κυβέρνηση την 21η Μαΐου.",,,,other,,0.6,,0.0,,,,0.0,,[],"[['egaleo', 'location', '0.8'], ['new democracy', 'political party', '0.8'], ['may 21', 'date', '0.8.']]"
18,"Fellow members of the New Democracy, in the truth agreement we signed four years ago I also committed myself to a secure homeland. A united society, without the old divisions and for a better and more modern everyday life. I have not moved away from these goals, despite the successive 'storms' that have broken out with us at the helm of the country.","Συναγωνιστές της Νέας Δημοκρατίας, στη συμφωνία αλήθειας που υπογράψαμε πριν από τέσσερα χρόνια είχα δεσμευτεί επίσης για μία ασφαλή πατρίδα. Μια ενωμένη κοινωνία, χωρίς τους παλιούς διχασμούς και για μια καλύτερη και πιο σύγχρονη καθημερινότητα. Δεν απομακρύνθηκα από αυτούς τους στόχους, παρά τις αλλεπάλληλες «καταιγίδες» που ξέσπασαν με εμάς στο τιμόνι του τόπου.",,other,,other,,0.7,,0.2,,,,0.0,,[],"[['new democracy', 'political party', '0.95'], ['four years ago', 'date', '0.9']]"
19,"You know it well. Count how many crises we have been through together: migratory invasions in the Evros and the Aegean, the global coronavirus pandemic, the war in Ukraine, the energy boom, natural disasters, the daily threats of Turkey. No government since the post-war era has faced so many obstacles in such a short time. Yet this government has kept our borders impregnable.","Το ξέρετε καλά. Μετρήστε πόσες κρίσεις περάσαμε μαζί: μεταναστευτικές εισβολές στον Έβρο και στο Αιγαίο, παγκόσμια πανδημία του κορονοϊού, πόλεμος στην Ουκρανία, ενεργειακή «έκρηξη», φυσικές καταστροφές, καθημερινές απειλές της Τουρκίας. Καμία κυβέρνηση από τη μεταπολίτευση και μετά δεν αντιμετώπισε τόσα πολλά εμπόδια σε τόσο μικρό χρόνο. Κι όμως, αυτή η κυβέρνηση κράτησε απόρθητα τα σύνορά μας.",,national security,,other,,0.5,,0.0,,,,0.0,,[],"[['1. evros', 'location', '1.0'], ['2. aegean', 'location', '1.0'], ['3. global coronavirus pandemic', 'organization', '0.7'], ['4. ukraine', 'location', '1.0'], ['5. turkey', 'location', '1.0'], ['6. government', 'organization', '1.0']]"
20,"With a gigantic programme it supported workers in business and work. It organised an exemplary vaccination campaign, at the same time implementing the commitments for which the Greek people had entrusted it.","Με ένα γιγαντιαίο πρόγραμμα στήριξε τους εργαζόμενους στις επιχειρήσεις και  την εργασία. Οργάνωσε μία υποδειγματική εκστρατεία εμβολιασμού, υλοποιώντας την ίδια ώρα τις δεσμεύσεις για τις οποίες την είχε εμπιστευτεί ο ελληνικός λαός.",,health,,other,,0.8,,0.0,,,,0.0,,[],"[['greek people', 'group of people', '1.0'], ['greece', 'country', '1.0']]"
21,"I ask you, does Greece in 2023 resemble Greece in 2019? The answer is: no, not at all. We have a fiscal surplus in 2022. This prudent management has succeeded in increasing our GDP by 26 billion; our debt, that very important indicator of our credibility, has been reduced by 40 full points, the largest reduction in public debt in the whole of Europe.","Σας ρωτώ, η Ελλάδα του 2023 θυμίζει σε τίποτα εκείνη του 2019; Η απάντηση είναι: όχι, σε τίποτα. Έχουμε δημοσιονομικό πλεόνασμα το 2022. Αυτή η συνετή διαχείριση πέτυχε να μεγεθύνουμε το ΑΕΠ μας κατά 26 δισ. Το χρέος μας, ο τόσο σημαντικός αυτός δείκτης για την αξιοπιστία μας, μειώθηκε 40 ολόκληρες μονάδες, η μεγαλύτερη μείωση δημοσίου χρέους σε ολόκληρη την Ευρώπη.",,debt,,austerity,,0.9,,0.0,,,,0.0,,[],"[['greece', 'location', '1.0'], ['europe', 'location', '1.0'], ['2023', 'date', '1.0'], ['2019', 'date', '1.0'], ['gdp', 'organization', '1.0']]"
22,"But at the same time, along with the economic recovery, we have also strengthened our defence. To those who did not see borders at sea and wanted them open on land, we gave a double answer. We zeroed out refugee flows. We relieved our islands, we built modern structures instead of the shameful structures of Moria. We saved lives in the Aegean. And, yes, we extended the fence on Evros. The fence is being extended, let those who fought it and are still fighting it hear it well.","Ταυτόχρονα όμως, μαζί με την οικονομική ανάταξη προχωρήσαμε και την ενίσχυση της άμυνάς μας. Σε όσους δε διέκριναν σύνορα στη θάλασσα και τα ήθελαν ανοιχτά στην ξηρά απαντήσαμε διπλά. Μηδενίσαμε τις προσφυγικές ροές. Ανακουφίσαμε τα νησιά μας, χτίσαμε σύγχρονες δομές αντί για τα αίσχη της Μόριας. Σώσαμε ζωές στο Αιγαίο. Και, ναι, επεκτείναμε τον φράχτη στον Έβρο. Ο φράχτης επεκτείνεται, να το ακούσουν καλά όσοι τον πολέμησαν και τον πολεμούν ακόμα.",,migration,,sea borders,,0.5,,0.2,,,,0.0,,[],"[['moria', 'location', '0.7'], ['aegean', 'location', '0.7'], ['evros', 'location', '0.6']]"
23,"On the other hand, we are upgrading our Armed Forces as never before with 24 new Rafale, 84 F-16 Vipers, three new frigates, increases in salaries and allowances for our servicemen and women. Why? Because for us, yes, defence is an end in itself. There is no economic prosperity that is not based on national sovereignty.","Από την άλλη πλευρά, αναβαθμίζουμε όσο ποτέ τις Ένοπλες Δυνάμεις μας με 24 νέα Rafale, 84 F-16 Viper, τρεις νέες φρεγάτες, αυξήσεις σε μισθούς και σε επιδόματα στους ενστόλους μας. Γιατί; Γιατί για εμάς η άμυνα, ναι, είναι αυτοσκοπός. Δεν υπάρχει οικονομική ευημερία που να μη στηρίζεται στην εθνική κυριαρχία.",,other,,defense spending,,1.0,,0.0,,,,0.0,,[],"[['armed forces', 'organization', '0.8'], ['rafale', 'organization', '0.6'], ['f-16 vipers', 'organization', '0.6'], ['frigates', 'organization', '0.6'], ['servicemen', 'group of people', '0.8'], ['women', 'group of people', '0.8'], ['national sovereignty', 'political party', '0.6.']]"
24,"The crisis for me, friends, has never been an alibi for giving up what we are demanding. So today the country has a new face, not only in taxes and increases, in employment, in immigration, in defence, but also in works and interventions in our daily life.","Η κρίση για εμένα, φίλες και φίλοι, δεν έγινε ποτέ άλλοθι για να παραιτηθώ από αυτά που διεκδικούμε. Έτσι σήμερα η χώρα έχει άλλη όψη, όχι μόνο στους φόρους και στις αυξήσεις, στην απασχόληση, στο μεταναστευτικό, στην άμυνα, αλλά και με έργα και παρεμβάσεις στην καθημερινή μας ζωή.",,employment,,employment,,0.6,,0.2,,,,0.0,,[],[]
25,"See for example what is happening here in West Attica. A long time ago, Metro Line 3 terminated not far from here, in Agia Marina. Now it connects to Agia Varvara, Korydallos, Nikaia and Piraeus.","Δείτε για παράδειγμα τι συμβαίνει εδώ, στη Δυτική Αττική. Πριν από καιρό η Γραμμή 3 του Μετρό τερμάτιζε όχι μακριά από εδώ, στην Αγία Μαρίνα. Τώρα συνδέεται με την Αγία Βαρβάρα, τον Κορυδαλλό, τη Νίκαια και τον Πειραιά.",,other,,other,,0.0,,0.0,,,,0.0,,[],"[['west attica', 'location', '1.0'], ['metro line 3', 'organization', '1.0'], ['agia marina', 'location', '1.0'], ['agia varvara', 'location', '1.0'], ['korydallos', 'location', '1.0'], ['nikaia', 'location', '1.0'], ['piraeus', 'location', '1.0']]"
26,"The very important Line 2 tender, which will finally connect Anthoupoli with Ilion, is also being developed. While the road connection of the Western Regional Road of Egaleo with the Athens-Corinth National Road is also being planned. The new three-storey building of the university, the equipment of its laboratories, the energy upgrade of 12 schools and the Attikon Hospital, the pilot renovation of the refugee houses in Agia Varvara, the new town hall in Egaleo.","Εξελίσσεται, επίσης, ο τόσο σημαντικός διαγωνισμός της Γραμμής 2, που θα ενώσει επιτέλους την Ανθούπολη με το Ίλιον. Ενώ σχεδιάζεται και η οδική σύνδεση της Δυτικής Περιφερειακής του Αιγάλεω με την Εθνική Αθηνών - Κορίνθου. Σε νέα φάση εκτέλεσης το νέο τριώροφο κτίριο του πανεπιστημίου, ο εξοπλισμός των εργαστηρίων του, η ενεργειακή αναβάθμιση 12 σχολείων και του Νοσοκομείου «Αττικόν», η πιλοτική ανακαίνιση των προσφυγικών πολυκατοικιών στην Αγία Βαρβάρα, το νέο δημαρχείο στο Αιγάλεω.",,infrastructure,,other,,0.0,,0.0,,,,0.0,,[],"[['anthoupoli', 'location', '1.0'], ['ilion', 'location', '1.0'], ['western regional road', 'organization', '1.0'], ['egaleo', 'location', '1.0'], ['athens-corinth national road', 'location', '1.0'], ['university', 'organization', '1.0'], ['attikon hospital', 'organization', '1.0'], ['agia varvara', 'location', '1.0'], ['town hall', 'organization', '1.0'], ['egaleo', 'location', '1.0.']]"
