id,text,text_el,topic,topic-other-context,subtopic,topic-open,sentiment,polarization,polarization-definition,toxicity,toxicity-definition,populism,populism-definition,hate speech,ner,ner-limited
15," This is the big issue that should concern Greek society, the road to the elections, so I am addressing today.  Animals to citizens.  Right Left Eccentric. "," Αυτό το μεγάλο θέμα που πρέπει να απασχολήσει την ελληνική κοινωνία, την πορεία προς τις εκλογές λοιπόν, απευθύνομαι σήμερα  Ζώα στους πολίτες  Δεξιούς αριστερούς Έκκεντρο",elections,elections,other,greek elections,0.0,0.5,1.0,0.2,0.6,0.5,0.0,0.0,"[['greek', 'gpe', '0.769', 'greek society', 'org', '0.846', 'animals', 'misc', '0.245', 'right', 'org', '0.326', 'left', 'org', '0.326']]","[['greek society', 'location', '1.0'], ['right', 'political party', '0.6'], ['left', 'political party', '0.6'], ['eccentric', 'political party', '0.6']]"
16," We are not only appealing to the left, to the citizens who have worked hard.  They've made a fortune all their lives and they see that now that fortune is threatened.  They say that the narrative, the great election of this, among all the others, is the dilemma that has to do between.  Protecting their property or looting their property.  The dilemma he has to do and we put it very much so the regime will Panagiotis.  The proposal for the regulation of red loans and the protection of the first home, the dilemma to regulate.  Loans said.  Gallery, algae. "," Δεν απευθυνόμαστε μόνο στους αριστερούς, τους πολίτες που έχουν δουλέψει σκληρά  Μια ολόκληρη ζωή έχουν κάνει μια περιουσία και βλέπουν ότι τώρα αυτή η περιουσία απειλείται  Λένε ότι το διήγημα, το μεγάλο εκλογών αυτών, μεταξύ όλων των άλλων είναι και το δίλημμα που έχει να κάνει ανάμεσα  Την προστασία της περιουσίας τους ή στη λεηλασία της περιουσίας τους  Το δίλημμα που έχει να κάνει και το θέσαμε πολύ έτσι το καθεστώς θα τον Παναγιώτη  Την πρόταση για τη ρύθμιση των κόκκινων δανείων και την προστασία της πρώτης κατοικίας, το δίλημμα να ρυθμίσει  Δανείων έλεγε  Gallery, αλγη",economy,economy,bank regulations,economic security,0.0,0.3,0.0,0.3,0.95,0.5,0.5,0.0,"[['panagiotis', 'name', 'high', 'red loans', 'organization', 'medium', 'first home', 'organization', 'medium']]","[['panagiotis', 'organization', '0.8'], ['gallery', 'organization', '0.5']]"
17," That society will decide.  Kokkalis will decide the protection of the first home and it is not only an issue that concerns social cohesion, but an issue that concerns the sustainability of the Greek economy.  Society cannot become a jungle.  We cannot live in a country of work, the middle class and power cannot become a pawn in the speculative plans of the powerful few.  So I want to send a message from here today from his daughter. "," Ότι η κοινωνία θα αποφασίσει  Κόκκαλη θα αποφασίσει η προστασία της πρώτης κατοικίας και δεν είναι μονάχα ένα ζήτημα που αφορά την κοινωνική συνοχή, αλλά ένα ζήτημα που αφορά τη βιωσιμότητα της ελληνικής οικονομίας  Δεν μπορεί η κοινωνία να γίνει ζούγκλα  Δεν μπορεί να ζήσουμε σε μια χώρα εργασίας, δεν μπορεί η μεσαία τάξη και για δύναμη να γίνουν βορά στα σχέδια της κερδοσκοπίας λίγων ισχυρών  Θέλω λοιπόν να στείλω σήμερα ένα μήνυμα από δω από την κόρη του",housing,housing,middle class,housing protection,-0.4,0.3,0.0,0.0,0.1,0.2,0.2,0.0,"[['kokkalis', 'person', '0.9'], ['greek', 'nationality', '0.6']]","[['kokkalis', 'person', '0.8'], ['greek economy', 'organization', '0.6'], ['middle class', 'group of people', '0.6'], ['daughter', 'person', '0.5']]"
18, The next elections are crucial.  Gall for.  Gal because. , Οι επόμενες εκλογές είναι κρίσιμες  Gall για  Gal γιατί,elections,elections,election spending,elections,0.0,0.0,0.0,0.1,0.2,0.5,0.0,0.0,"[['elections', 'event', '0.90'], ['gall', 'person', '0.60'], ['gal', 'person', '0.60']]",[]
19," Which is our choice in order to ensure that every citizen's vote is equally matched.  What comes out of the House is a right, the ecosystem.  Some logic does not mean that we choose to vote for testimony, but I will say it differently the most powerful.  A vote of protest, the strongest anti-systemic vote is the one that will defeat the system that governs us. "," Που είναι δική μας επιλογή για να υπάρχει αντιστοίχιση ισότιμη της ψήφου κάθε πολίτη  Αυτό που βγαίνει στη Βουλή είναι ένα δίκιο, το οικοσύστημα  Κάποια λογική δεν σημαίνει ότι επιλέγουμε να ψηφίσουμε για μαρτυρία, αλλά θα το πω και διαφορετικά οι πιο ισχυροί  Ψήφος διαμαρτυρίας, η πιο ισχυρή αντισυστημική ψήφος είναι αυτή που θα πλήξει το σύστημα που μας κυβερνά",elections,elections,election spending,voting,0.0,0.75,0.5,0.6,0.8,0.7,0.5,0.1,"[['house', 'org', '0.979']]","[['house', 'organization', '0.8'], ['the system', 'organization', '0.7'], ['system', 'organization', '0.5'], ['citizen', 'group of people', '0.5']]"
20, Glass for.  Glass for.  Glass for.  Glass for.  Glass for.  That the victory of SYRIZA in the elections by simple proportional representation will lead the next day to the formation of a government of progressive cooperation. , Γυαλ για  Γυαλ για  Γυαλ για  Γυαλ για  Γυαλ για  Ότι η νίκη του ΣΥΡΙΖΑ στις εκλογές απλής αναλογικής θα οδηγήσει την επόμενη μέρα σε σχηματισμό κυβέρνησης προοδευτικής συνεργασίας,elections,elections,election spending,greek elections,0.0,0.1,0.1,0.2,0.0,0.1,0.0,0.0,"[['syriza', 'org', '0.87']]","[['syriza', 'organization', '0.95'], ['government', 'organization', '0.60'], ['progressive cooperation', 'group of people', '0.50'], ['elections', 'date', '0.60']]"
21," Glass for.  For l.  For.  So we know that a vote for SYRIZA, to put it briefly, means 4 things.  It means a wage increase, it means a price reduction, it means debt adjustment and it means a net. "," Γυαλ για  Για λ  Για  Τετραπλών εκλογών να ξέρουμε λοιπόν ότι ψήφος στο ΣΥΡΙΖΑ να το πω επιγραμματικά σημαίνει 4 πράγματα  Σημαίνει αύξηση μισθών, σημαίνει μείωση τιμών, σημαίνει ρύθμιση χρεών και σημαίνει ένα δίχτυ",other,other,other,politics/election,0.75,0.0,0.0,0.1,0.3,0.7,0.0,0.0,"[['syriza', 'org', '1.0']]","[['syriza', 'political party', '1.0'], ['glass', 'person', '0.7']]"
22, Glass for.  For l.  Glass for.  Then they present their supposedly antisystemic power of the soul kind.  Antisystemic are the ones who will find the system and want to get as head of the combination to prosecutors and judges who are the system within the House.  Glass for. , Γυαλ για  Για λ  Γυαλ για  Κατόπιν παρουσιάζουν τους δήθεν αντισυστημική δύναμη της ψυχής είδους  Αντισυστημική είναι αυτοί που θα βρίσκουμε το σύστημα και θέλουν να πάρουν ως επικεφαλής του συνδυασμού στους εισαγγελείς και δικαστές που είναι το σύστημα μέσα στο Σώμα  Γυαλ για,other,democracy,other,antisystemic power,0.0,0.8,0.0,0.6,0.8,0.9,0.0,0.4,[],[]
23," Mass for fascism is the yeast against intolerance.  The battle against misanthropy is not won by decrees, and not only by decrees that are perforated and unconstitutional.  It is won through a daily struggle, it is won in the spaces of everyday life, where we have to create a network of solidarity and support for the weakest, a network of solidarity and support for the different and that we want a pluralistic society, a democratic society, a society where everyone is equal, so.  Our struggle for justice is a struggle that has perspective, comes from far away and will go far away.  This place has always been a place where the conquests of the people lead to more justice and more democracy.  On the 21st of May we strike. "," Μας για το φασισμό υπάρχει η μαγιά απέναντι στη μισαλλοδοξία  Η μάχη απέναντι στον μισανθρωπισμό δεν κερδίζεται με διατάγματα και μάλιστα διάτρητα και αντισυνταγματικά  Κερδίζεται με αγώνα καθημερινό, κερδίζεται μέσα στους χώρους της καθημερινότητας, εκεί όπου πρέπει να δημιουργήσουμε δίκτυο αλληλεγγύης και στήριξης στους πιο αδύναμους δίκτυο αλληλεγγύης και στήριξης στο διαφορετικό και ότι θέλουμε μια κοινωνία πλουραλιστική, μια κοινωνία δημοκρατική, μια κοινωνία του να είναι όλοι ίσοι για αυτό λοιπόν  Ο αγώνας μας για δικαιοσύνη είναι ένας αγώνας που έχει και προοπτική, έρχεται από πολύ μακριά και θα πάει πολύ μακριά  Αυτός ο τόπος ήταν πάντα ένας στόχος όπου οι κατακτήσεις του λαού οδηγούσαν σε περισσότερη δικαιοσύνη και περισσότερη δημοκρατία  Στις 21 του Μαϊκόν χτυπήσουμε",other,other,strikes,anti-fascism or anti-intolerance,0.0,0.2,0.0,0.1,0.2,0.0,0.0,0.0,[],"[['mass', 'organization', '0.3'], ['fascism', 'political party', '0.3'], ['intolerance', 'group of people', '0.3'], ['misanthropy', 'group of people', '0.3'], ['decrees', 'organization', '0.3'], ['unconstitutional', 'organization', '0.3'], ['solidarity', 'group of people', '0.3'], ['support', 'group of people', '0.3'], ['pluralistic society', 'organization', '0.3'], ['democratic society', 'organization', '0.3'], ['everyone', 'group of people', '0.3'], ['justice', 'group of people', '0.3'], ['perspective', 'organization', '0.3'], ['conquests', 'organization', '0.3'], ['people', 'group of people', '0.3'], ['democracy', 'organization', '0.3'], ['may 21st', 'date', '0.3']]"
24, Glass for.  Glass for.  Glass for.  Glass for.  Glass for.  Glass for.  For λ U.  He was saying about word.  , Γυαλ για  Γυαλ για  Γυαλ για  Γυαλ για  Γυαλ για  Γυαλ για  Για λ U  Έλεγε για λέξη,other,other,other,glass,0.0,0.0,0.0,0.1,0.0,0.0,0.0,0.0,"[['λ u', 'unknown', '0.5'], ['he', 'person', '0.5']]",[]
