id,text,text_el,topic,topic-context,subtopic,subtopic-context,topic-open,sentiment,polarization,polarization-definition,toxicity,toxicity-definition,populism,populism-definition,hate speech,ner,ner-limited
23,"Second example: The BOAK. The Mitsotakis government wasted three whole years in order to find a way to redistribute the pie. It took three years to come up with the adoption of Syriza's original plan, with the only change being what? The imposition of tolls. Tolls to be paid not only by visitors to your island, but also by you Cretans. They delayed three years to come back to our plan with the toll difference, but they propagandize as if they are dealing with lotus eaters the project as their own. And the case has a future. Because from a government that has failed in four years to fix the problems created by the bad weather of 2019, no one can claim to ever complete the Northern Crete Highway. Now, friends, as I was coming on the plane, I asked a Chaniotee to explain to me why, over time, the Mitsotakis have not done well electorally in their homeland, Crete. And do you know what he replied? ""But we know them, that's why we don't vote for them""! Well, now that the entire Greek people have been learning about them for four years, especially Kyriakos Mitsotakis, it is time for the entire Greek people to follow the example of their fellow citizens. Because the country needs a prime minister who is responsible, not a prime minister who did not know - that is to say, a prime minister who did not know - not a prime minister who does not care.","Δεύτερο παράδειγμα: Ο ΒΟΑΚ. Η κυβέρνηση Μητσοτάκη σπατάλησε τρία ολόκληρα χρόνια προκειμένου να βρει τρόπο να αναδιανείμει την πίτα. Τρία χρόνια χρειάστηκαν για να καταλήξουν στην υιοθέτηση του αρχικού σχεδίου του ΣΥΡΙΖΑ, με μόνη αλλαγή, ποια; Την επιβολή διοδίων. Να πληρώνουν διόδια όχι μόνο οι επισκέπτες στο νησί σας, αλλά και εσείς οι Κρητικοί. Καθυστέρησαν τρία χρόνια για να επιστρέψουν στο σχέδιό μας με τη διαφορά των διοδίων, αλλά προπαγανδίζουν λες και έχουν να κάνουν με λωτοφάγους το έργο ως δικό τους. Και η υπόθεση έχει μέλλον. Γιατί από την κυβέρνηση που δεν κατάφερε μέσα σε τέσσερα χρόνια να αποκαταστήσει τα προβλήματα που δημιούργησε η κακοκαιρία του 2019, κανείς δεν μπορεί να έχει την απαίτηση να ολοκληρώσει ποτέ τον Βόρειο Οδικό Άξονα Κρήτης. Τώρα που ερχόμουν, φίλες και φίλοι, στο αεροπλάνο, ρώτησα έναν Χανιώτη να μου εξηγήσει γιατί διαχρονικά δε πάνε καλά εκλογικά οι Μητσοτάκηδες στον τόπο τους, στη Κρήτη. Και ξέρετε τι μου απάντησε; «Μα εμείς τους ξέρουμε, για αυτό δεν τους ψηφίζουμε»! Ε τώρα λοιπόν, που εδώ και τέσσερα χρόνια τους έμαθε και ιδίως τον Κυριάκο Μητσοτάκη και ολόκληρος ο ελληνικός λαός, ήρθε η ώρα ολόκληρος ο ελληνικός λαός να ακολουθήσει το παράδειγμα των συγχωριανών του. Γιατί ο τόπος χρειάζεται πρωθυπουργό ευθύνης, όχι έναν πρωθυπουργό που δεν ήξερε -άγνοιας δηλαδή-, όχι έναν πρωθυπουργό που δεν νοιάζεται.",,elections,,other,,-0.78,,0.8,,,,0.4,,[],"[['mitsotakis government', 'organization', '1.0'], ['syriza', 'political party', '1.0'], ['crete', 'location', '1.0'], ['greek', 'country', '1.0'], ['2019', 'date', '1.0'], ['northern crete highway', 'organization', '1.0'], ['chaniotee', 'person', '1.0'], ['kyriakos mitsotakis', 'person', '1.0']]"
24,"Because if you were to ask me to find a description for Mr Mitsotakis during these four years, I would say exactly that: he doesn't care. He does not care about society, he does not care about the people, he does not care about today and tomorrow and he has been constantly trying to deceive the citizens with communication tricks for four years now, and he has proved it many times. When, during the pandemic, he was asking everyone to take individual responsibility for following the measures he had imposed, he was going on carefree bike rides in Parnitha. Do you remember then? And feasts in Ikaria. When also at every critical moment he invokes ignorance of everything. He knew nothing about the wiretapping going on in the office next door by his nephew. How could he know what his nephew was doing... alas!","Γιατί αν μου ζητούσατε να βρω ένα χαρακτηρισμό για τον κ. Μητσοτάκη αυτά τα τέσσερα χρόνια, αυτόν ακριβώς θα έλεγα: δεν νοιάζεται. Δεν νοιάζεται για την κοινωνία, δεν νοιάζεται για τους ανθρώπους, δεν νοιάζεται για το σήμερα και το αύριο και επιχειρεί διαρκώς να εξαπατήσει με επικοινωνιακά τεχνάσματα τους πολίτες, τέσσερα χρόνια τώρα και το απέδειξε πολλές φορές. Όταν μέσα στην πανδημία ζητούσε από όλους ατομική ευθύνη για να ακολουθούν τα μέτρα που ο ίδιος είχε επιβάλλει, αυτός έκανε ανέμελες ποδηλατάδες στην Πάρνηθα. Θυμάστε τότε; Και τσιμπούσια στην Ικαρία. Όταν επίσης σε κάθε κρίσιμη στιγμή επικαλείται την άγνοια για τα πάντα. Δεν ήξερε τίποτε για τις υποκλοπές που γίνονταν στο διπλανό γραφείο από τον ανιψιό του. Πού να ξέρει τι κάνει ο ανιψιός του… αλίμονο!",,accountability,,other,,-0.8,,0.2,,,,0.9,,[],"[['mr mitsotakis', 'person', '1.0'], ['society', 'group of people', '0.5'], ['people', 'group of people', '0.5'], ['citizens', 'group of people', '0.5'], ['pandemic', 'date', '0.5'], ['parnitha', 'location', '1.0'], ['ikaria', 'location', '1.0.']]"
25,"He didn't know what Patsis was doing that he had in his parliamentary group. He didn't know who the Minister of Culture appointed to head the National Theatre and pretended not to know. He didn't know about the party of direct assignments, he didn't know in the end even about the state in which Karamanlis had left the railways. 57 dead and the Prime Minister of the country declaring that 'the only one to blame is a stationmaster', who was appointed on a buffet and had only five days' service in his job. He did not know that the trains were allowed to become a death trap. Because their plan was to privatise services, the public-private partnership, which drives out permanent employees and brings in people with blocks and no experience into critical positions. Just as their plan a few days later was to bring to Parliament, the atheophobes, the privatisation of water and then they said ""it is not what you think, we are not aiming to privatise it"". He also did not know that our fellow citizens who were intubated outside the intensive care units had no hope of survival. And Greece paid a heavy price: more than 37 000 deaths, the worst in the whole of the Western European world and beyond, compared to our population, worse than Bolsonaro's Brazil, unfortunately. But he did not know...","Δεν ήξερε τι έκανε ο Πάτσης που είχε στην κοινοβουλευτική του ομάδα. Δεν ήξερε ποιον διόρισε η υπουργός Πολιτισμού επικεφαλής στο Εθνικό Θέατρο και έκανε τάχα ότι δεν το γνωρίζει. Δεν ήξερε για το πάρτι των απευθείας αναθέσεων, δεν ήξερε στο τέλος ούτε για την κατάσταση την οποία είχε αφήσει ο κ. Καραμανλής τους σιδηρόδρομους. 57 νεκροί και ο πρωθυπουργός της χώρας να δηλώνει πως «ο μόνος που φταίει είναι  ένας σταθμάρχης», τον οποίο διόρισαν με ρουσφέτι και ήταν πέντε μονάχα μέρες η προϋπηρεσία του στο πόσο του. Δεν ήξερε ότι αφέθηκαν τα τρένα να γίνουν παγίδα θανάτου. Διότι το σχέδιό τους ήταν η ιδιωτικοποίηση υπηρεσιών, η σύμπραξη δημοσίου ιδιωτικού, που διώχνει μόνιμους υπαλλήλους και φέρνει σε κρίσιμες θέσεις ανθρώπους με μπλοκάκια και χωρίς προϋπηρεσία. Όπως επίσης το σχέδιό τους λίγες μέρες μετά ήταν να φέρουν στη Βουλή, οι αθεόφοβοι, την ιδιωτικοποίηση του νερού και μετά έλεγαν «δεν είναι αυτό που νομίζετε, δεν έχουμε στόχο να το ιδιωτικοποιήσουμε». Δεν ήξερε επίσης ότι οι συμπολίτες μας που διασωληνώθηκαν έξω από τις Μονάδες Εντατικής Θεραπείας, δεν είχαν καμία ελπίδα να επιβιώσουν. Και η Ελλάδα πλήρωσε βαρύτατο τίμημα: 37.000 και πλέον οι νεκροί, χειρότεροι σε όλο τον δυτικό ευρωπαϊκό κόσμο και όχι μόνο, σε σύγκριση με τον πληθυσμό μας, χειρότεροι και από τη Βραζιλία του Μπολσονάρο δυστυχώς. Δεν ήξερε όμως...",,other,,other,,,,0.5,,,,0.0,,[],"[['patsis', 'person', '0.5'], ['minister of culture', 'organization', '0.5'], ['national theatre', 'organization', '0.5'], ['party of direct assignments', 'political party', '0.5'], ['karamanlis', 'person', '0.5'], ['prime minister', 'organization', '0.5'], ['country', 'location', '0.5'], ['railways', 'organization', '0.5'], ['stationmaster', 'person', '0.5'], ['trains', 'organization', '0.5'], ['public-private partnership', 'organization', '0.5'], ['parliament', 'organization', '0.5'], ['atheophobes', 'political party', '0.5'], ['water', 'organization', '0.5'], ['greece', 'country', '0.5'], ['western european world', 'location', '0.5'], [""bolsonaro's brazil"", 'location', '0.5']]"
26,"But now he has the audacity to know to tell us what. To promise to support public health care. Let there be no doubt that this man cares for nothing more than his political and personal survival and is capable of saying anything in order to survive. Even to dress up as Syriza, take off his tie and shout ""Justice everywhere"" and say ""long live public health care, better wages, better jobs"".","Τώρα όμως έχει το θράσος να γνωρίζει για να μας πει, τι. Να υπόσχεται ότι θα στηρίξει τη δημόσια Υγεία. Για να μη μείνει καμιά αμφιβολία ότι αυτός ο άνθρωπος δε νοιάζεται για τίποτα παραπάνω, πέρα από την πολιτική και προσωπική του επιβίωση και είναι ικανός να πει τα πάντα, προκειμένου να επιβιώσει. Ακόμη και να ντυθεί ΣΥΡΙΖΑ, να βγάλει τη γραβάτα και να φωνάζει «Δικαιοσύνη παντού» και να λέει «ζήτω το δημόσιο σύστημα υγείας, καλύτεροι μισθοί, καλύτερες δουλειές».",,opponent criticism,,public welfare,,-0.7,,0.8,,,,0.1,,[],"[['syriza', 'organization', '0.9'], ['public health care', 'organization', '0.8'], ['justice', 'group of people', '0.7'], ['everywhere', 'location', '0.6'], ['better wages', 'group of people', '0.6'], ['better jobs', 'group of people', '0.6.']]"
27,"But on May 21, what we saw as indignation during the days of Tempi, what we saw as anger overflowing not only among young people, but among all our fellow citizens in the streets, on May 21 this anger, this indignation will be transformed into a political decision and a political mandate with the seal of the popular vote. Greece has a chance to put four hard years behind it. To leave behind this generalised feeling of insecurity, worry, anxiety about tomorrow and to take a first step towards hope, a first step towards certainty, a first step towards the return of justice to the country, and side by side we will fight and I am sure we will win this crucial battle.","Στις 21 του Μάη όμως αυτό που είδαμε ως αγανάκτηση τις ημέρες των Τεμπών, αυτό που είδαμε ως θυμό να ξεχειλίζει όχι μόνο τους νέους ανθρώπους, όλους τους συμπολίτες μας στους δρόμους, στις 21 του Μάη αυτός ο θυμός, αυτή η αγανάκτηση θα μετατραπεί σε πολιτική απόφαση και πολιτική εντολή με τη σφραγίδα της λαϊκής ψήφου. Η Ελλάδα έχει μια ευκαιρία να αφήσει πίσω της τέσσερα σκληρά χρόνια. Να αφήσει πίσω της αυτό το γενικευμένο αίσθημα της ανασφάλειας, την ανησυχία, την αγωνία για το αύριο και να κάνει ένα πρώτο βήμα προς την ελπίδα, ένα πρώτο βήμα προς τη σιγουριά, ένα πρώτο βήμα για να επιστρέψει στον τόπο η δικαιοσύνη και ο ένας πλάι στον άλλον θα δώσουμε και είμαι βέβαιος θα κερδίσουμε αυτή την κρίσιμη μάχη.",,other,,other,,0.5,,0.2,,,,0.2,,[],"[['tempi', 'location', '0.5', ''], ['greece', 'country', '0.9', ''], ['may 21', 'date', '1.0']]"
28,"In this election, friends, citizens of Chania, it is the first time we will vote with an electoral system that will not steal the vote of the citizens. What you vote for will come out in Parliament, what you vote for will be matched by fairness in Parliament. We will vote for the first time with a system of proportional representation. Which means that there will be no bonuses and no tricks to baptize minority governments as self-reliant. But that does not mean that this election is the election of the loose vote. Our vote on May 21 will produce a government. That is why I want to ask one thing at this very important, very large gathering here in Chania: to ask you, and the Greek people, to ask you to give a strong mandate to SYRIZA - Progressive Alliance in the elections of 21 May. A majority and a strong mandate to form a government of progressive cooperation on the very next day, which we want to be a strong and long-term government.","Σε αυτές τις εκλογές, φίλες και φίλοι, πολίτες των Χανίων, είναι η πρώτη φορά που θα ψηφίσουμε με ένα εκλογικό σύστημα που δεν θα κλέβει την ψήφο των πολιτών. Ό,τι ψηφίσεις, αυτό θα βγαίνει μέσα στη Βουλή, ό,τι ψηφίζεις θα αντιστοιχείται με δικαιοσύνη μέσα στο Κοινοβούλιο. Θα ψηφίσουμε για πρώτη φορά με το σύστημα της απλής αναλογικής. Που σημαίνει ότι δεν θα υπάρχουν μπόνους και κόλπα για να βαφτίζουν αυτοδύναμες τις κυβερνήσεις της μειοψηφίας. Αυτό όμως δεν σημαίνει ότι αυτές οι εκλογές είναι οι εκλογές της χαλαρής ψήφου. Η ψήφος μας την 21η του Μάη θα βγάλει κυβέρνηση. Γι' αυτό και θέλω σε αυτή την πολύ σημαντική, την πολύ μεγάλη συγκέντρωση εδώ στα Χανιά να ζητήσω ένα πράγμα: να ζητήσω από εσάς, αλλά και από τον ελληνικό λαό, να ζητήσω στις εκλογές της 21ης του Μάη να δώσετε ισχυρή εντολή στον ΣΥΡΙΖΑ-Προοδευτική Συμμαχία. Πρωτιά και ισχυρή εντολή για να σχηματίσουμε την επόμενη κιόλας ημέρα κυβέρνηση προοδευτικής συνεργασίας, που θέλουμε να είναι μια κυβέρνηση ισχυρή και μακράς πνοής.",,elections,,other,,0.68,,0.2,,,,0.2,,[],"[['chania', 'location', '1.0'], ['greek people', 'group of people', '1.0'], ['syriza - progressive alliance', 'political party', '1.0'], ['greece', 'country', '1.0'], ['may 21', 'date', '1.0']]"
29,"Mr Mitsotakis in recent days, fearful that no matter what happens in 25 days he will leave the building he loved more than any other, the Maximou building, is trying to pass this fear on to the citizens. To turn his own fear into the fear of the citizens. One, he is concerned with how to steal the deputies of one, the next with how to blackmail the other, the parallel with how to exclude the third. He is concerned with all this to hide and, above all, not to talk about policies and programmes. He does not say a word about his programme, apart from those cheap copies I mentioned earlier. And most importantly, while he goes out to the Greek people and says that the dilemma of this election is ""Mitsotakis or Tsipras"", he hides, he runs away, he doesn't even think about the idea, like the devil he wants to avoid a televised debate in front of the Greek people to present our positions, our programme, our proposals. Why is he doing this? He is doing this because he has no answers. He has no answers for the big issues, he has no answers for the obscenity that has his own stamp. Because he can tell us that precision is imported, but obscenity is made in Greece, it is Greek and has his own signature.","Ο κ. Μητσοτάκης τις τελευταίες ημέρες, φοβισμένος που ό,τι και να γίνει σε 25 μέρες εγκαταλείπει το κτίριο που αγάπησε περισσότερο από κάθε άλλο, το Μέγαρο Μαξίμου, προσπαθεί να περάσει αυτό τον φόβο του στους πολίτες. Τον δικό του φόβο να τον μετατρέψει σε φόβο των πολιτών. Μια, ασχολείται με το πώς θα κλέψει τους βουλευτές του ενός, την άλλη με το πώς θα εκβιάσει τον άλλο, την παράλλη με το πώς θα αποκλείσει τον τρίτο. Όλο με αυτά ασχολείται για να κρυφτεί και κυρίως να μη μιλήσει για πολιτικές και για προγράμματα. Δεν λέει λέξη για το πρόγραμμά του, πέρα από αυτές τις φτηνές αντιγραφές, που σας είπα πιο πριν. Και το κυριότερο, ενώ βγαίνει στον ελληνικό λαό και λέει ότι το δίλημμα αυτής της κάλπης είναι “Μητσοτάκης ή Τσίπρας”, κρύβεται, το βάζει στα πόδια, ούτε καν σκέφτεται την ιδέα, σαν το διάολο το λιβάνι θέλει να αποφύγει μια τηλεοπτική συζήτηση ενώπιος ενωπίω μπροστά στον ελληνικό λαό για να παρουσιάσουμε τις θέσεις, το πρόγραμμά μας, τις προτάσεις μας. Γιατί το κάνει αυτό; Το κάνει αυτό γιατί δεν έχει απαντήσεις. Δεν έχει απαντήσεις για τα μεγάλα θέματα, δεν έχει απαντήσει για την αισχροκέρδεια που έχει τη δική του σφραγίδα. Γιατί μπορεί να μας λέει ότι η ακρίβεια είναι εισαγόμενη, αλλά η αισχροκέρδεια είναι made in Greece, είναι ελληνική και έχει τη δική του υπογραφή.",,other,,other,,,,0.2,,,,0.5,,[],"[['mr mitsotakis', 'person', '1.0'], ['maximou building', 'location', '1.0'], ['greek people', 'group of people', '1.0'], ['mitsotakis or tsipras', 'political party', '1.0'], ['greece', 'country', '1.0']]"
30,"He apparently has no answers about illegal surveillance.  You remember every time I questioned him in the House, he either didn't come or whenever he was forced to come, he would shut down the debate himself and run away. He took on the role of the Speaker of the House! He has no answers for the crime in Tempe, nor for the tragedy of the pandemic. He wants all that to be forgotten. And only discuss Varoufakis, Velopoulos and Kasidiaris. To discuss anything else, except the big issues in front of us and except his responsibilities because he has been ruling for four years, he didn't become prime minister yesterday, we weren't ruled by a doppelganger.","Δεν έχει απαντήσεις προφανώς για τις παράνομες παρακολουθήσεις.  Θυμάστε κάθε φορά που τον ρωτούσα στη Βουλή, ή δεν ερχόταν ή όποτε ήταν αναγκασμένος να έρθει, έκλεινε μόνος του τη συζήτηση και το έβαζε στα πόδια. Έπαιρνε τον ρόλο του Προέδρου της Βουλής! Δεν έχει απαντήσεις για το έγκλημα στα Τέμπη, ούτε για τη τραγωδία της πανδημίας. Θέλει όλα αυτά να ξεχαστούν. Και να συζητάμε μονάχα για τον Βαρουφάκη, τον Βελόπουλο και τον Κασιδιάρη. Να συζητάμε οτιδήποτε άλλο, εκτός από τα μεγάλα θέματα που έχουμε μπροστά μας και εκτός από τις ευθύνες του γιατί κυβερνά τέσσερα χρόνια, δεν έγινε χτες πρωθυπουργός, δεν μας κυβερνούσε ένας σωσίας του.",,accountability,,other,,-0.8,,0.2,,,,0.0,,[],"[['tempe', 'location', '0.6'], ['varoufakis', 'person', '0.6'], ['velopoulos', 'person', '0.6'], ['kasidiaris', 'person', '0.6']]"
