id,text,text_el,topic,subtopic,topic-open,sentiment,polarization,polarization-definition,toxicity,toxicity-definition,populism,populism-definition,hate speech,ner,ner-limited
61," What they told you all these years, do you remember.  That it was SYRIZA who butchered you.  13 consecutive reductions made by the Samaras government, they forgot about them.  And what did they say to you at the end, when we resisted the terrible pressures of the Troika and the institutions and did not cut a single euro?  That we swapped pensions for Macedonia, that's what they said, that's what their miserable propaganda said.  When we took the decision to defend our national interest, when we took the decision to close a major wound in our foreign policy. And today, with everything that is happening around us, the war in Ukraine, the pressures that even the Scandinavian countries want to join NATO, what would happen today if we did not solve this issue in a fair and privileged way for the country?  Why was our ancient cultural heritage recognized, why are Greek F-16s flying over the airspace of our neighbours today? "," Τι σας έλεγαν τόσα χρόνια, θυμάστε  Ότι  ο ΣΥΡΙΖΑ ήταν αυτός που σας κατακρεούργησε  13 συνεχόμενες μειώσεις έκανε η κυβέρνηση Σαμαρά, τα ξέχασαν  Και τι  σας έλεγαν στο τέλος, όταν εμείς αντισταθήκαμε στις τρομακτικές πιέσεις της τρόικας και των θεσμών και δε μειώσαμε ούτε ένα ευρώ  Ότι ανταλλάξαμε τις συντάξεις με το Μακεδονικό, αυτά έλεγαν, η άθλια προπαγάνδα τους αυτά έλεγε  Όταν πήραμε την απόφαση να υπερασπιστούμε το εθνικό μας συμφέρον, όταν πήραμε την απόφαση να κλείσουμε μια μεγάλη πληγή στην εξωτερική μας πολιτική Και σήμερα, με όλα όσα συμβαίνουν γύρω μας, τον πόλεμο στην Ουκρανία, τις πιέσεις που ακόμα και οι σκανδιναβικές χώρες θέλουν να μπουν στο ΝΑΤΟ, τι θα γινόταν σήμερα αν δε λύναμε αυτό το θέμα με τρόπο δίκαιο και προνομιακό για τη χώρα  Γιατί αναγνωρίστηκε η αρχαία μας πολιτιστική κληρονομιά, γιατί σήμερα πετάνε τα ελληνικά F-16 πάνω από τον εναέριο χώρο των γειτόνων μας",other,other,misrepresentation of government actions,0.0,0.75,0.2,0.1,0.3,0.2,0.2,0.0,"[['syriza', 'org', '0.8'], ['samaras', 'person', '0.8'], ['troika', 'org', '0.8'], ['macedonia', 'loc', '0.8'], ['ukraine', 'loc', '0.8'], ['scandinavian countries', 'loc', '0.8'], ['nato', 'org', '0.8'], ['greek', 'norp', '0.8'], ['f-16s', 'product', '0.8']]","[['samaras', 'person', '0.5'], ['syriza', 'organization', '0.5'], ['troika', 'organization', '0.5'], ['macedonia', 'country', '0.5'], ['ukraine', 'location', '0.5'], ['scandinavian countries', 'group of people', '0.5'], ['nato', 'organization', '0.5'], ['greek', 'group of people', '0.5'], ['f-16s', 'organization', '0.5']]"
62, What would happen today.  Today those who then wore helmets and went out on the street would sign with two hands the NATO membership of our neighbours with the name Macedonia.  That would be today. ," Τι θα γινόταν σήμερα  Σήμερα αυτοί που τότε φορούσαν περικεφαλαίες και έβγαιναν στο δρόμο, θα υπέγραφαν με δυο χέρια την ένταξη στο ΝΑΤΟ των γειτόνων μας με το όνομα Μακεδονία  Αυτό θα γινόταν σήμερα",other,other,nato membership,0.5,0.1,0.0,0.2,0.0,0.2,0.0,0.0,"[['nato', 'organization', '1.0'], ['macedonia', 'location', '1.0']]","[['nato', 'organization', '1.0'], ['macedonia', 'location', '1.0']]"
63,"So they said that we would supposedly trade the pension issue.  And they said that, because, what did they expect, what did they beg.  They begged us to be the ones to cut pensions.  And what they did as soon as they got here. ","Είπαν λοιπόν ότι εμείς δήθεν θ’ ανταλλάσσαμε το θέμα των συντάξεων  Και το είπαν αυτό, γιατί, τι περίμεναν, τι παρακαλάγανε  Παρακαλάγανε να είμαστε εμείς αυτοί που θα μειώσουμε συντάξεις  Και τι έκαναν με το που ήρθαν",other,pensions,pension,-0.6,0.7,0.0,0.45,0.2,0.6,0.0,0.2,[],[]
64," As soon as they came in, while they had promised that they would keep what we called the 13th pension, which was over 1 billion a year, they abolished it all at once.  Four years have passed, €4 billion have been lost to pensioners.  So justice in pensions means restoring the 13th pension introduced in 2019.  Justice in pensions means returning all retroactive payments in 3 annual instalments and restoring the injustices created by the personal difference.  As well as the abolition of the privatisation of supplementary insurance. "," Με το που ήρθαν, ενώ είχαν υποσχεθεί ότι θα διατηρήσουν αυτό που εμείς ονομάσαμε 13η σύνταξη και ήταν πάνω από 1 δις σε ετήσια βάση, το καταργήσανε μεμιάς  Τέσσερα χρόνια πέρασαν, 4 δισεκατομμύρια ευρώ έχουν στερηθεί οι συνταξιούχοι  Δικαιοσύνη λοιπόν στις συντάξεις, σημαίνει επαναφορά  της 13ης σύνταξης που θεσπίστηκε το 2019  Δικαιοσύνη στις συντάξεις σημαίνει επιστροφή όλων των αναδρομικών σε 3 ετήσιες δόσεις και αποκατάσταση των αδικιών που δημιουργούνται από την προσωπική διαφορά  Καθώς επίσης και κατάργηση της ιδιωτικοποίησης της επικουρικής ασφάλισης",other,pensions,pensions,-0.85,0.7,0.1,0.2,0.2,0.7,0.5,0.0,"[['13th pension', 'entity', ''], ['pensioners', 'entity', ''], ['2019', 'entity', ''], ['retroactive payments', 'entity', ''], ['personal difference', 'entity', ''], ['privatisation of supplementary insurance', 'entity', '']]","[['13th pension', 'organization', '1.0'], ['pensioners', 'group of people', '1.0'], ['13th pension', 'date', '1.0'], ['privatisation of supplementary insurance', 'organization', '1.0']]"
65," But we want to create conditions of justice for mothers too.  And that for us means: Increase and conversion of the child benefit into a mother's allowance and granting it to the mother from the birth of the child until the age of 24, regardless of her studies. Justice for mothers, it means special maternity leave for self-employed women, freelancers and farmers and above all it means, and this is for young couples, nurseries for all children This means justice for young couples and especially young women, young mothers.  But justice for young couples means more than that.  It means affordable housing with low rents through the creation of a housing bank and the control of Airbnb.  Means doubling the rent allowance. "," Θέλουμε όμως να δημιουργήσουμε συνθήκες δικαιοσύνης και  για τις μητέρες  Και αυτό για μας σημαίνει: Αύξηση και μετατροπή του επιδόματος παιδιού σε επίδομα μητέρας και χορήγησή του στη μητέρα από τη γέννηση του παιδιού μέχρι τα 24 έτη ανεξαρτήτως σπουδών Δικαιοσύνη για τις μητέρες, σημαίνει ειδική άδεια μητρότητας σε αυτοαπασχολούμενες, ελεύθερες επαγγελματίες και αγρότισσες  και κυρίως σημαίνει, και αυτό αφορά τα νέα ζευγάρια, βρεφονηπιακοί σταθμοί για όλα τα παιδιά Αυτό σημαίνει δικαιοσύνη για τα νέα ζευγάρια και ιδίως τις νέες γυναίκες, τις νέες μητέρες  Δικαιοσύνη για τα νέα ζευγάρια όμως σημαίνουν κι άλλα πράγματα  Σημαίνει προσιτή κατοικία με χαμηλά ενοίκια μέσα από τη δημιουργία τράπεζας στέγης και τον έλεγχο του Airbnb  Σημαίνει  διπλασιασμός του επιδόματος ενοικίου",housing,maternity leave,justice for mothers,0.2,0.35,0.1,0.1,0.0,0.2,0.0,0.0,[],[]
66,"But what is justice in health?  Huge issue of Health.  I would say, perhaps the most critical thing we need to be concerned about. ","Τι σημαίνει όμως δικαιοσύνη στην Υγεία  Τεράστιο θέμα το θέμα της Υγείας  Θα έλεγα, ίσως το πιο κρίσιμο που πρέπει να μας απασχολήσει",health,public health system,health justice,0.0,0.0,0.0,0.0,0.0,0.1,0.0,0.0,"[['justice', 'person', '1.0'], ['health', 'organization', '1.0']]","[['health', 'organization', '0.6'], ['justice', 'organization', '0.3']]"
67, Because we all have experience of the devaluation of public hospitals.  So Justice in our Health means: immediate recruitment 5. 500 permanent health workers and the recruitment of an additional 10. 000 over three years.  It means the tenure of health workers who fought the battle of the pandemic on the front line and then were applauded by some.  Then they were forgotten. , Διότι όλοι έχουμε  εμπειρία από την απαξίωση των δημόσιων νοσοκομείων  Δικαιοσύνη λοιπόν στην Υγεία μας σημαίνει: Άμεση πρόσληψη 5 500 μόνιμων υγειονομικών και πρόσληψη επιπλέον 10 000 σε βάθος τριετίας  Σημαίνει μονιμοποίηση του υγειονομικού προσωπικού που έδωσε τη μάχη της πανδημίας στην πρώτη γραμμή και τότε τους χειροκροτούσανε κάποιοι  Μετά τους ξεχάσανε,health,public health system,healthcare workforce,-0.1,0.1,0.0,0.0,0.0,0.4,0.2,0.0,"[['justice', 'person', '0.9'], ['health', 'organization', '0.6']]","[['justice', 'organization', '0.6'], ['health', 'organization', '0.6'], ['justice in our health', 'group of people', '0.5'], ['5', 'number', '1.0'], ['500', 'number', '1.0'], ['10', '000', 'number', '1.0'], ['three years', 'date', '1.0']]"
68, It means the inclusion of health personnel in the heavy and unhealthy.   It means a payroll reshuffle with a starting salary of 2. 000 and incentives for new doctors to join the NHS. Justice for Education also means hiring teachers and professors.  20. , Σημαίνει ένταξη του υγειονομικού προσωπικού στα βαρέα και ανθυγιεινά   Σημαίνει αναδιαμόρφωση μισθολογίου με εισαγωγικό μισθό πρωτοδιοριζόμενου γιατρού τα 2 000 ευρώ και κίνητρα για την ένταξη νέων γιατρών στο ΕΣΥ Δικαιοσύνη για την Παιδεία επίσης σημαίνει πρόσληψη δασκάλων και καθηγητών  20,health,employment,healthcare workforce,0.0,0.1,0.0,0.1,0.2,0.2,0.1,0.0,"[['nhs', 'organization', '1.0'], ['education', 'organization', '1.0']]","[['health personnel', 'organization', '0.8'], ['nhs', 'organization', '0.8'], ['justice for education', 'organization', '0.5'], ['teachers', 'group of people', '0.6'], ['professors', 'group of people', '0.6'], ['20', 'date', '1.0']]"
69,000 appointments of permanent teachers of primary and secondary education over four years.  Doubling state funding to universities and the number of faculty members over four years.  Free postgraduate programmes.  Restoration of the Two-Year Study Programmes. ,000 διορισμοί μόνιμων δασκάλων και καθηγητών της Πρωτοβάθμιας και Δευτεροβάθμιας Εκπαίδευσης σε βάθος τετραετίας  Διπλασιασμός της κρατικής χρηματοδότησης στα πανεπιστήμια και του αριθμού των μελών ΔΕΠ σε βάθος τετραετίας  Δωρεάν μεταπτυχιακά προγράμματα  Επαναφορά λειτουργίας των Διετών Προγραμμάτων Σπουδών,education,higher education,education,1.0,0.0,0.0,0.0,0.0,0.1,0.0,0.0,[],[]
70," Increase in the number of admissions to universities with the abolition of the Minimum Base and free access to low-demand schools. I want to leave last in this attempt to explain our motto, what justice in the state means, because it is also timely after what we have seen in front of us lately.  Justice in the state means: Replacing the so-called executive state with a democratic, efficient and just state.  With meritocracy and transparency structures.  With a drastic limitation of secondments and direct assignments.  Above all, it means an end to the party-appointed inappropriate station masters, the golden boys, the blue ones in the Public Organizations with the fat salaries. "," Αύξηση του αριθμού των εισακτέων στα ΑΕΙ με  κατάργηση της Ελάχιστης Βάσης και Δυνατότητα ελεύθερης πρόσβασης στις σχολές χαμηλής ζήτησης Θέλω να αφήσω τελευταίο σ’ αυτή την απόπειρα να εξηγήσω το σύνθημά μας, το τι σημαίνει δικαιοσύνη στο κράτος γιατί είναι και επίκαιρο μετά τα όσα είδαμε μπροστά μας το τελευταίο διάστημα  Δικαιοσύνη στο κράτος, σημαίνει: Αντικατάσταση του δήθεν επιτελικού κράτους με ένα δημοκρατικό, αποτελεσματικό και δίκαιο κράτος  Με δομές αξιοκρατίας και διαφάνειας  Με δραστικό περιορισμό των μετακλητών και των απευθείας αναθέσεων  Σημαίνει πάνω απ’ όλα, τέλος στους κομματικά διορισμένους ακατάλληλους σταθμάρχες, στα golden boys, τα  γαλάζια στους Δημόσιους Οργανισμούς με τους παχυλούς μισθούς",education,higher education,university admissions,0.0,0.4,0.0,0.2,0.2,0.5,0.0,0.0,"[['universities', 'organization', '0.6'], ['minimum base', 'law', '0.7'], ['democratic', 'ideology', '0.7'], ['secondments', 'occupation', '0.5'], ['public organizations', 'organization', '0.8']]","[['universities', 'organization', '1.0'], ['minimum base', 'date', '0.7'], ['attempt to explain', 'group of people', '0.6'], ['justice in the state', 'political party', '0.8'], ['executive state', 'organization', '0.5'], ['democratic state', 'political party', '0.7'], ['meritocracy', 'political party', '0.6'], ['transparency structures', 'organization', '0.6'], ['secondments', 'organization', '0.6'], ['direct assignments', 'organization', '0.6'], ['party-appointed station masters', 'political party', '0.7'], ['public organizations', 'organization', '0.8.']]"
71," We want a state next to the citizen, at the service of the citizen.  That engenders trust and security.  We also want a Greek Police that fights crime and not collaborates with crime.  That is why we will proceed immediately to reorganize, democratize and cleanse the Greek Police from sworn officers. And we want a transparent and democratic NSA that deals with national security and the fight against organised crime.  And not for half the political system to listen.  We want an NSA to pursue Greekmafia, not to be run by Greekmafia as has been the case for the last 4 years with Mr.  Mitsotakis. "," Θέλουμε κράτος δίπλα στον πολίτη, στην υπηρεσία του πολίτη  Που να γεννά εμπιστοσύνη και ασφάλεια  Θέλουμε επίσης μια Ελληνική Αστυνομία που να καταπολέμα το έγκλημα και όχι να συνεργάζεται με το έγκλημα  Γι’  αυτό και θα προχωρήσουμε άμεσα στην αναδιοργάνωση, τον εκδημοκρατισμό και τη κάθαρση της Ελληνικής Αστυνομίας από τους επίορκους αστυνομικούς Και θέλουμε μια ΕΥΠ, διαφανή και δημοκρατική που θα ασχολείται την εθνική ασφάλεια και τη καταπολέμηση του οργανωμένου εγκλήματος  Και όχι για να ακούει το μισό πολιτικό σύστημα  Θέλουμε μια ΕΥΠ να καταδιώκει τη  Greekmafia, όχι να διοικείται από τη Greekmafia όπως συμβαίνει τα 4 τελευταία χρόνια με τον κ  Μητσοτάκη",national security,police violence,police reform in greece,0.7,0.5,0.1,0.35,0.2,0.2,0.2,0.1,"[['greek police', 'organization', '1.0'], ['greekmafia', 'organization', '1.0'], ['greek police', 'organization', '1.0'], ['nsa', 'organization', '1.0'], ['nsa', 'organization', '1.0'], ['organized crime', 'crime', '1.0'], ['mr. mitsotakis', 'person', '1.0']]","[['greek police', 'organization', '1.0'], ['greekmafia', 'group of people', '1.0'], ['nsa', 'organization', '1.0'], ['mr. mitsotakis', 'person', '1.0']]"
72," Finally, justice in the state means control of all public spending, including arms spending. And I say this from here in Kalamata, where for 4 years now, New Democracy has achieved the following terrible thing: Tripling the cost of the Kalamata Air Training Center, it went up three times more than when we planned it.  So I say this to make it clear: We will not tolerate games with the defense of the country.  We will actively support the personnel of the Armed Forces, we will actively support the Greek Civilian Industry and we will control all the armament programs decided in the last three years.  Euro to euro.  Every euro of the Greek taxpayer for the defense of the country will strengthen the defense of the country and especially will strengthen the personnel of the Armed Forces, those who hold Thermopylae. "," Τέλος, δικαιοσύνη στο κράτος σημαίνει και έλεγχος όλων των δημόσιων δαπανών, και των εξοπλιστικών δαπανών συμπεριλαμβανομένων Και το λέω αυτό από εδώ από τη Καλαμάτα, όπου 4 χρόνια τώρα, η Νέα Δημοκρατία έχει καταφέρει το εξής φοβερό: Να τριπλασιάσει το κόστος  Κέντρου Αεροπορικής εκπαίδευσης Καλαμάτας, ανέβηκε τρείς φορές επάνω, από όσο όταν εμείς το σχεδιάζαμε  Το λέω λοιπόν για να γίνει κατανοητό: Παιχνίδια με την άμυνα της χώρας δεν θα ανεχτούμε  Θα στηρίξουμε έμπρακτα το προσωπικό των Ενόπλων Δυνάμεων, θα στηρίξουμε έμπρακτα την Ελληνική Πολιτική Βιομηχανία και θα ελέγξουμε όλα τα εξοπλιστικά προγράμματα που αποφασίστηκαν τα τρία τελευταία χρόνια  Ευρώ προς ευρώ  Κάθε ευρώ του Έλληνα φορολογούμενου για την άμυνα της χώρας, θα ενισχύσει την άμυνα της χώρας και κυρίως θα ενισχύει στο προσωπικό των Ενόπλων Δυνάμεων, αυτούς που κρατάνε Θερμοπύλες",national defence,defense spending,arms spending in the state,-0.5,0.1,0.2,0.2,0.0,0.2,0.0,0.0,"[['kalamata', 'location', '1.0'], ['new democracy', 'organization', '1.0'], ['kalamata air training center', 'organization', '1.0'], ['greek civilian industry', 'organization', '1.0'], ['armed forces', 'organization', '1.0'], ['thermopylae', 'location', '1.0']]","[['kalamata', 'location', '1.0'], ['new democracy', 'political party', '1.0'], ['greek civilian industry', 'organization', '1.0'], ['armed forces', 'group of people', '1.0'], ['greek', 'country', '1.0'], ['thermopylae', 'location', '1.0'], ['last three years', 'date', '1.0']]"
73," All this, friends, is crucial, but justice everywhere without justice in justice, there can be no justice in justice.   And this is very critical. And justice in the judiciary means: strengthening its officials, but above all, its independence.  With a comprehensive plan to restore the relationship of trust between the judiciary and citizens.  Justice in Justice means speeding up the administration of justice, digitising it and improving its infrastructure.  But it also means cutting the umbilical cord between the judiciary and the executive. A few days ago in an interview with a television station, I was asked: ""You don't trust the Supreme Court prosecutor, does that mean you don't trust the judiciary?"".  And I replied: just as politics is not Tsipras, just as journalism is not Pretenderis - he was next to me - justice is not one man, justice is not the Prosecutor of the Supreme Court.  There are dozens, hundreds, of honest judges out there. "," Όλα αυτά, φίλες και φίλοι, είναι κρίσιμα, αλλά δικαιοσύνη παντού χωρίς δικαιοσύνη στη Δικαιοσύνη, δεν μπορεί να υπάρξει   Και αυτό είναι πολύ κρίσιμο Και δικαιοσύνη στη Δικαιοσύνη σημαίνει: Ενίσχυση των λειτουργών της  μα πάνω απ’ όλα,  της ανεξαρτησίας τους  Με ολοκληρωμένο σχέδιο αποκατάστασης της σχέσης εμπιστοσύνης της Δικαιοσύνης  με τους πολίτες  Δικαιοσύνη στη Δικαιοσύνη σημαίνει επιτάχυνση της απονομής της, ψηφιοποίηση και βελτίωση των υποδομών της  Σημαίνει όμως και κόψιμο του ομφάλιου λώρου ανάμεσα στη δικαστική και την εκτελεστική εξουσία Πριν από λίγες μέρες σε μια συνέντευξή μου σ’ έναν τηλεοπτικό σταθμό, με ρώτησαν: «Δεν έχετε εμπιστοσύνη στον Εισαγγελέα του Αρείου Πάγου, σημαίνει ότι δεν έχετε εμπιστοσύνη στη Δικαιοσύνη»  Και απάντησα: Όπως η πολιτική δεν είναι ο Τσίπρας, όπως η δημοσιογραφία δεν είναι ο Πρετεντέρης –αυτός ήταν δίπλα μου- έτσι και η Δικαιοσύνη δεν είναι ένας άνθρωπος, δεν είναι ο Εισαγγελέας του Αρείου Πάγου η Δικαιοσύνη  Υπάρχουν εκεί έξω δεκάδες, εκατοντάδες, έντιμοι δικαστές",justice,judicial independence,justice in the judiciary,0.0,0.1,0.0,0.0,0.1,0.0,0.0,0.0,"[['tsipras', 'person', '0.2'], ['pretenderis', 'person', '0.2'], ['supreme court', 'organization', '0.7'], ['judiciary', 'organization', '0.9'], ['citizens', 'group', '0.4']]","[['tsipras', 'person', '0.1'], ['pretenderis', 'person', '0.1'], ['supreme court', 'organization', '0.3'], ['judiciary', 'organization', '0.6'], ['administration of justice', 'organization', '0.2'], ['citizens', 'group of people', '0.3'], ['television station', 'organization', '0.1'], ['politicians', 'group of people', '0.2'], ['journalists', 'group of people', '0.2'], ['greece', 'country', '1.0'], ['a few days ago', 'date', '0.4']]"
