id,text,text_el,topic,subtopic,topic-open,sentiment,polarization,polarization-definition,toxicity,toxicity-definition,populism,populism-definition,hate speech,ner,ner-limited
32," They have ennobled Culture in cement and antiquities and left Art and the world of Art, without support, without rights, without a future.   But, what else is Greece if it is not its culture.  what else is our country if it is not culture and if we do not support culture and the people of culture, how can we have a future. And the most outrageous thing is that by taking advantage of the extraordinary circumstances of the pandemic they changed the laws and managed, how they managed it is a big question, but they managed it, to distribute almost 10 billion euros through direct awards and closed tenders, mostly to companies that were set up three days before the award of the project. "," Ευτέλισαν τον Πολιτισμό σε τσιμέντο και αρχαιοκαπηλία και άφησαν την Τέχνη και τον κόσμο της Τέχνης, χωρίς στήριξη, χωρίς δικαιώματα, χωρίς μέλλον   Αλλά, τι άλλο είναι η Ελλάδα αν δεν είναι ο πολιτισμός της  τι άλλο είναι η χώρα μας αν δεν είναι πολιτισμός και αν δε στηρίξουμε τον πολιτισμό και τους ανθρώπους του Πολιτισμού, πώς θα έχουμε μέλλον Και το πιο εξωφρενικό, είναι ότι εκμεταλλευόμενοι τις έκτακτες συνθήκες της πανδημίας άλλαξαν τους νόμους και κατάφεραν, πώς το κατάφεραν είναι ένα μεγάλο ερώτημα, αλλά το κατάφεραν, να μοιράσουν σχεδόν 10 δισεκατομμύρια ευρώ με απευθείας αναθέσεις και κλειστούς διαγωνισμούς, ως επί το πλείστον  σε εταιρείες που φτιάχτηκαν τρεις μέρες πριν την ανάθεση του έργου",culture,artists,culture,-0.8,0.85,0.0,0.3,0.3,0.4,0.2,0.1,"[['greece', 'location', '0.9'], ['culture', 'organization', '0.8'], ['art', 'organization', '0.7'], ['the world of art', 'organization', '0.6'], ['pandemic', 'event', '0.8']]","[['greece', 'country', '1.0'], ['art', 'group of people', '0.8'], ['pandemic', 'date', '0.7'], ['culture', 'organization', '0.6'], ['companies', 'organization', '0.6']]"
33,"This is the Greece of Mr.  Mitsotakis.  And this Greece hurts us all.  And I want to address today, not only to the Left and the Left, the progressive and the progressive, but also to the conservative citizens.  I am absolutely sure that this party and this Greece that Mr.  Mitsotakis, neither can conservative citizens deserve, nor can conservative citizens feel comfortable.  But they feel ashamed. ","Αυτή είναι η Ελλάδα του κ  Μητσοτάκη  Και η Ελλάδα αυτή μας πληγώνει όλους  Και θέλω σήμερα ν’ απευθυνθώ, όχι μόνο στους Αριστερούς και τις Αριστερές, τους προοδευτικούς και τις προοδευτικές, αλλά και στους συντηρητικούς πολίτες  Είμαι απόλυτα βέβαιος ότι αυτό το κόμμα και αυτή η Ελλάδα που έφτιαξε ο κ  Μητσοτάκης, ούτε στους συντηρητικούς  πολίτες μπορεί ν’ αξίζει, ούτε οι συντηρητικοί πολίτες μπορεί να αισθάνονται άνετα  Αλλά αισθάνονται ντροπή",political parties,other,greek politics,-0.9,0.95,0.3,0.5,0.2,0.5,0.2,0.0,"[['greece', 'location', '1.0'], ['mr. mitsotakis', 'person', '1.0']]","[['mr. mitsotakis', 'person', '0.9'], ['left', 'group of people', '0.5'], ['progressive', 'group of people', '0.5'], ['conservative citizens', 'group of people', '0.7'], ['party', 'organization', '0.3'], ['greece', 'country', '0.8']]"
34," That's why the day after the elections, regardless of which party we belong to, regardless of what ideas we have, we have to see what day will dawn on us.  If this government and this Prime Minister are given a mandate to renew their mandate, those who broke the rule of law with the wiretaps, those who destroyed the state itself with the buffets, those who organized this great plundering of wealth redistribution, what else will they do if they are completely unaccountable for another 4 years? It is therefore a national obligation and duty to fight together to keep society standing.  Let us all fight together for a great political change that will mean a change in our daily life, a change in our lives.  With more justice and prosperity for all.  And I believe that this Greece that is hurting us, we must and we can change it.  To defeat the perpetrators of economic and national decline. "," Γι' αυτό την επομένη των εκλογών, ανεξάρτητα από το σε ποιο κόμμα ανήκουμε, ποιες ιδέες έχουμε, πρέπει να δούμε ποια μέρα θα μας ξημερώσει  Αν αυτή η κυβέρνηση και αυτός ο Πρωθυπουργός πάρουν εντολή ανανέωσης της θητείας τους, αυτοί που καταρράκωσαν το κράτος δικαίου με τις υποκλοπές, αυτοί που διέλυσαν  το ίδιο το κράτος με τα ρουσφέτια, αυτοί που οργάνωσαν τη μεγάλη αυτή λεηλασία αναδιανομής του πλούτου, τι άλλο θα κάνουν, αν είναι απολύτως ανεξέλεγκτοι για άλλα 4 χρόνια Είναι λοιπόν εθνική υποχρέωση και καθήκον να παλέψουμε όλοι μαζί για να σταθεί η κοινωνία όρθια  Να παλέψουμε όλοι μαζί για μια μεγάλη πολιτική αλλαγή που θα σημαίνει και αλλαγή στην καθημερινότητά μας, αλλαγή στη ζωή μας  Με περισσότερη δικαιοσύνη και προκοπή για όλους  Και πιστεύω ότι αυτή η Ελλάδα που μας πληγώνει, πρέπει και μπορούμε να την αλλάξουμε  Να νικήσουμε τους αυτουργούς της οικονομικής και εθνικής κατάπτωσης",elections,lack of accountability,greek elections,-0.4,0.65,0.2,0.2,0.3,0.2,0.2,0.0,"[['prime minister', 'person', '0.8'], ['government', 'organization', '0.7'], ['rule of law', 'other', '0.6'], ['wiretaps', 'other', '0.5'], ['state', 'organization', '0.7'], ['buffets', 'other', '0.5'], ['wealth redistribution', 'other', '0.6'], ['greece', 'location', '0.7']]","[['elections', 'date', 'medium'], ['government', 'organization', 'high'], ['prime minister', 'person', 'high'], ['wiretaps', 'group of people', 'low'], ['state', 'organization', 'high'], ['buffets', 'group of people', 'low'], ['wealth redistribution', 'organization', 'low'], ['society', 'organization', 'medium'], ['greece', 'location', 'high']]"
35," Defeat the stereotype that suits them.  What is the stereotype.  ""Everyone is the same, nothing changes"".  Yes, it can change. "," Να νικήσουμε το στερεότυπο που τους βολεύει  Ποιο είναι το στερεότυπο  «Όλοι ίδιοι είναι, τίποτα δεν αλλάζει»  Ναι, μπορεί ν’ αλλάξει",other,other,stereotypes,0.5,0.0,0.0,0.1,0.0,0.2,0.0,0.0,[],[]
36," And no, we're not all the same.  We are not all the same.  One can accuse us of many things.  For mistakes, for wrong choices.  There is one thing we cannot be blamed for: For our honesty.  For our clean front.  For our clean hands. "," Και όχι, δεν είμαστε όλοι το ίδιο  Δεν είμαστε όλοι το ίδιο  Μπορεί κανείς να μας κατηγορήσει για πολλά  Για λάθη, για λάθος επιλογές  Για ένα πράγμα δεν μπορεί κανείς να μας κατηγορήσει: Για την εντιμότητά μας  Για το καθαρό μας μέτωπο  Για τα καθαρά μας χέρια",corruption,other,individuality,0.0,0.1,0.0,0.2,0.2,0.2,0.0,0.0,[],[]
37," We took over the country in conditions of disintegration and bankruptcy.  We worked hard to get the country out of the mire of bankruptcy.  We made mistakes.  Yes, we made mistakes. "," Παραλάβαμε τη χώρα σε συνθήκες διάλυσης και  χρεοκοπίας  Δουλέψαμε σκληρά για να βγάλουμε τη χώρα από το βούρκο της χρεοκοπίας  Κάναμε λάθη  Ναι, κάναμε λάθη",economy,bankruptcy,country's recovery,0.2,0.2,0.0,0.0,0.0,0.0,0.0,0.0,[],[]
38," But we got the country out of the memoranda, we regulated the debt.  We left 37 billion in the public purse.  We didn't give 10 billion in assignments.  We did not fill the Public Utility Companies with red golden boys as they have been filled with blue golden boys, grasshoppers looting the public purse. "," Βγάλαμε όμως τη χώρα από τα μνημόνια, ρυθμίσαμε το χρέος  Αφήσαμε 37 δισεκατομμύρια στο δημόσιο Ταμείο  Δε δώσαμε εμείς 10 δισεκατομμύρια σε αναθέσεις  Δε γεμίσαμε τις εταιρείες της Δημόσιας Κοινωνικής Ωφέλειας, με κόκκινα golden boys όπως έχουν γεμίσει αυτοί με γαλάζια golden boys, ακρίδες που λεηλατούν το δημόσιο χρήμα",debt,debt regulations,economy,0.75,0.2,0.0,0.2,0.2,0.5,0.0,0.0,[],[]
39," It's not in our DNA to profit, to be profligate.  In our DNA is justice, it's honesty, it's humanity.  We care about society.  Because we are part of this society.  This is our difference. "," Δεν είναι στο δικό μας DNA το κέρδος, η αισχροκέρδεια  Στο δικό μας DNA είναι η δικαιοσύνη, είναι η εντιμότητα, είναι η ανθρωπιά  Νοιαζόμαστε για την κοινωνία  Γιατί είμαστε κομμάτι αυτής της κοινωνίας  Αυτή είναι η διαφορά μας",other,other,society,0.8,0.0,0.0,0.0,0.0,0.2,0.0,0.0,"[['dna', 'other', '1.0'], ['justice', 'other', '1.0'], ['honesty', 'other', '1.0'], ['humanity', 'other', '1.0.']]","[['dna', 'organization', '0.9'], ['society', 'group of people', '0.7']]"
40," These elections, friends, are a historic opportunity to answer the crucial dilemmas that stand before us.  What are these crucial dilemmas:First of all: Truth or cover-up.  Honesty or corruption.  Democracy or family rule. "," Οι εκλογές αυτές φίλες και φίλοι, είναι μια ιστορική ευκαιρία να απαντήσουμε στα κρίσιμα διλήμματα που ορθώνονται μπροστά μας  Ποια είναι αυτά τα κρίσιμα διλήμματα:Πρώτα απ’ όλα: Αλήθεια ή συγκάλυψη  Εντιμότητα ή διαφθορά  Δημοκρατία ή οικογενειοκρατία",elections,corruption,elections,0.5,1.0,0.5,0.1,0.1,0.5,0.0,0.0,"[['elections', 'event', '1.0'], ['truth', 'other', '1.0'], ['honesty', 'other', '1.0'], ['democracy', 'other', '1.0']]",[]
41,"  Justice for all or privileges for a few.  These are the crucial dilemmas, these are the big questions that every Greek is called upon to answer on May 21.  I am sure that the answer that he will give at the polls, the important answer that the Greek people will give, will be: Justice.  Justice everywhere.  Because the need and the demand for justice permeate today the entire Greek society. ","  Δικαιοσύνη για όλους ή προνόμια για λίγους  Αυτά είναι τα κρίσιμα διλήμματα, αυτά είναι τα μεγάλα ερωτήματα τα οποία καλείται κάθε Ελληνίδα και κάθε Έλληνας ν’ απαντήσει στις 21 του Μάη  Είμαι βέβαιος ότι η απάντηση που θα δώσει στις κάλπες, σημαντικό απάντηση που θα δώσει ο ελληνικός λαός, θα είναι: Δικαιοσύνη  Δικαιοσύνη παντού  Γιατί η ανάγκη και το αίτημα της δικαιοσύνης διαπερνούν σήμερα όλη την ελληνική κοινωνία",justice,injustice,justice,0.75,0.1,0.0,0.0,0.0,0.1,0.2,0.0,"[['greek', 'norp', '1.0'], ['may 21', 'date', '1.0'], ['greek people', 'norp', '1.0'], ['greek society', 'norp', '1.0']]","[['greek', 'country', '1.0'], ['may 21', 'date', '1.0'], ['greek people', 'group of people', '1.0']]"
42,"And you know, we're beginning to understand this now, all of us.  When we walk in the streets, when we talk in cafes, when we go out in the squares.  The climate has changed. ","Και ξέρετε, έχουμε αρχίσει αυτό πια να το καταλαβαίνουμε όλοι και όλες  Όταν περπατάμε στους δρόμους, όταν μιλάμε στα καφενεία, όταν βγαίνουμε στις πλατείες  Το κλίμα έχει αλλάξει",environment,other,climate,0.5,0.0,0.0,0.0,0.0,0.0,0.0,0.0,[],[]
43," Let them put numbers and bars on the news reports.  We know them well, the real numbers and the real correlations.  We see them in the neighbourhoods, in the workplaces, in the squares and in the cafes.  We see them, we know the real correlations. "," Αφήστε τους να βγάζουν αριθμούς και μπάρες στα δελτία των ειδήσεων  Εμείς τους ξέρουμε καλά, τους πραγματικούς αριθμούς και τους πραγματικούς συσχετισμούς  Τους βλέπουμε μέσα στις γειτονιές, μέσα στους χώρους δουλειάς, στις πλατείες και στα καφενεία  Τους βλέπουμε, τους ξέρουμε τους πραγματικούς συσχετισμούς",other,other,statistics or data analysis,0.0,0.2,0.0,0.1,0.2,0.8,0.2,0.0,[],"[['neighbourhoods', 'location', '0.5'], ['workplaces', 'location', '0.5'], ['squares', 'location', '0.5'], ['cafes', 'location', '0.5']]"
44,"So today, from here, from Kalamata, which as I said at the beginning of my speech is significant, from here we started the great battle, the great political march for the great victory in 2015, from here we start today.  So from here, from Kalamata, I want to invite you all together to co-sign this national plan that the country needs, a national plan for the uplift and regeneration of our country.  And this plan has two words: JUSTICE EVERYWHERE.  It is the plan for the reconstruction of the state, it is the plan for the recovery of the economy, it is the plan for the strengthening of social protection, but also for the necessary breathing space for democracy itself. ","Θέλω λοιπόν σήμερα, από δω, από την Καλαμάτα, που όπως είπα στην αρχή της ομιλίας μου είναι σημαδιακό, από δω ξεκινήσαμε  τη μεγάλη μάχη, τη μεγάλη πολιτική πορεία για τη μεγάλη νίκη το 2015, από δω ξεκινάμε και σήμερα  Θέλω λοιπόν από δω, από την Καλαμάτα, να σας καλέσω όλες και όλους μαζί, να  συνυπογράψουμε αυτό το εθνικό σχέδιο  που έχει ανάγκη ο τόπος, ένα εθνικό σχέδιο ανάταξης και αναγέννησης της πατρίδας μας  Και αυτό το σχέδιο έχει δυο λέξεις: ΔΙΚΑΙΟΣΥΝΗ ΠΑΝΤΟΥ  Είναι το σχέδιο για την ανασυγκρότηση του κράτους, είναι το σχέδιο για την ανάταξη της οικονομίας, είναι το σχέδιο για την ενίσχυση της κοινωνικής προστασίας, αλλά και για την αναγκαία ανάσα της ίδιας της  δημοκρατίας",justice,injustice,national plan,0.6878,0.2,0.0,0.0,0.0,0.2,0.4,0.0,"[['kalamata', 'location', '1.0'], ['2015', 'date', '1.0']]","[['kalamata', 'location', '1.0'], ['2015', 'date', '1.0']]"
45," Our national plan seeks to put the country back on the path of European normality.  Note the irony, those who were demonstrating saying ""we are staying in Europe"" are the ones who have led the country today miles away from what Europe means.  Why Europe means above all the rule of law. So what we want to do is to make Greece, to make Greece a normal European country again.  Fighting glaring inequalities.  With a slogan that I think you will also like, because it's catchy, short, simple and to the point. "," Το εθνικό μας σχέδιό επιδιώκει να επαναφέρουμε τη χώρα σε τροχιά  ευρωπαϊκής κανονικότητας  Προσέξτε ειρωνεία της τύχης, αυτοί οι οποίοι διαδήλωναν λέγοντας «μένουμε Ευρώπη», είναι αυτοί που οδήγησαν τη χώρα σήμερα μίλια μακριά από αυτό που σημαίνει Ευρώπη  Γιατί Ευρώπη σημαίνει πάνω απ’ όλα κράτος δικαίου Εμείς λοιπόν αυτό το οποίο θέλουμε να κάνουμε, είναι να ξαναγίνει η Ελλάδα, να γίνει η Ελλάδα μια κανονική ευρωπαϊκή χώρα  Να καταπολεμήσουμε τις κραυγαλέες ανισότητες  Με ένα σύνθημα που νομίζω ότι θα αρέσει και σ’ εσάς, γιατί είναι εύηχο, σύντομο, απλό και περιεκτικό",europe,other,greek recovery,0.4,0.2,0.3,0.1,0.2,0.2,0.0,0.0,"[['greece', 'location', '0.9'], ['europe', 'location', '0.8']]","[['greece', 'location', '1.0'], ['europe', 'country', '1.0'], ['european', 'organization', '0.8'], ['europe', 'location', '0.7'], ['greece', 'organization', '0.6'], ['rule of law', 'organization', '0.5'], ['irony', 'organization', '0.3']]"
46,"What it means to vote for SYRIZA.  It means higher wages, lower prices, debt regulation and an efficient state.  This is what a vote for SYRIZA Progressive Alliance means. ","Τι σημαίνει ψήφος στο ΣΥΡΙΖΑ  Σημαίνει αύξηση μισθών, μείωση τιμών, ρύθμιση χρεών και αποτελεσματικό κράτος  Αυτό σημαίνει ψήφος στο ΣΥΡΙΖΑ Προοδευτική Συμμαχία",elections,debt regulations,syriza,0.8,0.0,0.0,0.0,0.0,0.2,0.0,0.0,"[['syriza', 'org', '1.0'], ['progressive alliance', 'org', '0.95']]","[['syriza', 'organization', '1.0'], ['progressive alliance', 'group of people', '1.0.']]"
47," So our plan is to raise wages, lower prices, regulate debts and have an efficient state.  And it seeks to support the middle class by redressing the injustices against it.  It seeks to support the forces of production so that Greece can produce more wealth, but distributed to the whole of Greek society, without leaving those who produce the wealth on the sidelines.  We aim to change the production model.  Invest in human capital, in highly qualified young scientists.  Humane and modern working conditions and pay for all workers. We aim to boost healthy entrepreneurship and investment in strategic sectors of the economy. "," Το σχέδιό μας λοιπόν προβλέπει αύξηση μισθών,  μείωση τιμών, ρύθμιση χρεών και αποτελεσματικό κράτος  Και επιδιώκει να στηρίξει τη μεσαία τάξη, αποκαθιστώντας τις αδικίες σε βάρος της  Επιδιώκει να στηρίξουμε τις δυνάμεις της παραγωγής για να παράγει η Ελλάδα περισσότερο πλούτο, που θα κατανέμεται όμως στο σύνολο  της ελληνικής κοινωνίας, χωρίς να μένουν στο περιθώριο εκείνοι που  παράγουν τον πλούτο  Έχουμε στόχο ν’ αλλάξουμε το παραγωγικό μοντέλο  Να επενδύσουμε στο ανθρώπινο κεφάλαιο, στους υψηλής κατάρτισης νέους επιστήμονες  Σε ανθρώπινους και σύγχρονους όρους δουλειάς και αμοιβής για όλους τους εργαζόμενους Έχουμε στόχο να ενισχύσουμε την υγιή επιχειρηματικότητα και τις επενδύσεις σε στρατηγικούς τομείς της οικονομίας",economy,wages,economic policy,0.75,0.1,0.0,0.0,0.0,0.2,0.2,0.0,"[['greece', 'location', '1.0'], ['middle class', 'group', '1.0'], ['wealth', 'entity', '1.0'], ['production model', 'concept', '1.0'], ['human capital', 'entity', '1.0'], ['scientists', 'profession', '1.0'], ['working conditions', 'concept', '1.0'], ['pay', 'entity', '1.0'], ['workers', 'profession', '1.0'], ['entrepreneurship', 'concept', '1.0'], ['investment', 'concept', '1.0'], ['strategic sectors', 'concept', '1.0'], ['economy', 'concept', '1.0']]","[['greece', 'location', '1.0'], ['middle class', 'group of people', '1.0'], ['greek society', 'group of people', '1.0'], ['young scientists', 'group of people', '1.0'], ['workers', 'group of people', '1.0']]"
48," We aim to protect the right to work, the right to housing, the right of every young person to quality education, the right of every pensioner to a decent pension, the right of every citizen to decent health care. Our national plan provides that as the first act of justice from the first days of progressive governance, we will abolish all those laws and regulations that put a barrier to the freedoms and rights of the citizen and remove any barrier to the impunity of the privileged.  We aim to immediately put an end to:The jungle labour regime. The plundering of the first home. On the criminal immunity of bank executives. Tax immunity for companies speculating in electricity, oil and essentials. "," Έχουμε στόχο να προστατεύσουμε το δικαίωμα στην εργασία, το δικαίωμα στην κατοικία, το δικαίωμα κάθε νέας και κάθε νέου σε ποιοτικές σπουδές, το δικαίωμα κάθε συνταξιούχου σε αξιοπρεπή σύνταξη, το δικαίωμα κάθε πολίτη σε αξιοπρεπή Φροντίδα Υγείας Το εθνικό μας σχέδιο προβλέπει ότι ως πρώτη πράξη δικαιοσύνης από τις πρώτες μέρες της προοδευτικής διακυβέρνησης, θα καταργήσουμε όλους εκείνους τους νόμους και τις διατάξεις, που βάζουν φραγμό στις ελευθερίες και τα δικαιώματα του πολίτη και αφαιρούν κάθε φραγμό από την ασυδοσία των προνομιούχων  Έχουμε στόχο άμεσα να βάλουμε τέρμα:Στο εργασιακό καθεστώς της ζούγκλας Στη λεηλασία της πρώτης κατοικίας Στην ποινική ασυλία των τραπεζικών στελεχών Στη φορολογική ασυλία των εταιρειών που κερδοσκοπούν στο ρεύμα, το πετρέλαιο και τα είδη πρώτης ανάγκης",employment,workers' rights,progressive governance,0.8,0.2,0.0,0.1,0.0,0.2,0.4,0.0,"[['we', 'unspecified entity', '0.998'], ['young person', 'person', '0.653'], ['pensioner', 'person', '0.974'], ['citizen', 'person', '0.998'], ['national plan', 'organization', '0.809'], ['progressive governance', 'organization', '0.568'], ['laws', 'other', '0.857'], ['regulations', 'other', '0.876'], ['freedoms', 'other', '0.768'], ['rights', 'other', '0.902'], ['impunity', 'other', '0.789'], ['privileged', 'other', '0.831'], ['jungle labour regime', 'other', '0.564'], ['first home', 'other', '0.675'], ['bank executives', 'person', '0.576'], ['tax immunity', 'other', '0.698'], ['electricity', 'other', '0.807'], ['oil', 'other', '0.789'], ['essentials', 'other', '0.673']]","[['1. citizenship', 'organization', '1.0'], ['2. national plan', 'organization', '0.7'], ['3. progressive governance', 'organization', '0.6'], ['4. jungle labour regime', 'organization', '0.6'], ['5. bank executives', 'group of people', '0.7'], ['6. companies', 'organization', '0.6'], ['7. electricity', 'location', '0.6'], ['8. oil', 'location', '0.6.']]"
