id,text,text_el,topic,topic-context,subtopic,subtopic-context,topic-open,sentiment,polarization,polarization-definition,toxicity,toxicity-definition,populism,populism-definition,hate speech,ner,ner-limited
11,"And the question is where did all those billions go? You know and we all know very well where they went. One look at the direct awards, the Pecha lists and the obscenity of obscenity is enough to understand where they went. If we, instead of having the obligation to collect 40 billion in public funds, had been able to spend 60, then everyone would have felt in practice exactly what the slogan that we write on our flags and banners, exactly what 'Justice everywhere' means. If we had that leeway, today our hospitals would be on their feet, social cohesion would have been strengthened, wages and pensions would have seen significant increases, the weak would have seen a white day, the welfare state would have been there to support people, education and culture would have received decisive support. But none of this has happened. And society is sinking, the rich are getting richer, the middle classes are getting poorer and the poor are getting poorer.","Και το ερώτημα είναι πού πήγαν όλα αυτά τα δισεκατομμύρια; Ξέρετε και ξέρουμε καλά όλοι πού πήγαν. Μια ματιά στις απευθείας αναθέσεις, στις λίστες Πέτσα και στην ασυδοσία της αισχροκέρδειας αρκεί για να καταλάβουμε πού πήγαν. Αν εμείς, αντί να έχουμε την υποχρέωση να μαζέψουμε 40 δισ. στα δημόσια ταμεία, είχαμε την ευχέρεια να ξοδέψουμε 60, τότε όλοι θα είχαν αισθανθεί στην πράξη τι ακριβώς σημαίνει το σύνθημα που γράφουμε στις σημαίες μας και στα πανό μας, τι ακριβώς σημαίνει «Δικαιοσύνη παντού». Αν είχαμε αυτή την ευχέρεια, σήμερα τα νοσοκομεία μας θα στέκονταν στα πόδια τους, η κοινωνική συνοχή θα είχε ενισχυθεί, οι μισθοί και οι συντάξεις θα είχαν δει σημαντικές αυξήσεις, οι αδύναμοι θα είχαν δει άσπρη μέρα, το κράτος πρόνοιας θα ήταν εκεί για να στηρίζει τους ανθρώπους, η παιδεία και ο πολιτισμός θα είχαν αποφασιστική στήριξη. Αλλά τίποτε απ' όλα αυτά δεν έχει γίνει. Και η κοινωνία βυθίζεται, οι πλούσιοι γίνονται πλουσιότεροι, οι μεσαίοι γίνονται φτωχοί και οι φτωχοί γίνονται φτωχότεροι.",,other,,austerity,,,,0.2,,,,0.9,,[],"[['pecha', 'organization', '1.0'], ['justice', 'political party', '0.8'], ['hospitals', 'group of people', '0.6'], ['wages', 'group of people', '0.6'], ['pensions', 'group of people', '0.6'], ['education', 'group\xa0of people', '0.6'], ['culture', 'group of people', '0.6']]"
12,"But as if that wasn't enough, we get the finger wagging. The day before yesterday, Mr Mitsotakis arrived to say that ""SYRIZA put us in the memoranda""! and he got us out of the memoranda. You know, it would be laughable if it wasn't tearful! Because this is classic alt-right politics of the far right, of Trump, it's Trumpism personified to tell the biggest lie, as supposedly the truth. We did not fight the battle with the people to apologize for supposedly putting the country under the memoranda, we fought the battle and got the country out of the memoranda. We fought with the people to get rid of them. Did Mr Mitsotakis fight this battle, back when he was shouting 'Yerushalayim, Yerushalayim and Shoeble'? That is the level of the election debate. And it is a panic choice that he is making. And his panic is even greater, you know, because this time he knows that this time he will not find any allies to support any Schäuble and no Geroun, because even there in Germany there is no Schäuble. But there is a Chancellor whom I visited the day before yesterday and who is giving the green light to the prospect of a progressive government in Greece that will pursue a policy other than that of increasing, of widening inequalities. A policy of supporting society and boosting the economy.","Αλλά σαν να μη φτάνει αυτό, μας κουνάνε και το δάχτυλο. Έφτασε προχθές ο κ. Μητσοτάκης να πει ότι τελικά «ο ΣΥΡΙΖΑ μας έβαλε στα μνημόνια»! και αυτός μας έβγαλε από τα μνημόνια. Ξέρετε, θα ήταν για γέλια αν δεν ήταν για κλάματα! Διότι αυτή είναι η κλασική πολιτική της alt-right της άκρας Δεξιάς, του Τραμπ, είναι ο τραμπισμός προσωποποιημένος να λέγεται το μεγαλύτερο ψέμα, ως δήθεν η αλήθεια. Δεν δώσαμε εμείς μαζί με τον λαό τη μάχη για να απολογούμαστε ότι δήθεν βάλαμε τη χώρα στα μνημόνια, εμείς δώσαμε τη μάχη και βγάλαμε τη χώρα από τα μνημόνια. Δώσαμε μαζί με τον λαό τη μάχη για να απαλλαγούμε από αυτά. Έδωσε τη μάχη αυτή ο κ. Μητσοτάκης, τότε που «κραύγαζε Γερούν γερά και βάστα Σόιμπλε»; Αυτό είναι το επίπεδο της προεκλογικής αντιπαράθεσης. Και είναι μια επιλογή πανικού αυτή που κάνει. Και ο πανικός του γίνεται ακόμη μεγαλύτερος, ξέρετε, γιατί τούτη τη φορά γνωρίζει ότι δεν θα βρει σύμμαχο κανένα Σόιμπλε για να υποστηρίζει και κανένα Γερούν, διότι ακόμη κι εκεί στη Γερμανία δεν υπάρχει Σόιμπλε. Αλλά υπάρχει ένας Καγκελάριος τον οποίο επισκέφθηκα εγώ προχθές και ο οποίος δίνει πράσινο φως στην προοπτική μιας προοδευτικής κυβέρνησης στην Ελλάδα, που θα ακολουθήσει μια άλλη πολιτική από αυτήν της αύξησης, της διόγκωσης των ανισοτήτων. Μια πολιτική στήριξης της κοινωνίας και ανάτασης της οικονομίας.",,opponent criticism,,other,,-0.3,,0.2,,,,0.0,,[],"[['mitsotakis', 'person', '0.6'], ['syriza', 'organization', '0.6'], ['trump', 'person', '0.6'], ['alt-right', 'organization', '0.6'], ['yerushalayim', 'person', '0.6'], ['shoeble', 'person', '0.6'], ['germany', 'country', '0.6'], ['chancellor', 'person', '0.6'], ['greece', 'country', '0.6']]"
13,"But what else was Mr Mitsotakis telling us in 2019? He was telling us that the middle class would see bright days under his administration. And what did he do? He promised to bring it up to the big salons and eventually plunged it into living on food stamps. That's what he did. Income for most of our fellow, middle-class citizens evaporates in the first three weeks of the month. The supermarket has become a nightmare. At petrol stations we have the most expensive price in the whole of Europe. Electricity eats up half a pensioner's pension, while small and medium-sized businesses cannot even get past the banks. And the resources of the Recovery Fund are all going to a few business groups that can be counted on the fingers of two hands. Was the middle class avenged during the difficult years when the Syriza government was struggling to get the country out of the quagmire others had thrown it into?  Yes, it was wronged, it paid a disproportionate burden.","Τι άλλο όμως μας έλεγε ο κ. Μητσοτάκης το 2019; Μας έλεγε ότι η μεσαία τάξη θα δει με τη διακυβέρνησή του λαμπρές μέρες. Και τι έκανε; Της έταξε να την ανεβάσει στα μεγάλα σαλόνια και τελικά τη βύθισε να ζει με τα κουπόνια. Αυτό έκανε. Το εισόδημα για τους περισσότερους συμπολίτες μας, μεσαίους συμπολίτες μας, εξανεμίζεται τις τρεις πρώτες εβδομάδες του μήνα. Το σούπερ μάρκετ έχει γίνει ένας εφιάλτης. Στα πρατήρια της βενζίνης έχουμε την ακριβότερη τιμή σε όλη την Ευρώπη. Το ηλεκτρικό ρεύμα τρώει τη μισή σύνταξη του συνταξιούχου, ενώ οι μικρομεσαίες επιχειρήσεις δεν περνάνε ούτε έξω από τις τράπεζες. Και οι πόροι του Ταμείου Ανάκαμψης πηγαίνουν όλοι σε λίγους μετρημένους στα δάχτυλα των δυο χεριών, επιχειρηματικούς ομίλους. Αδικήθηκε η μεσαία τάξη τα δύσκολα χρόνια που η κυβέρνηση του ΣΥΡΙΖΑ πάλευε να βγάλει τη χώρα από τον βάλτο που άλλοι την έριξαν;  Ναι, αδικήθηκε, πλήρωσε δυσανάλογο βάρος. ",,other,,middle class,,-0.8,,0.2,,,,0.9,,[],"[['mr mitsotakis', 'person', '1.0'], ['middle class', 'group of people', '1.0'], ['administration', 'organization', '0.6'], ['big salons', 'location', '0.4'], ['food stamps', 'organization', '0.4'], ['citizens', 'group of people', '0.6'], ['supermarket', 'location', '1.0'], ['petrol stations', 'location', '1.0'], ['europe', 'country', '0.4'], ['electricity', 'organization', '0.4'], ['pensioner', 'person', '1.0'], ['small and medium-sized businesses', 'group of people', '1.0'], ['banks', 'organization', '0.6'], ['recovery fund', 'organization', '0.6'], ['business groups', 'group of people', '1.0'], ['syriza government', 'political party', '1.0'], ['country', 'country', '1.0.']]"
14,"But here there is a big difference with Mitsotakis' policy. His policy is not a national imperative, it does not serve a national goal as we did when we had to remove the noose of the memoranda and the Troika from the throat of every citizen and the country. His policy is a plan, his plan: a plan to destroy the middle class for the benefit of the big interests, a plan to redistribute wealth from the many to the few and powerful, for the benefit of the cartels, the banks and the funds. And I have the feeling that the Greek people are beginning to understand this. People understand when they see 15 companies listed on the Athens Stock Exchange with 20-year profitability records of over 1 billion each, when the vast majority of households cannot make ends meet for the month. These are the inequalities, this is the redistribution of wealth that Mr Mitsotakis is attempting. That is why the prevailing sentiment from coast to coast across Greece can be summed up, I believe, in just two words: Enough!","Αλλά εδώ υπάρχει μια μεγάλη διαφορά με την πολιτική Μητσοτάκη. Η δική του πολιτική δεν είναι εθνική επιταγή, δεν υπηρετεί έναν εθνικό στόχο όπως εμείς τότε που έπρεπε να βγάλουμε τη θηλιά των μνημονίων και της τρόικας από τον λαιμό του κάθε πολίτη και της χώρας. Η δική του πολιτική είναι σχέδιο, δικό του σχέδιο: σχέδιο αφανισμού της μεσαίας τάξης προς όφελος των μεγάλων συμφερόντων, σχέδιο αναδιανομής του πλούτου από τους πολλούς στους λίγους και ισχυρούς, προς όφελος των καρτέλ, των τραπεζών και των funds. Και αυτό ο ελληνικός λαός έχω την αίσθηση ότι αρχίζει πια και το καταλαβαίνει. Καταλαβαίνει ο κόσμος όταν βλέπει 15 εισηγμένες εταιρείες στο Χρηματιστήριο Αθηνών να έχουν ρεκόρ κερδοφορίας εικοσαετίας με πάνω από 1 δισ. η κάθε μια, όταν η συντριπτική πλειοψηφία των νοικοκυριών δεν μπορεί να βγάλει το μήνα. Αυτές είναι οι ανισότητες, αυτό είναι η αναδιανομή πλούτου που επιχειρεί ο κ. Μητσοτάκης. Γι' αυτό και το κυρίαρχο συναίσθημα από άκρη σε άκρη σε όλη την Ελλάδα συνοψίζεται πιστεύω σε δύο μόνο λέξεις: Ως εδώ!",,other,,austerity,,-0.9,,0.6,,,,0.5,,[],"[['mitsotakis', 'person', '1.0'], ['troika', 'organization', '0.8'], ['greek people', 'group of people', '1.0'], ['athens stock exchange', 'organization', '1.0'], ['greece', 'country', '1.0']]"
15,"So much for corruption, so much for punctuality, so much for insecurity, so much for family rule, so much for general injustice.","Ως εδώ, με τη διαφθορά, ως εδώ με την ακρίβεια, ως εδώ με την ανασφάλεια, ως εδώ με την οικογενειοκρατία, ως εδώ με τη γενικευμένη αδικία.",,corruption,,other,,-0.8,,0.0,,,,0.5,,[],[]
16,"So far, with wages disappearing in the first fortnight of the month, rents, electricity, fuel and supermarkets, while speculation and obscenity have become the law of the land.","Ως εδώ, με τους μισθούς που εξανεμίζονται στο πρώτο δεκαπενθήμερο του μήνα, στα ενοίκια,  στο ρεύμα, στα καύσιμα και στο σούπερ μάρκετ, ενώ η κερδοσκοπία και η αισχροκέρδεια έχουν γίνει νόμος του κράτους.",,other,,cost of living,,-0.8,,0.0,,,,0.0,,[],[]
17,So much for the unbearable electricity bills and the PPC playing a leading role in obscenity and handing out fat salaries and bonuses to the blue golden boys.,"Ως εδώ, με τους αβάσταχτους λογαριασμούς στο ρεύμα και με τη  ΔΕΗ να πρωταγωνιστεί στην αισχροκέρδεια και να μοιράζει να παχυλούς μισθούς και μπόνους στα γαλάζια golden boys",,energy,,other,,-0.8,,,,,,0.3,,[],"[['ppc', 'organization', '0.9'], ['blue golden boys', 'group of people', '0.7']]"
18,"So much for the funds and the crows who are party officials like their MP Mr. Patsis, who supposedly didn't know what he was doing, who were throwing families out on the street for a few thousand euros. At a time when the party that voted the laws to allow this, that voted the bankruptcy law, the New Democracy party owes over 400 million in loans and unpaid loans to the banks, which the Greek people have financed with their own blood.","Ως εδώ, με τα funds και τα κοράκια που είναι κομματικοί αξιωματούχοι όπως ο βουλευτής τους ο κ. Πάτσης, που δήθεν δεν ήξεραν τι έκανε, που αυτό που έκανε ήταν να πετά στο δρόμο οικογένειες για λίγες χιλιάδες ευρώ. Την ώρα μάλιστα που το κόμμα που ψήφιζε τους νόμους για να το επιτρέπει αυτό, που ψήφιζε το πτωχευτικό νόμο, το κόμμα της Νέας Δημοκρατίας χρωστάει πάνω από 400 εκατομμύρια δανεικά κι αγύριστα στις τράπεζες, τις οποίες έχει χρηματοδοτήσει με το αίμα του ο ελληνικός λαός.",,privatization,,bankruptcy,,-0.8,,0.2,,,,0.3,,[],"[['mr. patsis', 'person', '0.6'], ['new democracy party', 'political party', '0.6'], ['greek', 'country', '0.8']]"
19,"So much for the mockery of pensioners. What did they tell us? That they would support the pensioners. And what did they finally do? They said the 13th pension introduced and given by Syriza was a pittance, but they would keep it. They abolished it the very next day and of course they stole the retroactive payments, contrary to the decision of the Council of State. Because for them, Justice and its decisions are a la carte. They only respect them when they feel like respecting them. When they don't want to respect them, they don't respect them and most of the time they don't want to respect them. Pensioners have lost a total of EUR 7 billion over the four years of the Mitsotakis government.","Ως εδώ, με την κοροϊδία των συνταξιούχων. Τι μας έλεγαν; Ότι θα στηρίξουν τους συνταξιούχους. Και τι έκαναν τελικά Έλεγαν ήταν ψίχουλα η 13η σύνταξη που θέσπισε και έδωσε ο ΣΥΡΙΖΑ, αλλά θα την κρατούσαν. Την κατάργησαν την επόμενη κιόλας μέρα και βεβαίως έκλεψαν τα αναδρομικά, σε αντίθεση με την απόφαση του Συμβουλίου της Επικρατείας. Γιατί γι' αυτούς η Δικαιοσύνη και οι αποφάσεις της είναι α λα καρτ. Τις σέβονται μόνο όταν γουστάρουν να τις σέβονται. Όταν δεν θέλουν να τις σέβονται, δεν τις σέβονται και τις περισσότερες φορές δεν θέλουν να τις σέβονται. 7 δισ. ευρώ στο σύνολο οι συνταξιούχοι έχασαν αυτά τα τέσσερα χρόνια από τη διακυβέρνηση Μητσοτάκη.",,pensioners,,other,,-0.9,,0.3,,,,0.7,,[],"[['syriza', 'political party', '1.0'], ['council of state', 'organization', '1.0'], ['mitsotakis government', 'group of people', '1.0'], ['greece', 'country', '1.0'], ['eur', 'currency', '1.0'], ['4 years', 'date', '1.0']]"
20,"This big ""So far"", I can find dozens of examples to go with it. But I will say three:
Enough with the arrogance.
Enough with indifference.
Enough with the mockery.","Αυτό το μεγάλο «Ως εδώ», μπορώ να βρω δεκάδες παραδείγματα για να το συνοδεύσω. Θα πω όμως τρία:
Ως εδώ με την αλαζονεία.
Ως εδώ με την αδιαφορία.
Ως εδώ με τη κοροϊδία.",,other,,other,,-0.7,,0.1,,,,0.2,,[],[]
21,"Because what else but a mockery is what we saw yesterday when Mr.Mitsotakis, who has been ruling the country for four years now and has destroyed the National Health System, finished what was left of the state, shrunk the income, but he comes out - and he hasn't ruled for a single day - and promises better salaries again, an efficient state, and free public health care. It's like the wolf coming out and promising to keep more sheep. That reminds me: the wolf guarding more sheep. So much for deception and so much for deceiving the Cretans.","Γιατί τι άλλο πέρα από κοροϊδία είναι αυτό που είδαμε και χτες να βγαίνει σε προεκλογικό σποτ ο κ. Μητσοτάκης ο οποίος κυβερνά 4 χρόνια τώρα τη χώρα και ρήμαξε το Εθνικό Σύστημα Υγείας, αποτελείωσε ό,τι είχε μείνει όρθιο από το κράτος, συρρίκνωσε το εισόδημα, αλλά να βγαίνει -λες και δεν κυβέρνησε ούτε μια μέρα- και να τάζει καλύτερους μισθούς ξανά, αποτελεσματικό κράτος, και τη δημόσια δωρεάν Υγεία. Είναι σαν να βγαίνει ο λύκος και να υπόσχεται ότι θα φυλάει περισσότερα πρόβατα. Αυτό μου θυμίζει εμένα: ο λύκος να φυλά περισσότερα  πρόβατα. Ως εδώ, λοιπόν με την εξαπάτηση και ως εδώ και με την εξαπάτηση των Κρητικών.",,health,,public health system,,-0.9,,0.9,,,,0.3,,[],"[['mr. mitsotakis', 'person', '1.0'], ['national health system', 'organization', '0.5'], ['the state', 'organization', '0.5'], ['cretans', 'group of people', '1.0.']]"
22,"Let me give you two typical examples that show how we understand problem solving and how Mr Mitsotakis, who is also a compatriot of yours and who is supposed to take care of Crete and Chania. In April '19, under the SYRIZA government, a protocol of cooperation was signed between the Ministry of National Defence and the Municipality of Chania, which provided for the concession of 54 acres of the Markopoulou Camp to the Municipality of Chania. On these 54 acres we had a plan to create, among other things, green spaces and infrastructure for sports, culture and social welfare. The transfer of the military installations to another site was then financed with EUR 1 300 000 and, under the agreement signed, it should have been completed within 15 months. The New Democracy Government not only failed to complete any agreement in 15 months, but broke every record: it managed to leave it incomplete for four years and only complete it this year. And what is Mr Mitsotakis doing now? He appears to the citizens of Chania with audacity, presenting as his own plan and his own project, what others worked out, others decided and others financed. And his only contribution was to delay it for four whole years.","Επιτρέψτε μου να αναφέρω δυο χαρακτηριστικά παραδείγματα, που δείχνουν πώς εμείς αντιλαμβανόμαστε τη λύση προβλημάτων και πώς ο κ. Μητσοτάκης, που είναι και συμπατριώτης σας και θα φρόντιζε, υποτίθεται, την Κρήτη και τα Χανιά. Τον Απρίλιο του ‘19, επί κυβέρνησης ΣΥΡΙΖΑ υπογράφηκε πρωτόκολλο συνεργασίας μεταξύ του υπουργείου Εθνικής Αμύνης και του Δήμου Χανίων, το οποίο προέβλεπε την παραχώρηση 54 στρεμμάτων του Στρατοπέδου Μαρκοπούλου στον Δήμο Χανίων. Στα 54 αυτά στρέμματα είχαμε σχέδιο να δημιουργήσουμε, μεταξύ άλλων, χώρους πρασίνου και υποδομές άθλησης, πολιτισμού και κοινωνικής πρόνοιας. Η δε μεταφορά των στρατιωτικών εγκαταστάσεων σε άλλο χώρο χρηματοδοτήθηκε τότε με 1.300.000 ευρώ και βάσει της συμφωνίας που υπογράφηκε θα έπρεπε να έχει ολοκληρωθεί μέσα σε 15 μήνες. Η κυβέρνηση της Νέας Δημοκρατίας όχι μόνο δεν ολοκλήρωσε καμία συμφωνία σε 15 μήνες, αλλά έσπασε κάθε ρεκόρ: κατάφερε να την αφήσει ανολοκλήρωτη τέσσερα χρόνια και να την ολοκληρώσει μόλις φέτος. Και τι κάνει τώρα ο κ. Μητσοτάκης; Εμφανίζεται στους πολίτες των Χανίων με θράσος, παρουσιάζοντας ως δικό του σχέδιο και δικό του έργο, αυτό που άλλοι επεξεργάστηκαν, άλλοι αποφάσισαν και άλλοι χρηματοδότησαν. Και η μόνη δική του συμβολή ήταν στο να το καθυστερήσει τέσσερα ολόκληρα χρόνια.",,other,,other,,-0.8,,0.1,,,,0.0,,[],"[['mr mitsotakis', 'person', '1.0'], ['syriza', 'political party', '1.0'], ['ministry of national defence', 'organization', '1.0'], ['municipality of chania', 'organization', '1.0'], ['crete', 'location', '1.0'], ['chania', 'location', '1.0'], ['markopoulou camp', 'location', '1.0'], ['eur', 'date', '1.0'], [""april '19"", 'date', '1.0'], ['four years', 'date', '1.0'], ['new democracy government', 'organization', '1.0']]"
