id,text,text_el,topic,topic-other-context,subtopic,topic-open,sentiment,polarization,polarization-definition,toxicity,toxicity-definition,populism,populism-definition,hate speech,ner,ner-limited
15," I believe that the tragic accident of Tempe - and today we are 40 days away from this tragic accident and we must say here today that we are not forgetting our fellow citizens, the young children who were unjustly lost, who took the train to go to their destination and never arrived - the tragedy of Tempe, well, I have the feeling that it has changed the way Greek society stands against the political system as a whole.  Easy propaganda is no longer easy to digest.  The whole governmental narrative of the regime has been thrown into the dustbin at once.  The so-called executive state that turned out in practice to be a broken state, the so-called excellent people who turned out to be useless, the so-called modernists who turned out to be anachronistic, plunged us into the oldest times of partisanship, family rule, favouritism and anarchy.  And above all, I think that this tragic accident has shown how false this whole mechanism of powerful propaganda is.  How rigged and hypocritical is the chief of staff of the staff state, who supposedly knew nothing and is not responsible for anything.  Everybody else in this country is responsible, we all have one responsibility, 10 million responsibilities, except one: The Prime Minister. "," Πιστεύω ότι το τραγικό δυστύχημα των Τεμπών –και σήμερα κλείνουμε 40 μέρες απ’ αυτό το τραγικό δυστύχημα και πρέπει να πούμε και σήμερα εδώ ότι δεν ξεχνάμε τους συμπολίτες μας, τα νέα παιδιά που άδικα χάθηκαν, που πήραν το τρένο να πάνε στον προορισμό τους και δεν έφτασαν ποτέ- η τραγωδία των Τεμπών, λοιπόν, έχω την αίσθηση ότι άλλαξε τον τρόπο που η ελληνική κοινωνία στέκεται απέναντι στο πολιτικό σύστημα συνολικά  Η εύκολη προπαγάνδα δεν είναι πια εύπεπτη  Όλο το καθεστωτικό κυβερνητικό αφήγημα, πήγε μεμιάς στον κάλαθο των αχρήστων  Το δήθεν επιτελικό κράτος που αποδείχτηκε στην πράξη ένα διαλυμένο κράτος σμπαραλιασμένο, οι δήθεν άριστοι που αποδείχτηκαν άχρηστοι, οι δήθεν εκσυγχρονιστές που αποδείχτηκαν αναχρονιστές, μας βύθισαν στις πιο παλιές εποχές του κομματισμού, της οικογενειοκρατίας, της ευνοιοκρατίας και της αναξιοκρατίας  Και κυρίως, νομίζω ότι αυτό το τραγικό δυστύχημα ανέδειξε πόσο ψεύτικος είναι τελικά όλος αυτός ο μηχανισμός της πανίσχυρης προπαγάνδας  Πόσο στημένος και υποκριτής είναι ο αρχιεπιτελάρχης του επιτελικού κράτους, που δήθεν τίποτα δεν ήξερε και δεν έχει ευθύνη για τίποτα  Όλοι οι άλλοι σ’ αυτή τη χώρα ευθύνονται, όλοι μας έχουμε από μια ευθύνη, 10 εκατομμύρια ευθύνες, εκτός από μία: Του πρωθυπουργού",accountability,accountability.,other,tempe tragedy,-0.6,0.78,0.2,0.2,0.3,0.7,0.1,0.0,"[['tempe', 'location', '1.0'], ['greek', 'society', '1.0'], ['political system', 'organization', '1.0'], ['greek citizens', 'person', '1.0'], ['children', 'person', '1.0'], ['train', 'object', '1.0'], ['tempe', 'tragedy', '1.0'], ['governmental narrative', 'organization', '1.0'], ['regime', 'organization', '1.0'], ['executive state', 'organization', '1.0'], ['modernists', 'organization', '1.0'], ['partisanship', 'concept', '1.0'], ['family rule', 'concept', '1.0'], ['favouritism', 'concept', '1.0'], ['anarchy', 'concept', '1.0'], ['tragic accident', 'event', '1.0'], ['powerful propaganda', 'concept', '1.0'], ['chief of staff', 'person', '1.0'], ['staff state', 'organization', '1.0'], ['prime minister', 'person', '1.0']]","[['tempe', 'location', '1.0'], ['greek society', 'group of people', '1.0'], ['political system', 'organization', '1.0'], ['governmental narrative', 'organization', '1.0'], ['regime', 'organization', '1.0'], ['executive state', 'organization', '0.75'], ['modernists', 'organization', '0.75'], ['partisanship', 'organization', '1.0'], ['anarchy', 'organization', '1.0'], ['chief of staff', 'person', '1.0'], ['prime minister', 'person', '1.0'], ['10 million', 'group of people', '0.5']]"
16," And so I think that today what is a pervasive feeling in Greek society is: enough with this propaganda and this hypocrisy.  This is the feeling that I get from talking, talking, walking among people.  And the crucial question now for our Central Committee, for SYRIZA, for every democratic citizen, is how this ""so far"" from a statement, from a feeling, will become an act of political change.  How to pave the way for change and progressive governance.  And I think we have a double task ahead of us. "," Κι έτσι νομίζω ότι σήμερα αυτό που είναι διάχυτο ως αίσθηση στην ελληνική κοινωνία είναι ένα: Φτάνει πια μ’ αυτή την προπαγάνδα και μ’ αυτή την υποκρισία  Αυτό είναι το αίσθημα που εγώ καταλαβαίνω συζητώντας, μιλώντας, περπατώντας μέσα στους ανθρώπους  Και το κρίσιμο ερώτημα τώρα για την Κεντρική μας Επιτροπή, για τον ΣΥΡΙΖΑ, για κάθε δημοκρατικό πολίτη, είναι πώς αυτό το “ως εδώ” από διαπίστωση, από συναίσθημα, θα γίνει πράξη πολιτικής αλλαγής  Πώς θα ανοίξει ο δρόμος για την αλλαγή και την προοδευτική διακυβέρνηση  Και νομίζω ότι έχουμε μπροστά μας ένα διπλό καθήκον",democracy,democracy,other,political change,0.0,0.1,0.2,0.0,0.0,0.1,0.0,0.0,"[['greek society', 'geopolitical entity', '1.0'], ['central committee', 'organization', '0.7'], ['syriza', 'organization', '0.6']]","[['greek society', 'group of people', '1.0'], ['central committee', 'organization', '1.0'], ['syriza', 'political party', '1.0'], ['citizen', 'person', '1.0'], ['political change', 'date', '1.0'], ['progressive governance', 'date', '1.0']]"
17," The first, to communicate our programme, to convince that things can be done differently.  That we have the plan and we can put an end to obscenity, devaluation, indifference, injustice, inequality.  And the second, that change can be made with one condition: the clear, unquestionable electoral victory of SYRIZA-Progressive Alliance in the upcoming elections of May 21.  So only if SYRIZA wins, and this is not an electoral or propaganda argument.  It reflects the truth of associations, the truth of life. "," Το πρώτο, να επικοινωνήσουμε το πρόγραμμά μας, να πείσουμε ότι τα πράγματα μπορούν να γίνουν αλλιώς  Ότι έχουμε το σχέδιο και μπορούμε να βάλουμε ένα τέλος στην αισχροκέρδεια, στην απαξίωση, στην αδιαφορία, στην αναξιοκρατία, στην αδικία  Και το δεύτερο, ότι η αλλαγή μπορεί να γίνει πράξη με μια προϋπόθεση: Την καθαρή, αδιαμφισβήτητη εκλογική νίκη του ΣΥΡΙΖΑ-Προοδευτική Συμμαχία στις επικείμενες εκλογές της 21ης του Μάη  Μόνο λοιπόν με νίκη του ΣΥΡΙΖΑ, κι αυτό δεν είναι ένα επιχείρημα ψηφοθηρικό ή προπαγανδιστικό  Αντανακλά την αλήθεια των συσχετισμών, την αλήθεια της ζωής",elections,elections,election spending,elections,0.4,0.2,0.1,0.1,0.0,0.25,0.5,0.0,"[['syriza-progressive alliance', 'org', 'high'], ['may 21', 'misc', 'medium'], ['syriza', 'org', 'high']]","[['syriza-progressive alliance', 'political party', '1.0'], ['may 21', 'date', '1.0']]"
18," There is no other way.  The Mitsotakis regime will be defeated if the New Democracy of Mr.  Mitsotakis defeated in this election.  And New Democracy will be defeated if SYRIZA- Progressive Alliance wins these elections, comes first in these elections.  It's simple things. "," Δεν υπάρχει άλλος τρόπος  Το καθεστώς Μητσοτάκη θα ηττηθεί αν η Νέα Δημοκρατία του κ  Μητσοτάκη ηττηθεί σ’ αυτές τις εκλογές  Και η Νέα Δημοκρατία θα ηττηθεί αν ο ΣΥΡΙΖΑ- Προοδευτική Συμμαχία κερδίσει αυτές τις εκλογές, έρθει πρώτος σ’ αυτές τις εκλογές  Είναι απλά τα πράγματα",elections,elections,election spending,elections,0.0,0.1,0.2,0.1,0.0,0.5,0.0,0.0,"[['mitsotakis', 'person', '0.75'], ['new democracy', 'organization', '1.0'], ['mitsotakis', 'person', '0.75'], ['new democracy', 'organization', '1.0'], ['syriza-progressive alliance', 'organization', '1.0']]","[['mitsotakis', 'person', '0.9'], ['new democracy', 'political party', '0.8'], ['syriza- progressive alliance', 'political party', '0.8'], ['elections', 'date', '0.6']]"
19," Only with the victory of SYRIZA will our people give a clear and strict mandate, I would say, not only to SYRIZA but to all progressive forces, for a progressive government of cooperation, now, on the next election day, on May 22.  Without the adventures of the chain of electoral contests proposed and pursued by Mr.  Mitsotakis. "," Μόνο με τη νίκη του ΣΥΡΙΖΑ ο λαός μας θα δώσει μια σαφή και αυστηρή, θα έλεγα, εντολή όχι μόνο στον ΣΥΡΙΖΑ αλλά σε όλες τις προοδευτικές δυνάμεις, για προοδευτική κυβέρνηση συνεργασίας, τώρα, την επόμενη μέρα των εκλογών, στις 22 του Μάη  Χωρίς τις περιπέτειες της αλυσίδας εκλογικών αναμετρήσεων που προτείνει και επιδιώκει ο κ  Μητσοτάκης",elections,elections,election spending,election,0.5,0.65,0.2,0.2,0.2,0.2,0.1,0.0,"[['syriza', 'org', '1.0'], ['mitsotakis', 'per', '1.0'], ['may 22', 'misc', '1.0']]","[['1. syriza', 'organization', '1.0'], ['2. mitsotakis', 'person', '1.0'], ['3. greece', 'country', '1.0'], ['4. may 22', 'date', '1.0']]"
20," This is only the only way to change, for a long-lasting government with an unprecedented level of popular support.  It is also the only path to political and social stability.  The path of unity of our people in the common effort for the common good.  The right wing invokes the fact that the leaderships of the democratic parties refuse this prospect.  And this becomes an argument to convince not that a government working together for change is a negative development, but that it is an impossible development.  We answer: Why everyone declares what they declare, as they declare it, before the elections, trying to gain as much popular influence as possible, is understandable.  The election is a competitive process.  And that's fine. "," Αυτός είναι μόνο ο μόνος δρόμος προς την αλλαγή, για μια κυβέρνηση μακράς πνοής, που θα διαθέτει μια πρωτοφανή σε έκταση λαϊκή στήριξη  Είναι και ο μόνος δρόμος της πολιτικής και κοινωνικής σταθερότητας  Ο δρόμος της ενότητας του λαού μας στην κοινή προσπάθεια για το κοινό καλό  Η Δεξιά επικαλείται το γεγονός ότι οι ηγεσίες των δημοκρατικών κομμάτων αρνούνται αυτή την προοπτική  Κι αυτό γίνεται επιχείρημα για να πείσει όχι ότι η κυβέρνηση συνεργασίας για την αλλαγή είναι αρνητική εξέλιξη, αλλά ότι είναι αδύνατη εξέλιξη  Απαντάμε: Το γιατί δηλώνουν όσα δηλώνουν, όπως τα δηλώνουν, οι πάντες πριν από τις εκλογές, προσπαθώντας να κερδίσουν όσο γίνεται μεγαλύτερη λαϊκή επιρροή, είναι εύλογο  Η εκλογική αναμέτρηση είναι μια ανταγωνιστική διαδικασία  Και καλώς είναι έτσι",political parties,political parties,other,unity in government,0.0,0.1,0.2,0.1,0.0,0.1,0.0,0.0,[],"[['government', 'organization', '0.7'], ['democratic parties', 'political party', '0.5'], ['unity', 'group of people', '0.5'], ['right wing', 'group of people', '0.5'], ['elections', 'date', '0.5']]"
21," But what is overlooked by those who propagate this view.  They overlook one fact: what lies between the pre-election statements and the post-election decisions, which is the popular verdict, the election result itself.  This is overlooked.  And it's not unimportant at all. "," Τι παραβλέπουν όμως όσοι διακινούν αυτή την άποψη  Παραβλέπουν ένα γεγονός: Αυτό που μεσολαβεί ανάμεσα στις προεκλογικές δηλώσεις και στις μετεκλογικές αποφάσεις, που είναι η λαϊκή ετυμηγορία, το ίδιο το εκλογικό αποτέλεσμα  Αυτό παραβλέπουν  Και δεν είναι καθόλου ασήμαντο",elections,democracy,election spending,elections,0.0,0.0,0.0,0.0,0.0,0.0,0.0,0.0,[],"[['election result', 'date', '1.0']]"
22," The sovereign people and their democratically expressed mandate.  So we must ask for this mandate with honesty, with sincerity, not only on our own behalf, but on behalf of a necessary change, political and social, and a necessary new governance, progressive governance.  And I want to take my thinking a step further here. "," Τον κυρίαρχο λαό και τη δημοκρατικά εκφρασμένη εντολή του  Αυτή την εντολή λοιπόν πρέπει να τη ζητήσουμε με ευθύτητα, με ειλικρίνεια, για λογαριασμό όχι μόνο δικό μας, αλλά για λογαριασμό μιας αναγκαίας αλλαγής, πολιτικής και κοινωνικής και μιας αναγκαίας νέας διακυβέρνησης, προοδευτικής διακυβέρνησης  Κι εγώ θέλω να πάω κι ένα βήμα παραπάνω τη σκέψη μου εδώ",democracy,democracy,other,democracy,0.5,0.1,0.2,0.2,0.0,0.4,0.0,0.0,"[['sovereign people', 'organization', '0.5'], ['mandate', 'person', '0.3'], ['governance', 'organization', '0.4'], ['political', 'other', '0.2'], ['social', 'other', '0.2'], ['progressive governance', 'organization', '0.4']]","[['sovereign people', 'group of people', '0.75', 'democratically expressed mandate', 'group of people', '0.75', 'progressive governance', 'organization', '0.75']]"
23," Let me ask myself: If the result that we are asking for comes about, if the conditions are formed with a victory for Syriza and therefore the conditions are formed not only politically, morally, but also in terms of numbers that will give the possibility of forming a government of progressive forces, which leadership, which democratic party will be the one that will decide to ignore this will?  And I wonder again: Which leadership of which democratic party will be the one to decide to ignore this will of the people for the great political change?  Which leadership of which political party will be the one that will decide to bear the cost for the country, but also the cost for itself, of a series of electoral contests that New Democracy is seeking, but which will certainly not be positive for the Greek people. "," Να αναρωτηθώ: Αν έρθει αυτό το αποτέλεσμα που ζητάμε, αν διαμορφωθούν οι συνθήκες με νίκη του ΣΥΡΙΖΑ και άρα διαμορφωθούν όχι μόνο πολιτικά, ηθικά, αλλά και σε επίπεδο αριθμών οι συνθήκες που θα δίνουν τη δυνατότητα σχηματισμού κυβέρνησης προοδευτικών δυνάμεων, ποια ηγεσία, ποιου δημοκρατικού κόμματος θα είναι αυτή που θ’ αποφασίσει να αγνοήσει αυτή τη θέληση  Και αναρωτιέμαι και πάλι: Ποια ηγεσία ποιου δημοκρατικού κόμματος θα είναι αυτή που θα αποφασίσει να αγνοήσει αυτή τη θέληση του λαού για τη μεγάλη πολιτική αλλαγή  Ποια ηγεσία ποιου πολιτικού κόμματος θα είναι αυτή που θα αποφασίσει να επωμιστεί το κόστος για τη χώρα, αλλά και το κόστος για την ίδια, μιας σειράς εκλογικών αναμετρήσεων που επιδιώκει η Νέα Δημοκρατία, αλλά που σίγουρα δεν θα είναι θετικές για τον ελληνικό λαό",elections,political parties,election spending,greek elections,0.0,0.3,0.2,0.1,0.0,0.2,0.0,0.0,"[['syriza', 'organization', '1.0'], ['new democracy', 'organization', '1.0'], ['greek', 'nationality', '0.5']]","[['syriza', 'organization', '1.0'], ['new democracy', 'organization', '1.0'], ['greek', 'country', '1.0']]"
24," So that is why we insist and will insist until election Sunday.  But in order to put into practice, comrades, this ""so far"" that is coming from the whole Greek society, we must at the same time decide on the direction of.  Not only ""to here"" but also ""to where"". "," Γι` αυτό λοιπόν επιμένουμε και θα επιμείνουμε ως την Κυριακή των εκλογών  Για να γίνει όμως πράξη, συντρόφισσες και σύντροφοι αυτό το “ως εδώ” που βγαίνει απ’ όλη την ελληνική κοινωνία, πρέπει ταυτόχρονα να γίνει απόφαση και το προς τα πού  Όχι μόνο το “ως εδώ” αλλά και το “προς τα πού”",elections,elections,other,greek election,0.0,0.0,0.0,0.0,0.0,0.0,0.0,0.0,"[['greek', 'society', 'election sunday', 'comrades', '']]","[['1. greek society', 'group of people', '0.8'], ['2. comrades', 'group of people', '0.5'], ['3. greece', 'country', '0.6']]"
25," Decision and action by the citizens' vote.  ""So far"" is only possible with a strong decision in which direction: Towards change.  Towards a progressive government of cooperation.  Which is only guaranteed by the victory of SYRIZA in the elections.  So the ""so far"" is only put into practice with the decision ""towards the ballot papers and victory for SYRIZA-Progressive Alliance"".  This should be our message to citizens.  I know and we know, of course, that in this battle we are not only facing Mr. "," Απόφαση και πράξη με τη ψήφο των πολιτών  Το “ως εδώ” γίνεται πράξη μόνο με ισχυρή απόφαση προς τα πού: Προς την αλλαγή  Προς την προοδευτική κυβέρνηση συνεργασίας  Που διασφαλίζεται μόνο με τη νίκη του ΣΥΡΙΖΑ στις εκλογές  Άρα το “ως εδώ” γίνεται πράξη μόνο με την απόφαση “προς τα ψηφοδέλτια και τη νίκη για τον ΣΥΡΙΖΑ-Προοδευτική Συμμαχία”  Αυτό πρέπει να είναι το μήνυμά μας στους πολίτες  Ξέρω και ξέρουμε, βέβαια, ότι σε αυτή τη μάχη δεν έχουμε να αντιμετωπίσουμε μόνο τον κ",elections,elections,election spending,election/ voting,0.5,0.65,0.2,0.1,0.1,0.25,0.0,0.0,"[['syriza', 'political party', '1.0'], ['progressive alliance', 'political alliance', '0.9']]","[['syriza', 'organization', '1.0'], ['progressive alliance', 'group of people', '0.9'], ['mr.', 'person', '0.6']]"
26," Mitsotakis, his propaganda and his actions.  But we also have to deal with all those who despise and fear, even, and the slogan that we have here: ""Justice Everywhere"".  All those who despise and fear it, because they have powerful interests.  And they don't want justice. "," Μητσοτάκη, την προπαγάνδα του και τα πεπραγμένα του  Αλλά έχουμε να αντιμετωπίσουμε και όλους εκείνους που απεχθάνονται και φοβούνται, ακόμα, και το σύνθημα που έχουμε εδώ: Το «Δικαιοσύνη Παντού»  Όλους αυτούς που το απεχθάνονται και φοβούνται, διότι έχουν συμφέροντα ισχυρά  Και δεν θέλουν τη δικαιοσύνη",justice,justice,injustice,justice,-0.8,0.8,0.5,0.2,0.6,0.75,0.5,0.2,"[['mitsotakis', 'person', '0.89'], ['justice everywhere', 'organization', '0.65']]","[['mitsotakis', 'person', '0.9'], ['justice everywhere', 'group of people', '0.9'], ['here', 'location', '0.6']]"
27," The oligarchy of corruption, all those who have supported the regime we live in today, who consider it their property.  And I refer not only to interests but also to parts at the top of the state pyramid, which are intertwined with them.  In short, we are not only facing Mr. "," Την ολιγαρχία της διαφθοράς, όλους εκείνους που έχουν στηρίξει αυτό το καθεστώς που ζούμε σήμερα, το θεωρούν ιδιοκτησία τους  Και αναφέρομαι όχι μόνο σε συμφέροντα αλλά και σε τμήματα στην κορυφή της κρατικής πυραμίδας, που διαπλέκονται μαζί τους  Με δυο λόγια, δεν έχουμε απέναντί μας μόνο τον κ",corruption,corruption.,corruption,corruption,-0.9,0.95,0.8,0.8,0.6,0.6,0.8,0.1,"[['none', 'none', 'none']]","[['regime', 'organization', '0.6'], ['oligarchy', 'group of people', '0.7'], ['state pyramid', 'organization', '0.4']]"
