id,text,text_el,topic,subtopic,topic-open,sentiment,polarization,polarization-definition,toxicity,toxicity-definition,populism,populism-definition,hate speech,ner,ner-limited
49,"We will put an end to those obstacles that block the way, block young people, lock the doors of universities to thousands of young people and have led almost all the universities in the region to decline.  We will change, yes.  We will abolish the university police.  Why we want to appoint teachers in schools and not police officers.  Police officers will return to the neighbourhoods to protect against organised crime. ","Θα βάλουμε τέρμα, στα εμπόδια εκείνα που κλείνουν το δρόμο, βάζουν φραγμό στους νέους ανθρώπους που κλειδώνουν τις πόρτες των ΑΕΙ σε χιλιάδες νέα παιδιά και έχουν οδηγήσει σχεδόν όλα τα πανεπιστημιακά Ιδρύματα της Περιφέρειας σε παρακμή  Θ’ αλλάξουμε εμείς, ναι  Θα καταργήσουμε την πανεπιστημιακή αστυνομία  Γιατί εμείς θέλουμε να διορίζουμε καθηγητές στα σχολεία και όχι αστυνομικούς  Οι αστυνομικοί θα γυρίσουν στις γειτονιές για να προστατεύουν  από το οργανωμένο έγκλημα",education,higher education,education,0.5,0.1,0.0,0.2,0.1,0.2,0.0,0.0,"[['universities', 'organization', '1.0'], ['region', 'location', '0.9'], ['university police', 'organization', '1.0'], ['schools', 'organization', '1.0'], ['police officers', 'occupation', '1.0'], ['neighbourhoods', 'location', '1.0'], ['organized crime', 'crime', '1.0']]","[['universities', 'organization', '0.8'], ['region', 'location', '0.9'], ['university police', 'organization', '0.7'], ['teachers', 'group of people', '0.8'], ['police officers', 'group of people', '0.8'], ['neighbourhoods', 'location', '0.7'], ['organized crime', 'group of people', '0.7']]"
50,"And, of course, we will put an end to the downward spiral, the downward slide, the dismantling, the privatisation of the NHS.  Because without a strong NHS, there can be no sense of security in Greek society.  We will also put an end to the institutional devaluation of people of culture and the downgrading of their degrees.  The institutionalisation of the violation of the confidentiality of communications.  In violation of rights. But what's about ending the negative effects of the laws that have been passed over these four years, what's about what we're going to repeal, is only the first chapter in our plan.  Because the next, many more chapters are not about what to stop, what to permanently remove from our lives, but about what to create.  They have to do with what we build, they have to do with what we build.  And what we want to build is step by step to make our vision of justice everywhere a reality.  And let me tell you today, as succinctly as I can, what this vision that we have, what our vision means.  what justice means everywhere, what justice means in our everyday life, what can change in our lives. First of all, justice in society for us means and we will put it into practice from the very first days of the progressive government: immediate and drastic measures to fight against inexactness, to put an end to obscenity. ","Και βεβαίως, θα βάλουμε ένα τέρμα στην καθοδική πορεία, στην κατρακύλα, στη διάλυση, στην ιδιωτικοποίηση του ΕΣΥ  Γιατί χωρίς ισχυρό ΕΣΥ, δεν μπορεί να υπάρχει αίσθημα ασφάλειας στην ελληνική κοινωνία  Θα βάλουμε επίσης ένα τέρμα, στη θεσμική απαξίωση των ανθρώπων του πολιτισμού και την υποβάθμιση των πτυχίων τους  Στη θεσμοθέτηση της παραβίασης του απόρρητου των επικοινωνιών  Στην παραβίαση των δικαιωμάτων Αυτά όμως που αφορούν τον τερματισμό των αρνητικών επιπτώσεων νόμων που ψήφισαν αυτά τα 4 χρόνια, αυτά που αφορούν στο τι θα καταργήσουμε, είναι μονάχα το πρώτο κεφάλαιο στο σχέδιό μας  Γιατί τα επόμενα, πολλά περισσότερα κεφάλαια δεν έχουν να κάνουν με το τι θα σταματήσουμε, με το τι οριστικά θα αφαιρέσουμε από τη ζωή μας, αλλά έχουν να κάνουν με το τι θα δημιουργήσουμε  Έχουν να κάνουν με το τι θα οικοδομήσουμε, έχουν να κάνουν με το τι θα χτίσουμε  Και αυτό που θέλουμε να χτίσουμε είναι βήμα-βήμα να κάνουμε πράξη το όραμά μας  για δικαιοσύνη παντού  Και επιτρέψτε μου να σας πω σήμερα όσο πιο περιεκτικά μπορώ, τι σημαίνει αυτό το όραμα που έχουμε, τι σημαίνει το όραμά μας  τι σημαίνει δικαιοσύνη παντού, τι σημαίνει δικαιοσύνη στην καθημερινότητά μας, τι μπορεί ν’ αλλάξει στη ζωή μας Πρώτα απ’ όλα, δικαιοσύνη στην κοινωνία για μας σημαίνει και θα το κάνουμε πράξη από τις πρώτες κιόλας μέρες της προοδευτικής διακυβέρνησης: Άμεσα και δραστικά μέτρα για να καταπολεμήσουμε την ακρίβεια, για  να μπει τέλος στην αισχροκέρδεια",health,privatization of healthcare,nhs and societal justice,0.5,0.2,0.5,0.1,0.2,0.1,0.0,0.0,"[['nhs', 'organization', '1.0'], ['greek', 'nationality', '1.0']]","[['nhs', 'organization', '1.0'], ['greek society', 'group of people', '0.8'], ['institutional devaluation of people of culture', 'organization', '1.0'], ['institutionalisation of the violation of the confidentiality of communications', 'organization', '0.9'], ['rights', 'group of people', '0.5'], ['laws', 'organization', '0.5'], ['first chapter', 'date', '0.5'], ['vision of justice', 'organization', '1.0'], ['society', 'location', '0.5'], ['progressive government', 'organization', '0.8'], ['inexactness', 'group of people', '0.6'], ['obscenity', 'group of people', '0.6']]"
51," How.  First of all, with the nationalisation of the PPC and the ridding of the unqualified who have turned it into a tool of speculation.  By protecting vulnerable consumers from power cuts.  By imposing a cap on the wholesale and retail price of electricity and retail pricing of gas and oil products. Because we believe that justice, when we go through a crisis, is for everyone to back up.  Not some people making billions and the vast majority of the Greek people not being able to make it through the month. "," Πώς  Πρώτα απ’ όλα, με την κρατικοποίηση της ΔΕΗ και την απαλλαγή της από τους αρίστους που την έχουν μετατρέψει σε εργαλείο κερδοσκοπίας  Με την προστασία των ευάλωτων καταναλωτών από τις αποκοπές ρεύματος  Με την επιβολή πλαφόν στην τιμή χονδρικής και λιανικής ηλεκτρικής ενέργειας και τη διατίμηση στη λιανική του φυσικού αερίου και των πετρελαιοειδών Γιατί εμείς πιστεύουμε, ότι δικαιοσύνη είναι, όταν περνάμε μια κρίση, όλοι να βάζουμε πλάτη  Όχι κάποιοι να βγάζουν δισεκατομμύρια και η μεγάλη πλειοψηφία  του ελληνικού λαού να μην μπορεί να βγάλει το μήνα",privatization,nationalization,energy policy,0.5,0.1,0.0,0.1,0.0,0.6,0.2,0.0,"[['ppc', 'organization', '0.9'], ['greek', 'nationality', '1.0']]","[['ppc', 'organization', '0.9'], ['greek people', 'group of people', '0.8'], ['greece', 'country', '0.8']]"
52," But what does justice at work mean?  Justice in work and in wages means: An increase in the minimum wage in the private sector to 880 euros, from the very first days of government.  And the introduction of the Automatic Price Indexation on an annual basis. "," Τι σημαίνει όμως δικαιοσύνη στην εργασία  Δικαιοσύνη στην εργασία και στο μισθό, σημαίνει: Αύξηση του κατώτατου μισθού στον ιδιωτικό τομέα στα 880 ευρώ, από τις πρώτες κιόλας μέρες της διακυβέρνησης  Και η θεσμοθέτηση της Αυτόματης Τιμαριθμικής Αναπροσαρμογής σε ετήσια βάση",employment,wages,workplace justice,0.0,0.0,0.0,0.0,0.0,0.2,0.0,0.0,"[['justice', 'org', '0.9'], ['automatic price indexation', 'misc', '0.8']]","[['automatic price indexation', 'organization', '0.6'], ['private sector', 'group of people', '0.4'], ['government', 'organization', '0.4'], ['minimum wage', 'political party', '0.2 (note: this could also be considered an organization or a policy', 'but political party is also a valid choice)'], ['euros', 'date', '0.1 (note: this could also be considered a currency', 'but date is also a valid choice)']]"
53," It means raising the salaries of all civil servants by 10%, as much as inflation in the last year, because they haven't seen increases since before the memoranda. Justice at work means the introduction of a mechanism for the unfreezing of triennials and for indexation in the private sector as well.  It means the restoration of collective labour agreements.  It means the re-establishment of the Labour Inspectorate.  It means restoring the 8-hour week and abolishing unpaid overtime. "," Σημαίνει αύξηση των μισθών όλων των δημοσίων υπαλλήλων κατά 10%, όσο ο πληθωρισμός τον τελευταίο χρόνο, γιατί έχουν να δουν αυξήσεις πριν από τα μνημόνια Δικαιοσύνη στην εργασία σημαίνει  τη θέσπιση μηχανισμού για το ξεπάγωμα των τριετιών αλλά και για την τιμαριθμική αναπροσαρμογή και στον ιδιωτικό τομέα  Σημαίνει επαναφορά των συλλογικών συμβάσεων εργασίας  Σημαίνει επανίδρυση του Σώματος Επιθεώρησης Εργασίας  Σημαίνει επαναφορά του 8ωρου και κατάργηση των απλήρωτων υπερωριών",employment,workers' rights,labor rights,1.0,0.2,0.0,0.1,0.0,0.4,0.0,0.0,"[['civil servants', 'organization', '0.8'], ['inflation', 'concept', '0.6'], ['memoranda', 'organization', '0.5'], ['justice', 'organization', '0.5'], ['triennials', 'concept', '0.4'], ['indexation', 'concept', '0.4'], ['private sector', 'organization', '0.5'], ['collective labour agreements', 'concept', '0.5'], ['labour inspectorate', 'organization', '0.6'], ['8-hour week', 'concept', '0.6'], ['unpaid overtime', 'concept', '0.5']]","[['1. civil servants', 'group of people', '0.8'], ['2. justice', 'organization', '0.5'], ['3. triennials', 'date', '0.3'], ['4. private sector', 'group of people', '0.4'], ['5. labour inspectorate', 'organization', '0.6'], ['6. 8-hour week', 'date', '0.5']]"
54,"But what does justice in the economy mean in general?  Justice in the economy means that from the very first days, we will introduce a tax-free rate of 10. 000 for all: Freelancers, employees, pensioners, farmers, block workers.  Justice in the economy means reducing VAT on foodstuffs to the lowest rate, as has been done in Spain.  And a reduction in fuel excise duties to the lowest rate provided by the European Union. ","Τι σημαίνει όμως γενικότερα δικαιοσύνη στην οικονομία  Δικαιοσύνη στην οικονομία σημαίνει ότι από τις πρώτες κιόλας μέρες, θα θεσπίσουμε το αφορολόγητο στις 10 000 ευρώ για όλους: Ελεύθερους επαγγελματίες, μισθωτούς, συνταξιούχους, αγρότες, εργαζόμενους με μπλοκάκι  Δικαιοσύνη στην οικονομία σημαίνει μείωση του ΦΠΑ στα τρόφιμα στο χαμηλότερο συντελεστή, όπως έχει γίνει στην Ισπανία  Και μείωση των ΕΦΚ στα καύσιμα στον κατώτερο συντελεστή που προβλέπει η Ευρωπαϊκή Ένωση",economy,tax cuts,economic justice,0.6,0.0,0.0,0.0,0.0,0.5,0.0,0.0,"[['spain', 'location', '0.5'], ['european union', 'organization', '0.5']]","[['spain', 'location', '0.5'], ['european union', 'organization', '0.5']]"
55," It finally means the abolition of the business tax.  It means protecting the first home, agricultural land and commercial property from auctions.  It means 120 instalments and a haircut on the basic debt for public debts. "," Σημαίνει τέλος, κατάργηση του τέλους επιτηδεύματος  Σημαίνει προστασία της πρώτης κατοικίας, της αγροτικής γης και της επαγγελματικής στέγης από τους πλειστηριασμούς  Σημαίνει 120 δόσεις και κούρεμα βασικής οφειλής για τα χρέη στο Δημόσιο",debt,bank regulations,tax reform,0.5,0.0,0.0,0.0,0.0,0.5,0.0,0.0,"[['the business tax', 'organization', '0.69'], ['first home', 'location', '0.95'], ['agricultural land', 'location', '0.88'], ['commercial property', 'location', '0.73'], ['120 instalments', 'number', '0.61'], ['basic debt', 'law', '0.47'], ['public debts', 'law', '0.84']]",[]
56," It means rules in the operation of funds and a public pillar in our banking system. Let me explain a little bit what I mean: Governments, my friends, are not subservient to the banks.  Governments are not for ministers to come out and pretend to be puppets and say ""we exchanged binges with the bankers"".  Governments are there to legislate and enforce laws, even on bankers. "," Σημαίνει κανόνες στη λειτουργία των funds και δημόσιος πυλώνας στο τραπεζικό μας  σύστημα Επιτρέψτε μου να εξηγήσω λίγο τι εννοώ: Οι κυβερνήσεις, φίλες και φίλοι, δεν είναι  υποχείρια των τραπεζών  Οι κυβερνήσεις δεν είναι για να βγαίνουν οι Υπουργοί και να κάνουν δήθεν τα κουτσαβάκια και να λένε «ανταλλάξαμε μπινελίκια με τους τραπεζίτες»  Οι κυβερνήσεις είναι για να νομοθετούν και να επιβάλλουν τους νόμους, ακόμα και στους τραπεζίτες",accountability,bank regulations,banking regulations,0.0,0.2,0.0,0.1,0.2,0.2,0.0,0.0,"[['governments', 'organization', '0.82'], ['banks', 'organization', '0.53'], ['ministers', 'person', '0.6']]","[['governments', 'organization', '0.85'], ['ministers', 'person', '0.7'], ['bankers', 'group of people', '0.8']]"
57, So our position towards the Banks is clear.  Lately they've been making excess profits.  Why. ," Η θέση μας λοιπόν απέναντι στις Τράπεζες, είναι καθαρή  Το τελευταίο διάστημα έχουν υπερκέρδη  Γιατί",other,banking profits,bank profits,-0.4,0.0,0.0,0.1,0.0,0.2,0.0,0.0,[],[]
58," Why they are keeping deposit rates stuck and have gone to hell with lending rates.  And those who have taken out a loan, with variable interest rate it can be even 200, 250 euros, it can go up to 300.  In a time of frightening prices, when everything is getting more expensive around us. "," Γιατί κρατάνε καθηλωμένα τα επιτόκια των καταθέσεων κι έχουν πάει στο θεό τα επιτόκια των χορηγήσεων  Και όποιοι έχουν πάρει ένα δάνειο, με κυμαινόμενο επιτόκιο αυτό μπορεί να έχει ακριβύνει ακόμα και 200, 250 ευρώ, μπορεί να πάει και 300  Σε μια εποχή τρομακτικής ακρίβειας, που όλα ακριβαίνουν γύρω μας",economy,interest rates,interest rates,-0.7,0.8,0.1,0.6,0.2,0.8,0.2,0.0,"[['deposit rates', 'term', '1.0'], ['lending rates', 'term', '1.0']]",[]
59," This is not tolerable, it cannot be tolerated by Banks that are alive, because the Greek taxpayer has given his blood to be alive.  With three recapitalisations and the so-called deferred tax.  So, what we are clearly saying that we are going to introduce is an extraordinary tax for the banks in order to raise the money needed to support consumers who currently have a variable rate loan. And at the same time we will legislate to implement substantial regulations - a breathing space for borrowers.   We will also not allow the full privatisation of the National Bank.  Because we aim to transform the National Bank into what its name says: National Bank.  Public pillar of the banking system.  So we will prevent harmonized practices, we will direct financial instruments to the real economy, on the basis of the national development strategy, we will implement a public interest oriented policy for the management of red loans, and we will establish a specific regulatory framework for the transparency of banking transactions and for the operation of the so-called Claims Management Companies, the so-called servicers who are currently chasing citizens to eat their marrow and to make auctions. Because fairness in the economy, my friends, means that everyone should have access to bank finance, not just the big and powerful.  Today, 96% of businesses in our country, small and medium-sized enterprises, cannot even pass through a banking institution. "," Αυτό δεν είναι ανεκτό, δεν μπορεί να είναι ανεκτό από Τράπεζες οι οποίες είναι στη ζωή, γιατί ο Έλληνας φορολογούμενος έχει δώσει το αίμα του για να είναι στη ζωή  Με τρεις ανακεφαλοποιήσεις και με το λεγόμενο αναβαλλόμενο φόρο  Άρα λοιπόν, αυτό που καθαρά λέμε ότι θα θεσπίσουμε, είναι έναν έκτακτο φόρο για τις Τράπεζες  προκειμένου να μαζέψουμε τα χρήματα που χρειάζονται για να ενισχυθούν οι καταναλωτές που σήμερα έχουν δάνειο με κυμαινόμενο επιτόκιο Και ταυτόχρονα θα νομοθετήσουμε ώστε να εφαρμόσουν ουσιαστικές ρυθμίσεις- ανάσα για τους δανειολήπτες   Δεν θα επιτρέψουμε επίσης την  πλήρη ιδιωτικοποίηση της Εθνικής Τράπεζας  Γιατί εμείς έχουμε στόχο να μετατρέψουμε την Εθνική Τράπεζα σε αυτό που λέει τ’ όνομά της: Εθνική  Δημόσιο πυλώνα του τραπεζικού συστήματος  Έτσι θα αποτρέπουμε τις εναρμονισμένες πρακτικές, θα κατευθύνουμε τα χρηματοδοτικά εργαλεία στην πραγματική οικονομία, στη βάση της εθνικής αναπτυξιακής στρατηγικής, θα εφαρμόσουμε πολιτική προσανατολισμένη στο δημόσιο συμφέρον για τη διαχείριση των κόκκινων δανείων,  και θα θεσπίσουμε ειδικό ρυθμιστικό πλαίσιο για τη διαφάνεια των τραπεζικών συναλλαγών και για τη λειτουργία των λεγόμενων Εταιριών Διαχείρισης Απαιτήσεων, των  λεγόμενων servicers που σήμερα κυνηγάνε τους πολίτες να τους φάνε το μεδούλι και να κάνουν πλειστηριασμούς Γιατί, η δικαιοσύνη στην οικονομία, φίλες και φίλοι, σημαίνει να έχουν όλοι τη δυνατότητα σε τραπεζική χρηματοδότηση και όχι μόνο οι μεγάλοι και οι ισχυροί  Σήμερα, το 96% των επιχειρήσεων στον τόπο μας, οι μικρές και μεσαίες επιχειρήσεις δηλαδή, δεν μπορούν να περάσουν ούτε έξω από ένα τραπεζικό Ίδρυμα",economy,bank regulations,banking regulations,-0.4,0.2,0.0,0.2,0.0,0.3,0.0,0.0,"[['banks', 'organization', '0.80'], ['greek', 'nationality', '0.80'], ['national bank', 'organization', '0.80'], ['public', 'organization', '0.60'], ['national development strategy', 'organization', '0.80'], ['claims management companies', 'organization', '0.80']]","[['banks', 'organization', '1.0'], ['greek taxpayer', 'group of people', '0.7'], ['consumers', 'group of people', '0.8'], ['national bank', 'organization', '1.0'], ['borrowers', 'group of people', '0.7'], ['red loans', 'organization', '0.8'], ['claims management companies', 'organization', '0.6'], ['servicers', 'organization', '0.7'], ['citizens', 'group of people', '0.7'], ['economy', 'organization', '0.6'], ['businesses', 'group of people', '0.8'], ['small and medium-sized enterprises', 'group of people', '0.9'], ['banking institution', 'organization', '0.7']]"
60," While 4% take out and take out and take out loans. So, this will end with a progressive government.  Because, fairness in the economy means that everyone has equal access to finance, it means that everyone can have a fair arrangement on their loan and not just the Papathanases, to cut their loans and the vast majority of the Greek people can't afford to pay for the auctions and the persecutions. This is justice in the economy.  But we also want to bring justice to pensions.  For retired people, for the workers. "," Ενώ το 4% παίρνει και ξαναπαίρνει και ξαναπαίρνει δάνεια Αυτό λοιπόν, θα τελειώσει με μια προοδευτική διακυβέρνηση  Διότι, δικαιοσύνη στην οικονομία σημαίνει  όλοι να έχουν ίση πρόσβαση στη χρηματοδότηση, σημαίνει να μπορεί ο καθένας να έχει μια δίκαιη ρύθμιση  στο δάνειό του και όχι μόνο οι λογής Παπαθανάσηδες, να κουρεύουν τα δάνειά τους και η μεγάλη πλειοψηφία του ελληνικού λαού να μην μπορεί ν’ αντέξει από τους πλειστηριασμούς και τις διώξεις Αυτό είναι δικαιοσύνη στην οικονομία  Όμως, θέλουμε να φέρουμε και τη δικαιοσύνη στις συντάξεις  Για τους συνταξιούχους, για τους απόμαχους της εργασίας",economy,pensions,economy,0.5,0.25,0.1,0.1,0.2,0.5,0.2,0.0,"[['greek', 'nationality', '1.0'], ['papathanases', 'person', '0.5']]","[['papathanases', 'organization', '1.0'], ['greek people', 'group of people', '1.0'], ['greece', 'country', '0.5']]"
