id,text,text_el,topic,topic-context,subtopic,subtopic-context,topic-open,sentiment,polarization,polarization-definition,toxicity,toxicity-definition,populism,populism-definition,hate speech,ner,ner-limited
59,"However, I have to say something about yesterday I was very annoyed with what happened in Mykonos. They grounded you, beat up an archaeologist savagely because the man went to protect the archaeological site.  He can't even talk in here. ","Πάντως να πω και κάτι για χθες ενοχλήθηκα πάρα πολύ με αυτά που έγιναν στη Μύκονο Εδάρη σε εδάρησαν, έδειραν άγρια αρχαιολόγο γιατί ο άνθρωπος πήγε να προστατεύσει τον αρχαιολογικό χώρο  Δεν μπορεί καν να μιλάει εδώ μέσα",other,,other,,assault,-0.5,0.8,0.0,0.3,0.1,0.1,0.0,0.0,"[['mykonos', 'location', '0.85'], ['archaeologist', 'profession', '0.7'], ['archaeological site', 'location', '0.6']]","[['mykonos', 'location', '0.6'], ['archaeologist', 'person', '0.7'], ['archaeological site', 'location', '0.6']]"
60,"The pimps of Myconu have been operating for decades. I'm going to say something to the government. Cameras that were to be put all over the island, as you were saying, where did they go from the year before last, you would say the state-of-the-art short in the police station. ","Η νταβατζήδες της μυκόνου λειτουργούν εδώ και δεκαετίες Θα πω κάτι στην κυβέρνηση Κάμερες που ήταν να μπουν σε όλο το νησί, όπως λέγατε, πού πήγανε από πρόπερσι θα λέγατε το υπερσύγχρονο κοντός στο αστυνομικό τμήμα",corruption,,police violence,,prostitution,-0.6,0.1,0.0,0.1,0.8,0.0,0.0,0.0,"[['myconu', 'location', '0.95'], ['government', 'organization', '0.7'], ['cameras', 'product', '0.6']]","[['myconu', 'location', '1.0'], ['government', 'organization', '0.5'], ['island', 'location', '0.8'], ['police station', 'organization', '0.7']]"
61," What happened.  2 years we have been listening to this for 2 years, why don't we go in and out to see who is beating whom to threaten any of the Mykonos mafia or the batsmen? Why don't you do something and did meeting Prime Minister again meeting, you know.  They get together and talk about it, they say that his ministers are leaving, we will have ministries, ministries 2 years ago you said that and it still hasn't happened, Mr. The next 4 years. Please stand by your earpiece the next 4 years will surely do what I say. "," Τι απέγινε  2 χρονια τα ακουμε αυτα γιατι δεν μπαινουν αυτα για να βλέπουμε Ποιος δέρνει ποιόν να απειλούν το οποιοδήποτε η βατάτζηδες η μαφία της Μυκόνου Γιατί δεν κάνετε κάτι και έκανε σύσκεψη Πρωθυπουργός πάλι σύσκεψη, ξέρετε  Μαζεύονται και συζητάνε τα λένε λέει πως τα δικά του φεύγουν οι υπουργοί, θα κάνουμε υπουργεία, υπουργείο πριν 2 χρόνια τα λέγατε και ακόμα δεν έγιναν κύριε Υπουργέ Τα επόμενα 4 χρόνια Παρακαλώ αναμείνατε στο ακουστικό σας τα επόμενα 4 χρόνια θα τα κάνετε σίγουρα τι να πω",other,,other,,government inaction,-0.4,0.2,,0.6,0.5,0.8,0.0,0.0,"[['mykonos mafia', 'organization', 'medium', 'prime minister', 'person', 'high']]","[['mykonos mafia', 'group of people', '0.8'], ['prime minister', 'person', '0.9'], ['mr.', 'person', '0.6'], ['next 4 years', 'date', '0.7']]"
62, I don't know.  Let's go now and partnerships. Up until six months ago all the trolls and their parrots were saying that the Greek solution would work with the new democracy. All the parakeets. , Δεν ξέρω  Πάμε τώρα και συνεργασίες Μέχρι πριν κάνα εξάμηνο όλοι τα τρολ τα παπαγαλάκια τους έλεγαν ότι η ελληνική λύση θα συνεργαστεί με τη νέα δημοκρατία Όλα τα παπαγαλάκια,political parties,,other,,greek solution,0.0,0.2,0.0,0.1,0.2,0.2,0.0,0.2,"[['greek', 'location', '0.7'], ['six months ago', 'date', '0.8']]","[['greek', 'location', '0.8'], ['democracy', 'group of people', '0.6']]"
63,"To create a problem in our self-personal, self-reliant path. This is not the case anyway. Suddenly they put the curtakis, Now look curtakis form, but there is also Giannakis.  Giannakis agent publisher, Giannakis Mr. Minister Giannakis became an agent with Kourtakis, they put the Kourtakis record was the question Syriza will work with the Greek solution.  In fact, you know why you're doing this.  Let me say it because you are incapable of really saying that we can govern Greece, but we say we can govern Greece, we have a plan. We have a programme, we are not looking for a crutch from anyone, neither from PASOK nor from SYRIZA, as you are looking for behind the scenes. ","Για να δημιουργήσουν πρόβλημα στην αυτοπρόσωπη αυτεξούσια διαδρομή μας Αυτό δεν ισχύει έτσι κι αλλιώς Ξαφνικά βάζουν τους κουρτάκη, Δες τώρα κουρτάκης μορφή, αλλά υπάρχει κι ο Γιαννάκης  Ο Γιαννάκης παράγοντας εκδότης, ο Γιαννάκης κύριε Υπουργέ Γιαννάκης έγινε παράγοντας με κουρτάκης, βάζουν τον κουρτάκη εγγραφή ήτανε ο ρω ΣΥΡΙΖΑ θα συνεργαστεί με την ελληνική λύση  Μάλιστα ξέρετε γιατί το κάνετε αυτό  Ας το πω εγώ γιατί είστε ανίκανοι πραγματικά να πείτε ότι μπορούμε να κυβερνήσουμε την Ελλάδα, εμείς εμείς όμως το λέμε, μπορούμε να κυβερνήσουμε την Ελλάδα, έχουμε σχέδιο Έχουμε πρόγραμμα, δεν ψάχνουμε δεκανίκι από κανέναν, ούτε από το ΠΑΣΟΚ, ούτε από τον ΣΥΡΙΖΑ, όπως ψάχνετε εσείς παρασκηνιακά",political parties,,other,,greek politics,0.0,0.2,0.0,0.3,0.6,0.2,0.0,0.0,[],"[['giannakis', 'person', '0.9'], ['kourtakis', 'person', '0.8'], ['syriza', 'political party', '0.9'], ['greek solution', 'political party', '0.8'], ['pasok', 'political party', '0.8'], ['greece', 'country', '0.9']]"
64,"And for us we say the following, so that some people will understand. You are decades of failures. Back. Every power when it becomes strong. It does not consider anything better than its best interest, that's why you don't quit for it you have failed in a company my own to say that my manager will go home.  It's a given that my partner will go home.  You Failure to Failure. Bankruptcy on bankruptcy, bankruptcy on bankruptcy. ","Και για μας λέμε το εξής, για να το καταλάβουν κάποιοι Είστε δεκαετίες αποτυχιών Πίσω Κάθε εξουσία όταν γίνεται ισχυρή Δεν θεωρεί τίποτε καλύτερο από το συμφέρον της, για αυτό και δεν παραιτείστε για αυτό έχετε αποτύχει σε μια εταιρεία τη δική μου να πω ότι ο διευθυντής μου θα πάει σπίτι του  Είναι δεδομένο ότι ο συνεργάτης μου θα πάει σπίτι του  Εσείς αποτυχία στην αποτυχία Χρεοκοπία στη χρεοκοπία, πτώχευση στην πτώχευση",other,,bankruptcy,,failure,-0.8,1.0,0.0,0.85,0.9,0.8,0.2,0.2,[],[]
65,"Punctuation in verb 2 in the chair no one wants to move from the chair no one moves. Us personally as the Greek solution. Because we do not consider power as a spoil, but as a service to the Greek citizen, a service to the homeland.  We cannot work with people who see power as a spoil. Proof of this is the statement of Mrs.Bakoyannis, who said, we exclude Mr.Velopoulos from possible cooperation, because it is impossible to cooperate with a party which has diametrically opposite views on national issues from ours. She is absolutely right, I thank Mrs Bakoyannis very much because normally I should have sent her a pot and flowers because she told the truth for the first time, because she told the truth. ","Ρημαδιό στο ρήμα 2 στην καρέκλα δεν θέλει κανένας απ την καρέκλα δεν κουνιέται κανείς Εμάς προσωπικά ως η ελληνική λύση Επειδή δεν θεωρούμε την εξουσία λάφυρο, αλλά υπηρεσία προς τον έλληνα πολίτη υπηρεσία προς την πατρίδα  Δεν μπορούμε να συνεργαστούμε με ανθρώπους που βλέπουν την εξουσία ως λάφυρο Απόδειξη η δήλωση της κυρίας Μπακογιάννη, η οποία είπε, εμείς τον αποκλείουμε τον κύριο Βελόπουλο από ενδεχόμενες συνεργασίες, διότι είναι αδύνατο να συνεργαστούμε με ένα κόμμα το οποίο εκ διαμέτρου είναι αντίθετες οι απόψεις στα εθνικά θέματα από μας Έχει απόλυτο δίκαιο, την ευχαριστώ θερμά την κυρία Μπακογιάννη γιατί κανονικά έπρεπε να της στείλω και μια γλάστρα και λουλούδια γιατί είπε για πρώτη φορά την αλήθεια, γιατί είπε την αλήθεια",political parties,,other,,power/politics,0.0,0.25,0.5,0.25,0.8,0.2,0.0,0.0,"[['greek citizen', 'location', '1.0'], ['homeland', 'location', '1.0'], ['mrs. bakoyannis', 'person', '1.0'], ['mr. velopoulos', 'person', '1.0']]","[['greek citizen', 'person', '1.0'], ['homeland', 'country', '1.0'], ['mrs. bakoyannis', 'person', '1.0'], ['mr. velopoulos', 'person', '1.0'], ['party', 'group of people', '0.5'], ['us personally', 'group of people', '0.8']]"
66," Because the new democracy PASOK and SYRIZA agree on everything for them.  Cyprus is a third country.  The single defence doctrine is a thing of the past.  The Prespa agreement must be honoured and respected on the part of the New Democracy and the other parties.  And if we lose Kastelorizo, as Mr Tsipras and Mrs Bakoyannis said, because as he said. From the twenty-eighth meridian and east never mind, we'll see them later from Rhodes, east and from double Castellorizo and Symi, Rhodes are 3 parties in the package of one, they are 3 pieces in the package of one policy, an anti-people policy of passionate enemy against Greece and the Greeks and this policy we will fight to the end, because we are the solution, the only solution, the patriotic solution, the national solution, he said. "," Διότι η νέα Δημοκρατία ΠΑΣΟΚ και ΣΥΡΙΖΑ συμφωνούν σε όλα για αυτούς  Η Κύπρος είναι τρίτο κράτος  Το ενιαίο αμυντικό δόγμα ανήκει στο παρελθόν  Η συμφωνία των Πρεσπών πρέπει να τιμηθεί να τηρηθεί από την πλευρά της Νέας Δημοκρατίας και των υπολοίπων κομμάτων  Και αν χάσουμε το Καστελόριζο, όπως είπε ο κύριος Τσίπρας και κυρία Μπακογιάννη, γιατί όπως είπε Από τον εικοστό όγδοο μεσημβρινό και ανατολικά δεν πειράζει, θα τα δούμε αργότερα από τη Ρόδο, ανατολικά και από διπλασιάσουμε το Καστελόριζο και τη Σύμη τη Ρόδο είναι 3 κόμματα στη συσκευασία του ενός, είναι 3 κομμάτια σε συσκευασία της μιας πολιτικής, μιας πολιτικής αντιλαϊκής εχθρό πάθους απέναντι στην Ελλάδα και τους Έλληνες και αυτή την πολιτική θα την πολεμήσουμε μέχρις εσχάτων, γιατί είμαστε η λύση, η μοναδική λύση, η πατριωτική λύση, η εθνική λύση, είπε",national security,,other,,greek politics,-0.4,0.75,0.2,0.75,0.8,0.5,0.0,0.1,"[['pasok', 'organization', '1.0'], ['syriza', 'organization', '1.0'], ['cyprus', 'location', '1.0'], ['new democracy', 'organization', '1.0'], ['prespa agreement', 'organization', '1.0'], ['mr tsipras', 'person', '1.0'], ['mrs bakoyannis', 'person', '1.0'], ['kastelorizo', 'location', '1.0'], ['rhodes', 'location', '1.0'], ['castellorizo', 'location', '1.0'], ['symi', 'location', '1.0'], ['greece', 'location', '1.0']]","[['pasok', 'organization', '1.0'], ['syriza', 'organization', '1.0'], ['cyprus', 'country', '1.0'], ['new democracy', 'organization', '1.0'], ['prespa agreement', 'organization', '1.0'], ['mr tsipras', 'person', '1.0'], ['mrs bakoyannis', 'person', '1.0'], ['kastelorizo', 'location', '1.0'], ['rhodes', 'location', '1.0'], ['symi', 'location', '1.0'], ['greece', 'country', '1.0']]"
67," More Mrs Bakoyannis. More. But I pass her by and thank her very much for what she did.  For us it was the best gift, that is, it is now clearly visible. "," Και άλλα κυρία Μπακογιάννη Κι άλλα Αλλά την προσπερνώ και την ευχαριστώ θερμά για αυτό που έκανε  Για μας ήταν το καλύτερο δώρο, δηλαδή φαίνεται πλέον ξεκάθαρα",other,,other,,mrs bakoyannis,0.45,0.0,0.0,0.0,0.0,0.0,0.0,0.0,"[['mrs bakoyannis', 'person', '0.9']]","[['mrs bakoyannis', 'person', '100%'], ['us', 'group of people', '100%']]"
68," They have nothing to do with them and you have nothing to do with them.  We are different, we are Greek patriots, far from extremes, far from barbarities, but we are just Greek patriots. So now let's move from the diplomacy of the earthquakes to the diplomacy of Dendias. There is no worse Foreign Secretary, I say from the floor of the House. With Mr Dendias as our guide, we are heading into the abyss of the n. And with the silence of SYRIZA and PASOK which annoys me personally so much they are leading to disaster. Achieved the impossible, worst foreign minister ever.  What is this. "," Δεν έχουν καμία σχέση με αυτούς αυτούς και εσάς καμία σχέση  Είμαστε διαφορετικοί, είμαστε έλληνες πατριώτες, μακριά από ακρότητες, μακριά από βαρβαρότητες, αλλά είμαστε απλά έλληνες πατριώτες Πάμε λοιπόν τώρα από τη διπλωματία των σεισμών στη διπλωματία του Δένδια Δεν υπάρχει χειρότερος υπουργός Εξωτερικών, το λέω από βήματος Βουλής Με οδηγό τον κύριο Δένδια οδηγούμαστε στο βάραθρο ν Και με τη σιωπή του ΣΥΡΙΖΑ και του ΠΑΣΟΚ που με ενοχλεί προσωπικά εμένα τόσο οι ίδιοι είναι οδηγούν στην καταστροφή Πέτυχε το ακατόρθωτο χειρότερος υπουργός Εξωτερικών που πέρασε ποτέ  Ποιο είναι αυτό",external affairs,,other,,foreign secretary/diplomacy of dendias,-0.8,0.87,0.6,0.8,0.8,0.6,0.25,0.4,"[['greek', 'nationality', '2.0'], ['dendias', 'person', '1.0'], ['foreign secretary', 'title', '1.0'], ['house', 'location', '1.0'], ['syriza', 'political party', '1.0'], ['pasok', 'political party', '1.0']]","[['dendias', 'person', '1.0'], ['house', 'group of people', '1.0'], ['syriza', 'political party', '1.0'], ['pasok', 'political party', '1.0']]"
69," For the first time Greece and Cyprus have succeeded in not having a single line. He hit the island of Cyprus, our sister Cyprus which is the same country as us, how he hit it, he votes for Turkey.  Mr. Dendias and Cyprus votes and a. To get them into the International Maritime Organization. Instead of us voting against Turkey, he goes off on his own.  The Ministry of Foreign Affairs is doing what I want to do with trees. "," Για πρώτη φορά πέτυχε η Ελλάδα και η Κύπρος να μην έχουν ενιαία γραμμή Χτύπησε τη νήσο Κύπρο την αδελφή μας Κύπρο που είναι η ίδια χώρα με εμάς πως τη χτύπησε, ψηφίζει Τουρκία  Ο κύριος Δένδιας και η Κύπρος ψηφίζει και μια Για να τους βάλουν στον Διεθνή Οργανισμό Ναυτιλίας Αντί να καταψηφίσουμε και εμείς την Τουρκία πηγαίνει μόνος του  Το Υπουργείο Εξωτερικών δι κό του κάνει Τι θέλω δένδιας",external affairs,,other,,greek-cypriot relations,-0.5,0.8,1.0,0.6,0.8,0.75,0.0,0.2,"[['greece', 'location', '1.0'], ['cyprus', 'location', '1.0'], ['cyprus', 'location', '1.0'], ['turkey', 'location', '1.0'], ['dendias', 'person', '1.0'], ['cyprus', 'location', '1.0'], ['international maritime organization', 'organization', '1.0'], ['turkey', 'location', '1.0'], ['ministry of foreign affairs', 'organization', '1.0']]","[['greece', 'country', '0.9'], ['cyprus', 'location', '0.9'], ['turkey', 'country', '0.7'], ['dendias', 'person', '0.5'], ['international maritime organization', 'organization', '0.8'], ['ministry of foreign affairs', 'organization', '0.8']]"
70," Neither the Prime Minister nor Tsipras nor Toulakis is interested.  Cyprus is furious with what Zeus did the other day, He went to Cavusoglu alone and says to him, We will put you there in charge.  Which Turkey that is lagging behind in shipping. Which and one is ahead of us very high champions in shipping we are and I will support the Turk and not Cyprus. "," Ούτε ο πρωθυπουργός ενδιαφέρεται ούτε ο Τσίπρας, ούτε ο Τουλακης  Η Κύπρος είναι έξαλλοι με αυτό που έκανε ο Δίας Προχθες, Πηγε Μονος του Τσαβούσογλου και του λέει, Θα σε βάλουμε εκεί υπεύθυνο  Ποια Τουρκία που είναι ουραγός στη ναυτιλία Ποια και μια είναι μπροστά από μας πολύ ψηλά πρωταθλητές στη ναυτιλία είμαστε και θα στηρίξω τον Τούρκο και όχι την Κύπρο",external affairs,,other,,politics,-0.8,1.0,0.0,0.85,0.9,0.9,0.0,0.8,"[['prime minister', 'person', '0.9'], ['tsipras', 'person', '0.8'], ['toulakis', 'person', '0.8'], ['cyprus', 'location', '0.9'], ['zeus', 'person', '0.7'], ['cavusoglu', 'person', '0.8'], ['turkey', 'location', '0.9']]","[['prime minister', 'person', '0.8'], ['tsipras', 'person', '0.8'], ['toulakis', 'person', '0.6'], ['cyprus', 'location', '0.8'], ['zeus', 'person', '0.6'], ['cavusoglu', 'person', '0.6'], ['turkey', 'country', '0.8'], ['cyprus', 'country', '0.6'], ['the other day', 'date', '0.6']]"
71," You are in your best. You are in your right mind, Mr. Minister, pick up Mr. Dendias from mistake to mistake he goes from mistake to mistake. For the first time the government has achieved this thing. "," Είστε με τα καλά σας Είστε με τα καλά σας, κύριε Υπουργέ, μαζέψτε τον κύριο Δένδια από λάθος σε λάθος πηγαίνει Για πρώτη φορά το πέτυχε η κυβέρνηση αυτό το πράγμα",other,,other,,government mistakes,0.5,0.1,0.0,0.2,0.1,0.2,0.0,0.0,"[['mr. minister', 'person', '0.8'], ['mr. dendias', 'person', '0.8'], ['the government', 'organization', '0.7']]","[['mr. minister', 'person', '0.9'], ['mr. dendias', 'person', '0.8'], ['government', 'organization', '0.9']]"
72,"Goes to the vision. He's putting out a vision statement, I have it in front of me.  How pages 2 of the other 3 pages How good that is our. ","Πάει στο όραμα Βγάζει μια ανακοίνωση για το όραμα, την έχω μπροστά μου  Πώς σελίδες 2 από τις άλλες 3 σελίδες Τι καλός που είναι ο μας",other,,other,,vision statement,0.0,0.0,0.0,0.2,0.0,0.0,0.0,0.0,[],[]
73," We will find them vision so the ramalio ramorum vision Nothing for the Greeks of Northern Epirus.  Here the minister forgot the pensions will tell me and the Greek overseas who were tricked times neither pension, nothing two and a half pages, nothing, nothing in nor for the EEZ to say something that we were tricked by the Albanians nothing thing. So there goes the Serbian Vucic. "," Θα τα βρούμε όραμα έτσι ο ραμάλιο ramorum όραμα Τίποτα για τους Έλληνες της Βορείου Ηπείρου  Εδώ ξέχασε ο υπουργός συντάξεις θα μου πείτε και τους ελληνοπόντιους που τους ξεγέλασες φορές ούτε σύνταξη, τίποτα δυόμιση σελίδες, τίποτα, τίποτα μέσα ούτε για την ΑΟΖ να πει κάτι ότι μας ξεγέλασαν οι Αλβανοί τίποτα πράγμα Πάει λοιπόν και στον Σέρβο Βούτσιτς",other,,other,,pensions,-0.5,0.0,0.0,0.5,0.9,0.3,0.0,0.0,"[['greeks', 'location', '0.6'], ['northern epirus', 'location', '0.6'], ['greek', 'nationality', '0.5'], ['albanians', 'nationality', '0.5'], ['serbian', 'nationality', '0.5'], ['vucic', 'person', '0.6']]","[['ramalio ramorum', 'organization', '0.8'], ['greeks', 'group of people', '0.9'], ['northern epirus', 'location', '0.8'], ['minister', 'person', '0.7'], ['greek overseas', 'group of people', '0.8'], ['albanians', 'group of people', '0.7'], ['eez', 'location', '0.6'], ['serbian vucic', 'person', '0.7']]"
74,See the difference. 3 lines. Albanian two and a half. ,Δειτε διαφορα 3 γραμμές Αλβανός δυόμιση,other,,other,,measurement,0.0,0.5,0.0,0.1,0.5,0.2,0.0,0.8,"[['albanian', 'language', '1.0']]","[['albanian', 'country', '0.85']]"
