id,text,text_el,topic,topic-context,subtopic,subtopic-context,topic-open,sentiment,polarization,polarization-definition,toxicity,toxicity-definition,populism,populism-definition,hate speech,ner,ner-limited
34,"Choose which one you want so that we know who we have to deal with We know the Greek people don't know and that worries me, because the 25 26% insist on dragging you to vote. On the other hand I will say it. To understand it. Who is to blame. Today for the Greek Prime Minister It's Mr Tsipras' fault. For the Eye for Mr. Tsipras, Mitsotakis said the New Democracy. Mr Tsipras said it was made by the joints of power. You know, the joints between the bricks there is the joint, the bricks now if it means one side and brick the other and the joints of power is one thing, it's another thing, but the joints of power were made by you from PASOK, New Democracy and Syriza to the Prime Minister who blames the Deep State most deep state of his own appointed to democrats to hospital administrations, to independent authorities, to secretaries general, to any in front of me do not go, he is a democrat, this is the deep state. This is the principle of power, that is, in essence they both say that they are not to blame, but these are the actions of the same make sense and conclude, I can't maybe t can make out I can't follow. ","Να επιλέξετε ποιο θέλετε για να ξέρουμε ποιους έχουμε να κάνουμε Εμείς ξέρουμε ο ελληνικός λαός δεν ξέρει και αυτό με προβληματίζει, γιατί επιμένει το 25 26% να σε παρασύρει ψηφίζει Από την άλλη θα το πω Για να το καταλάβει Ποιος φταίει Σήμερα για τον έλληνα πρωθυπουργό Φταίει ο κύριος Τσίπρας Για το Μάτι για τον κύριο Τσίπρα έλεγε ο Μητσοτάκης η Νέα Δημοκρατία Τον κύριο Τσίπρας είπε ότι το έφτιαξαν οι αρμοί της εξουσίας Ξέρετε, οι αρμοί ανάμεσα στα τούβλα υπάρχει ο αρμός, τα τούβλα τώρα αν εννοεί από τη μία πλευρά τον έναν και τούβλο τον άλλον και οι αρμοί της εξουσίας είναι διαφορετικό, είναι άλλο πράγμα, αλλά οι αρμοί της εξουσίας φτιάχτηκαν από εσάς από το ΠΑΣΟΚ, τη Νέα Δημοκρατία και τον ΣΥΡΙΖΑ στον πρωθυπουργό που φταιει το Βαθυ Κρατος πιο βαθύ κράτος των διορισμένων δικό του να δημοκρατών σε διοικήσεις νοσοκομείων, σε ανεξάρτητες αρχές, σε γενικούς γραμματείς, σε οποιαδήποτε μπροστά μου να μην πας, είναι ένας δημοκράτης, Αυτό είναι το βαθύ κράτος Αυτή είναι η αρχή της εξουσίας, δηλαδή στην ουσία λένε και οι 2 ότι δεν φταίνε αυτοί, αλλά αυτά είναι τα πεπραγμένα των ίδιων βγάλτε άκρη και συμπέρασμα, εγώ δεν μπορώ ίσως ο τ να μπορεί να βγάλει εγώ αδυνατώ να παρακολουθήσω",other,,other,,greek politics,-0.5,0.2,0.2,0.6,0.5,0.8,0.3,0.1,"[['greek', 'nationality', '1.0'], ['25', 'number', '0.9'], ['26', 'number', '0.9'], ['vote', 'event', '0.8'], ['greek prime minister', 'title', '1.0'], ['mr tsipras', 'person', '1.0'], ['eye', 'title', '0.8'], ['mitsotakis', 'person', '1.0'], ['new democracy', 'organization', '1.0'], ['joints of power', 'event', '0.8'], ['pasok', 'organization', '0.9'], ['syriza', 'organization', '0.9'], ['deep state', 'organization', '1.0'], ['democrats', 'organization', '0.8'], ['hospital administrations', 'organization', '0.8'], ['independent authorities', 'organization', '0.8'], ['secretaries general', 'title', '0.8']]","[['greek people', 'group of people', '1'], ['25 26%', 'group of people', '1'], ['greek prime minister', 'person', '1'], ['mr tsipras', 'person', '1'], ['new democracy', 'political party', '1'], ['joints of power', 'organization', '1'], ['pasok', 'political party', '1'], ['syriza', 'political party', '1'], ['deep state', 'organization', '1'], ['democrats', 'group of people', '1'], ['hospital administrations', 'organization', '1'], ['independent authorities', 'organization', '1'], ['secretaries general', 'organization', '1']]"
35,"The tragedy that became a sacrifice. The tragedy that became an opportunity, mercy and mercy, we mourned people, some say opportunity, others say sacrifice, opportunity as if it's a damn thing. These are incredible things, of course, and I should say here that SYRIZA was saying the same thing with Mr.Xantho, who is the voice of SYRIZA in the context of good neighbourliness with New Democracy, saying that it is an opportunity for reflection, the tragedy at Mati, so we will take a philosophical approach together with a Confucius and a Gandhi, and we will all discuss Socrates and Plato together.  We will reflect on what was to blame for Mati, what was to blame for Tempe. ","Η τραγωδία που έγινε θυσία Η τραγωδία που έγινε ευκαιρία, έλεος και έλεος, θρηνήσαμε ανθρώπους, άλλοι λένε ευκαιρία, άλλοι λεν θυσία, ευκαιρία λες και είναι κωτσόβολος Είναι απίστευτα πράγματα αυτά βέβαια εδώ να πω ότι και ο ΣΥΡΙΖΑ τα ίδια έλεγε με τον κύριο Ξανθό που είναι η φωνή του ΣΥΡΙΖΑ στα πλαίσια της καλής γειτονίας με τη Νέα Δημοκρατία που έλεγε ότι είναι ευκαιρία αναστοχασμού, λέει η τραγωδία στο Μάτι, έτσι και επί ευκαιρία αναστοχασμού θα κάνουμε μια φιλοσοφική προσέγγιση μαζί με ένα Κομφούκιο μαζί με ένα Γκάντι και θα συζητάμε όλοι μαζί με τον Σωκράτη και τον Πλάτωνα  Θα αναστοχαστούμε τι έφταιγε στο Μάτι, Τι έφταιγε στα Τέμπη",other,,other,,tragedy at mati,0.0,0.1,0.0,0.1,0.3,0.1,0.0,0.0,"[['mati', 'location', '1.0'], ['syriza', 'organization', '1.0'], ['mr.xantho', 'person', '1.0'], ['new democracy', 'organization', '1.0'], ['confucius', 'person', '1.0'], ['gandhi', 'person', '1.0'], ['socrates', 'person', '1.0'], ['plato', 'person', '1.0'], ['tempe', 'location', '1.0']]","[['syriza', 'organization', '1.0'], ['mr.xantho', 'person', '0.9'], ['new democracy', 'political party', '1.0'], ['mati', 'location', '1.0'], ['tempe', 'location', '1.0']]"
36, We're going to do a meditation together. This common thinker there is a proposal to go to Mount Athos.  He has many monks to contemplate with. , Θα κάνουμε ένα στοχασμό όλοι μαζί Αυτή η κοινή στοχαστής υπάρχει μια πρόταση να πάει στο Άγιο Όρος  Έχει πολλούς καλόγερους να στοχαστεί μαζί τους,other,,other,,meditation,0.0,0.0,0.0,0.0,0.0,0.0,0.0,0.0,"[['mount athos', 'location', '0.7']]","[['mount athos', 'location', '0.8'], ['monks', 'group of people', '0.6']]"
37," Here we want efficiency, not reflection.  The goal is to make a Greece truly strong, self-reliant and self-reliant reflections to go to the Athenians inside to reflect. And we now begin the philanthropic, tragically proportionate responsibility. Ready Tsipras says I do, but put on the share of responsibility says Mr Mitsotakis.  Yes, and I'll take my share of that, too. "," Εδώ θέλουμε αποτελεσματικότητα, όχι αναστοχασμούς  Στόχος είναι να κάνουμε μια Ελλάδα πραγματικά ισχυρή, αυτοδύναμη και αυτεξούσια αναστοχασμούς να πάνε στους αγιορείτες μέσα να αναστοχαστούν Κι αρχίζουμε τώρα τα φιλάνθρωπο, τραγικά αναλογική ευθύνη Έτοιμος ο Τσίπρας λέει Εγώ ναι, αλλά βάλουν στο μερίδιο που αναλογεί την ευθύνη λέει κύριος Μητσοτάκης  Ναι και εγώ αναλαμβάνω μερίδιο αυτής που αναλογεί ωραία",other,,other,,greek economy,0.0,0.1,0.0,0.1,0.1,0.1,0.0,0.0,"[['greece', 'location', '0.95'], ['athenians', 'misc', '0.7'], ['tsipras', 'person', '0.8'], ['mitsotakis', 'person', '0.8']]","[['greece', 'location', '1.0'], ['athenians', 'group of people', '0.5'], ['tsipras', 'person', '1.0'], ['mitsotakis', 'person', '1.0.']]"
38," So I start 2012 to 2023 12 years two thousand twelve twelve fifteen Nudos government pasok 4 years 2015 19 SYRIZA government 4 years 2000 1923 Nudos government 4 years Mr. Staikura, so new democracy an addition is multiple we have 70% responsibility. Pasok, New Democracy and from 35 each and 30% of SYRIZA that is. Anyone travelling by train from 12 to 23 should know that they are at risk of being killed 30%.  Syriza 35 against the new democracy and 35 against Paso. "," Ξεκινάω λοιπόν 2012 έως 2023 12 χρονια δυο χιλιαδες δωδεκα δεκαπεντε κυβέρνηση Νουδου πασόκ 4 χρόνια 2015 19 κυβέρνησης ΣΥΡΙΖΑ 4 χρόνια 2000 1923 κυβέρνηση Νουδου 4 χρόνια κύριε Σταϊκούρα, άρα νέα δημοκρατία μια πρόσθεση είναι πολλαπλά έχουμε 70% ευθύνης Πασοκ, νέα Δημοκρατία και από 35 έκαστος και 30% του ΣΥΡΙΖΑ δηλαδή Όποιος ταξιδεύει με τρένο από το 12 μέχρι το 23 να ξέρει έχει κίνδυνο να σκοτωθεί 30%  Συριζα 35 κατά τη νέα δημοκρατία και 35 κατά το Πάσο",political parties,,election spending,,greek politics,0.0,0.0,,0.2,0.5,0.4,0.0,0.2,"[['2012', 'date', '1.0'], ['2023', 'date', '1.0'], ['12', 'cardinal', '0.75'], ['two thousand twelve', 'date', '0.25'], ['twelve fifteen', 'time', '1.0'], ['nudos', 'org', '1.0'], ['pasok', 'org', '1.0'], ['4 years', 'date', '1.0'], ['2015', 'date', '1.0'], ['19', 'cardinal', '0.75'], ['syriza', 'org', '1.0'], ['2000', 'date', '1.0'], ['1923', 'date', '1.0'], ['mr. staikura', 'person', '1.0'], ['new democracy', 'org', '1.0'], ['70%', 'percent', '1.0'], ['pasok', 'org', '1.0'], ['new democracy', 'org', '1.0'], ['35', 'cardinal', '0.5'], ['30%', 'percent', '1.0'], ['syriza', 'org', '1.0'], ['30%', 'percent', '1.0'], ['35', 'cardinal', '0.5']]","[['2012', 'date', 'high'], ['2023', 'date', 'high'], ['12 years', 'date', 'high'], ['two thousand twelve', 'date', 'high'], ['twelve fifteen', 'date', 'low'], ['nudos government', 'organization', 'high'], ['pasok', 'political party', 'high'], ['4 years', 'date', 'high'], ['2015', 'date', 'high'], ['19', 'date', 'low'], ['syriza government', 'organization', 'high'], ['2000', 'date', 'low'], ['1923', 'date', 'low'], ['mr. staikura', 'person', 'medium'], ['new democracy', 'political party', 'high'], ['70%', 'null', 'low'], ['pasok', 'political party', 'high'], ['new democracy', 'political party', 'high'], ['35%', 'null', 'low'], ['30%', 'null', 'low'], ['syriza', 'political party', 'high']]"
39, This is how a country is seriously governed. Proportionate share of responsibility what is proportionately dead.  You will go on your back. , Έτσι κυβερνάται σοβαρά μια χώρα Αναλογεί μερίδιο ευθύνης τι είναι κατ αναλογία νεκρούς  Θα πάτε στην πλάτη σας,other,,other,,country governance,-0.6,0.5,0.0,0.7,0.7,0.7,0.0,0.1,[],[]
40,"What are these things. These are divisions, but they are addressed.  I repeat, if that man, the Dr. was saying he could hear me no longer understood anyone. You say my share of the responsibility.  What is the size. ","Τι πράγματα είναι αυτά Διότητες είναι αυτές, αλλά απευθύνονται  Επαναλαμβάνω, αν εκείνος ο άντρας, ο Δρ έλεγε με ακούει πια δεν κατάλαβε κανείς Εσείς λέτε αναλογεί το μερίδιο της ευθύνης μου  Ποιο είναι το μέγεθος",other,,other,,divisions,0.0,0.0,0.0,0.2,0.0,0.0,0.0,0.0,"[['dr.', 'person', '0.8']]","[['dr.', 'person', '0.6']]"
41," Tell us which one of the 60 dead, whoever is talking about deaths, about dead people, I'll tell you, but of the 60 dead, 20 have the name SYRIZA, 20 have the name PASOK and 20 have the name New Democracy.  So it's convenient. We're serious. So let's go into the finances for a moment, because. Do you have any people. "," Πείτε μας ποιο ποιο πως όποιος μιλάμε για θανάτους, για νεκρούς, να στο πω Μα ωραία από τους 60 νεκρούς, οι 20 έχουν το όνομα ΣΥΡΙΖΑ, οι 20 το όνομα ΠΑΣΟΚ και 20 έχουν το όνομα Νέα Δημοκρατία  Έτσι βολεύει Σοβαρά μιλάμε Πάμε λοιπόν και στα οικονομικά για λίγο, γιατί Εχετε κανένα λαό",political parties,,other,,political parties,0.0,0.5,0.5,0.4,0.8,0.9,0.5,0.1,"[['syriza', 'org', '0.6'], ['pasok', 'org', '0.6'], ['new democracy', 'org', '0.6']]","[['syriza', 'organization', '50%'], ['pasok', 'organization', '50%'], ['new democracy', 'organization', '50%']]"
42," Just struggle to be pelagoric to be desperate, to be really poor.  Pamphleteer.  You targeted the bankrupt you tell him we will with the memoranda, we will do better.  You've brought 17 arrangements how is it 5 6 arrangements it seems the fatigue I know 5 4 6 7 I don't know how it seems, they all failed because they all failed because you are unable to follow the facts of what is happening in society. "," Απλά αγώνα να είναι πελαγοδρομεί να είναι απελπισμένος, να είναι πραγματικά φτωχός  Πάμφτωχος  Στοχεύσατε το χρεοκοπήσατε του λέτε θα με τα μνημόνια, θα πάμε καλύτερα  Έχετε φέρει 17 ρυθμίσεις πως είναι 5 6 ρυθμίσεις φαίνεται η κούραση από ότι ξέρω 5 4 6 7 δεν ξέρω πώς φαίνεται, απέτυχαν όλες γιατί απέτυχαν γιατί αδυνατείτε να παρακολουθήσετε τα πραγματικά περιστατικά στο τι γίνεται στην κοινωνία",economy,,austerity,,poverty,-0.8,0.6,0.0,0.6,0.5,0.5,0.0,0.0,[],[]
43,"You do not see the transport.  I tell you poverty and despair with the lies you tell poverty and despair there is poverty and despair outside and anger and anger and I will tell you what Rousseau said when the people will have nothing to eat anymore.  He knows what he's going to eat, Mr. Staikura. He said I live for the rich. The rich will go, will go out into the streets and eat the world to each other. And the social peace and tranquillity that is a necessary condition of a favourable state will be wasted. We warn you. ","Δεν βλέπετε τη συγκοινωνία  Εγώ σας λέω φτώχεια και απελπισία με τα ψέματα που λέτε φτώχεια και απελπισία υπάρχει έξω και οργή και θυμός και θα σου πω τι έλεγε Ρουσό όταν ο λαός δεν θα έχει τίποτα πια να φάει  Ξέρει τι θα φάει κύριε σταϊκούρα έλεγε ότι ζω τους πλούσιους Τους πλούσιους θα πάει, θα βγει στους δρόμους και να τρώει τον κόσμο στον άλλον Και η κοινωνική γαλήνη και ηρεμία που είναι απαραίτητη προϋπόθεση μιας ευνομούμενης πολιτείας, θα πάνε στράφι Εμείς σας προειδοποιούμε",other,,poverty,,poverty,-0.6,0.9,0.0,0.8,0.8,0.8,0.5,0.0,"[['rousseau', 'person', '1.0'], ['mr. staikura', 'person', '1.0']]","[['rousseau', 'person', '0.9'], ['mr. staikura', 'person', '0.9']]"
44,"And it gets to the point of celebrating the poor people's baskets.  The ornamental baskets begins the Santa Claus basket, the housewife's basket, the godfather's basket, the Easter basket, miss eggs and baskets. The only basket worthy of all that Georgiades does is the wastebasket that the Greek people will throw them in at the elections.  What is it? ","Και φτάνει στο σημείο να πανηγυρίζετε για τα καλάθια των φτωχών  Τα χρηστά καλάθια αρχίζει το καλάθι του Άη Βασίλη, το καλάθι της νοικοκυράς, το καλάθι του νονού, το καλάθι του Πάσχα, χάσετε τα αυγά και τα καλάθια Το μόνο καλάθι που αξίζει σε όλα αυτά που κάνει ο γεωργιάδης είναι το καλάθι των αχρήστων να τους πετάξει εκεί ο ελληνικός λαός στις εκλογές  Τι ειναι",elections,,election spending,,baskets,-0.4,1.0,0.0,0.8,0.75,0.9,0.2,0.6,"[['santa claus', 'person', '0.9'], ['easter', 'event', '0.8'], ['georgiades', 'person', '0.9'], ['greek', 'organization', '0.7']]","[['santa claus', 'person', '0.6'], ['housewife', 'group of people', '0.6'], ['godfather', 'person', '0.6'], ['easter', 'date', '0.6'], ['georgiades', 'person', '0.6'], ['greek', 'country', '0.6'], ['elections', 'date', '0.6']]"
45," The Greek beggar is with baskets to go shopping with full Pass. You sell out everything, even the water you sell out now another fruit it sold out and this one there is no limit. Of course, in the villas and the pools in the luxury hypnotists you will come out afterwards and say, Maria Antoinette, don't drink water, it's expensive, drink coke. As Marie Antoinette used to say. "," Ο ελληνας επαίτης είναι με καλαθάκια να πηγαίνει για να ψωνίζει με full Pass Ξεπουλάτε τα πάντα, ακόμα και το νερό ξεπουλάτε τώρα άλλο φρούτο αυτό ξεπούλησε και αυτό δεν υπάρχει τίποτε όριο Βέβαια, στις βίλες και τις πισίνες στα πολυτελή υπνωτήρια θα βγαίνετε μετά και θα λέει το εξής, η Μαρία Αντουανέτα, μην πίνετε νερό είναι ακριβό πιείτε κόκα κόλα Όπως έλεγε η Μαρία Αντουανέτα",other,,poverty,,beggars,-0.5,0.8,0.0,0.5,0.8,0.8,0.0,0.2,"[['greek', 'norp', '0.67'], ['pass', 'product', '0.78'], ['maria antoinette', 'person', '0.67']]","[['greek', 'location', '1.0'], ['pass', 'date', '0.6'], ['maria antoinette', 'person', '0.8']]"
46,"So we'll do it again. You'll bring us a water exchange again, like the energy exchange, the next and they'll say it's our fault the next. That's what I'm telling you is wrong.  I imagine that during the election Mr. Staikura will say the Prime Minister because he sold the water to the private sector he will take out and go for the water.  You are also capable of this. ","Έτσι θα κάνουμε πάλι Θα μας φέρετε και πάλι ένα χρηματιστήριο νερού, όπως το χρηματιστήριο ενέργειας, η επόμενη και θα λένε φταίμε εμείς την επόμενη Αυτά εγώ στο λέω είναι λάθος  Φαντάζομαι ότι προεκλογικά κύριε σταϊκούρα θα πει ο πρωθυπουργός επειδή πούλησε το νερό στους ιδιώτες θα βγάλει και να γό τερ πας να μη βγάλουμε και να πας για το νερό  Είστε ικανοί και για αυτό",privatization,,privatization of water,,water,-0.4,0.5,0.0,0.2,0.2,0.7,0.0,0.1,"[['mr. staikura', 'person', '0.9'], ['prime minister', 'title', '0.7']]","[['mr. staikura', 'person', '0.9'], ['prime minister', 'organization', '0.9']]"
47,"One port in Igoumenitsa sold off. A strategic port for which really 2 months before you go to elections and need everything because it has the right without elections.  Let the Greek people decide to elect a term, I say, you coward. Elect the Greek solution of SYRIZA PASOK and decide the next government.  You have a month and a half before the elections that you are selling off the port without returning the land area without investment, writing the local community in your old, old shoes.  By what right. ","Ξεπούλησε το ένα λιμάνι στην Ηγουμενίτσα Ένα στρατηγικής σημασίας λιμάνι για το οποίο πραγματικά 2 μήνες πριν πάτε σε εκλογές και πρέπει τα πάντα γιατί έχει το δικαίωμα χωρίς εκλογές  Αφήστε τον ελληνικό λαό να αποφασίσει να εκλέξει όρο λέω κουκουέ Να εκλέξει η ελληνική λύση του ΣΥΡΙΖΑ ΠΑΣΟΚ και να αποφασίσει η επόμενη κυβέρνηση  Έχετε ενάμιση μήνα πριν τις εκλογές πως ξεπουλάτε το λιμάνι χωρίς απόδοση της χερσαίας ζώνης χωρίς επενδύσεις, γράφοντας στην κοινωνία την τοπική στα παλιά σας, τα παπούτσια  Με ποιο δικαίωμα",privatization,,hospital privatization,,port sale,-0.51,0.95,0.2,0.8,0.8,0.8,0.2,0.1,"[['igoumenitsa', 'location', '1.0'], ['greek', 'misc', '0.5'], ['syriza', 'organization', '1.0'], ['pasok', 'organization', '1.0.']]","[['igoumenitsa', 'location', '1.0'], ['greek', 'country', '1.0'], ['syriza', 'political party', '0.5'], ['pasok', 'political party', '0.5']]"
48,"Tell me what you left to the Greek public sector.  What is left in the Greek State.  At last I can tell you that the ministers of the New Democracy, who are paid by the state but hate the Greek state, hate the state. It's called a phallus, you can't suckle from a state for 20 years of your life or 30. ","Πείτε μου τι αφήσατε στον ελληνικό δημόσιο  Τι έχει μείνει στο ελληνικό Δημόσιο  Επιτέλους να σου πω εγώ οι υπουργοί της Νέας Δημοκρατίας, οι οποίοι πληρώνονται από το δημόσιο αλλά μισούν το ελληνικό δημόσιο, μισούν το κράτος Φαυλότης λέγεται αυτό, δεν μπορείς να βυζαίνεις από ένα κράτος επί 20 χρόνια της ζωής σου ή 30",public sector,,other,,greek public sector,-0.6,0.7,0.5,0.5,0.8,0.7,0.0,0.5,"[['greek', 'gpe', '1.0'], ['new democracy', 'org', '0.8'], ['state', 'gpe', '0.8'], ['phallus', 'person', '0.6']]","[['greek', 'country', '1.0'], ['new democracy', 'political party', '1.0']]"
