id,text,text_el,topic,topic-context,subtopic,subtopic-context,topic-open,sentiment,polarization,polarization-definition,toxicity,toxicity-definition,populism,populism-definition,hate speech,ner,ner-limited
17,"This is a state. This is a state. This is a state. Miserable, miserable, partisan, he's a party official. ","Αυτό είναι κράτος Αυτό είναι κράτος Αυτό είναι κράτος Αθλιότητες, αθλιότητες, κομματικά, αυτός είναι κομματικό στέλεχος",other,,other,,state,-0.8,1.0,1.0,0.6,0.8,0.8,0.0,0.2,"[['state', 'location', '1.0'], ['state', 'location', '1.0'], ['state', 'location', '1.0'], ['party official', 'person', '0.6']]","[['party official', 'person', '0.8'], ['party', 'group of people', '0.6']]"
18," There was a guy in the back who was a UN security officer and upstairs with the bracelet inside the prison.  To prove that he didn't know and he didn't know the commandments and the end of the interview.  Finally, Mr. Staikura. Even in North Korea they don't do that. Nor in North Korea. And I'm not going to get into the logic. "," Από πίσω υπήρχε ένας τύπος που ήταν υπεύθυνος ασφαλείας του ΟΗΕ και πάνω με το βραχιολάκια μέσα στη φυλακή  Για να αποδειξω οτι δεν ηξερε και αυτος και την εντολές τελος τελος συνέντευξη  Τέλος, κύριε σταϊκούρα Ούτε στη Βόρεια Κορέα δεν τα κάνουν αυτά Ούτε στη Βόρεια Κορέα Και δεν θα μπω στη λογική",other,,other,,un security officer,0.0,0.0,0.0,0.2,0.8,0.2,0.0,0.0,"[['un', 'organization', '0.9'], ['north korea', 'location', '0.9'], ['mr. staikura', 'person', '0.7']]","[['un', 'organization', '0.8'], ['north korea', 'location', '0.8'], ['north korea', 'country', '0.8'], ['mr. staikura', 'person', '0.8']]"
19," What the great scientists said Vassilis Papadopoulos and the logos engineer Lakafosis in the mega on your own channel of Mr. Marinakis. They said no more, no less. That the explosion that was caused no one knows what caused it.  And you know the loss of the children were not the derailment of the train collision was caused by the explosion and the scientists come out and tell us they don't know about the explosion.  No one detects that our children were burned, Mr. Staikura, you are close to Lamia with Lamia. "," Τι είπαν οι μεγάλοι επιστήμονες Ο Βασίλης Παπαδόπουλος και ο λογος Μηχανικος Λακαφώσης στο μέγκα στο δικό σας κανάλι του κυρίου Μαρινάκη Είπαν ούτε λίγο, ούτε πολύ Ότι η έκρηξη που προκλήθηκε κανείς δεν ξέρει από τι έγινε  Και ξέρετε η απώλεια των παιδιών δεν έγιναν τον εκτροχιασμό της σύγκρουσης στο τρένο έγινε από την έκρηξη και βγαίνουν οι επιστήμονες και μας λένε ότι δεν ξέρουν από την έκρηξη  Κανένα δεν ανιχνεύει απ ότι κάηκαν τα παιδιά μας, κύριε Σταϊκούρα, είστε κοντά στην Λαμία με τη Λαμία",other,,other,,explosion,-0.5,0.1,0.0,0.1,0.8,0.1,0.0,0.0,"[['vassilis papadopoulos', 'person', '0.9'], ['lakafosis', 'person', '0.7'], ['mr. marinakis', 'person', '0.8'], ['mr. staikura', 'person', '0.6'], ['lamia', 'location', '0.8']]","[['vassilis papadopoulos', 'person', '0.7'], ['lakafosis', 'person', '0.7'], ['mr. marinakis', 'person', '0.7'], ['mr. staikura', 'person', '0.7'], ['lamia', 'location', '0.7']]"
20,"It is our Thessaly, why do not you as a minister you as ministers wonder why it caused.  What caused the explosion and he comes out evangelical and confirms what the KKE says from the first moment something strange was carried by the freight train.  Some people murdered our children from the explosion.  What caused the explosion. ","Είναι Θεσσαλία μας, γιατί δεν αναρωτιέστε ως υπουργός εσείς ως υπουργοί γιατί προκάλεσε  Τι προκάλεσε την έκρηξη και βγαίνει ευαγγελάτος και επιβεβαιώνει αυτό που λέει το ΚΚΕ από την πρώτη στιγμή κάτι περίεργο μετέφερε η εμπορική αμαξοστοιχία  Κάποιοι δολοφόνησαν τα παιδιά μας από την έκρηξη  Τι προκάλεσε την έκρηξη",other,,other,,explosion,-0.6,0.8,0.0,0.7,0.5,0.7,0.2,0.2,"[['thessaly', 'location', '1.0'], ['kke', 'organization', '1.0']]","[['thessaly', 'location', '1.0'], ['kke', 'political party', '1.0']]"
21," No one answers. No one answers. And you keep lying. And I'll say something else, Kazantzakis says.  The lie is an anandry. This is what the great Kazantzakis said.  But good governance requires bravery and therefore. You are neither a user nor a man so go to elections soon set a date so that the country can be saved. We will because we say it buries the truth. "," Δεν απαντάει κανένας Δεν απαντάει κανένας Και λέτε συνεχώς ψέματα Και θα πω και κάτι, λέει ο Καζαντζάκης  Το ψέμα είναι ανανδρία Αυτό έλεγε ο Μέγας Καζαντζάκης  Η χρηστή διακυβέρνηση όμως θέλει ανδρεία άρα Δεν είστε ούτε χρήστη, ούτε ανδρί για αυτό πάτε σε εκλογές σύντομα ορίστε ημερομηνία για να μπορέσει να σωθεί ο τόπος Θα γιατί λέμε ότι θάβει την αλήθεια",elections,,other,,politics/elections,-0.4,0.6,0.0,0.6,0.7,0.4,0.0,0.1,"[['kazantzakis', 'person', '0.9']]","[['kazantzakis', 'person', '0.85'], ['country', 'location', '0.90']]"
22, New Democracy talks about SYRIZA's 7 17 convention.  Let me accept that SYRIZA was a group of people who didn't know what was happening to them. Harry you want script. , Η νέα δημοκρατία ομιλεί για τη σύμβαση 7 17 του ΣΥΡΙΖΑ  Να δεχτώ εγώ ότι ο ΣΥΡΙΖΑ ήταν μια ομάδα ανθρώπων που δεν ήξερε τους γινόταν Χάρυ να θέλετε σεναρίου,other,,other,,syriza convention,0.0,0.5,0.0,0.7,0.9,0.5,0.0,0.2,"[['new democracy', 'org', '0.6'], ['syriza', 'org', '0.9'], ['harry', 'per', '0.5']]","[['new democracy', 'organization', '0.9'], ['syriza', 'political party', '0.9'], ['group of people', 'group of people', '0.7'], ['harry', 'person', '0.6']]"
23,"Transparency Authority inspectors had identified criminal charges and removed him from the new democracy. With her removed for tulupaki. Who had the history file. What the government is doing.  He takes the file and gives it to the financial prosecutor, who puts it on file. ","Οι επιθεωρητές της αρχής διαφάνειας είχε εντοπίσει ποινικές ευθύνες και απομακρύνθηκε από τη νέα δημοκρατία Μαζί της απομακρύνθηκε για τουλουπάκη Που είχε το φάκελο της ιστορίας Τι κάνει η κυβέρνηση  Παίρνει το φάκελο και τη δίνει στον οικονομικό εισαγγελέα, ο οποίος τη βάζει στο αρχείο",other,,corruption,,corruption,0.0,0.5,0.0,0.1,0.5,0.0,0.0,0.0,"[['transparency authority', 'organization', '0.9'], ['new democracy', 'organization', '0.6'], ['tulupaki', 'person', '0.4'], ['government', 'organization', '0.7'], ['financial prosecutor', 'person', '0.6']]","[['transparency authority', 'organization', '0.9'], ['new democracy', 'political party', '0.5'], ['tulupaki', 'person', '0.5'], ['government', 'organization', '0.6'], ['financial prosecutor', 'organization', '0.5']]"
24,This is not called interference with justice. This is not called by the government a gross violation of principles. The Constitution on the independence of the judiciary. ,Αυτό δεν λέγεται παρέμβαση στη δικαιοσύνη Αυτό δεν λέγεται από την κυβέρνηση ωμή παραβίαση αρχών Του Συντάγματος για ανεξαρτησία της δικαιοσύνης,justice,,judicial independence,,judicial independence,0.0,0.0,0.0,0.0,0.0,0.0,0.0,0.0,"[['constitution', 'organization', '0.9'], ['independence', 'misc', '0.6'], ['judiciary', 'organization', '0.9']]","[['constitution', 'organization', '0.8'], ['judiciary', 'organization', '0.6']]"
25,"But what government are we talking about.  The government of the contractors, the authorities, the canal lords, the oligarchy and the plutocracy.  This is the government. And our issue is Karamanlis of the two parties here and the rest of them with Karamanlis, Kostas, Karamanlis.  Our subject is Karamanlis, only because we don't say about all the others.  All the ministers from 12 all the officials from 12 all the officials from 12 all the people in charge should go and apologise and convince us that they are not to blame. ","Αλλά για ποια κυβέρνηση μιλάμε  Την κυβέρνηση των εργολάβων, των αρχών, των καναλαρχών, της ολιγαρχίας και της πλουτοκρατίας  Αυτή είναι η κυβέρνηση Και το θέμα μας είναι ο Καραμανλής από τα 2 κόμματα εδώ και τους υπόλοιπους με τον Καραμανλή, τον Κώστα, τον Καραμανλή  Το θέμα μας είναι ο Καραμανλής, μόνο γιατί δεν λέμε για όλους τους υπόλοιπους  Όλοι οι υπουργοί από το 12 όλοι οι υπηρεσιακοί παράγοντες από το 12 όλοι οι υπεύθυνοι πρέπει να πάνε βραχιολάκια, να απολογηθούν και να μας πείσουν ότι δεν φταίνε",accountability,,oligarchy,,government,0.0,0.5,0.2,0.2,0.2,0.7,0.75,0.0,"[['government', 'organization', '0.9'], ['contractors', 'organization', '0.7'], ['authorities', 'organization', '0.7'], ['canal lords', 'organization', '0.5'], ['oligarchy', 'organization', '0.5'], ['plutocracy', 'organization', '0.5'], ['karamanlis', 'person', '0.9'], ['kostas', 'person', '0.6'], ['ministers', 'title', '0.7'], ['officials', 'title', '0.7'], ['people in charge', 'title', '0.6']]","[['karamanlis', 'person', '0.6'], ['kostas', 'person', '0.3']]"
26,"Why no one talks about the helenic train. No one is talking about the company, neither SYRIZA is talking about the company, nor Tsipras.  I call Androulakis, we said he's looking to find a way to co-govern now from here he'll go from there he'll go from there, he's confused, he's at a crossroads and incumbents and he's looking to go right from left to go in the middle where to go so this proves he can't govern anyway.  So let the voters understand that they can't and they don't have it and they don't want it. Let's go on, because we are only talking about the Tempe yesterday I was reading a notice official people's minefield engineers of the OSE, the route Thessaloniki-Eidomeni minefield the route Thessaloniki-Eidomeni if something will be done tomorrow I did not know what the minister would say I did not know what the other would say and what bothers me most is that neither SYRIZA nor PASOK are targeting the minister responsible Mr Karagiannis is responsible for infrastructure.  This incredible, invisible press. ","Γιατί κανείς δεν μιλάει για τη χελλενικ τρέιν Δεν μιλάει κανένας εταιρεία, ούτε ο ΣΥΡΙΖΑ μιλάει για την εταιρεία, ούτε ο Τσίπρας  Καλώ Ανδρουλάκης, είπαμε ψάχνει να βρει τρόπο να συγκυβερνήσει τώρα από δω θα πάει από κει θα πάει, έχει μπερδευτεί, είναι σε ένα σταυροδρόμι και κατεστημένες και κοιτάει να πάω δεξιά από αριστερά να πάω στη μέση που να πάω έτσι αυτό αποδεικνύει ότι δεν μπορεί να κυβερνήσει έτσι κι αλλιώς  Άρα λοιπόν ας το καταλάβουν και οι ψηφοφόροι ότι και δεν μπορούν και δεν το έχουν και δεν θέλουν Πάμε στο εξής, επειδή μιλάμε μόνο για τα Τέμπη χθες διάβαζα μια ανακοίνωση επίσημη ανθρώπων μηχανοδηγών του ΟΣΕ ναρκοπέδιο, η διαδρομή Θεσσαλονίκη Ειδομένη ναρκοπέδιο η διαδρομή Θεσσαλονίκη Ειδομένη αν θα γίνει κάτι αύριο δεν ήξερα θα πει ο υπουργός δεν ήξερα τι θα πει ο άλλος και αυτό που με ενοχλεί περισσότερο είναι ούτε ο ΣΥΡΙΖΑ ούτε το ΠΑΣΟΚ στοχοποιούν τον καθ ύλην αρμόδιο υπουργό Ο κύριος Καραγιάννης είναι υπεύθυνος για τις υποδομές  Αυτός ο απίστευτος, ο αόρατος Τύπος",other,,railway,,hellenic train,-0.5,0.2,0.0,0.7,0.5,0.5,0.0,0.0,"[['helenic train', 'organization', '1.0'], ['company', 'organization', '0.6'], ['syriza', 'organization', '1.0'], ['tsipras', 'person', '1.0'], ['androulakis', 'person', '1.0'], ['ose', 'organization', '1.0'], ['thessaloniki-eidomeni', 'location', '1.0'], ['pasok', 'organization', '1.0'], ['mr karagiannis', 'person', '1.0']]","[['androulakis', 'person', '0.6'], ['syriza', 'political party', '1.0'], ['tsipras', 'person', '0.6'], ['hellenic train', 'organization', '0.6'], ['tempe', 'location', '1.0'], ['thessaloniki', 'location', '1.0'], ['eidomeni', 'location', '1.0'], ['ose', 'organization', '0.6'], ['pasok', 'political party', '0.6'], ['mr karagiannis', 'person', '0.6']]"
27,"In the no one talks about him, because he gets on well with the contractors who are friends.  I imagine words the properties of Mr. Spirtzis friend I mean with construction contractors or the other ministers of the New Democracy. Listen God, one friend, the other friendless, the truth Cut off the bad company.  Bad company leads to bad paths. ","Στην κανένας δεν ομιλεί για αυτόν, γιατί τα πάει καλά με τους εργολάβους που είναι φίλοι  Φαντάζομαι λόγια τις ιδιότητες του κυρίου Σπίρτζη φίλε εννοώ με εργολάβους κατασκευές ή των υπολοίπων υπουργών της Νέας Δημοκρατίας Ακούστε Θεός, ο ένας φίλος, ο άλλος φιλτάτη, η αλήθεια Κόψτε τις κακές παρέες  Οι κακές παρέες οδηγούν σε κακούς ατραπούς",corruption,,corruption,,corruption,-0.4,0.5,0.0,0.6,0.5,0.3,0.0,0.2,"[['mr. spirtzis', 'person', '0.7'], ['new democracy', 'organization', '0.6']]","[['mr. spirtzis', 'person', '0.9'], ['new democracy', 'political party', '0.9']]"
28,"You don't know that there is a danger to the buses.  Minister.  Don't you know, Minister, that there have been announcements upon announcements that since '12 they haven't bought tires on the buses in Athens.  No one on the radar in Rhodes knows about the airport and the airport is not working.  You don't know that. ","Δεν ξέρετε ότι υπάρχει κίνδυνος για τα λεωφορεία  Κύριε υπουργέ  Δεν ξέρετε κύριε υπουργέ, ότι υπάρχουν ανακοινώσεις επί ανακοινώσεων ότι από το 12 δεν έχουν αγοράσει ελαστικά στα λεωφορεία στην Αθήνα  Δεν ξέρει κανένας στο ραντάρ στη Ρόδο για το αεροδρόμιο και το αεροδρόμιο δεν λειτουργεί  Δεν το ξέρετε αυτό",other,,other,,transportation safety,-0.5,0.6,0.0,0.1,0.2,0.6,0.0,0.0,"[['buses', 'other', '0.50'], ['minister', 'person', '1.00'], ['athens', 'location', '0.75'], ['rhodes', 'location', '0.85'], ['airport', 'other', '0.75']]","[['1. minister', 'person', '0.8'], ['2. athens', 'location', '0.6'], ['3. rhodes', 'location', '0.6']]"
29," You're going to kill people, Minister, you're going to kill people again and you're going to say we didn't know, we're informing you, there are announcements.  The minutes of the Parliament there is no radar in Rhodes. For passenger planes at the airport. How they land blindly. "," Θα σκοτώσετε κόσμο, κύριε Υπουργέ, θα σκοτωθεί κόσμος πάλι και πάλι θα λέτε δεν ξέραμε σας ενημερώνουμε, υπάρχουν ανακοινώσεις  Τα πρακτικά της Βουλής δεν υπάρχει ραντάρ στη Ρόδο Για τα αεροπλάνα επιβατικά στο αεροδρόμιο Πώς προσγειώνονται στα τυφλά",civil protection,,safety,,airplane safety,-0.8,0.7,0.0,0.4,0.2,0.4,0.0,0.0,"[['minister', 'person', '0.95'], ['parliament', 'organization', '0.8'], ['rhodes', 'location', '0.7']]","[['minister', 'person', '0.95'], ['parliament', 'organization', '0.75'], ['rhodes', 'location', '0.90']]"
30,"We go wherever it comes out, they say yes, but we go wherever it comes out, Minister. And we have the Prime Minister, who went on a channel with a journalist who played the role of a TV laundress. TV laundress the journalist what the prime minister was saying a handkerchief to have to steal the journalist as the prime minister's laundry.  A little bit of humming, a little bit of tears, a little bit of emptiness, a little bit of love and a little bit of going away and thinking and doing. ","Πάμε και όπου βγει λένε και αυτοί ναι, αλλά πάμε και όπου βγει μπορεί να βγει ο χάρος, κύριε Υπουργέ Και έχουμε τον κύριο πρωθυπουργό, ο οποίος πήγε σε ένα κανάλι με έναν δημοσιογράφο ο οποίος υποδύθηκε την τηλεοπτική πλύστρα Τηλεοπτική πλύστρα ο δημοσιογράφος ό τι έλεγε ο πρωθυπουργός ένα μαντήλι να έχει να κλέψει ο δημοσιογράφος ως πλυντήριο του πρωθυπουργού  Λίγο βούρκωμα, λίγο δάκρυ, λίγο συναίσθημα κενού, αγάπη και λίγο να φύγουμε και να σκεφτούμε και να κάνουμε",other,,other,,politics,0.0,0.5,0.0,0.2,0.1,0.2,0.0,0.0,"[['minister', 'person', '1.0'], ['prime minister', 'person', '1.0']]","[['minister', 'person', '1.0'], ['prime minister', 'person', '1.0'], ['journalist', 'person', '1.0'], ['tv', 'organization', '1.0'], ['country', 'location', '1.0] (unspecified)'], ['date', 'date', '1.0] (unspecified)']]"
31,"Let's better go play a comedy Mr Theodorakis, because he has raped our reasoning enough, especially with the shameful Prespa agreement that if it wasn't for him and his ilk would not have passed. The Greek Prime Minister comes out and what does he say, Mr Staikoura? I'll call, says the Italians now and tell them we will not give us crippled trains that is, what tells us 4 years of the line before creator.  The wrecks that the Greek solution denounced and Mr. Viliardos and I were saying here that they are wrecks, we sent these trains away, the Swiss didn't want them and sent them here, the Italians will now call them. It really is aimed at people of limited perception. ","Ας πάει καλύτερα να παίξει μια κωμωδία κύριος Θεοδωράκης, γιατί αρκετά έχει βιάσει τη λογική μας, ειδικά με την επαίσχυντη συμφωνία των Πρεσπών που αν δεν ήταν αυτός και οι όμοιοί του δεν θα περνούσαν Βγαίνει ο έλληνας πρωθυπουργός και τι λέει κύριε Σταϊκούρα Θα τηλεφωνήσω, λέει στους Ιταλούς τώρα και θα τους πω δεν θα μας δώσετε σαπάκια τρένα δηλαδή, τι μας λέει 4 χρόνια της γραμμής πριν από δημιουργός  Τα σαπάκια που κατήγγειλε η ελληνική λύση και λέγαμε ο κύριος Βιλιάρδος και εγώ εδώ ότι είναι σαπάκια, τα τρένα αυτά τα διώξαμε, οι Ελβετοί δεν τα θέλανε και τα στείλανε εδώ Ιταλοί τώρα θα τους πάρει τηλέφωνο Πραγματικά απευθύνεται σε άτομα περιορισμένης αντίληψης",other,,other,,greek politics,-0.8,0.8,0.0,0.8,0.8,0.8,0.0,0.8,"[['mr theodorakis', 'person', '0.8'], ['prespa agreement', 'organization', '0.7'], ['greek prime minister', 'person', '0.8'], ['mr staikoura', 'person', '0.7'], ['italians', 'organization', '0.6'], ['4 years of the line before creator', 'organization', '0.5'], ['greek solution', 'organization', '0.6'], ['mr. viliardos', 'person', '0.7'], ['swiss', 'organization', '0.6']]","[['mr theodorakis', 'person', '1.0'], ['prespa', 'location', '1.0'], ['greek prime minister', 'person', '1.0'], ['mr staikoura', 'person', '1.0'], ['italians', 'group of people', '1.0'], ['4 years', 'date', '1.0'], ['swiss', 'group of people', '1.0'], ['italians', 'organization', '1.0'], ['mr. viliardos', 'person', '1.0']]"
32,"As Prime Minister with limited responsibility. He said the following, now we're telling the September complete story. I'll finish everything. ","Ως πρωθυπουργός περιορισμένης ευθύνης Είπε το εξής, τώρα λέμε τον Σεπτέμβριο τελείως ιστορία Θα τα τελειώσω όλα",other,,other,,prime minister,0.0,0.0,0.0,0.2,0.0,0.2,0.0,0.0,"[['prime minister', 'title', '0.99'], ['september', 'date', '0.75']]","[['prime minister', 'person', '0.95'], ['september', 'date', '0.8']]"
33,"This is what Christ does.  God made the planet in 7 days for the world and the universe.  The Prime Minister in 7 months will do the same road. Who are you addressing or is he lying now, Mr. Staikura, Prime Minister, or for four and a half years he was incapable of doing what can be done in 7 months. ","Αυτά τα κάνει ο Χριστός  Ο Θεός έκανε σε 7 μέρες τον πλανήτη για τον κόσμο και το σύμπαν  Ο πρωθυπουργός σε 7 μήνες θα κάνει το ίδιο δρόμο Που απευθυνεστε ή τώρα λέει ψέματα κύριε σταϊκούρα, πρωθυπουργός ή επί τεσσεράμισι χρόνια ήταν ανίκανος να κάνει αυτό που μπορεί να γίνει σε 7 μήνες",other,,other,,prime minister,0.0,0.1,0.0,0.1,0.1,0.8,0.0,0.0,"[['christ', 'person', '0.8'], ['god', 'person', '0.7'], ['7 days', 'date', '1.0'], ['prime minister', 'person', '0.9'], ['7 months', 'date', '1.0'], ['mr. staikura', 'person', '0.6'], ['4 and a half years', 'date', '1.0']]","[['christ', 'person', '0.8'], ['god', 'organization', '0.7'], ['prime minister', 'person', '0.9'], ['mr. staikura', 'person', '0.8'], ['political party', 'group of people', '0.6'], ['7 months', 'date', '0.9'], ['7 days', 'date', '0.7'], ['location', 'location', '0.6'], ['country', 'country', '0.6']]"
